id,title,link,price,origin,image,seller_name,seller_link,sell_type,num_bids,num_watchers,num_stock,date
item23f757e51b,"PARNASSIUS EPAPHUS HILLENSIS M, SPITI, KUNZAM LA RARE!",https://www.ebay.com/itm/154473587995?hash=item23f757e51b:g:Y2oAAOSwcZxgmCKj,$29.00,"Liptovska Kokava, Slovakia",https://i.ebayimg.com/images/g/Y2oAAOSwcZxgmCKj/s-l300.jpg,parnassius26,https://www.ebay.com/usr/parnassius26?_trksid=p2047675.l2559,Auction,0,0,1,Unknown
item23f757e513,"PARNASSIUS EPAPHUS KOTZSCHI M, GANSU, XIAHE, BIG OCELI RARE!",https://www.ebay.com/itm/154473587987?hash=item23f757e513:g:KqIAAOSwtPFgmCME,$35.00,"Liptovska Kokava, Slovakia",https://i.ebayimg.com/images/g/KqIAAOSwtPFgmCME/s-l300.jpg,parnassius26,https://www.ebay.com/usr/parnassius26?_trksid=p2047675.l2559,Auction,0,0,1,Unknown
item3b546a77cf,"Lepidoptera. Parnassius epaphus nomionides, A1-, pair, China",https://www.ebay.com/itm/254819334095?hash=item3b546a77cf:g:ulwAAOSwQHVf6aZG,$59.00,"Kursk City, Russian Federation",https://i.ebayimg.com/images/g/ulwAAOSwQHVf6aZG/s-l300.jpg,mistericus,https://www.ebay.com/usr/mistericus?_trksid=p2047675.l2559,Instant,0,0,1,"Dec 28, 2020 02:30:07 PST"
item3b5337f2f9,"Lepidoptera. Parnassius epaphus pseudosikkimensis, A-, pair, Tibet.",https://www.ebay.com/itm/254799246073?hash=item3b5337f2f9:g:fvcAAOSwTwRfy7co,$45.00,"Kursk City, Russian Federation",https://i.ebayimg.com/images/g/fvcAAOSwTwRfy7co/s-l300.jpg,mistericus,https://www.ebay.com/usr/mistericus?_trksid=p2047675.l2559,Instant,0,0,1,"Mar 04, 2021 12:46:46 PST"
item3da259a5ff,unmounted Real Butterfly specimens Parnassius epaphus ssp. pair CHINA c149,https://www.ebay.com/itm/264716789247?hash=item3da259a5ff:g:xLYAAOSw8zZeq0cc,$29.99,"Chino Hills, California, United States",https://i.ebayimg.com/images/g/xLYAAOSw8zZeq0cc/s-l300.jpg,888storeonline,https://www.ebay.com/usr/888storeonline?_trksid=p2047675.l2559,Instant,0,0,1,"Mar 24, 2021 22:35:49 PDT"
item3daf1b0977,unmounted Real Butterfly specimens Parnassius epaphus ssp. pair CHINA c148,https://www.ebay.com/itm/264930789751?hash=item3daf1b0977:g:vOoAAOSwJ1Jeq0Z8,$29.99,"Chino Hills, California, United States",https://i.ebayimg.com/images/g/vOoAAOSwJ1Jeq0Z8/s-l300.jpg,888storeonline,https://www.ebay.com/usr/888storeonline?_trksid=p2047675.l2559,Instant,0,0,1,"Mar 24, 2021 22:35:51 PDT"
item3b46685ef3,unmounted Real Butterfly specimens Parnassius epaphus ssp. pair CHINA c137,https://www.ebay.com/itm/254584315635?hash=item3b46685ef3:g:JccAAOSwnaVeq0b6,$29.99,"Chino Hills, California, United States",https://i.ebayimg.com/images/g/JccAAOSwnaVeq0b6/s-l300.jpg,888storeonline,https://www.ebay.com/usr/888storeonline?_trksid=p2047675.l2559,Instant,0,0,1,"Mar 24, 2021 22:35:50 PDT"
