id,title,link,price,origin,image,seller_name,seller_link,sell_type,num_bids,num_watchers,num_stock,date
item592eac6fb1,Papilio dardanus ONE REAL BUTTERFLY BLACK WHITE AFRICA UNMOUNTED WINGS CLOSED,https://www.ebay.com/itm/383035142065?hash=item592eac6fb1:g:dfcAAOSwRaJdHpSJ,$6.00,"Sahuarita, Arizona, United States",https://i.ebayimg.com/images/g/dfcAAOSwRaJdHpSJ/s-l300.jpg,bicbugs,https://www.ebay.com/usr/bicbugs?_trksid=p2047675.l2559,Instant,0,0,More than 10,"Feb 08, 2021 18:31:07 PST"
item3dbcbf5725,46577p Papilionidae Papilio dardanus Uganda,https://www.ebay.com/itm/265159661349?hash=item3dbcbf5725:g:HXgAAOSwGD9gnigZ,$8.00,"Krasnoyarsk city, Russian Federation",https://i.ebayimg.com/images/g/HXgAAOSwGD9gnigZ/s-l300.jpg,fareastinsects,https://www.ebay.com/usr/fareastinsects?_trksid=p2047675.l2559,Instant,0,0,1,Unknown
item3443dd8151,UNMOUNTED BUTTERFLY PAPILIO DARDANUS 1 PC .,https://www.ebay.com/itm/224476889425?hash=item3443dd8151:g:BQwAAOSwsZpgiN1e,$2.99,"pattaya, chonburi, Thailand",https://i.ebayimg.com/images/g/BQwAAOSwsZpgiN1e/s-l300.jpg,wthongmai,https://www.ebay.com/usr/wthongmai?_trksid=p2047675.l2559,Auction,0,0,1,"May 27, 2021 22:33:27 PDT"
item5923a7d6e5,REAL FRAMED BUTTERFLY PAPILIO DARDANUS CHOCOLATE FORM FEMALE KENYA,https://www.ebay.com/itm/382850291429?hash=item5923a7d6e5:g:YaAAAOSwgyZcP-ic,$21.53,"Sahuarita, Arizona, United States",https://i.ebayimg.com/images/g/YaAAAOSwgyZcP-ic/s-l300.jpg,bicbugs,https://www.ebay.com/usr/bicbugs?_trksid=p2047675.l2559,Instant,0,0,1,"Feb 08, 2021 18:31:01 PST"
item33d79ecce6,MB 04 A+/A  Papilio dardanus meriones  FEBRUARY SALE,https://www.ebay.com/itm/222660840678?hash=item33d79ecce6:g:wL8AAOSwxqBgG0Wd,$3.25,"Southport, North Carolina, United States",https://i.ebayimg.com/images/g/wL8AAOSwxqBgG0Wd/s-l300.jpg,budgetbutterfly,https://www.ebay.com/usr/budgetbutterfly?_trksid=p2047675.l2559,Instant,0,0,More than 10,"Feb 03, 2021 16:55:24 PST"
item23f68ca782,Insect Butterfly Papilionidae Papilio dardanus meriones-Rare subspecies!,https://www.ebay.com/itm/154460268418?hash=item23f68ca782:g:hJAAAOSwaVVgpcMh,$4.95,"Irvine, Alberta, Canada",https://i.ebayimg.com/images/g/hJAAAOSwaVVgpcMh/s-l300.jpg,wynlynwings,https://www.ebay.com/usr/wynlynwings?_trksid=p2047675.l2559,Instant,0,0,More than 10,Unknown
item4d9f641cc9,REAL BUTTERFLY BLACK/WHITE PAPILIO DARDANUS AFRICA Framed Taxidermy Odd Fun Gift,https://www.ebay.com/itm/333386620105?hash=item4d9f641cc9:g:FZAAAOSwZ15dwF4r,$79.98,"Des Moines, Iowa, United States",https://i.ebayimg.com/images/g/FZAAAOSwZ15dwF4r/s-l300.jpg,murrellsmisc,https://www.ebay.com/usr/murrellsmisc?_trksid=p2047675.l2559,Instant,0,0,1,"Jun 15, 2020 19:58:20 PDT"
item4b1de05b1f,UAP 06 A+/A FEMALE Papilio dardanus Mocker Swallowtail Blue Form,https://www.ebay.com/itm/322623789855?hash=item4b1de05b1f:g:bM4AAOSwLIhZfR6E,$5.50,"Southport, North Carolina, United States",https://i.ebayimg.com/images/g/bM4AAOSwLIhZfR6E/s-l300.jpg,budgetbutterfly,https://www.ebay.com/usr/budgetbutterfly?_trksid=p2047675.l2559,Instant,0,0,Last one,"Jan 27, 2018 12:43:43 PST"
item28a7fd197d,Papilio dardanus Butterfly Dome,https://www.ebay.com/itm/174617074045?hash=item28a7fd197d:g:UUUAAOSw~o5aan5H,$78.00,"Newport, North Carolina, United States",https://i.ebayimg.com/images/g/UUUAAOSw~o5aan5H/s-l300.jpg,papilio28570,https://www.ebay.com/usr/papilio28570?_trksid=p2047675.l2559,Instant,0,0,2,Unknown
