id,title,link,price,origin,image,seller_name,seller_link,sell_type,num_bids,num_watchers,num_stock,date
item26636a787a,Coastal Blue Women's Halter Neck Pointed Front Tankini Top Small Spotted,https://www.ebay.com/itm/164876679290?hash=item26636a787a:g:6FEAAOSwKJVgpzau,$6.95,"Cass City, Michigan, United States",https://i.ebayimg.com/images/g/6FEAAOSwKJVgpzau/s-l300.jpg,8ten1944,https://www.ebay.com/usr/8ten1944?_trksid=p2047675.l2559,Instant,0,0,1,Unknown
item2f6030cd24,"Breyer  Horses Lot of 3 CLYDESDALE, BLACK & WHITE SMALL SPOTTED   #5",https://www.ebay.com/itm/203477273892?hash=item2f6030cd24:g:XncAAOSwgLRgstcq,$10.00,"Lincoln City, Oregon, United States",https://i.ebayimg.com/images/g/XncAAOSwgLRgstcq/s-l300.jpg,suzyscollectibles2008,https://www.ebay.com/usr/suzyscollectibles2008?_trksid=p2047675.l2559,Auction,0,0,1,Unknown
item1d05739a35,Genuine Natural Small Spotted Goat Skin Leather Pelt Approx 2 1/2' x 1 1/2',https://www.ebay.com/itm/124645513781?hash=item1d05739a35:g:uT4AAOSwwRFgVo-O,$47.99,"Fernandina Beach, Florida, United States",https://i.ebayimg.com/images/g/uT4AAOSwwRFgVo-O/s-l300.jpg,toogoodooroad,https://www.ebay.com/usr/toogoodooroad?_trksid=p2047675.l2559,Instant,0,0,1,"May 06, 2021 06:24:57 PDT"
item343001cfba,INC International Concepts Small Spotted Top,https://www.ebay.com/itm/224143724474?hash=item343001cfba:g:sd4AAOSwh7lfUWxr,$10.00,"Antelope, California, United States",https://i.ebayimg.com/images/g/sd4AAOSwh7lfUWxr/s-l300.jpg,paradise-lena,https://www.ebay.com/usr/paradise-lena?_trksid=p2047675.l2559,Instant,0,0,1,"Feb 06, 2021 05:50:26 PST"
item4dc5270b02,TH2O Women's Size Small Spotted Eagle Ray Performance V-Neck Fishing Shirt,https://www.ebay.com/itm/334020152066?hash=item4dc5270b02:g:BqUAAOSw1qVgsoio,$27.19,"Winter Park, Florida, United States",https://i.ebayimg.com/images/g/BqUAAOSw1qVgsoio/s-l300.jpg,julee3283710,https://www.ebay.com/usr/julee3283710?_trksid=p2047675.l2559,Instant,0,0,1,"May 30, 2021 05:53:46 PDT"
item488f9b77c1,ETCETERA WOMENS size SMALL SPOTTED gathered top  BLOUSE  Nwt $$$,https://www.ebay.com/itm/311646975937?hash=item488f9b77c1:g:DZEAAOSwFOleUD9b,$34.49,"Shell Knob, Missouri, United States",https://i.ebayimg.com/images/g/DZEAAOSwFOleUD9b/s-l300.jpg,wants-n-wishes,https://www.ebay.com/usr/wants-n-wishes?_trksid=p2047675.l2559,Instant,0,0,1,"Feb 28, 2021 15:18:45 PST"
item23daa687e2,Ann Taylor Factory NWT Petite Small Spotted Flounce Cuff Blouse Shirt Free Ship,https://www.ebay.com/itm/153992202210?hash=item23daa687e2:g:ch8AAOSwa9he~nSu,$17.99,"Walker, Louisiana, United States",https://i.ebayimg.com/images/g/ch8AAOSwa9he~nSu/s-l300.jpg,abroussa,https://www.ebay.com/usr/abroussa?_trksid=p2047675.l2559,Instant,0,0,2,"Apr 09, 2021 09:29:35 PDT"
item1ed9005ff5,"3 Sisters Jacket Clothing Small, Spotted Women's Dress Coat  1940 3S757",https://www.ebay.com/itm/132489699317?hash=item1ed9005ff5:g:EBYAAOSwrw1cthg~,$49.95,"Somerset, Kentucky, United States",https://i.ebayimg.com/images/g/EBYAAOSwrw1cthg~/s-l300.jpg,jackterrierfan,https://www.ebay.com/usr/jackterrierfan?_trksid=p2047675.l2559,Instant,0,0,1,"Mar 18, 2021 10:15:07 PDT"
item218a6077d4,Madewell Zip Top Small Spotted Calf Hair Transport Crossbody Bag New With Tags!,https://www.ebay.com/itm/144055498708?hash=item218a6077d4:g:KbIAAOSwObNf7LxK,$40.00,"Lincolnwood, Illinois, United States",https://i.ebayimg.com/images/g/KbIAAOSwObNf7LxK/s-l300.jpg,mipilj-0,https://www.ebay.com/usr/mipilj-0?_trksid=p2047675.l2559,Auction,0,0,1,Unknown
item3640bb2adb,Small Spotted Owl Dangle Earrings 925 Sterling Silver,https://www.ebay.com/itm/233014242011?hash=item3640bb2adb:g:Lb8AAOSwenJb9KLj,$10.99,"Hales Corners, Wisconsin, United States",https://i.ebayimg.com/images/g/Lb8AAOSwenJb9KLj/s-l300.jpg,coronasunjewelry,https://www.ebay.com/usr/coronasunjewelry?_trksid=p2047675.l2559,Instant,0,0,7,"Apr 26, 2021 12:46:20 PDT"
item48f6a69cef,SMALL SPOTTED  PEACH COLOUR VISCOSE FABRIC-SOLD BY 4 METRES,https://www.ebay.com/itm/313375759599?hash=item48f6a69cef:g:GIwAAOSwL8hf-kgo,$21.25,"London, United Kingdom",https://i.ebayimg.com/images/g/GIwAAOSwL8hf-kgo/s-l300.jpg,vegatextiles,https://www.ebay.com/usr/vegatextiles?_trksid=p2047675.l2559,Instant,0,0,1,"Mar 09, 2021 17:37:29 PST"
item48eefe9e24,Black Small Spotted Figured Viscose Polyester Fabric - Sold By The Metre,https://www.ebay.com/itm/313247309348?hash=item48eefe9e24:g:8gIAAOSw4IVffNRf,$6.55,"London, United Kingdom",https://i.ebayimg.com/images/g/8gIAAOSw4IVffNRf/s-l300.jpg,vegatextiles,https://www.ebay.com/usr/vegatextiles?_trksid=p2047675.l2559,Instant,0,0,More than 10,"Mar 30, 2021 16:08:21 PDT"
item1cfd892a04,Madewell Zip Top Small Spotted Calf Hair Transport Crossbody Bag-NWT,https://www.ebay.com/itm/124512709124?hash=item1cfd892a04:g:-FEAAOSwAp1f8jFn,$150.00,"Lake Saint Louis, Missouri, United States",https://i.ebayimg.com/images/g/-FEAAOSwAp1f8jFn/s-l300.jpg,jennal0587,https://www.ebay.com/usr/jennal0587?_trksid=p2047675.l2559,Instant,0,0,1,"Mar 03, 2021 13:15:10 PST"
item440219c942,Small Spotted Seahorse Necklace 925 Sterling Silver Corona Sun Jewelry,https://www.ebay.com/itm/292093020482?hash=item440219c942:g:C0oAAOSwIWVY-qq1,$22.99,"Hales Corners, Wisconsin, United States",https://i.ebayimg.com/images/g/C0oAAOSwIWVY-qq1/s-l300.jpg,coronasunjewelry,https://www.ebay.com/usr/coronasunjewelry?_trksid=p2047675.l2559,Instant,0,0,Last one,"Apr 26, 2021 12:36:56 PDT"
item2f50f315a6,MOLERANI Women's Casual Long Sleeve Round Neck Loose Tunic T Shirt Blouse Tops,https://www.ebay.com/itm/203221570982?hash=item2f50f315a6:g:1EYAAOSw7mlf2x0H,$47.40,"Multiple Locations, United States",https://i.ebayimg.com/images/g/1EYAAOSw7mlf2x0H/s-l300.jpg,jaipurexport,https://www.ebay.com/usr/jaipurexport?_trksid=p2047675.l2559,Instant,0,0,1,"May 29, 2021 16:44:22 PDT"
item5db7379604,Small spotted dart Trachinotus baillonii Fish Taxidermy Oddities,https://www.ebay.com/itm/402505831940?hash=item5db7379604:g:DU0AAOSwGPhff8vm,$60.00,"Tampa, Florida, United States",https://i.ebayimg.com/images/g/DU0AAOSwGPhff8vm/s-l300.png,palaone,https://www.ebay.com/usr/palaone?_trksid=p2047675.l2559,Instant,0,0,1,"Dec 15, 2020 17:15:54 PST"
item596440aae9,AUSELILY Women's Short Sleeve Pockets Empire Waist Pleated Loose Swing Casual Fl,https://www.ebay.com/itm/383934049001?hash=item596440aae9:g:0zkAAOSwqKZgGk89,$69.98,"Multiple Locations, United States",https://i.ebayimg.com/images/g/0zkAAOSwqKZgGk89/s-l300.jpg,clothinghomedecormall,https://www.ebay.com/usr/clothinghomedecormall?_trksid=p2047675.l2559,Instant,0,0,1,"May 28, 2021 23:47:14 PDT"
item367a1851c6,Proenza Schouler Runway Small Spotted Calf Hair Lunch Bag Clutch Black White,https://www.ebay.com/itm/233976648134?hash=item367a1851c6:g:MYsAAOSwnXlgf1~m,$525.00,"Charlotte, North Carolina, United States",https://i.ebayimg.com/images/g/MYsAAOSwnXlgf1~m/s-l300.jpg,shoesforeverstore,https://www.ebay.com/usr/shoesforeverstore?_trksid=p2047675.l2559,Instant,0,0,1,Unknown
item2d30ea8987,POPYOUNG Women's Summer Casual Tshirt Dresses Short Sleeve Boho Beach Dress,https://www.ebay.com/itm/194094205319?hash=item2d30ea8987:g:ROcAAOSwPMBgkNqI,$57.77,"Redmond, Washington, United States",https://i.ebayimg.com/images/g/ROcAAOSwPMBgkNqI/s-l300.jpg,trendings53,https://www.ebay.com/usr/trendings53?_trksid=p2047675.l2559,Instant,0,0,1,"May 30, 2021 02:44:21 PDT"
item2afa0b05cd,MOLERANI Women's Long Sleeve Casual Swing Simple T-Shirt Loose Dress,https://www.ebay.com/itm/184583652813?hash=item2afa0b05cd:g:VrQAAOSwPGBf2vkR,$52.48,"Multiple Locations, United States",https://i.ebayimg.com/images/g/VrQAAOSwPGBf2vkR/s-l300.jpg,fashionstylo,https://www.ebay.com/usr/fashionstylo?_trksid=p2047675.l2559,Instant,0,0,1,"May 27, 2021 23:47:50 PDT"
item2d1edc9ad5,WNEEDU Women's Long Sleeve T-Shirt Dress Round Neck Casual Loose Dress,https://www.ebay.com/itm/193791302357?hash=item2d1edc9ad5:g:KjoAAOSwr8Vf0OWw,$46.74,"Multiple Locations, United States",https://i.ebayimg.com/images/g/KjoAAOSwr8Vf0OWw/s-l300.jpg,jaipurexport,https://www.ebay.com/usr/jaipurexport?_trksid=p2047675.l2559,Instant,0,0,1,"May 25, 2021 15:31:36 PDT"
item2af4b0068d,MOLERANI Women's Loose Plain Maxi Dresses Casual Long Dresses with Pockets,https://www.ebay.com/itm/184493803149?hash=item2af4b0068d:g:duIAAOSwQPdfjHHR,$71.17,"Multiple Locations, United States",https://cdn.walletmonitor.com/img/7390f3877e07d01947353d5a9586eec9.jpg,fashionstylo,https://www.ebay.com/usr/fashionstylo?_trksid=p2047675.l2559,Instant,0,0,1,"May 30, 2021 03:20:47 PDT"
item490029f86b,"Viscose Polyester Fabric Small Spotted Ivory Colour 55"" Wide Sold By The Metre",https://www.ebay.com/itm/313535363179?hash=item490029f86b:g:sLUAAOSwcupgpZIV,$4.95,"London, United Kingdom",https://i.ebayimg.com/images/g/sLUAAOSwcupgpZIV/s-l300.jpg,vegatextiles,https://www.ebay.com/usr/vegatextiles?_trksid=p2047675.l2559,Instant,0,0,10,Unknown
item28a0511e13,MOLERANI Women's Casual Plain Simple T-Shirt Loose Dress,https://www.ebay.com/itm/174488362515?hash=item28a0511e13:g:lp8AAOSwPp1fkBki,$52.33,"Multiple Locations, United States",https://cdn.walletmonitor.com/img/30adfaa8c58a51972bb4e6dd83e7ac4e.jpg,fashionstylo,https://www.ebay.com/usr/fashionstylo?_trksid=p2047675.l2559,Instant,0,0,1,"May 30, 2021 04:23:00 PDT"
item2afcfd1d86,AUSELILY Women's Summer Sleeveless Loose Plain Maxi Dress Casual Long Dress with,https://www.ebay.com/itm/184633073030?hash=item2afcfd1d86:g:n70AAOSwwfhgC98O,$74.36,"Multiple Locations, United States",https://i.ebayimg.com/images/g/n70AAOSwwfhgC98O/s-l300.jpg,fashionstylo,https://www.ebay.com/usr/fashionstylo?_trksid=p2047675.l2559,Instant,0,0,1,"May 30, 2021 03:20:38 PDT"
item3616bbe96f,Small Spotted Seahorse Pendant 925 Sterling Silver Corona Sun Jewelry,https://www.ebay.com/itm/232309647727?hash=item3616bbe96f:g:C0oAAOSwIWVY-qq1,$15.99,"Hales Corners, Wisconsin, United States",https://i.ebayimg.com/images/g/C0oAAOSwIWVY-qq1/s-l300.jpg,coronasunjewelry,https://www.ebay.com/usr/coronasunjewelry?_trksid=p2047675.l2559,Instant,0,0,Last one,"Apr 26, 2021 12:42:55 PDT"
item1ce9a9d4a2,Jellycat. Small Spotted Spotty Cow Beanie.,https://www.ebay.com/itm/124179305634?hash=item1ce9a9d4a2:g:pusAAOSwDX9etCRv,$9.91,"Plymouth, United Kingdom",https://i.ebayimg.com/images/g/pusAAOSwDX9etCRv/s-l300.jpg,amkholt72,https://www.ebay.com/usr/amkholt72?_trksid=p2047675.l2559,Instant,0,0,1,"Aug 10, 2020 04:48:38 PDT"
item218a545943,Small spotted ware floral creamer,https://www.ebay.com/itm/144054704451?hash=item218a545943:g:IzcAAOSwvtla-MMn,$8.00,"Spokane, Washington, United States",https://i.ebayimg.com/images/g/IzcAAOSwvtla-MMn/s-l300.jpg,latonna_sue,https://www.ebay.com/usr/latonna_sue?_trksid=p2047675.l2559,Auction,0,0,1,Unknown
item5dc2bb636e,Cherokee Small Spotted Scrub Zip Jacket Full Zip,https://www.ebay.com/itm/402699019118?hash=item5dc2bb636e:g:sFgAAOSwFdRgLxIM,$15.99,"Lawrence, Kansas, United States",https://i.ebayimg.com/images/g/sFgAAOSwFdRgLxIM/s-l300.jpg,eli-cel-3t3ljklc,https://www.ebay.com/usr/eli-cel-3t3ljklc?_trksid=p2047675.l2559,Instant,0,0,1,Unknown
item1ab5259237,Madewell Zip Top Small Spotted Calf Hair Transport Crossbody Bag,https://www.ebay.com/itm/114708288055?hash=item1ab5259237:g:J8gAAOSw1YNgPH46,$85.00,"Peoria, Arizona, United States",https://i.ebayimg.com/images/g/J8gAAOSw1YNgPH46/s-l300.jpg,spreadinggrace,https://www.ebay.com/usr/spreadinggrace?_trksid=p2047675.l2559,Instant,0,0,1,"Apr 13, 2021 16:16:12 PDT"
item48f69ba282,AUSELILY Women's Sleeveless Pockets Casual Swing T-Shirt Dresses,https://www.ebay.com/itm/313375040130?hash=item48f69ba282:g:-rMAAOSwDuVf-V0v,$59.66,"Multiple Locations, United States",https://i.ebayimg.com/images/g/-rMAAOSwDuVf-V0v/s-l300.jpg,usafestivalshop,https://www.ebay.com/usr/usafestivalshop?_trksid=p2047675.l2559,Instant,0,0,1,"May 29, 2021 19:49:10 PDT"
item1eba2103e5,Small Spotted Glass Basket Pink and White Square Handle AS IS,https://www.ebay.com/itm/131971744741?hash=item1eba2103e5:g:QPcAAOSwCGVYApvU,$44.99,"Cleveland, Ohio, United States",https://i.ebayimg.com/images/g/QPcAAOSwCGVYApvU/s-l300.jpg,lambs-one,https://www.ebay.com/usr/lambs-one?_trksid=p2047675.l2559,Instant,0,0,1,"Jan 17, 2020 12:48:19 PST"
item28a0248b92,MOLERANI Women's Casual Swing Simple T-Shirt Loose Dress,https://www.ebay.com/itm/174485441426?hash=item28a0248b92:g:IUsAAOSwhG5fjQFt,$54.42,"Multiple Locations, United States",https://i.ebayimg.com/images/g/IUsAAOSwhG5fjQFt/s-l300.jpg,fashionstylo,https://www.ebay.com/usr/fashionstylo?_trksid=p2047675.l2559,Instant,0,0,1,"May 30, 2021 05:34:18 PDT"
item5dc8236a6b,Pauline the Stuffed Small Spotted Pig Plush - Douglas Cuddle Toys - #1890 NWT,https://www.ebay.com/itm/402789722731?epid=2254408706&hash=item5dc8236a6b:g:3scAAOSw5PNgdDyL,$14.90,"Cedar Park, Texas, United States",https://i.ebayimg.com/images/g/3scAAOSw5PNgdDyL/s-l300.jpg,punkinsnuffles,https://www.ebay.com/usr/punkinsnuffles?_trksid=p2047675.l2559,Instant,0,0,1,"May 05, 2021 23:24:40 PDT"
item342f1c3953,MOLERANI Women's Casual Plain Simple T-Shirt Loose Dress,https://www.ebay.com/itm/224128678227?hash=item342f1c3953:g:hX8AAOSwf2RfQWYs,$49.27,"Multiple Locations, United States",https://cdn.walletmonitor.com/img/e186878a7623c7638a59cf91967dcbf2.jpg,virtual_mall,https://www.ebay.com/usr/virtual_mall?_trksid=p2047675.l2559,Instant,0,0,1,"May 30, 2021 06:23:54 PDT"
item51e69b3009,"VINTAGE STEIFF GERMANY 5"" SMALL SPOTTED MOHAIR HORSE",https://www.ebay.com/itm/351761281033?hash=item51e69b3009:g:elUAAOSw-4BXYvWC,$85.00,"Windham, Maine, United States",https://i.ebayimg.com/images/g/elUAAOSw-4BXYvWC/s-l300.jpg,sandy810,https://www.ebay.com/usr/sandy810?_trksid=p2047675.l2559,Instant,0,0,1,"Nov 14, 2019 11:05:52 PST"
item23f4262730,Baby Deer Plush 9 Inch Small Spotted Brown,https://www.ebay.com/itm/154419996464?hash=item23f4262730:g:HcoAAOSwLwdgfLnK,$6.99,"Ayer, Massachusetts, United States",https://i.ebayimg.com/images/g/HcoAAOSwLwdgfLnK/s-l300.jpg,treasuresbykay15,https://www.ebay.com/usr/treasuresbykay15?_trksid=p2047675.l2559,Instant,0,0,1,"May 13, 2021 21:19:57 PDT"
item1abb76a9c1,PAULINE the Stuffed SMALL SPOTTED PIG Plush - by Douglas Cuddle Toys - #1890,https://www.ebay.com/itm/114814265793?epid=2254408706&hash=item1abb76a9c1:g:~B4AAOSw4xVewqhA,$16.45,"Keene, New Hampshire, United States",https://i.ebayimg.com/images/g/~B4AAOSw4xVewqhA/s-l300.jpg,douglas_cuddle_toys,https://www.ebay.com/usr/douglas_cuddle_toys?_trksid=p2047675.l2559,Instant,0,0,10,Unknown
item343c0b26cb,PAULINE the Stuffed SMALL SPOTTED PIG Plush - by Douglas Cuddle Toys,https://www.ebay.com/itm/224345663179?epid=2254408706&hash=item343c0b26cb:g:hjYAAOSwsAVgIoO~,$10.99,"Loveland, Colorado, United States",https://i.ebayimg.com/images/g/hjYAAOSwsAVgIoO~/s-l300.jpg,ashes0fyou,https://www.ebay.com/usr/ashes0fyou?_trksid=p2047675.l2559,Instant,0,0,1,"Feb 11, 2021 18:40:00 PST"
item5b951532b5,MISFAY Women Short Sleeve Loose Plain Maxi Dresses Casual Long Dresses Pockets,https://www.ebay.com/itm/393343218357?hash=item5b951532b5:g:uskAAOSwabZgq4no,$50.36,"Multiple Locations, United States",https://i.ebayimg.com/images/g/uskAAOSwabZgq4no/s-l300.jpg,kalakindia1407,https://www.ebay.com/usr/kalakindia1407?_trksid=p2047675.l2559,Instant,0,0,1,"May 30, 2021 07:40:46 PDT"
item3d21712ccc,New Small Spotted Art Pattern Blue Green Colour Soft Chenille Upholstery Fabric,https://www.ebay.com/itm/262554070220?epid=11006119616&hash=item3d21712ccc:g:4p8AAOSwSnZfAK5K,$48.19,"Leeds, United Kingdom",https://i.ebayimg.com/images/g/4p8AAOSwSnZfAK5K/s-l300.jpg,nicolasince1985,https://www.ebay.com/usr/nicolasince1985?_trksid=p2047675.l2559,Instant,0,0,More than 10,"Jul 04, 2020 09:30:31 PDT"
item34429d6b4d,AUSELILY Women's Sleeveless Pleated Loose Swing Casual Dress with Pockets Knee L,https://www.ebay.com/itm/224455912269?hash=item34429d6b4d:g:974AAOSwioBgmA0f,$57.99,"Multiple Locations, United States",https://i.ebayimg.com/images/g/974AAOSwioBgmA0f/s-l300.jpg,the_color_shop,https://www.ebay.com/usr/the_color_shop?_trksid=p2047675.l2559,Instant,0,0,1,"May 30, 2021 05:20:32 PDT"
item3674535085,Douglas Small Spotted Pig Stuffed Animal Toy Plush,https://www.ebay.com/itm/233879851141?hash=item3674535085:g:fMEAAOSwZfNaXTmq,$5.99,"New Albany, Indiana, United States",https://i.ebayimg.com/images/g/fMEAAOSwZfNaXTmq/s-l300.jpg,pancake*maker,https://www.ebay.com/usr/pancake*maker?_trksid=p2047675.l2559,Instant,0,0,1,Unknown
item3ff4f669c6,MOLERANI Women's Casual Plain Simple T-Shirt Loose Dress,https://www.ebay.com/itm/274692729286?hash=item3ff4f669c6:g:wJkAAOSwFZtgM2OX,$54.67,"Multiple Locations, United States",https://i.ebayimg.com/images/g/wJkAAOSwFZtgM2OX/s-l300.jpg,dezilshopping,https://www.ebay.com/usr/dezilshopping?_trksid=p2047675.l2559,Instant,0,0,1,"May 30, 2021 08:16:29 PDT"
item2d30b91946,MOLERANI Women's Sleeveless Loose Plain Dresses Casual Short Dress with Pockets,https://www.ebay.com/itm/194090965318?hash=item2d30b91946:g:dt8AAOSwcwtgj68T,$64.46,"Redmond, Washington, United States",https://i.ebayimg.com/images/g/dt8AAOSwcwtgj68T/s-l300.jpg,trendings53,https://www.ebay.com/usr/trendings53?_trksid=p2047675.l2559,Instant,0,0,1,"May 30, 2021 00:51:16 PDT"
item48df816d47,1911 E46 Philadelphia Caramel Indian Chiefs (small) Spotted Tail G 41148,https://www.ebay.com/itm/312987446599?hash=item48df816d47:g:1oYAAOSwglJeQHvc,$12.00,"Mahomet, Illinois, United States",https://i.ebayimg.com/images/g/1oYAAOSwglJeQHvc/s-l300.jpg,joesvintagesportscardsii,https://www.ebay.com/usr/joesvintagesportscardsii?_trksid=p2047675.l2559,Instant,0,0,1,"Feb 09, 2021 13:39:31 PST"
item28b1c114b0,MISFAY Women Short Sleeve Loose Plain Maxi Dresses Casual Long Dresses Pockets,https://www.ebay.com/itm/174780912816?hash=item28b1c114b0:g:WcoAAOSwNfhgrIUO,$74.90,"Multiple Locations, United States",https://i.ebayimg.com/images/g/WcoAAOSwNfhgrIUO/s-l300.jpg,pinkcity-8,https://www.ebay.com/usr/pinkcity-8?_trksid=p2047675.l2559,Instant,0,0,1,"May 30, 2021 00:38:39 PDT"
item1f21eef259,MOLERANI Women's Casual Plain Simple T-Shirt Loose Dress,https://www.ebay.com/itm/133713293913?hash=item1f21eef259:g:kwIAAOSw7jRgaFzG,$63.32,"Multiple Locations, United States",https://i.ebayimg.com/images/g/kwIAAOSw7jRgaFzG/s-l300.jpg,usasilvershop,https://www.ebay.com/usr/usasilvershop?_trksid=p2047675.l2559,Instant,0,0,1,"May 30, 2021 06:28:53 PDT"
item2878f0a720,"Ink Navy White Small Spotted Polka Dot Georgette Dress Craft Fabric 44"" 1313",https://www.ebay.com/itm/173827729184?hash=item2878f0a720:g:18gAAOSwG0Fe42q7,$7.08,"Smethwick, United Kingdom",https://i.ebayimg.com/images/g/18gAAOSwG0Fe42q7/s-l300.jpg,textileplaza,https://www.ebay.com/usr/textileplaza?_trksid=p2047675.l2559,Instant,0,0,10,"Jun 12, 2020 04:44:53 PDT"
item2182543821,TRANSKEI 1988 FDC BIG SERVAL SMALL SPOTTED CAT ANTELOPE DUIKER WILD DOG ORIBI,https://www.ebay.com/itm/143920478241?hash=item2182543821:g:O4wAAOSwOMxft7dS,$4.25,"Herne Bay, United Kingdom",https://i.ebayimg.com/images/g/O4wAAOSwOMxft7dS/s-l300.jpg,clacarca-88,https://www.ebay.com/usr/clacarca-88?_trksid=p2047675.l2559,Instant,0,0,1,Unknown
item3b5112c34d,Lot of 24 SMALL SPOTTED CLAM SEA SHELLS BEACH DECOR NAUTICAL CRAFT TROPICAL,https://www.ebay.com/itm/254763254605?hash=item3b5112c34d:g:8pAAAOSwxSNfmzu6,$7.99,"Pine Bluff, Arkansas, United States",https://i.ebayimg.com/images/g/8pAAAOSwxSNfmzu6/s-l300.jpg,razorback_pickers,https://www.ebay.com/usr/razorback_pickers?_trksid=p2047675.l2559,Instant,0,0,1,"May 25, 2021 17:44:27 PDT"
item48f2836ae2,BNWT Cath Kidston Brampton Small Spotted Pocket Backpack in Red,https://www.ebay.com/itm/313306344162?epid=23042578094&hash=item48f2836ae2:g:Ra0AAOSwZq9ftYoZ,$120.52,"London, United Kingdom",https://i.ebayimg.com/images/g/Ra0AAOSwZq9ftYoZ/s-l300.jpg,jessget,https://www.ebay.com/usr/jessget?_trksid=p2047675.l2559,Instant,0,0,1,"Feb 18, 2021 12:58:10 PST"
item28850d047d,Vintage Pair of Cute Small Spotted Pig Figurines - Very Unique,https://www.ebay.com/itm/174030914685?hash=item28850d047d:g:kEQAAOSwkzRdfTht,$3.99,"Elgin, Illinois, United States",https://i.ebayimg.com/images/g/kEQAAOSwkzRdfTht/s-l300.jpg,terryrazz4252,https://www.ebay.com/usr/terryrazz4252?_trksid=p2047675.l2559,Instant,0,0,1,"Feb 14, 2020 07:18:30 PST"
item2f507759a6,MOLERANI Women's Casual Plain Simple Long Sleeve T-Shirt Loose Dress,https://www.ebay.com/itm/203213461926?hash=item2f507759a6:g:BLYAAOSwO6Bf0MLQ,$53.79,"Multiple Locations, United States",https://i.ebayimg.com/images/g/BLYAAOSwO6Bf0MLQ/s-l300.jpg,jaipurexport,https://www.ebay.com/usr/jaipurexport?_trksid=p2047675.l2559,Instant,0,0,1,"May 29, 2021 14:21:19 PDT"
item5b8e50d237,MOLERANI Women's Casual Swing Simple T-Shirt Loose Dress,https://www.ebay.com/itm/393229685303?hash=item5b8e50d237:g:GSsAAOSwHDNgZZiM,$62.69,"Multiple Locations, United States",https://i.ebayimg.com/images/g/GSsAAOSwHDNgZZiM/s-l300.jpg,ninnihomegarden,https://www.ebay.com/usr/ninnihomegarden?_trksid=p2047675.l2559,Instant,0,0,1,"May 30, 2021 06:30:41 PDT"
item5b95153400,MISFAY Womens Summer Contrast Sleeveless Tank Top Floral Print Maxi Dress,https://www.ebay.com/itm/393343218688?hash=item5b95153400:g:9bsAAOSwV7Vgq4oN,$47.11,"Multiple Locations, United States",https://i.ebayimg.com/images/g/9bsAAOSwV7Vgq4oN/s-l300.jpg,kalakindia1407,https://www.ebay.com/usr/kalakindia1407?_trksid=p2047675.l2559,Instant,0,0,1,"May 30, 2021 07:40:40 PDT"
item3669b65889,AUSELILY Women's Summer Sleeveless Loose Plain Maxi Dress Casual Long Dress with,https://www.ebay.com/itm/233701791881?hash=item3669b65889:g:ybEAAOSwKdVfUaCU,$62.40,"Multiple Locations, United States",https://cdn.walletmonitor.com/img/96999e10a85b64e4086d6863defacf59.jpg,fashionhut85,https://www.ebay.com/usr/fashionhut85?_trksid=p2047675.l2559,Instant,0,0,1,"May 30, 2021 03:48:46 PDT"
item1f0f37f01b,Small Spotted Babylonia Seashells Crafts Sea Shells Vase Filler Beach Coastal,https://www.ebay.com/itm/133399310363?hash=item1f0f37f01b:g:rMQAAOSwcgNZBj99,$11.99,"Cockeysville, Maryland, United States",https://i.ebayimg.com/images/g/rMQAAOSwcgNZBj99/s-l300.jpg,sellswellshells,https://www.ebay.com/usr/sellswellshells?_trksid=p2047675.l2559,Instant,0,0,2,"Feb 22, 2021 17:08:38 PST"
item2d30fdc6c7,POPYOUNG Women's Long Sleeve T Shirt Dresses Casual Swing Dress,https://www.ebay.com/itm/194095466183?hash=item2d30fdc6c7:g:euwAAOSwLL1gkSml,$53.26,"Redmond, Washington, United States",https://i.ebayimg.com/images/g/euwAAOSwLL1gkSml/s-l300.jpg,trendings53,https://www.ebay.com/usr/trendings53?_trksid=p2047675.l2559,Instant,0,0,1,"May 29, 2021 13:10:38 PDT"
item3b43fffcc1,Small Spotted Seahorse Necklace Pendant 925 Sterling Silver Jewelry Charm,https://www.ebay.com/itm/254543920321?hash=item3b43fffcc1:g:LoAAAOSwc6RecYr9,$13.99,"Milwaukee, Wisconsin, United States",https://i.ebayimg.com/images/g/LoAAAOSwc6RecYr9/s-l300.jpg,esanfordsalvage,https://www.ebay.com/usr/esanfordsalvage?_trksid=p2047675.l2559,Instant,0,0,4,Unknown
item4b82cedf2c,MISFAY Women Short Sleeve Loose Plain Maxi Dresses Casual Long Dresses Pockets,https://www.ebay.com/itm/324317142828?hash=item4b82cedf2c:g:EQgAAOSwBCtfdvbt,$64.33,"Multiple Locations, United States",https://cdn.walletmonitor.com/img/b94b897a0845aee2b33ec8a2f1d1e782.jpg,home_garden_care,https://www.ebay.com/usr/home_garden_care?_trksid=p2047675.l2559,Instant,0,0,1,"May 30, 2021 07:41:02 PDT"
item3669ad8415,AUSELILY Women's Sleeveless Pockets Casual Swing T-Shirt Dresses,https://www.ebay.com/itm/233701213205?hash=item3669ad8415:g:8dAAAOSwsQNfUPpL,$47.71,"Multiple Locations, United States",https://cdn.walletmonitor.com/img/ea11a54870ec8f67e19ac715fd4ab53a.jpg,fashionhut85,https://www.ebay.com/usr/fashionhut85?_trksid=p2047675.l2559,Instant,0,0,1,"May 30, 2021 03:48:45 PDT"
item2d31188be0,Vintage Small Spotted Dog Ceramic Money box 6ins Stamped To Bottom,https://www.ebay.com/itm/194097220576?hash=item2d31188be0:g:iwMAAOSwahlghpKW,$9.91,"North shields, United Kingdom",https://i.ebayimg.com/images/g/iwMAAOSwahlghpKW/s-l300.jpg,jontino,https://www.ebay.com/usr/jontino?_trksid=p2047675.l2559,Instant,0,0,1,Unknown
item5b9647f5c8,MOLERANI Women's Loose Plain Maxi Dresses Casual Long Dresses with Pockets,https://www.ebay.com/itm/393363322312?hash=item5b9647f5c8:g:LH0AAOSwRK5gsQ8y,$80.66,"Multiple Locations, United States",https://i.ebayimg.com/images/g/LH0AAOSwRK5gsQ8y/s-l300.jpg,ninnihomegarden,https://www.ebay.com/usr/ninnihomegarden?_trksid=p2047675.l2559,Instant,0,0,1,"May 29, 2021 23:34:37 PDT"
item3b536ee623,POPYOUNG Women's Summer Casual Tshirt Dresses Short Sleeve Boho Beach Dress,https://www.ebay.com/itm/254802847267?hash=item3b536ee623:g:aBIAAOSwdo5f0IIk,$40.61,"Multiple Locations, United States",https://i.ebayimg.com/images/g/aBIAAOSwdo5f0IIk/s-l300.jpg,wish-n-buy,https://www.ebay.com/usr/wish-n-buy?_trksid=p2047675.l2559,Instant,0,0,1,"May 30, 2021 09:03:50 PDT"
item2d30b8293b,TODOLOR Womens Casual Sundress Pleated Summer Knee Length Tank Sleeveless Sun Dr,https://www.ebay.com/itm/194090903867?hash=item2d30b8293b:g:y2cAAOSwpGFgj6ct,$62.39,"Redmond, Washington, United States",https://i.ebayimg.com/images/g/y2cAAOSwpGFgj6ct/s-l300.jpg,trendings53,https://www.ebay.com/usr/trendings53?_trksid=p2047675.l2559,Instant,0,0,1,"May 30, 2021 08:38:58 PDT"
item5b93f7d6f5,POPYOUNG Women's Swimsuit Cover Ups Summer Swing Casual Beach Dress,https://www.ebay.com/itm/393324517109?hash=item5b93f7d6f5:g:X58AAOSw~g1gn6UT,$34.11,"Multiple Locations, United States",https://i.ebayimg.com/images/g/X58AAOSw~g1gn6UT/s-l300.jpg,kalakindia1407,https://www.ebay.com/usr/kalakindia1407?_trksid=p2047675.l2559,Instant,0,0,1,"May 29, 2021 02:39:12 PDT"
item5233b654a1,Antique Bird Print-SMALL SPOTTED WOODPECKER-Sepp-Nozeman-1770,https://www.ebay.com/itm/353054905505?hash=item5233b654a1:g:A5oAAOSwbBxem1kS,$697.50,"Zeeland, Netherlands",https://i.ebayimg.com/images/g/A5oAAOSwbBxem1kS/s-l300.jpg,theprintscollector,https://www.ebay.com/usr/theprintscollector?_trksid=p2047675.l2559,Instant,0,0,1,"Nov 25, 2020 10:55:35 PST"
