id,title,link,price,origin,image,seller_name,seller_link,sell_type,num_bids,num_watchers,num_stock,date
item56f71c8e8c,#1127 Insects Papilionidae Parnassius felderi maui M Russia Primorye,https://www.ebay.com/itm/373513031308?hash=item56f71c8e8c:g:PnIAAOSwxwBgXHlM,$25.00,"Vladivostok, Russian Federation",https://i.ebayimg.com/images/g/PnIAAOSwxwBgXHlM/s-l300.jpg,pacificvdk,https://www.ebay.com/usr/pacificvdk?_trksid=p2047675.l2559,Instant,0,0,1,Unknown
item56f71c886b,#1126 Insects Papilionidae Parnassius felderi maui pair Russia Primorye,https://www.ebay.com/itm/373513029739?hash=item56f71c886b:g:WsYAAOSwyEdgXHkD,$75.00,"Vladivostok, Russian Federation",https://i.ebayimg.com/images/g/WsYAAOSwyEdgXHkD/s-l300.jpg,pacificvdk,https://www.ebay.com/usr/pacificvdk?_trksid=p2047675.l2559,Instant,0,0,1,Unknown
item3b2e62acb6,"Lepidoptera. Parnassius felderi litoreus, A-, pair, Russia, Far East, RARE",https://www.ebay.com/itm/254181289142?hash=item3b2e62acb6:g:O2sAAOSwWB5b04IS,$169.00,"Kursk City, Russian Federation",https://i.ebayimg.com/images/g/O2sAAOSwWB5b04IS/s-l300.jpg,mistericus,https://www.ebay.com/usr/mistericus?_trksid=p2047675.l2559,Instant,0,0,1,"Mar 19, 2020 14:23:38 PDT"
item4b6c2bc57d,"Parnassius felderi felderi, male, A1+ quality (Russia: Far East)",https://www.ebay.com/itm/323937355133?hash=item4b6c2bc57d:g:6jgAAOSwUP5cJiWT,$15.00,"Saratov, default, Russian Federation",https://i.ebayimg.com/images/g/6jgAAOSwUP5cJiWT/s-l300.jpg,arctos16,https://www.ebay.com/usr/arctos16?_trksid=p2047675.l2559,Instant,0,0,1,"May 08, 2021 01:47:45 PDT"
item4b599847fa,"Parnassius felderi maui, male, A1- quality (Russia: Far East)",https://www.ebay.com/itm/323625699322?hash=item4b599847fa:g:G6MAAOSwHexcJiYz,$12.00,"Saratov, default, Russian Federation",https://i.ebayimg.com/images/g/G6MAAOSwHexcJiYz/s-l300.jpg,arctos16,https://www.ebay.com/usr/arctos16?_trksid=p2047675.l2559,Instant,0,0,1,"May 08, 2021 01:37:33 PDT"
item5da796d7c4,"Parnassius felderi, Russia, Amurland, Male, A1",https://www.ebay.com/itm/402243639236?hash=item5da796d7c4:g:zBQAAOSwBJJeoueD,$26.00,"Moscow, Russian Federation",https://i.ebayimg.com/images/g/zBQAAOSwBJJeoueD/s-l300.jpg,insectopedia,https://www.ebay.com/usr/insectopedia?_trksid=p2047675.l2559,Instant,0,0,3,"Apr 12, 2021 12:14:15 PDT"
