id,title,link,price,origin,image,seller_name,seller_link,sell_type,num_bids,num_watchers,num_stock,date
item33fbb328a6,Papilio maacki summer form REAL FRAMED BUTTERFLY BLUE GREEN,https://www.ebay.com/itm/223266154662?hash=item33fbb328a6:g:MRQAAOSwvNVcMXGv,$34.00,"Sahuarita, Arizona, United States",https://i.ebayimg.com/images/g/MRQAAOSwvNVcMXGv/s-l300.jpg,bicbugs,https://www.ebay.com/usr/bicbugs?_trksid=p2047675.l2559,Instant,0,0,More than 10,"Feb 08, 2021 18:30:48 PST"
item33e11a286e,Papilio maacki spring form ONE REAL BUTTERFLY BLUE GREEN WINGS CLOSED,https://www.ebay.com/itm/222819919982?hash=item33e11a286e:g:vAcAAOSw~E9cgxmk,$14.00,"Sahuarita, Arizona, United States",https://i.ebayimg.com/images/g/vAcAAOSw~E9cgxmk/s-l300.jpg,bicbugs,https://www.ebay.com/usr/bicbugs?_trksid=p2047675.l2559,Instant,0,0,More than 10,"Feb 08, 2021 18:30:56 PST"
item33fe82af4f,Papilio maacki summer form ONE REAL BUTTERFLY BLUE GREEN UNMOUNTED WINGS CLOSED,https://www.ebay.com/itm/223313309519?hash=item33fe82af4f:g:I7gAAOSwO7Nchw84,$14.00,"Sahuarita, Arizona, United States",https://i.ebayimg.com/images/g/I7gAAOSwO7Nchw84/s-l300.jpg,bicbugs,https://www.ebay.com/usr/bicbugs?_trksid=p2047675.l2559,Instant,0,0,More than 10,"Feb 08, 2021 18:30:59 PST"
item4226c8f946,"Papilio maacki - A Lot of 5 Large, Unmounted A1 Specimens, Dazzling Summer Form",https://www.ebay.com/itm/284118546758?hash=item4226c8f946:g:SGYAAOSwN3xf2-gl,$26.95,"Commack, New York, United States",https://i.ebayimg.com/images/g/SGYAAOSwN3xf2-gl/s-l300.png,limmerleps,https://www.ebay.com/usr/limmerleps?_trksid=p2047675.l2559,Instant,0,0,7 lots (5 items per lot),"Apr 05, 2021 17:55:40 PDT"
item590aba2278,Papilio maacki REAL FRAMED BUTTERFLY BLUE GREEN PURPLE SWALLOWTAIL,https://www.ebay.com/itm/382432060024?hash=item590aba2278:g:KFgAAOSwJcxcvjRW,$34.00,"Sahuarita, Arizona, United States",https://i.ebayimg.com/images/g/KFgAAOSwJcxcvjRW/s-l300.jpg,bicbugs,https://www.ebay.com/usr/bicbugs?_trksid=p2047675.l2559,Instant,0,0,More than 10,"Feb 08, 2021 18:31:07 PST"
item5936844ca0,Papilio maacki REAL BUTTERFLY BLUE GREEN SWALLOWTAIL CHRISTMAS ORNAMENT GIFT,https://www.ebay.com/itm/383166729376?hash=item5936844ca0:g:AJ0AAOSwlL1dhuqS,$34.00,"Sahuarita, Arizona, United States",https://i.ebayimg.com/images/g/AJ0AAOSwlL1dhuqS/s-l300.jpg,bicbugs,https://www.ebay.com/usr/bicbugs?_trksid=p2047675.l2559,Instant,0,0,More than 10,"Feb 08, 2021 18:31:08 PST"
item58c6493b34,"Very Fine Papilio Maacki Male Butterfly Professionally Mounted 4 1/4""",https://www.ebay.com/itm/381283810100?hash=item58c6493b34:g:aYIAAOSwBLlVcDqu,$49.95,"Mount Joy, Pennsylvania, United States",https://i.ebayimg.com/images/g/aYIAAOSwBLlVcDqu/s-l300.jpg,fleckstrade,https://www.ebay.com/usr/fleckstrade?_trksid=p2047675.l2559,Instant,0,0,1,Unknown
