id,title,link,price,origin,image,seller_name,seller_link,sell_type,num_bids,num_watchers,num_stock,date
item344305942b,WNEEDU Women's Long Sleeve Loose Plain Dresses Casual Short Dress with Pockets,https://www.ebay.com/itm/224462738475?hash=item344305942b:g:cFUAAOSwy2NgoAuO,$28.56,"Multiple Locations, United States",https://i.ebayimg.com/images/g/cFUAAOSwy2NgoAuO/s-l300.jpg,the_color_shop,https://www.ebay.com/usr/the_color_shop?_trksid=p2047675.l2559,Instant,0,0,1,"May 25, 2021 20:48:34 PDT"
item2d341f9279,MOLERANI Women's Long Sleeve Casual Swing Simple T-Shirt Loose Dress,https://www.ebay.com/itm/194148012665?hash=item2d341f9279:g:k00AAOSwtC1gqKy5,$55.46,"Redmond, Washington, United States",https://i.ebayimg.com/images/g/k00AAOSwtC1gqKy5/s-l300.jpg,trendings53,https://www.ebay.com/usr/trendings53?_trksid=p2047675.l2559,Instant,0,0,1,"May 29, 2021 20:35:28 PDT"
item46adf1190c,gold red color small spotted butterfly brooch pin by TIA? USA,https://www.ebay.com/itm/303565969676?hash=item46adf1190c:g:DR4AAOSw-FpedN4c,$1.00,"Melbourne, Florida, United States",https://i.ebayimg.com/images/g/DR4AAOSw-FpedN4c/s-l300.jpg,born2record,https://www.ebay.com/usr/born2record?_trksid=p2047675.l2559,Instant,0,0,1,"Jan 29, 2021 14:23:42 PST"
item3662dbe445,BISHUIGE Women Summer Casual T Shirt Dresses Beach Cover up Plain Tank Dress,https://www.ebay.com/itm/233586811973?hash=item3662dbe445:g:EzsAAOSwq3hevCGK,$45.75,"Multiple Locations, United States",https://walletmonitor.com/api/files/public?key=4df4d361a23f9184b4419ae1dcfc1fdb.jpg,ethnicindiamart,https://www.ebay.com/usr/ethnicindiamart?_trksid=p2047675.l2559,Instant,0,0,1,"May 28, 2021 16:20:30 PDT"
item523ea11197,X jazz Sunglasses Rectangular Small Spotted Black Brown Vintage 1985,https://www.ebay.com/itm/353238061463?hash=item523ea11197:g:Sp0AAOSw~SNfAMgy,$29.12,"Lecce, Italy",https://i.ebayimg.com/images/g/Sp0AAOSw~SNfAMgy/s-l300.jpg,tiziana629,https://www.ebay.com/usr/tiziana629?_trksid=p2047675.l2559,Instant,0,0,1,"May 13, 2021 12:38:46 PDT"
item34269f1032,Porcelain Dove Bird Figurine Statue Small Spotted Tabletop Decor,https://www.ebay.com/itm/223986257970?hash=item34269f1032:g:BdMAAOSwXetdyIOh,$12.60,"Kalispell, Montana, United States",https://i.ebayimg.com/images/g/BdMAAOSwXetdyIOh/s-l300.jpg,billwills,https://www.ebay.com/usr/billwills?_trksid=p2047675.l2559,Instant,0,0,1,"Mar 14, 2021 07:30:43 PDT"
item5b8e50b83a,MISFAY Women Short Sleeve Loose Plain Maxi Dresses Casual Long Dresses Pockets,https://www.ebay.com/itm/393229678650?hash=item5b8e50b83a:g:oWcAAOSwRQdgZZXg,$73.54,"Multiple Locations, United States",https://i.ebayimg.com/images/g/oWcAAOSwRQdgZZXg/s-l300.jpg,ninnihomegarden,https://www.ebay.com/usr/ninnihomegarden?_trksid=p2047675.l2559,Instant,0,0,1,"May 29, 2021 23:34:26 PDT"
item4230f30bce,TINY HAND CRAFTED AMUSING CERAMIC SMALL SPOTTED W SEEDBEADS GREEN FROG FIGURINE,https://www.ebay.com/itm/284289076174?hash=item4230f30bce:g:8MYAAOSwH7FgFdiQ,$10.00,"Orono, Maine, United States",https://i.ebayimg.com/images/g/8MYAAOSwH7FgFdiQ/s-l300.jpg,maineestatesales,https://www.ebay.com/usr/maineestatesales?_trksid=p2047675.l2559,Instant,0,0,1,Unknown
item2f6022357c,Vintage Mid-Century Brass Small Spotted Buck and Doe Deer 5 1/2 Inch And 4 Inch,https://www.ebay.com/itm/203476317564?hash=item2f6022357c:g:nGkAAOSwGpFgqGbB,$19.99,"Ironwood, Michigan, United States",https://i.ebayimg.com/images/g/nGkAAOSwGpFgqGbB/s-l300.jpg,8fisher,https://www.ebay.com/usr/8fisher?_trksid=p2047675.l2559,Auction,0,0,1,"May 28, 2021 20:11:29 PDT"
item523ea11022,X jazz Sunglasses Rectangular Small Spotted Black Brown Vintage,https://www.ebay.com/itm/353238061090?hash=item523ea11022:g:wdcAAOSwhRNe94A6,$29.05,"Lecce, Italy",https://i.ebayimg.com/images/g/wdcAAOSwhRNe94A6/s-l300.jpg,tiziana629,https://www.ebay.com/usr/tiziana629?_trksid=p2047675.l2559,Instant,0,0,1,"May 22, 2021 02:38:20 PDT"
item5b8b215429,MOLERANI Women's Casual Plain Simple Long Sleeve T-Shirt Loose Dress,https://www.ebay.com/itm/393176241193?hash=item5b8b215429:g:DGcAAOSwmt1gQ4t-,$47.43,"Multiple Locations, United States",https://i.ebayimg.com/images/g/DGcAAOSwmt1gQ4t-/s-l300.jpg,kalakindia1407,https://www.ebay.com/usr/kalakindia1407?_trksid=p2047675.l2559,Instant,0,0,1,"May 27, 2021 23:34:56 PDT"
item34428ba076,AUSELILY Women's Summer Sleeveless Loose Plain Maxi Dress Casual Long Dress with,https://www.ebay.com/itm/224454746230?hash=item34428ba076:g:GFwAAOSwl6lglpT-,$67.99,"Multiple Locations, United States",https://i.ebayimg.com/images/g/GFwAAOSwl6lglpT-/s-l300.jpg,the_color_shop,https://www.ebay.com/usr/the_color_shop?_trksid=p2047675.l2559,Instant,0,0,1,"May 30, 2021 06:37:53 PDT"
item422b54d4b3,MOLERANI Women's Loose Plain Maxi Dresses Casual Long Dresses with Pockets,https://www.ebay.com/itm/284194821299?hash=item422b54d4b3:g:bYgAAOSwVQhgNNla,$74.36,"Multiple Locations, United States",https://i.ebayimg.com/images/g/bYgAAOSwVQhgNNla/s-l300.jpg,dezilshopping,https://www.ebay.com/usr/dezilshopping?_trksid=p2047675.l2559,Instant,0,0,1,"May 30, 2021 07:38:30 PDT"
item1a943f5c1b,"H&M Navy, Honey, Ivory ""Equestrian & Small Spotted Scarf 90cm x 90cm",https://www.ebay.com/itm/114156330011?hash=item1a943f5c1b:g:gGUAAOSwOmtedyPc,$5.00,"Docklands, VIC, Australia",https://i.ebayimg.com/images/g/gGUAAOSwOmtedyPc/s-l300.jpg,mrsrobinsonvintage,https://www.ebay.com/usr/mrsrobinsonvintage?_trksid=p2047675.l2559,Instant,0,0,1,"Jan 02, 2021 03:13:56 PST"
item3fe00fadb6,"DISNEY MOANA PUA SMALL SPOTTED BLACK & WHITE PLUSH PIG TOY COLLECTIBLE 9.5""",https://www.ebay.com/itm/274342063542?hash=item3fe00fadb6:g:zjgAAOSwTopenN-Y,$14.24,"Danville, Kentucky, United States",https://i.ebayimg.com/images/g/zjgAAOSwTopenN-Y/s-l300.jpg,lorilee32,https://www.ebay.com/usr/lorilee32?_trksid=p2047675.l2559,Instant,0,0,1,"Jun 30, 2020 20:18:53 PDT"
item23d8985f02,POPYOUNG Women's Summer Casual Tshirt Dresses Short Sleeve Boho Beach Dress,https://www.ebay.com/itm/153957719810?hash=item23d8985f02:g:SE0AAOSwCWte1pM2,$53.83,"Multiple Locations, United States",https://walletmonitor.com/api/files/public?key=24266f6939aa08a853b0513a9e8e2b88.jpg,pickandshop,https://www.ebay.com/usr/pickandshop?_trksid=p2047675.l2559,Instant,0,0,1,"May 30, 2021 05:13:32 PDT"
item2f3d3c8d06,DALMATIAN STUFFED TEDDY SMALL SPOTTED BLACK AND WHITE CUDDLY TOY DOG FANCY DRESS,https://www.ebay.com/itm/202890841350?hash=item2f3d3c8d06:g:neUAAOSwGoRcano2,$14.16,"GB, United Kingdom",https://i.ebayimg.com/images/g/neUAAOSwGoRcano2/s-l300.jpg,idealgiftshop,https://www.ebay.com/usr/idealgiftshop?_trksid=p2047675.l2559,Instant,0,0,More than 10,"May 27, 2021 06:20:51 PDT"
item447eab49df,Image card no. 64 small-spotted alcockii fox shark dogfish fish fish,https://www.ebay.com/itm/294182930911?hash=item447eab49df:g:ER0AAOSwwTZdkdkj,$6.08,"Varna, Bulgaria",https://i.ebayimg.com/images/g/ER0AAOSwwTZdkdkj/s-l300.jpg,saintmichelfrance,https://www.ebay.com/usr/saintmichelfrance?_trksid=p2047675.l2559,Instant,0,0,1,Unknown
item4b82ce90b5,WNEEDU Women's 3/4 Sleeve Floral Printed Loose Plain Casual Long Maxi Dresses wi,https://www.ebay.com/itm/324317122741?hash=item4b82ce90b5:g:gREAAOSwJMxfdvVR,$72.64,"Multiple Locations, United States",https://cdn.walletmonitor.com/img/8e939ea3e055b226eac828d443a99ffe.jpg,home_garden_care,https://www.ebay.com/usr/home_garden_care?_trksid=p2047675.l2559,Instant,0,0,1,"May 30, 2021 07:40:57 PDT"
item46c5cd5754,Small fox shark small-spotted dogfish fish fish alcockii France sheet,https://www.ebay.com/itm/303966279508?hash=item46c5cd5754:g:bbMAAOSwT5tWGAHE,$6.08,"Varna, Bulgaria",https://i.ebayimg.com/images/g/bbMAAOSwT5tWGAHE/s-l300.jpg,saintmichelfrance,https://www.ebay.com/usr/saintmichelfrance?_trksid=p2047675.l2559,Instant,0,0,1,"May 06, 2021 03:34:58 PDT"
item28ac7b07f5,BISHUIGE Women Summer Casual Round Neck T Shirt Dresses Beach Cover up Plain Tan,https://www.ebay.com/itm/174692435957?hash=item28ac7b07f5:g:~Q4AAOSw45lgVHy4,$61.23,"Multiple Locations, United States",https://i.ebayimg.com/images/g/~Q4AAOSw45lgVHy4/s-l300.jpg,fashionstylo,https://www.ebay.com/usr/fashionstylo?_trksid=p2047675.l2559,Instant,0,0,1,"May 30, 2021 08:50:31 PDT"
item48f69ba15d,MISFAY Women's Summer Spaghetti Strap Casual Swing Tank Beach Cover Up Dress wit,https://www.ebay.com/itm/313375039837?hash=item48f69ba15d:g:gBgAAOSwio1f-V0W,$58.05,"Multiple Locations, United States",https://i.ebayimg.com/images/g/gBgAAOSwio1f-V0W/s-l300.jpg,usafestivalshop,https://www.ebay.com/usr/usafestivalshop?_trksid=p2047675.l2559,Instant,0,0,1,"May 30, 2021 09:12:57 PDT"
item3daa431d57,Rubber Stamp 2003 STAMPIN UP SMALL SPOTTED BUTTERFLY Polkadots Girls,https://www.ebay.com/itm/264849530199?hash=item3daa431d57:g:Z6MAAOSwhvNfTSLB,$2.45,"Intercourse, Pennsylvania, United States",https://i.ebayimg.com/images/g/Z6MAAOSwhvNfTSLB/s-l300.jpg,kma5608,https://www.ebay.com/usr/kma5608?_trksid=p2047675.l2559,Instant,0,0,1,"Mar 31, 2021 09:21:05 PDT"
item288864b1d9,"NEW!!! GUESS Women's Long Sleeve Koloa Ruffle Top (Sport Bengal, Sz: Small)",https://www.ebay.com/itm/174086992345?epid=13036054591&hash=item288864b1d9:g:Y5MAAOSwJBBgRdQq,$18.90,"Santa Cruz, California, United States",https://i.ebayimg.com/images/g/Y5MAAOSwJBBgRdQq/s-l300.jpg,samemarket,https://www.ebay.com/usr/samemarket?_trksid=p2047675.l2559,Instant,0,0,Last one,"May 29, 2021 13:56:53 PDT"
item4da1bda0ed,GUESS Women's Freedia Ruched Pullover Top (Various Colors & Sizes),https://www.ebay.com/itm/333426041069?hash=item4da1bda0ed:g:~dgAAOSwwJ1d5vTq,$24.99,"Denver, Colorado, United States",https://i.ebayimg.com/images/g/~dgAAOSwwJ1d5vTq/s-l300.png,theriverbendcompany,https://www.ebay.com/usr/theriverbendcompany?_trksid=p2047675.l2559,Instant,0,0,1,"Feb 05, 2021 11:12:40 PST"
item23db82fc4d,POPYOUNG Women's Swimsuit Cover Ups Summer Swing Casual Beach Dress,https://www.ebay.com/itm/154006649933?hash=item23db82fc4d:g:754AAOSwqOVfDMoX,$46.86,"Multiple Locations, United States",https://i.ebayimg.com/images/g/754AAOSwqOVfDMoX/s-l300.jpg,place_your_order,https://www.ebay.com/usr/place_your_order?_trksid=p2047675.l2559,Instant,0,0,1,"May 30, 2021 05:09:39 PDT"
item2af64a037a,POPYOUNG Women's Summer Casual Tshirt Dresses Short Sleeve Boho Beach Dress,https://www.ebay.com/itm/184520672122?hash=item2af64a037a:g:gN4AAOSwqoZgsoNz,$52.33,"Multiple Locations, United States",https://cdn.walletmonitor.com/img/ea08f1bf530c950227f04680c4417cfe.jpg,fashionstylo,https://www.ebay.com/usr/fashionstylo?_trksid=p2047675.l2559,Instant,0,0,1,"May 29, 2021 11:09:53 PDT"
item28a024883a,AUSELILY Women's Short Sleeve Pleated Loose Swing Casual Dress with Pockets Knee,https://www.ebay.com/itm/174485440570?hash=item28a024883a:g:bu0AAOSwgdlfjQDd,$62.80,"Multiple Locations, United States",https://i.ebayimg.com/images/g/bu0AAOSwgdlfjQDd/s-l300.jpg,fashionstylo,https://www.ebay.com/usr/fashionstylo?_trksid=p2047675.l2559,Instant,0,0,1,"May 30, 2021 04:23:16 PDT"
item23f507979e,"VINTAGE STEIFF GERMANY 5"" SMALL SPOTTED MOHAIR HORSE",https://www.ebay.com/itm/154434770846?hash=item23f507979e:g:F4IAAOSwuS5gjFYe,$98.00,"Milwaukee, Wisconsin, United States",https://i.ebayimg.com/images/g/F4IAAOSwuS5gjFYe/s-l300.jpg,terrkubac,https://www.ebay.com/usr/terrkubac?_trksid=p2047675.l2559,Instant,0,0,1,"May 26, 2021 12:43:10 PDT"
item59667b1241,MOLERANI Women's Casual Long Sleeve Round Neck Loose Tunic T Shirt Blouse Tops,https://www.ebay.com/itm/383971430977?hash=item59667b1241:g:JkoAAOSw0zRgM1SZ,$52.32,"Multiple Locations, United States",https://i.ebayimg.com/images/g/JkoAAOSw0zRgM1SZ/s-l300.jpg,clothinghomedecormall,https://www.ebay.com/usr/clothinghomedecormall?_trksid=p2047675.l2559,Instant,0,0,1,"May 26, 2021 19:51:50 PDT"
item1f21eef195,POPYOUNG Women's Summer Casual Tshirt Dresses Short Sleeve Boho Beach Dress,https://www.ebay.com/itm/133713293717?hash=item1f21eef195:g:7ZoAAOSwqQ1gaFy2,$63.32,"Multiple Locations, United States",https://i.ebayimg.com/images/g/7ZoAAOSwqQ1gaFy2/s-l300.jpg,usasilvershop,https://www.ebay.com/usr/usasilvershop?_trksid=p2047675.l2559,Instant,0,0,1,"May 28, 2021 15:12:45 PDT"
item23f2fd63f6,POPYOUNG Women's Summer Casual Tshirt Dresses Short Sleeve Boho Beach Dress,https://www.ebay.com/itm/154400547830?hash=item23f2fd63f6:g:XN0AAOSwL~RgaEeH,$51.91,"Multiple Locations, United States",https://i.ebayimg.com/images/g/XN0AAOSwL~RgaEeH/s-l300.jpg,ojanshicreation,https://www.ebay.com/usr/ojanshicreation?_trksid=p2047675.l2559,Instant,0,0,1,"May 30, 2021 07:01:23 PDT"
item2af4b9064e,MOLERANI Women's Casual Long Sleeve Round Neck Loose Tunic T Shirt Blouse Tops,https://www.ebay.com/itm/184494392910?hash=item2af4b9064e:g:4G8AAOSwm0lfjPl-,$44.75,"Multiple Locations, United States",https://cdn.walletmonitor.com/img/b49961a734a54d24f2307716e7338a93.jpg,fashionstylo,https://www.ebay.com/usr/fashionstylo?_trksid=p2047675.l2559,Instant,0,0,1,"May 30, 2021 03:05:43 PDT"
item1f226613b9,AUSELILY Women's Summer Sleeveless Loose Plain Maxi Dress Casual Long Dress with,https://www.ebay.com/itm/133721101241?hash=item1f226613b9:g:Xh8AAOSwvLFgcElW,$79.88,"Multiple Locations, United States",https://i.ebayimg.com/images/g/Xh8AAOSwvLFgcElW/s-l300.jpg,usasilvershop,https://www.ebay.com/usr/usasilvershop?_trksid=p2047675.l2559,Instant,0,0,1,"May 30, 2021 06:28:49 PDT"
item5b76d58073,MOLERANI Women's Loose Plain Maxi Dresses Casual Long Dresses with Pockets,https://www.ebay.com/itm/392835727475?hash=item5b76d58073:g:bdMAAOSwfaZe47Pv,$70.60,"Multiple Locations, United States",https://walletmonitor.com/api/files/public?key=b55336ab52ad319b69d3f0c6dec64e82.jpg,perkfashion,https://www.ebay.com/usr/perkfashion?_trksid=p2047675.l2559,Instant,0,0,1,"May 30, 2021 04:21:11 PDT"
item3ff1020ff6,MOLERANI Women's Casual Plain Simple Long Sleeve T-Shirt Loose Dress,https://www.ebay.com/itm/274626383862?hash=item3ff1020ff6:g:3jMAAOSw-JRf5zAw,$50.38,"Multiple Locations, United States",https://i.ebayimg.com/images/g/3jMAAOSw-JRf5zAw/s-l300.jpg,dezilshopping,https://www.ebay.com/usr/dezilshopping?_trksid=p2047675.l2559,Instant,0,0,1,"May 29, 2021 07:09:55 PDT"
item23f33c10a1,MOLERANI Women's Casual Swing Simple T-Shirt Loose Dress,https://www.ebay.com/itm/154404655265?hash=item23f33c10a1:g:zPAAAOSwSGtgbKGo,$53.98,"Multiple Locations, United States",https://i.ebayimg.com/images/g/zPAAAOSwSGtgbKGo/s-l300.jpg,ojanshicreation,https://www.ebay.com/usr/ojanshicreation?_trksid=p2047675.l2559,Instant,0,0,1,"May 30, 2021 09:15:34 PDT"
item34287990fa,AUSELILY Women's Sleeveless Pockets Casual Swing T-Shirt Dresses,https://www.ebay.com/itm/224017355002?hash=item34287990fa:g:GloAAOSwqBtexYtr,$55.98,"Multiple Locations, United States",https://walletmonitor.com/api/files/public?key=77287e7e64b83aaae642b3acf706bb07.jpg,pinkcitystudio,https://www.ebay.com/usr/pinkcitystudio?_trksid=p2047675.l2559,Instant,0,0,1,"May 30, 2021 02:28:11 PDT"
item28a02488b1,AUSELILY Women's Short Sleeve Pleated Loose Swing Casual Dress with Pockets Knee,https://www.ebay.com/itm/174485440689?hash=item28a02488b1:g:mK0AAOSwcyxfjQDu,$62.80,"Multiple Locations, United States",https://i.ebayimg.com/images/g/mK0AAOSwcyxfjQDu/s-l300.jpg,fashionstylo,https://www.ebay.com/usr/fashionstylo?_trksid=p2047675.l2559,Instant,0,0,1,"May 30, 2021 04:23:18 PDT"
item23f2fd654c,MOLERANI Women's Casual Plain Simple T-Shirt Loose Dress,https://www.ebay.com/itm/154400548172?hash=item23f2fd654c:g:56AAAOSw9MpgaEej,$51.91,"Multiple Locations, United States",https://i.ebayimg.com/images/g/56AAAOSw9MpgaEej/s-l300.jpg,ojanshicreation,https://www.ebay.com/usr/ojanshicreation?_trksid=p2047675.l2559,Instant,0,0,1,"May 30, 2021 04:36:26 PDT"
item263e896534,MISFAY Women's Summer Spaghetti Strap Casual Swing Tank Beach Cover Up Dress wit,https://www.ebay.com/itm/164257948980?hash=item263e896534:g:MzIAAOSw7WBe8P6l,$55.54,"Multiple Locations, United States",https://i.ebayimg.com/images/g/MzIAAOSw7WBe8P6l/s-l300.jpg,place_your_order,https://www.ebay.com/usr/place_your_order?_trksid=p2047675.l2559,Instant,0,0,1,"May 30, 2021 05:09:27 PDT"
item2aed07c70f,MISFAY Women's Summer Spaghetti Strap Casual Swing Tank Beach Cover Up Dress wit,https://www.ebay.com/itm/184365336335?hash=item2aed07c70f:g:AvMAAOSwqvZfD0Vy,$53.83,"Multiple Locations, United States",https://i.ebayimg.com/images/g/AvMAAOSwqvZfD0Vy/s-l300.jpg,handicraft-place,https://www.ebay.com/usr/handicraft-place?_trksid=p2047675.l2559,Instant,0,0,1,"May 28, 2021 08:01:39 PDT"
item365ff364bc,GUESS Womens Freedia Ruched Fitted Long-Sleeve Top Size Small Spotted Bengal,https://www.ebay.com/itm/233538020540?hash=item365ff364bc:g:4N4AAOSwXMZeen0C,$23.88,"Oceanside, California, United States",https://i.ebayimg.com/images/g/4N4AAOSwXMZeen0C/s-l300.jpg,neiisner,https://www.ebay.com/usr/neiisner?_trksid=p2047675.l2559,Instant,0,0,1,"Mar 25, 2021 12:16:04 PDT"
item3669b6b0d9,BISHUIGE Women Summer Casual V Neck T Shirt Dresses Beach Cover up Plain Tank Dr,https://www.ebay.com/itm/233701814489?hash=item3669b6b0d9:m:mDfTqFQBExCiDg_MQbt8N9Q,$51.38,"Multiple Locations, United States",https://cdn.walletmonitor.com/img/fbd0b9e4c970197afe7c5bcb5d1a8fa1.jpg,fashionhut85,https://www.ebay.com/usr/fashionhut85?_trksid=p2047675.l2559,Instant,0,0,1,"May 30, 2021 01:48:05 PDT"
item5b8e50a2e4,AUSELILY Women's Sleeveless Pleated Loose Swing Casual Dress with Pockets Knee L,https://www.ebay.com/itm/393229673188?hash=item5b8e50a2e4:g:s0QAAOSw931gZZQ7,$68.80,"Multiple Locations, United States",https://i.ebayimg.com/images/g/s0QAAOSw931gZZQ7/s-l300.jpg,ninnihomegarden,https://www.ebay.com/usr/ninnihomegarden?_trksid=p2047675.l2559,Instant,0,0,1,"May 29, 2021 23:34:21 PDT"
item3669b6720b,WNEEDU Women's 3/4 Sleeve Floral Printed Loose Plain Casual Long Maxi Dresses wi,https://www.ebay.com/itm/233701798411?hash=item3669b6720b:g:eS0AAOSwPLhfUaOS,$64.23,"Multiple Locations, United States",https://cdn.walletmonitor.com/img/aeee4774132f0b8610aca71abd95c24c.jpg,fashionhut85,https://www.ebay.com/usr/fashionhut85?_trksid=p2047675.l2559,Instant,0,0,1,"May 30, 2021 03:49:14 PDT"
item447d80f56e,MISFAY Women's Summer Casual T Shirt Dresses Beach Cover up Plain Tank Dress wit,https://www.ebay.com/itm/294163379566?hash=item447d80f56e:g:NW0AAOSw3LVglFa7,$53.83,"Multiple Locations, United States",https://i.ebayimg.com/images/g/NW0AAOSw3LVglFa7/s-l300.jpg,online_retail_exporter,https://www.ebay.com/usr/online_retail_exporter?_trksid=p2047675.l2559,Instant,0,0,1,"May 30, 2021 05:10:20 PDT"
item23d9593a48,POPYOUNG Women's Summer Casual Tshirt Dresses Short Sleeve Boho Beach Dress,https://www.ebay.com/itm/153970358856?hash=item23d9593a48:m:mmYTo7gYlrBFY92VU14oPaA,$54.35,"Multiple Locations, United States",https://walletmonitor.com/api/files/public?key=b61407ccaada33e20a839b4c638ed564.jpg,place_your_order,https://www.ebay.com/usr/place_your_order?_trksid=p2047675.l2559,Instant,0,0,1,"May 30, 2021 05:09:48 PDT"
item5966dfd0e3,AUSELILY Women's Summer Sleeveless Loose Plain Maxi Dress Casual Long Dress with,https://www.ebay.com/itm/383978033379?hash=item5966dfd0e3:g:RK8AAOSwOVhgNjcF,$79.32,"Multiple Locations, United States",https://i.ebayimg.com/images/g/RK8AAOSwOVhgNjcF/s-l300.jpg,clothinghomedecormall,https://www.ebay.com/usr/clothinghomedecormall?_trksid=p2047675.l2559,Instant,0,0,1,"May 30, 2021 05:24:44 PDT"
item596440ac21,AUSELILY Women's Short Sleeve Pleated Loose Swing Casual Dress with Pockets Knee,https://www.ebay.com/itm/383934049313?hash=item596440ac21:g:nRkAAOSwuDlgGk9w,$69.98,"Multiple Locations, United States",https://i.ebayimg.com/images/g/nRkAAOSwuDlgGk9w/s-l300.jpg,clothinghomedecormall,https://www.ebay.com/usr/clothinghomedecormall?_trksid=p2047675.l2559,Instant,0,0,1,"May 30, 2021 02:37:56 PDT"
item4b7a2d7269,MOLERANI Women's Casual Swing Simple T-Shirt Loose Dress,https://www.ebay.com/itm/324172345961?hash=item4b7a2d7269:g:XdcAAOSwADZexYts,$55.98,"Multiple Locations, United States",https://i.ebayimg.com/images/g/XdcAAOSwADZexYts/s-l300.jpg,pinkcitystudio,https://www.ebay.com/usr/pinkcitystudio?_trksid=p2047675.l2559,Instant,0,0,1,"May 30, 2021 02:28:02 PDT"
item2d1ed850b3,MOLERANI Women's Long Sleeve Casual Swing Simple T-Shirt Loose Dress,https://www.ebay.com/itm/193791021235?hash=item2d1ed850b3:g:qzMAAOSwmktf0Md6,$53.79,"Multiple Locations, United States",https://i.ebayimg.com/images/g/qzMAAOSwmktf0Md6/s-l300.jpg,jaipurexport,https://www.ebay.com/usr/jaipurexport?_trksid=p2047675.l2559,Instant,0,0,1,"May 26, 2021 20:06:51 PDT"
item289fedb010,AUSELILY Women Short Sleeve Loose Plain Casual Long Maxi Dresses with Pockets,https://www.ebay.com/itm/174481846288?hash=item289fedb010:g:ffwAAOSwCaBfiVGP,$77.45,"Multiple Locations, United States",https://cdn.walletmonitor.com/img/968ed1fba08fb8eafa2ddeaea8d75c77.jpg,fashionstylo,https://www.ebay.com/usr/fashionstylo?_trksid=p2047675.l2559,Instant,0,0,1,"May 30, 2021 03:36:21 PDT"
item2d33cb2d83,AUSELILY Women's Casual Crewneck Sleeveless High Low Flowy Side Split Midi Dress,https://www.ebay.com/itm/194142481795?hash=item2d33cb2d83:g:2kcAAOSwUURgphP3,$53.34,"Redmond, Washington, United States",https://i.ebayimg.com/images/g/2kcAAOSwUURgphP3/s-l300.jpg,trendings53,https://www.ebay.com/usr/trendings53?_trksid=p2047675.l2559,Instant,0,0,1,"May 29, 2021 16:37:00 PDT"
item48f69cbb48,MOLERANI Women's Casual Plain Simple T-Shirt Loose Dress,https://www.ebay.com/itm/313375112008?hash=item48f69cbb48:g:2agAAOSwnatf-XHN,$58.05,"Multiple Locations, United States",https://i.ebayimg.com/images/g/2agAAOSwnatf-XHN/s-l300.jpg,usafestivalshop,https://www.ebay.com/usr/usafestivalshop?_trksid=p2047675.l2559,Instant,0,0,1,"May 30, 2021 06:54:20 PDT"
item2b017e7c0f,MISFAY Women's Summer Casual T Shirt Dresses Beach Cover up Plain Tank Dress wit,https://www.ebay.com/itm/184708660239?hash=item2b017e7c0f:g:MiIAAOSws09gTHaW,$58.32,"Multiple Locations, United States",https://i.ebayimg.com/images/g/MiIAAOSws09gTHaW/s-l300.jpg,needo82,https://www.ebay.com/usr/needo82?_trksid=p2047675.l2559,Instant,0,0,1,"May 30, 2021 01:08:27 PDT"
item5b9515337c,MISFAY Women's Summer Sleeveless V-Neck T-Shirt Tunic Tops Blouse Shirts,https://www.ebay.com/itm/393343218556?hash=item5b9515337c:g:XM0AAOSwYBRgq4oI,$34.11,"Multiple Locations, United States",https://i.ebayimg.com/images/g/XM0AAOSwYBRgq4oI/s-l300.jpg,kalakindia1407,https://www.ebay.com/usr/kalakindia1407?_trksid=p2047675.l2559,Instant,0,0,1,"May 29, 2021 18:11:40 PDT"
item5b95153419,MISFAY Women's Henley Tops for Women Summer Short Sleeve Button Up V Neck Casual,https://www.ebay.com/itm/393343218713?hash=item5b95153419:g:z88AAOSwoQZgq4oT,$21.24,"Multiple Locations, United States",https://i.ebayimg.com/images/g/z88AAOSwoQZgq4oT/s-l300.jpg,kalakindia1407,https://www.ebay.com/usr/kalakindia1407?_trksid=p2047675.l2559,Instant,0,0,1,"May 28, 2021 18:03:04 PDT"
item5b76d5a58a,AUSELILY Women's Sleeveless Pockets Casual Swing T-Shirt Dresses,https://www.ebay.com/itm/392835736970?hash=item5b76d5a58a:g:TRAAAOSwHcxe47ck,$53.98,"Multiple Locations, United States",https://walletmonitor.com/api/files/public?key=9e713326cb978d8caa19e36cea08815d.jpg,perkfashion,https://www.ebay.com/usr/perkfashion?_trksid=p2047675.l2559,Instant,0,0,1,"May 29, 2021 04:02:18 PDT"
item2af48368bd,AUSELILY Women's Long Sleeve Pleated Loose Swing Casual Dress with Pockets Knee,https://www.ebay.com/itm/184490879165?hash=item2af48368bd:g:gLoAAOSwnB1fiaHe,$52.33,"Multiple Locations, United States",https://cdn.walletmonitor.com/img/af6b5ba259bb306b775b4274ec7c55bd.jpg,fashionstylo,https://www.ebay.com/usr/fashionstylo?_trksid=p2047675.l2559,Instant,0,0,1,"May 29, 2021 23:46:38 PDT"
item3ff102027e,POPYOUNG Women's Long Sleeve T Shirt Dresses Casual Swing Dress,https://www.ebay.com/itm/274626380414?hash=item3ff102027e:g:PQoAAOSwVZxf5y6d,$48.73,"Multiple Locations, United States",https://i.ebayimg.com/images/g/PQoAAOSwVZxf5y6d/s-l300.jpg,dezilshopping,https://www.ebay.com/usr/dezilshopping?_trksid=p2047675.l2559,Instant,0,0,1,"May 29, 2021 06:07:16 PDT"
item48f6627587,BISHUIGE Women Summer Casual Round Neck T Shirt Dresses Beach Cover up Plain Tan,https://www.ebay.com/itm/313371293063?hash=item48f6627587:g:sNYAAOSwITBf9V~S,$63.21,"Multiple Locations, United States",https://i.ebayimg.com/images/g/sNYAAOSwITBf9V~S/s-l300.jpg,usafestivalshop,https://www.ebay.com/usr/usafestivalshop?_trksid=p2047675.l2559,Instant,0,0,1,"May 30, 2021 08:29:16 PDT"
item2ae3ff7b34,LONGYUAN Women's Summer Casual T Shirt Dresses Swimsuit Cover Ups with Pockets,https://www.ebay.com/itm/184213797684?hash=item2ae3ff7b34:g:-I4AAOSwBiNecANk,$77.52,"Multiple Locations, United States",https://i.ebayimg.com/images/g/-I4AAOSwBiNecANk/s-l300.jpg,handicraft-place,https://www.ebay.com/usr/handicraft-place?_trksid=p2047675.l2559,Instant,0,0,1,"May 28, 2021 08:01:31 PDT"
item48f69c0b17,MOLERANI Women's Casual Swing Simple T-Shirt Loose Dress,https://www.ebay.com/itm/313375066903?hash=item48f69c0b17:g:ftUAAOSwdPFf-WUa,$59.66,"Multiple Locations, United States",https://i.ebayimg.com/images/g/ftUAAOSwdPFf-WUa/s-l300.jpg,usafestivalshop,https://www.ebay.com/usr/usafestivalshop?_trksid=p2047675.l2559,Instant,0,0,1,"May 29, 2021 19:49:10 PDT"
item2af4b8814b,POPYOUNG Women's Long Sleeve T Shirt Dresses Casual Swing Dress,https://www.ebay.com/itm/184494358859?hash=item2af4b8814b:m:mIgU8YeRWT788pTlYFlRNFQ,$48.73,"Multiple Locations, United States",https://cdn.walletmonitor.com/img/18675b917356dc64b95abd4a93f8e9a7.jpg,fashionstylo,https://www.ebay.com/usr/fashionstylo?_trksid=p2047675.l2559,Instant,0,0,1,"May 29, 2021 04:46:39 PDT"
item5b964815d5,BISHUIGE Women Summer Casual V Neck T Shirt Dresses Beach Cover up Plain Tank Dr,https://www.ebay.com/itm/393363330517?hash=item5b964815d5:g:JiQAAOSwvTNgsRJX,$66.42,"Multiple Locations, United States",https://i.ebayimg.com/images/g/JiQAAOSwvTNgsRJX/s-l300.jpg,ninnihomegarden,https://www.ebay.com/usr/ninnihomegarden?_trksid=p2047675.l2559,Instant,0,0,1,"May 29, 2021 23:18:39 PDT"
