id,title,link,image,price_sold,end_date,origin,seller_name,seller_link,sell_type,num_bids,num_sold,auction_end_date
item44b891df0a,Dried Insect/Butterfly/Moth Non set B8796 Blue Rare Hypolimnas salmacis Africa,https://www.ebay.com/itm/295154343690?hash=item44b891df0a:g:gg8AAOSwNYBi9tuy,https://i.ebayimg.com/thumbs/images/g/gg8AAOSwNYBi9tuy/s-l225.jpg,$6.07,Aug-12 17:56,"Goolwa, South Australia, Australia",uniquebutterfliesandinsects,https://www.ebay.com/usr/uniquebutterfliesandinsects?_trksid=p2047675.l2559,Instant,0,1,
item2b31551042,Butterfly  x1 female Hypolimnas salmacis (Ghana)  large,https://www.ebay.com/itm/185511252034?hash=item2b31551042:g:LhkAAOSwnmli3ADT,https://i.ebayimg.com/thumbs/images/g/LhkAAOSwnmli3ADT/s-l225.jpg,$4.60,Jul-31 10:50,"hamstall ridware, United Kingdom",ridware,https://www.ebay.com/usr/ridware?_trksid=p2047675.l2559,Auction,2,1,"Jul 31, 2022

10:50:51 PDT"
item28d45554a4,Butterfly  x1 male Hypolimnas salmacis (Ghana),https://www.ebay.com/itm/175361053860?hash=item28d45554a4:g:S8YAAOSwIrpi3ACA,https://i.ebayimg.com/thumbs/images/g/S8YAAOSwIrpi3ACA/s-l225.jpg,$4.07,Jul-31 10:48,"hamstall ridware, United Kingdom",ridware,https://www.ebay.com/usr/ridware?_trksid=p2047675.l2559,Auction,2,1,"Jul 31, 2022

10:48:18 PDT"
