id,title,link,image,price_sold,end_date,origin,seller_name,seller_link,sell_type,num_bids,num_sold,auction_end_date
item5bbed88823,Prepona praeneste Purple Red Framed Rare Butterfly Display,https://www.ebay.com/itm/394043885603?hash=item5bbed88823:g:a3gAAOSwINZiZNUJ,https://i.ebayimg.com/thumbs/images/g/a3gAAOSwINZiZNUJ/s-l225.jpg,$139.99,Aug-13 09:55,"Hot Springs, South Dakota, United States",butterfly-designs,https://www.ebay.com/usr/butterfly-designs?_trksid=p2047675.l2559,Instant,0,1,
item2b239a89f3,HYBRID AGRIAS BEATIFICA LACHAUMEI X PREPONA PRAENESTE MALE SPECIAL COLORS #22,https://www.ebay.com/itm/185280924147?hash=item2b239a89f3:g:VQQAAOSwwrRh5EfM,https://i.ebayimg.com/thumbs/images/g/VQQAAOSwwrRh5EfM/s-l225.jpg,$299.99,Aug-08 03:43,"Miami, Florida, United States",eduentomology,https://www.ebay.com/usr/eduentomology?_trksid=p2047675.l2559,Instant,0,1,
item4de21b163b,FANTASTIC PREPONA PRAENESTE  ABRUPTA  MALE NYMPHALIIDAE NYMPHALIDAE PERU,https://www.ebay.com/itm/334505907771?hash=item4de21b163b:g:BLIAAOSw0KFi1D8a,https://i.ebayimg.com/thumbs/images/g/BLIAAOSw0KFi1D8a/s-l225.jpg,$108.50,Jul-24 09:56,"Azay le Rideau, France",ameriana15,https://www.ebay.com/usr/ameriana15?_trksid=p2047675.l2559,Auction,14,1,"Jul 24, 2022

09:56:35 PDT"
item5bbdf6681b,Prepona praeneste Purple Red Framed Rare Butterfly Display,https://www.ebay.com/itm/394029066267?hash=item5bbdf6681b:g:9ywAAOSwduRiVhGk,https://i.ebayimg.com/thumbs/images/g/9ywAAOSwduRiVhGk/s-l225.jpg,$139.99,Jul-16 10:25,"Hot Springs, South Dakota, United States",butterfly-designs,https://www.ebay.com/usr/butterfly-designs?_trksid=p2047675.l2559,Instant,0,1,
item2b23899d9d,FANTASTIC PREPONA PRAENESTE MALE FROM PERU MOUNTED RIKER FRAMED #055,https://www.ebay.com/itm/185279815069?hash=item2b23899d9d:g:cvkAAOSwhdJh-zXu,https://i.ebayimg.com/thumbs/images/g/cvkAAOSwhdJh-zXu/s-l225.jpg,$89.99,Jun-27 06:34,"Miami, Florida, United States",eduentomology,https://www.ebay.com/usr/eduentomology?_trksid=p2047675.l2559,Instant,0,1,
