id,title,link,image,price_sold,end_date,origin,seller_name,seller_link,sell_type,num_bids,num_sold,auction_end_date
item54bd208ed7,"PARIDES NEOPHILUS EURYBATES MALE FROM POZO AZUL, ARGENTINIA",https://www.ebay.com/itm/363950280407?hash=item54bd208ed7:g:1YMAAOSwQZBi~lXG,https://i.ebayimg.com/thumbs/images/g/1YMAAOSwQZBi~lXG/s-l225.jpg,$3.75,Aug-28 10:02,"München, Germany",ilo44,https://www.ebay.com/usr/ilo44?_trksid=p2047675.l2559,Auction,5,1,"Aug 28, 2022

10:02:00 PDT"
item571fc74196,"PARIDES NEOPHILUS EURYBATES MALE FROM MISSIONES, ARGENTINIA",https://www.ebay.com/itm/374195306902?hash=item571fc74196:g:L1AAAOSwRCpi5UaI,https://i.ebayimg.com/thumbs/images/g/L1AAAOSwRCpi5UaI/s-l225.jpg,$18.27,Aug-06 11:27,"München, Germany",ilo44,https://www.ebay.com/usr/ilo44?_trksid=p2047675.l2559,Auction,7,1,"Aug 06, 2022

11:27:22 PDT"
item2416d80d07,Real Framed Butterfly Neophilus cattleheart Parides neophilus olivencius,https://www.ebay.com/itm/155002080519?hash=item2416d80d07:g:DgcAAOSwOmZihur~,https://i.ebayimg.com/thumbs/images/g/DgcAAOSwOmZihur~/s-l225.jpg,$49.99,Aug-05 14:02,"Hot Springs, South Dakota, United States",butterfly-designs,https://www.ebay.com/usr/butterfly-designs?_trksid=p2047675.l2559,Instant,0,1,
item1f3c02060d,"ENTOMOLOGY, BUTTERFLY: PARIDES NEOPHILUS ECBOLIUS FEMALE BRASIL",https://www.ebay.com/itm/134150751757?hash=item1f3c02060d:g:nQMAAOSwyY9ir19R,https://i.ebayimg.com/thumbs/images/g/nQMAAOSwyY9ir19R/s-l225.jpg,$5.50,Jun-26 10:39,"Haibach, Germany",aureus-butterflies-and-insects,https://www.ebay.com/usr/aureus-butterflies-and-insects?_trksid=p2047675.l2559,Auction,2,1,"Jun 26, 2022

10:39:40 PDT"
item2416d832e6,Real Framed Butterfly Parides neophilus olivencius Classic Black Display,https://www.ebay.com/itm/155002090214?hash=item2416d832e6:g:wpYAAOSwwORihu3F,https://i.ebayimg.com/thumbs/images/g/wpYAAOSwwORihu3F/s-l225.jpg,$49.99,Jun-16 15:20,"Hot Springs, South Dakota, United States",butterfly-designs,https://www.ebay.com/usr/butterfly-designs?_trksid=p2047675.l2559,Instant,0,1,
