id,title,link,image,price_sold,end_date,origin,seller_name,seller_link,sell_type,num_bids,num_sold,auction_end_date
item571a0524b7,"7 butterfly Danaus gilippus  queen butterfly and more, wings closed #335",https://www.ebay.com/itm/374098699447?hash=item571a0524b7:g:cYMAAOSwTR9ikDl1,https://i.ebayimg.com/thumbs/images/g/cYMAAOSwTR9ikDl1/s-l225.jpg,$8.00,May-30 13:14,"Miami, Florida, United States",rickysbugs,https://www.ebay.com/usr/rickysbugs?_trksid=p2047675.l2559,Instant,0,1,
item1f3aaa7fa7,"ENTOMOLOGY, BUTTERFLY: DANAUS GILIPPUS SSP ? MALE COLUMBIA",https://www.ebay.com/itm/134128238503?hash=item1f3aaa7fa7:g:qksAAOSwoVNijRgt,https://i.ebayimg.com/thumbs/images/g/qksAAOSwoVNijRgt/s-l225.jpg,$7.00,May-29 10:39,"Haibach, Germany",aureus-butterflies-and-insects,https://www.ebay.com/usr/aureus-butterflies-and-insects?_trksid=p2047675.l2559,Auction,2,1,"May 29, 2022

10:39:13 PDT"
item21a78bbc41,"ENTOMOLOGY, BUTTERFLY: DANAUS GILIPPUS THERISIPPUS MALE ARIZONA USA",https://www.ebay.com/itm/144544873537?hash=item21a78bbc41:g:WFMAAOSwpRFid~4c,https://i.ebayimg.com/thumbs/images/g/WFMAAOSwpRFid~4c/s-l225.jpg,$7.61,May-15 10:30,"Haibach, Germany",aureus-butterflies-and-insects,https://www.ebay.com/usr/aureus-butterflies-and-insects?_trksid=p2047675.l2559,Auction,2,1,"May 15, 2022

10:30:21 PDT"
item369be6a0fd,"Entomology, BUTTERFLY: DANAUS GILIPPUS THERISIPPUS TREATMENT USA ARIZONA #11",https://www.ebay.com/itm/234543816957?hash=item369be6a0fd:g:efsAAOSwsEpid9O~,https://i.ebayimg.com/thumbs/images/g/efsAAOSwsEpid9O~/s-l225.jpg,$11.24,May-15 09:41,"Haibach, Germany",aureus-tt-butterflies-and-insects,https://www.ebay.com/usr/aureus-tt-butterflies-and-insects?_trksid=p2047675.l2559,Auction,5,1,"May 15, 2022

09:41:11 PDT"
item369a5b5521,"Entomology, BUTTERFLY: DANAUS GILIPPUS STRIGOSUS passenger ARIZONA",https://www.ebay.com/itm/234517910817?hash=item369a5b5521:g:FgQAAOSwG~5iYAud,https://i.ebayimg.com/thumbs/images/g/FgQAAOSwG~5iYAud/s-l225.jpg,$13.39,May-08 09:58,"Haibach, Germany",aureus-tt-butterflies-and-insects,https://www.ebay.com/usr/aureus-tt-butterflies-and-insects?_trksid=p2047675.l2559,Auction,3,1,"May 08, 2022

09:58:12 PDT"
item597ddf9bb1,Danaus gilippus monarch mimic queen butterfly verso Arizona USA framed,https://www.ebay.com/itm/384363895729?hash=item597ddf9bb1:g:AjEAAOSw~GRhLopR,https://i.ebayimg.com/thumbs/images/g/AjEAAOSw~GRhLopR/s-l225.jpg,$28.00,May-04 07:48,Unknown,Unknown,Unknown,Instant,0,2,
item344ac3c91c,Danaus gilippus monarch mimic queen butterfly Arizona USA unmounted wings closed,https://www.ebay.com/itm/224592644380?hash=item344ac3c91c:g:SC8AAOSwwwdhLopp,https://i.ebayimg.com/thumbs/images/g/SC8AAOSwwwdhLopp/s-l225.jpg,$8.00,Apr-06 13:13,Unknown,Unknown,Unknown,Instant,0,3,
item1d249a71bf,Female Queen Butterfly Danaus gilippus Nymphalidae Lepidoptera South Texas B121,https://www.ebay.com/itm/125168153023?hash=item1d249a71bf:g:amoAAOSwgRViGFaB,https://i.ebayimg.com/thumbs/images/g/amoAAOSwgRViGFaB/s-l225.jpg,$6.19,Mar-07 19:12,"Houston, Texas, United States",txentosupply,https://www.ebay.com/usr/txentosupply?_trksid=p2047675.l2559,Auction,2,1,"Mar 07, 2022

19:12:22 PST"
item571118f6d2,Female Queen Butterfly Danaus gilippus Nymphalidae Lepidoptera South Texas B120,https://www.ebay.com/itm/373949003474?hash=item571118f6d2:g:apEAAOSwPBpiGFUF,https://i.ebayimg.com/thumbs/images/g/apEAAOSwPBpiGFUF/s-l225.jpg,$3.00,Mar-07 19:11,"Houston, Texas, United States",txentosupply,https://www.ebay.com/usr/txentosupply?_trksid=p2047675.l2559,Auction,3,1,"Mar 07, 2022

19:11:01 PST"
