id,title,link,image,price_sold,end_date,origin,seller_name,seller_link,sell_type,num_bids,num_sold,auction_end_date
item44aaf04f13,Real Insect/Butterfly/Moth Set Spread B8348 Rare Orange/Yellow Phoebis rurina,https://www.ebay.com/itm/294925651731?hash=item44aaf04f13:g:P6AAAOSwrZtiWNDr,https://i.ebayimg.com/thumbs/images/g/P6AAAOSwrZtiWNDr/s-l225.jpg,$7.07,May-16 04:07,"Goolwa, South Australia, Australia",uniquebutterfliesandinsects,https://www.ebay.com/usr/uniquebutterfliesandinsects?_trksid=p2047675.l2559,Instant,0,1,
item46e24bbfa0,Real Insect/Butterfly/Moth Set Spread B8340 Rare Orange/Yellow Phoebis rurina,https://www.ebay.com/itm/304444325792?hash=item46e24bbfa0:g:yAIAAOSw5oBiWMu~,https://i.ebayimg.com/thumbs/images/g/yAIAAOSw5oBiWMu~/s-l225.jpg,$7.07,May-16 04:07,"Goolwa, South Australia, Australia",uniquebutterfliesandinsects,https://www.ebay.com/usr/uniquebutterfliesandinsects?_trksid=p2047675.l2559,Instant,0,1,
item598430b33d,Phoebis rurina a1 male peru 3 pieces (unmounted),https://www.ebay.com/itm/384469873469?hash=item598430b33d:g:RD8AAOSwyiFhesUN,https://i.ebayimg.com/thumbs/images/g/RD8AAOSwyiFhesUN/s-l225.jpg,$7.50,Apr-27 08:00,"Sant Feliu de Llobregat, Spain",fernle_7753,https://www.ebay.com/usr/fernle_7753?_trksid=p2047675.l2559,Instant,0,3,
item3698528c08,Entomology Butterfly: phoebis Rurina ♂ Peru #23,https://www.ebay.com/itm/234483780616?hash=item3698528c08:g:SKUAAOSwJIZiQIzf,https://i.ebayimg.com/thumbs/images/g/SKUAAOSwJIZiQIzf/s-l225.jpg,$5.50,Apr-03 09:54,"Haibach, Germany",aureus-tt-butterflies-and-insects,https://www.ebay.com/usr/aureus-tt-butterflies-and-insects?_trksid=p2047675.l2559,Auction,3,1,"Apr 03, 2022

09:54:38 PDT"
item33fe8216df,Phoebis rurina ONE REAL BUTTERFLY YELLOW ORANGE PERU UNMOUNTED WINGS CLOSED,https://www.ebay.com/itm/223313270495?hash=item33fe8216df:g:6WoAAOSwLeFcMWO0,https://i.ebayimg.com/thumbs/images/g/6WoAAOSwLeFcMWO0/s-l225.jpg,$6.00,Mar-15 14:02,Unknown,Unknown,Unknown,Instant,0,44,
item422ff34f30,Phoebis rurina/Phoebis argante Display of 6 Butterflies! Free Shipping!,https://www.ebay.com/itm/284272316208?hash=item422ff34f30:g:vjkAAOSwyDpghjw5,https://i.ebayimg.com/thumbs/images/g/vjkAAOSwyDpghjw5/s-l225.jpg,$39.99,Mar-12 14:00,"Charleston, South Carolina, United States",mtborrelli,https://www.ebay.com/usr/mtborrelli?_trksid=p2047675.l2559,Instant,0,1,
