id,title,link,image,price_sold,end_date,origin,seller_name,seller_link,sell_type,num_bids,num_sold,auction_end_date
item364dd5a878,Leucaena leucocephala Wild Tamarind seeds Tropical 20 Seeds,https://www.ebay.com/itm/233234081912?hash=item364dd5a878:g:ab4AAOSwkwdbqOtA,https://i.ebayimg.com/thumbs/images/g/ab4AAOSwkwdbqOtA/s-l225.jpg,$8.99,May-30 02:28,Unknown,Unknown,Unknown,Instant,0,6,
item570a641655,Chinese Petai Fine Powder Leucaena Leucocephala Spice Fresh Pure Premium Quality,https://www.ebay.com/itm/373836486229?hash=item570a641655:g:SXwAAOSwc7Nhw-K8,https://i.ebayimg.com/thumbs/images/g/SXwAAOSwc7Nhw-K8/s-l225.jpg,$21.50 to $67.50,May-26 11:19,Unknown,Unknown,Unknown,Instant,0,2,
item23f57a4557,"200+Leucaena leucocephala Seeds, กระถิน",https://www.ebay.com/itm/154442286423?hash=item23f57a4557:g:W-EAAOSwOaRgk9Q9,https://i.ebayimg.com/thumbs/images/g/W-EAAOSwOaRgk9Q9/s-l225.jpg,$9.00,May-23 14:41,Unknown,Unknown,Unknown,Instant,0,13,
item260fd6e927,150 FRESH Leucaena Leucocephala / Lead Tree / White Popinac / Miracle Tree Seeds,https://www.ebay.com/itm/163474499879?hash=item260fd6e927:g:Ow8AAOxygj5Sfg-t,https://i.ebayimg.com/thumbs/images/g/Ow8AAOxygj5Sfg-t/s-l225.jpg,$5.99,May-23 06:24,Unknown,Unknown,Unknown,Instant,0,29,
item23e015e5b9,120 FRESH Leucaena Leucocephala / Lead Tree / White Popinac / Miracle Tree Seeds,https://www.ebay.com/itm/154083386809?hash=item23e015e5b9:g:DtEAAOxy3zNSfg9z,https://i.ebayimg.com/thumbs/images/g/DtEAAOxy3zNSfg9z/s-l225.jpg,$4.99,May-18 18:50,Unknown,Unknown,Unknown,Instant,0,22,
item3686aa05c4,RIVER TAMARIND Leucaena leucocephala Seeds x100 garden plant flower organic,https://www.ebay.com/itm/234187523524?hash=item3686aa05c4:g:Z1MAAOSwpQBgsO7g,https://i.ebayimg.com/thumbs/images/g/Z1MAAOSwpQBgsO7g/s-l225.jpg,$4.99,May-04 09:10,Unknown,Unknown,Unknown,Instant,0,2,
item525a938fc4,"10 Seeds Leucaena Leucocephala, Mimosa White Leadtree Jumbay White",https://www.ebay.com/itm/353706938308?hash=item525a938fc4:g:hB0AAOSwh1tfrVtS,https://i.ebayimg.com/thumbs/images/g/hB0AAOSwh1tfrVtS/s-l225.jpg,$3.45,May-04 08:57,Unknown,Unknown,Unknown,Instant,0,1,
item1f38eb7c01,"100+ Seeds Organic Leucaena Leucocephala seeds, Home grown CA USA,Harvested 2021",https://www.ebay.com/itm/134098942977?hash=item1f38eb7c01:g:HuYAAOSwn8NhL-2P,https://i.ebayimg.com/thumbs/images/g/HuYAAOSwn8NhL-2P/s-l225.jpg,$4.95,May-03 21:52,"Simi Valley, California, United States",kanittha08,https://www.ebay.com/usr/kanittha08?_trksid=p2047675.l2559,Instant,0,2,
item3b727bb107,Organic Subabul Seeds Leucaena Leucocephala Wild Tamarind Seed 100g,https://www.ebay.com/itm/255323779335?hash=item3b727bb107:g:6Y0AAOSwRiBh3CNB,https://i.ebayimg.com/thumbs/images/g/6Y0AAOSwRiBh3CNB/s-l225.jpg,$11.24,May-01 23:09,Unknown,Unknown,Unknown,Instant,0,1,
item369a473c96,Miracle Tree Mimosa Leucaena leucocephala Seeds x75 garden plant flower organic,https://www.ebay.com/itm/234516593814?hash=item369a473c96:g:Z1MAAOSwpQBgsO7g,https://i.ebayimg.com/thumbs/images/g/Z1MAAOSwpQBgsO7g/s-l225.jpg,$3.99,Apr-26 07:06,"Valletta, Malta, European Union, Malta",artmegara,https://www.ebay.com/usr/artmegara?_trksid=p2047675.l2559,Auction,1,1,"Apr 26, 2022

07:06:11 PDT"
item34592cc1c7,Miracle Tree Mimosa Leucaena Leucocephala Subabul Seed Safed Babool Beej Lamtoro,https://www.ebay.com/itm/224834404807?hash=item34592cc1c7:g:pn0AAOSwtVhiBmFQ,https://i.ebayimg.com/thumbs/images/g/pn0AAOSwtVhiBmFQ/s-l225.jpg,$12.99 to $29.99,Apr-16 07:39,Unknown,Unknown,Unknown,Instant,0,6,
item1f2b01104a,"100+ Seeds Organic Leucaena Leucocephala seeds, Home grown CA USA,Harvested 2021",https://www.ebay.com/itm/133865476170?hash=item1f2b01104a:g:HuYAAOSwn8NhL-2P,https://i.ebayimg.com/thumbs/images/g/HuYAAOSwn8NhL-2P/s-l225.jpg,$4.95,Mar-15 17:19,"Simi Valley, California, United States",kanittha08,https://www.ebay.com/usr/kanittha08?_trksid=p2047675.l2559,Instant,0,25,
item570a641655,Chinese Petai Fine Powder Leucaena Leucocephala Spice Fresh Pure Premium Quality,https://www.ebay.com/itm/373836486229?hash=item570a641655:g:SXwAAOSwc7Nhw-K8,https://i.ebayimg.com/thumbs/images/g/SXwAAOSwc7Nhw-K8/s-l225.jpg,$21.50 to $67.50,May-26 11:19,Unknown,Unknown,Unknown,Instant,0,2,
