id,title,link,image,price_sold,end_date,origin,seller_name,seller_link,sell_type,num_bids,num_sold,auction_end_date
item2cdcd6d75b,Papilio nireus Butterfly (FOLDED) Taxidermy REAL Unmounted,https://www.ebay.com/itm/192683628379?hash=item2cdcd6d75b:g:uKsAAOSwMuZbvBZV,https://i.ebayimg.com/thumbs/images/g/uKsAAOSwMuZbvBZV/s-l225.jpg,$2.85,Apr-19 10:28,Unknown,Unknown,Unknown,Instant,0,54,
item3dd37485fe,Bits And Bugs Framed Butterfly Papilio Nireus Black And Green 5 In Square Frame,https://www.ebay.com/itm/265540634110?hash=item3dd37485fe:g:vu8AAOSwHExiAvyt,https://i.ebayimg.com/thumbs/images/g/vu8AAOSwHExiAvyt/s-l225.jpg,$12.99,Apr-10 05:42,"Douglasville, Georgia, United States",ant0288,https://www.ebay.com/usr/ant0288?_trksid=p2047675.l2559,Instant,0,1,
item21a31cf09e,"ENTOMOLOGY, BUTTERFLY: PAPILIO NIREUS PSEUDONIREUS MALE ETHIOPIA RARE !",https://www.ebay.com/itm/144470503582?hash=item21a31cf09e:g:RFsAAOSw9T9iN3fA,https://i.ebayimg.com/thumbs/images/g/RFsAAOSw9T9iN3fA/s-l225.jpg,$6.99,Mar-27 11:52,"Haibach, Germany",aureus-butterflies-and-insects,https://www.ebay.com/usr/aureus-butterflies-and-insects?_trksid=p2047675.l2559,Auction,3,1,"Mar 27, 2022

11:52:03 PDT"
item3dc2842b06,African Blue-banded Swallowtail Butterfly Papilio nireus Male Folded FAST USA,https://www.ebay.com/itm/265256446726?hash=item3dc2842b06:g:AtcAAOSwX~dWn75W,https://i.ebayimg.com/thumbs/images/g/AtcAAOSwX~dWn75W/s-l225.jpg,$4.29,Mar-10 19:18,Unknown,Unknown,Unknown,Instant,0,14,
