id,title,link,image,price_sold,end_date,origin,seller_name,seller_link,sell_type,num_bids,num_sold,auction_end_date
item28d00790db,Butterfly  x1 female Acraea epaea epaea (Ghana),https://www.ebay.com/itm/175288848603?hash=item28d00790db:g:S~4AAOSwVLdih5uz,https://i.ebayimg.com/thumbs/images/g/S~4AAOSwVLdih5uz/s-l225.jpg,$4.03,May-29 11:05,"hamstall ridware, United Kingdom",ridware,https://www.ebay.com/usr/ridware?_trksid=p2047675.l2559,Auction,2,1,"May 29, 2022

11:05:31 PDT"
item28cc3a17c3,Butterfly  x1 male Acraea epaea epaea  (Ghana),https://www.ebay.com/itm/175225051075?hash=item28cc3a17c3:g:InUAAOSw6eNiSGH5,https://i.ebayimg.com/thumbs/images/g/InUAAOSw6eNiSGH5/s-l225.jpg,$3.15,Apr-10 13:07,"hamstall ridware, United Kingdom",ridware,https://www.ebay.com/usr/ridware?_trksid=p2047675.l2559,Auction,1,1,"Apr 10, 2022

13:07:29 PDT"
item1a95d50626,"LEPIDOPTERA, NYMPHALIDAE, HELICONIINAE, ACRAEA EPAEA (male) from CAMEROON",https://www.ebay.com/itm/114182915622?hash=item1a95d50626:g:nIcAAOSwyC1eKNuO,https://i.ebayimg.com/thumbs/images/g/nIcAAOSwyC1eKNuO/s-l225.jpg,$3.72,Mar-06 21:30,"Santiago de Compostela (A Coruña), Spain",insectpassion,https://www.ebay.com/usr/insectpassion?_trksid=p2047675.l2559,Instant,0,1,
item1ce2693645,"LEPIDOPTERA, NYMPHALIDAE, HELICONIINAE, ACRAEA EPAEA (female) from TOGO",https://www.ebay.com/itm/124057630277?hash=item1ce2693645:g:HUUAAOSw6INeKNoh,https://i.ebayimg.com/thumbs/images/g/HUUAAOSw6INeKNoh/s-l225.jpg,$4.98,Mar-06 21:30,Unknown,Unknown,Unknown,Instant,0,1,
