id,title,link,price,origin,image,seller_name,seller_link,sell_type,num_bids,num_watchers,num_stock,date
item59081f0f5a,Perisama euriclea verso ONE REAL BUTTERFLY RED WHITE BLUE UNMOUNTED WINGS CLOSED,https://www.ebay.com/itm/382388342618?hash=item59081f0f5a:g:kiMAAOSwJIlajiVk,$8.00,"Sahuarita, Arizona, United States",https://i.ebayimg.com/images/g/kiMAAOSwJIlajiVk/s-l300.jpg,bicbugs,https://www.ebay.com/usr/bicbugs?_trksid=p2047675.l2559,Instant,0,0,More than 10,"Feb 08, 2021 18:30:56 PST"
item590a06f3c8,Perisama euriclea verso REAL FRAMED BUTTERFLY RED WHITE BLUE PERU,https://www.ebay.com/itm/382420317128?hash=item590a06f3c8:g:GUYAAOSwBK5auF5M,$28.00,"Sahuarita, Arizona, United States",https://i.ebayimg.com/images/g/GUYAAOSwBK5auF5M/s-l300.jpg,bicbugs,https://www.ebay.com/usr/bicbugs?_trksid=p2047675.l2559,Instant,0,0,More than 10,"Feb 08, 2021 18:31:09 PST"
item59430bf000,Perisama euriclea ONE REAL BUTTERFLY BLUE BLACK UNMOUNTED WINGS CLOSED PERU,https://www.ebay.com/itm/383376945152?hash=item59430bf000:g:nBEAAOSwgNZeIncA,$8.00,"Sahuarita, Arizona, United States",https://i.ebayimg.com/images/g/nBEAAOSwgNZeIncA/s-l300.jpg,bicbugs,https://www.ebay.com/usr/bicbugs?_trksid=p2047675.l2559,Instant,0,0,More than 10,"Feb 08, 2021 18:30:52 PST"
item3414469340,Perisama euriclea REAL BUTTERFLY RED WHITE CHRISTMAS ORNAMENT GIFT PERU,https://www.ebay.com/itm/223678468928?hash=item3414469340:g:KlcAAOSwfyJdiUCz,$28.00,"Sahuarita, Arizona, United States",https://i.ebayimg.com/images/g/KlcAAOSwfyJdiUCz/s-l300.jpg,bicbugs,https://www.ebay.com/usr/bicbugs?_trksid=p2047675.l2559,Instant,0,0,More than 10,"Feb 08, 2021 18:30:51 PST"
item1cd7dfceb1,Perisama euriclea M male ex West-Ecuador n255,https://www.ebay.com/itm/123880853169?hash=item1cd7dfceb1:g:XiMAAOSw2SxdXEu4,$35.33,"Brachbach, Germany",https://i.ebayimg.com/images/g/XiMAAOSw2SxdXEu4/s-l300.jpg,borboleta555,https://www.ebay.com/usr/borboleta555?_trksid=p2047675.l2559,Instant,0,0,1,"Nov 01, 2020 03:49:48 PST"
