id,title,link,price,origin,image,seller_name,seller_link,sell_type,num_bids,num_watchers,num_stock,date
item33f09518f2,Batesia hypochlora verso ONE REAL BUTTERFLY YELLOW PINK UNMOUNTED WINGS CLOSED,https://www.ebay.com/itm/223079635186?hash=item33f09518f2:g:hOYAAOSw~51fMg4y,$16.00,"Sahuarita, Arizona, United States",https://i.ebayimg.com/images/g/hOYAAOSw~51fMg4y/s-l300.jpg,bicbugs,https://www.ebay.com/usr/bicbugs?_trksid=p2047675.l2559,Instant,0,0,More than 10,"Feb 08, 2021 18:30:38 PST"
item33f09532f8,Batesia hypochlora ONE REAL BUTTERFLY BLUE PINK PERU UNMOUNTED WINGS CLOSED,https://www.ebay.com/itm/223079641848?hash=item33f09532f8:g:5v0AAOSwkTVeiU0g,$16.00,"Sahuarita, Arizona, United States",https://i.ebayimg.com/images/g/5v0AAOSwkTVeiU0g/s-l300.jpg,bicbugs,https://www.ebay.com/usr/bicbugs?_trksid=p2047675.l2559,Instant,0,0,More than 10,"Feb 08, 2021 18:30:39 PST"
item5949ecbc01,Batesia hypochlora verso REAL FRAMED CLOWN BUTTERFLY YELLOW PINK PERU,https://www.ebay.com/itm/383492340737?hash=item5949ecbc01:g:YmUAAOSwKk5eip8F,$36.00,"Sahuarita, Arizona, United States",https://i.ebayimg.com/images/g/YmUAAOSwKk5eip8F/s-l300.jpg,bicbugs,https://www.ebay.com/usr/bicbugs?_trksid=p2047675.l2559,Instant,0,0,More than 10,"Feb 08, 2021 18:30:48 PST"
item5949dc64f6,Batesia hypochlora REAL FRAMED BUTTERFLY BLUE PINK PERU,https://www.ebay.com/itm/383491269878?hash=item5949dc64f6:g:1eYAAOSw5JdeiUu9,$36.00,"Sahuarita, Arizona, United States",https://i.ebayimg.com/images/g/1eYAAOSw5JdeiUu9/s-l300.jpg,bicbugs,https://www.ebay.com/usr/bicbugs?_trksid=p2047675.l2559,Instant,0,0,More than 10,"Feb 08, 2021 18:30:38 PST"
item4231f3475d,Lepidoptera -  Nympalidae -   Batesia hypochlora - Peru,https://www.ebay.com/itm/284305868637?hash=item4231f3475d:g:0WUAAOSwDmlgq~KJ,$2.84,"South Shields, United Kingdom",https://i.ebayimg.com/images/g/0WUAAOSwDmlgq~KJ/s-l300.jpg,0191stanhope,https://www.ebay.com/usr/0191stanhope?_trksid=p2047675.l2559,Auction,0,0,1,Unknown
item1d00cdd09b,"Batesia hypochlora ssp. hemichrysa Male EX tonantins, Brazil Rare n328",https://www.ebay.com/itm/124567539867?hash=item1d00cdd09b:g:MIUAAOSwHbdgI8vD,$103.54,"Brachbach, Germany",https://i.ebayimg.com/images/g/MIUAAOSwHbdgI8vD/s-l300.jpg,borboleta555,https://www.ebay.com/usr/borboleta555?_trksid=p2047675.l2559,Instant,0,0,1,Unknown
item446bddfa57,Real 3D Framed Butterfly Batesia Hypochlora Table Top,https://www.ebay.com/itm/293867485783?hash=item446bddfa57:g:qMsAAOSwaPFfxfXi,$19.99,"El Cerrito, California, United States",https://i.ebayimg.com/images/g/qMsAAOSwaPFfxfXi/s-l300.jpg,happyhippo128,https://www.ebay.com/usr/happyhippo128?_trksid=p2047675.l2559,Instant,0,0,1,"Feb 01, 2021 12:36:45 PST"
