id,title,link,price,origin,image,seller_name,seller_link,sell_type,num_bids,num_watchers,num_stock,date
item33e249f725,Papilio cresphontes rumiko ONE REAL BUTTERFLY GIANT SWALLOWTAIL WINGS CLOSED,https://www.ebay.com/itm/222839830309?hash=item33e249f725:g:g3cAAOSwcOtcjrGR,$12.00,"Sahuarita, Arizona, United States",https://i.ebayimg.com/thumbs/images/g/g3cAAOSwcOtcjrGR/s-l225.jpg,bicbugs,https://www.ebay.com/usr/bicbugs?_trksid=p2047675.l2559,Instant,0,0,More than 10,"Jun 18, 2021 19:15:52 PDT"
item58eb12647a,Papilio cresphontes verso REAL FRAMED BUTTERFLY YELLOW ARIZONA GIANT SWALLOWTAIL,https://www.ebay.com/itm/381900973178?hash=item58eb12647a:g:yqYAAOSwDk5UBjRv,$32.00,"Sahuarita, Arizona, United States",https://i.ebayimg.com/thumbs/images/g/yqYAAOSwDk5UBjRv/s-l225.jpg,bicbugs,https://www.ebay.com/usr/bicbugs?_trksid=p2047675.l2559,Instant,0,0,More than 10,"Jun 18, 2021 19:16:44 PDT"
item1d1258377d,Giant Swallowtail Butterfly Papilio cresphontes Papiliondaes Southeast Texas H28,https://www.ebay.com/itm/124861822845?hash=item1d1258377d:g:8ZEAAOSwiJBhHtN6,$5.50,"Houston, Texas, United States",https://i.ebayimg.com/thumbs/images/g/8ZEAAOSwiJBhHtN6/s-l225.jpg,txentosupply,https://www.ebay.com/usr/txentosupply?_trksid=p2047675.l2559,Instant,0,0,1,Unknown
item33b42c5e6b,Papilio cresphontes REAL AZ GIANT SWALLOWTAIL FRAMED BUTTERFLY INSECT,https://www.ebay.com/itm/222066138731?hash=item33b42c5e6b:g:C6QAAOSwMKpUZV0W,$32.00,"Sahuarita, Arizona, United States",https://i.ebayimg.com/thumbs/images/g/C6QAAOSwMKpUZV0W/s-l225.jpg,bicbugs,https://www.ebay.com/usr/bicbugs?_trksid=p2047675.l2559,Instant,0,0,More than 10,"Jun 18, 2021 19:16:43 PDT"
item5907bb75b1,Papilio cresphontes rumiko ONE REAL BUTTERFLY GIANT SWALLOWTAIL WINGS CLOSED,https://www.ebay.com/itm/382381815217?hash=item5907bb75b1:g:ZjkAAOSwM4Rchcwi,$12.00,"Sahuarita, Arizona, United States",https://i.ebayimg.com/thumbs/images/g/ZjkAAOSwM4Rchcwi/s-l225.jpg,bicbugs,https://www.ebay.com/usr/bicbugs?_trksid=p2047675.l2559,Instant,0,0,More than 10,"Jun 19, 2021 15:44:50 PDT"
item1d11bb65b1,"Unmounted A1- Papilio cresphontes, Male FLORIDA Giant Swallowtail BUTTERFLY",https://www.ebay.com/itm/124851545521?hash=item1d11bb65b1:g:DEoAAOSwp2RhAiud,$12.99,"Tampa, Florida, United States",https://i.ebayimg.com/thumbs/images/g/DEoAAOSwp2RhAiud/s-l225.jpg,gibsonianmuseum,https://www.ebay.com/usr/gibsonianmuseum?_trksid=p2047675.l2559,Instant,0,0,1,Unknown
