id,title,link,price,origin,image,seller_name,seller_link,sell_type,num_bids,num_watchers,num_stock,date
item5212b717c5,Precis Intermedia Stormrift RPG,https://www.ebay.com/itm/352501307333?hash=item5212b717c5:g:pl0AAOSwZKBZNiBn,$20.00,"Princeton, New Jersey, United States",https://i.ebayimg.com/thumbs/images/g/pl0AAOSwZKBZNiBn/s-l225.jpg,gaming_fool,https://www.ebay.com/usr/gaming_fool?_trksid=p2047675.l2559,Instant,0,0,1,"Jul 15, 2021 12:37:52 PDT"
item4d7fe61c03,Precis Intermedia RPGPundit's Gnome Murdered RPG Roleplaying at its Simplest,https://www.ebay.com/itm/332858268675?hash=item4d7fe61c03:g:WfMAAOSw9OFZNiCx,$12.00,"Princeton, New Jersey, United States",https://i.ebayimg.com/thumbs/images/g/WfMAAOSw9OFZNiCx/s-l225.jpg,gaming_fool,https://www.ebay.com/usr/gaming_fool?_trksid=p2047675.l2559,Instant,0,0,1,"Jul 15, 2021 12:37:52 PDT"
item5215c6caeb,Precis Intermedia Stellar Strike,https://www.ebay.com/itm/352552667883?hash=item5215c6caeb:g:EPAAAOSw2n5ZfjAr,$15.00,"Princeton, New Jersey, United States",https://i.ebayimg.com/thumbs/images/g/EPAAAOSw2n5ZfjAr/s-l225.jpg,gaming_fool,https://www.ebay.com/usr/gaming_fool?_trksid=p2047675.l2559,Instant,0,0,1,"Jan 24, 2021 13:36:33 PST"
item4d800fd650,Precis Intermedia A Fistful of Miniatures Basic Game,https://www.ebay.com/itm/332861003344?hash=item4d800fd650:g:UHIAAOSwlndZOEbO,$8.00,"Princeton, New Jersey, United States",https://i.ebayimg.com/thumbs/images/g/UHIAAOSwlndZOEbO/s-l225.jpg,gaming_fool,https://www.ebay.com/usr/gaming_fool?_trksid=p2047675.l2559,Instant,0,0,1,"Jan 31, 2021 06:44:59 PST"
item216a9af43c,Precis Intermedia: Foreign Element Science Fiction Roleplaying Core Rulebook,https://www.ebay.com/itm/143522460732?hash=item216a9af43c:g:8akAAOSwpI5eN4sL,$9.99,"Loveland, Colorado, United States",https://i.ebayimg.com/thumbs/images/g/8akAAOSwpI5eN4sL/s-l225.jpg,tarumil,https://www.ebay.com/usr/tarumil?_trksid=p2047675.l2559,Instant,0,0,1,"Apr 02, 2021 19:55:56 PDT"
item3dab7d24bd,Two-Fisted Tales - Revised Edition - Precis Intermedia Gaming - SC - 2007 PLI700,https://www.ebay.com/itm/264870110397?hash=item3dab7d24bd:g:zCkAAOSw88NZ9orP,$15.99,"Fairfield, California, United States",https://i.ebayimg.com/thumbs/images/g/zCkAAOSw88NZ9orP/s-l225.jpg,bookwyrmsbackshelf,https://www.ebay.com/usr/bookwyrmsbackshelf?_trksid=p2047675.l2559,Instant,0,0,1,"Jul 19, 2021 13:31:28 PDT"
item1efcd0e80f,Precis Intermedia: Foreign Element Science Fiction Roleplaying Core Rulebook,https://www.ebay.com/itm/133090568207?hash=item1efcd0e80f:g:-PEAAOSwJt1c6Yol,$5.00,"Glendora, California, United States",https://i.ebayimg.com/thumbs/images/g/-PEAAOSwJt1c6Yol/s-l225.jpg,frenzyk2298f,https://www.ebay.com/usr/frenzyk2298f?_trksid=p2047675.l2559,Instant,0,0,1,"Dec 19, 2020 20:42:23 PST"
item28b4ca62cd,GHOSTORIES Supernatural Mystery Role Playing Game - Precis Intermedia,https://www.ebay.com/itm/174831854285?hash=item28b4ca62cd:g:NOYAAOSwlUxg5n9T,$20.00,"Virginia Beach, Virginia, United States",https://i.ebayimg.com/thumbs/images/g/NOYAAOSwlUxg5n9T/s-l225.jpg,mydianthorne,https://www.ebay.com/usr/mydianthorne?_trksid=p2047675.l2559,Instant,0,0,1,"Aug 01, 2021 18:31:54 PDT"
