id,title,link,image,price_sold,end_date,origin,seller_name,seller_link,sell_type,num_bids,num_sold,auction_end_date
item1a9125c76f,"Antonovka Apple (Malus pumila Antonovka), 20 seeds",https://www.ebay.com/itm/114104321903?hash=item1a9125c76f:g:2e8AAOSwGENe0Xue,https://i.ebayimg.com/thumbs/images/g/2e8AAOSwGENe0Xue/s-l225.jpg,$2.80,Nov-28 08:18,"Allentown, Pennsylvania, United States",worldseeds,https://www.ebay.com/usr/worldseeds?_trksid=p2047675.l2559,Instant,0,105,
item288a52a3b0,Antonovka Apple (Malus pumila var. antonovka) 50 seeds,https://www.ebay.com/itm/174119363504?hash=item288a52a3b0:g:oFYAAOSwUEFd7ODU,https://i.ebayimg.com/thumbs/images/g/oFYAAOSwUEFd7ODU/s-l225.jpg,$5.90,Nov-26 12:58,"Novosibirsk, Russian Federation",kirsanovss,https://www.ebay.com/usr/kirsanovss?_trksid=p2047675.l2559,Instant,0,104,
item56f5f7124e,"15 Crabapple Tree Seeds (Malus Pumila Var) Crab Apple Flowering Fruit, FREE SHIP",https://www.ebay.com/itm/373493797454?hash=item56f5f7124e:g:TL0AAOSwcMNgSu85,https://i.ebayimg.com/thumbs/images/g/TL0AAOSwcMNgSu85/s-l225.jpg,$5.99,Nov-18 08:02,"Saint Augustine, Florida, United States",hyerfarm,https://www.ebay.com/usr/hyerfarm?_trksid=p2047675.l2559,Instant,0,53,
item3687f8be43,GRANNY SMITH Apple Tree Seeds x25 Malus Pumila Sylvestris Green Acid variant,https://www.ebay.com/itm/234209459779?hash=item3687f8be43:g:TUAAAOSwPKNgSdBH,https://i.ebayimg.com/thumbs/images/g/TUAAAOSwPKNgSdBH/s-l225.jpg,$3.99,Nov-13 23:15,"Valletta, Malta, European Union, Malta",artmegara,https://www.ebay.com/usr/artmegara?_trksid=p2047675.l2559,Instant,0,2,
item5926d92521,Malus pumila Fuji DWARF APPLE TREE Seeds!,https://www.ebay.com/itm/382903854369?hash=item5926d92521:g:8uwAAMXQrNtR0PPg,https://i.ebayimg.com/thumbs/images/g/8uwAAMXQrNtR0PPg/s-l225.jpg,$4.99,Oct-15 08:50,"Walterboro, South Carolina, United States",greg17086,https://www.ebay.com/usr/greg17086?_trksid=p2047675.l2559,Instant,0,19,
item3686bb0095,GRANNY SMITH Apple Tree Seeds x25 Malus Pumila Sylvestris Green Acid variant,https://www.ebay.com/itm/234188636309?hash=item3686bb0095:g:TUAAAOSwPKNgSdBH,https://i.ebayimg.com/thumbs/images/g/TUAAAOSwPKNgSdBH/s-l225.jpg,$3.99,Sep-26 16:03,"Valletta, Malta, European Union, Malta",artmegara,https://www.ebay.com/usr/artmegara?_trksid=p2047675.l2559,Instant,0,1,
