id,title,link,image,price_sold,end_date,origin,seller_name,seller_link,sell_type,num_bids,num_sold,auction_end_date
item2b1ce601d3,"GRAPHIUM RIDLEYANUS INFUSCATUS, Papilionidae, WONDERFUL DARK FORM, female, 1253",https://www.ebay.com/itm/185168429523?hash=item2b1ce601d3:g:acQAAOSw8LZhlAid,https://i.ebayimg.com/thumbs/images/g/acQAAOSw8LZhlAid/s-l225.jpg,$184.49,Nov-21 11:39,"Bratislava, Slovakia",martinaeurope,https://www.ebay.com/usr/martinaeurope?_trksid=p2047675.l2559,Auction,1,1,"Nov 21, 2021

11:39:13 PST"
item2b1ce5f7c6,"GRAPHIUM RIDLEYANUS, Papilionidae, WONDERFUL TWO-COLORED WINGS, female, 1275",https://www.ebay.com/itm/185168426950?hash=item2b1ce5f7c6:g:MBQAAOSwK39hlAfZ,https://i.ebayimg.com/thumbs/images/g/MBQAAOSwK39hlAfZ/s-l225.jpg,$84.49,Nov-21 11:36,"Bratislava, Slovakia",martinaeurope,https://www.ebay.com/usr/martinaeurope?_trksid=p2047675.l2559,Auction,1,1,"Nov 21, 2021

11:36:18 PST"
item46bef9557d,Real Butterfly/Insect/Moth Non Set B6927 Rare Dark red Graphium ridleyanus,https://www.ebay.com/itm/303851722109?hash=item46bef9557d:g:kjcAAOSwRFNgCAOV,https://i.ebayimg.com/thumbs/images/g/kjcAAOSwRFNgCAOV/s-l225.jpg,$3.88,Sep-15 21:06,"Goolwa, South Australia, Australia",uniquebutterfliesandinsects,https://www.ebay.com/usr/uniquebutterfliesandinsects?_trksid=p2047675.l2559,Instant,0,22,
