id,title,link,image,price_sold,end_date,origin,seller_name,seller_link,sell_type,num_bids,num_sold,auction_end_date
item343c003f4d,Lupinus perennis (Wild Lupine) wildflower seed pack perennial Z4-8,https://www.ebay.com/itm/224344948557?hash=item343c003f4d:g:vSwAAOSwKwlgIZ5j,https://i.ebayimg.com/thumbs/images/g/vSwAAOSwKwlgIZ5j/s-l225.jpg,$2.00,Nov-22 17:51,"Ottawa Lake, Michigan, United States",lakesideseeds,https://www.ebay.com/usr/lakesideseeds?_trksid=p2047675.l2559,Instant,0,5,
item23c0cc9373,100 Sundial Lupine seeds. Chemical free. Lupinus perennis,https://www.ebay.com/itm/153558487923?hash=item23c0cc9373:g:WIgAAOSwsKFfLYDW,https://i.ebayimg.com/thumbs/images/g/WIgAAOSwsKFfLYDW/s-l225.jpg,$2.50,Nov-11 00:56,"Amery, Wisconsin, United States",lupinegardensllc,https://www.ebay.com/usr/lupinegardensllc?_trksid=p2047675.l2559,Instant,0,63,
item35fe655938,LUPINE BLUE PERENNIAL Lupinus Perennis - 500 Bulk Seeds,https://www.ebay.com/itm/231901321528?hash=item35fe655938:g:JxEAAOSwAvJXAW8r,https://i.ebayimg.com/thumbs/images/g/JxEAAOSwAvJXAW8r/s-l225.jpg,$19.37,Oct-02 21:36,"Bellevue, Washington, United States",seedjet,https://www.ebay.com/usr/seedjet?_trksid=p2047675.l2559,Instant,0,46,
item21817646d4,"Perennial Lupine Flower Seeds - Lupinus Perennis, 8 Oz, Over 10,000 Seeds",https://www.ebay.com/itm/143905933012?epid=11013116690&hash=item21817646d4:g:InMAAOSw6DBf8ByE,https://i.ebayimg.com/thumbs/images/g/InMAAOSw6DBf8ByE/s-l225.jpg,$30.99,Oct-01 14:03,"Sarasota, Florida, United States",libbyslibrary,https://www.ebay.com/usr/libbyslibrary?_trksid=p2047675.l2559,Instant,0,2,
item1ec0d05126,LUPINE BLUE PERENNIAL Lupinus Perennis - 550 Bulk Seeds,https://www.ebay.com/itm/132083896614?hash=item1ec0d05126:g:7qEAAOSw241Yk3ag,https://i.ebayimg.com/thumbs/images/g/7qEAAOSw241Yk3ag/s-l225.jpg,$16.99,Sep-10 09:54,"Bellevue, Washington, United States",ovm-seeds,https://www.ebay.com/usr/ovm-seeds?_trksid=p2047675.l2559,Instant,0,17,
