id,title,link,image,price_sold,end_date,origin,seller_name,seller_link,sell_type,num_bids,num_sold,auction_end_date
item54abc63675,MARC JACOBS-MARC 500/S 0S92/KU Cateye Sunglasses Blue Mother Of Pearl Blue Avio,https://www.ebay.com/itm/363659146869?hash=item54abc63675:g:ZoQAAOSwOrBhu7sS,https://ir.ebaystatic.com/pictures/aw/pics/s_1x2.gif,$75.00,Mar-19 11:54,"Hackensack, New Jersey, United States",moda_eyes,https://www.ebay.com/usr/moda_eyes?_trksid=p2047675.l2559,Instant,0,3,
item48e9f37c80,925 Sterling Silver Real Blue Mother-Of-Pearl Ring Size 8,https://www.ebay.com/itm/313162693760?hash=item48e9f37c80:g:ZK8AAOSwVgFfG0A3,https://ir.ebaystatic.com/pictures/aw/pics/s_1x2.gif,$22.99,Mar-17 20:34,"New York, New York, United States",pawnshop_city,https://www.ebay.com/usr/pawnshop_city?_trksid=p2047675.l2559,Instant,0,1,
item2f77636c33,Sterling Silver - PERSONA Blue Mother of Pearl Bracelet Charm Bead - 2.5g,https://www.ebay.com/itm/203866467379?hash=item2f77636c33:g:ZZQAAOSwNGlhZ0lI,https://ir.ebaystatic.com/pictures/aw/pics/s_1x2.gif,$5.50,Mar-17 19:03,"Dallas, Texas, United States",thedelune,https://www.ebay.com/usr/thedelune?_trksid=p2047675.l2559,Auction,7,1,"Mar 17, 2022

19:03:49 PDT"
item1acc7ad89b,15 inch strand of Blue mother of Pearl Shell Beads  - 4mm round - G258,https://www.ebay.com/itm/115099752603?hash=item1acc7ad89b:g:bJcAAOSwK1NhlWPu,https://ir.ebaystatic.com/pictures/aw/pics/s_1x2.gif,$10.99,Mar-17 14:12,Unknown,Unknown,Unknown,Instant,0,18,
item1ac57aa500,Long Blue Mother of Pearl Chips Beaded Beads Necklace w/ Faux Pearls,https://www.ebay.com/itm/114982298880?hash=item1ac57aa500:g:gxkAAOSwxTRhEa8t,https://ir.ebaystatic.com/pictures/aw/pics/s_1x2.gif,$10.99,Mar-17 08:01,"Ortonville, Michigan, United States",brooch-utopia,https://www.ebay.com/usr/brooch-utopia?_trksid=p2047675.l2559,Instant,0,1,
item369152396a,Eddie Bauer Thermal Shirt Small Blue Mother of Pearl Buttons Short Puff Sleeve,https://www.ebay.com/itm/234366318954?hash=item369152396a:g:XRsAAOSw4xZh1y95,https://ir.ebaystatic.com/pictures/aw/pics/s_1x2.gif,$14.24,Mar-15 10:36,"Colorado Springs, Colorado, United States",mountaingirlthreads1,https://www.ebay.com/usr/mountaingirlthreads1?_trksid=p2047675.l2559,Instant,0,1,
item345b9feb90,Silver Dress Ring. Blue Mother of Pearl inserts. Floral. Chunky,https://www.ebay.com/itm/224875506576?hash=item345b9feb90:g:Yl4AAOSw-U5iC4Jm,https://ir.ebaystatic.com/pictures/aw/pics/s_1x2.gif,$16.38,Mar-15 08:42,"Ashby-de-la-Zouch, United Kingdom",acacialucy19,https://www.ebay.com/usr/acacialucy19?_trksid=p2047675.l2559,Auction,4,1,"Mar 15, 2022

08:42:26 PDT"
item2d613638f7,"Orvis Boxy Linen Top/Blouse, Duck Egg Blue, Mother-of-pearl Buttons, M",https://www.ebay.com/itm/194904471799?hash=item2d613638f7:g:~5UAAOSwwo1iKbZV,https://ir.ebaystatic.com/pictures/aw/pics/s_1x2.gif,$28.99,Mar-14 11:28,"Totnes, United Kingdom",greygreen66,https://www.ebay.com/usr/greygreen66?_trksid=p2047675.l2559,Instant,0,1,
item2f76ed0560,"Judith Ripka ""London"" Blue Mother of Pearl & CZ Gold Plated Stainless 7.5"" Watch",https://www.ebay.com/itm/203858707808?hash=item2f76ed0560:g:uGsAAOSwcB1iJOMR,https://ir.ebaystatic.com/pictures/aw/pics/s_1x2.gif,$29.99,Mar-13 09:37,"Dimondale, Michigan, United States",gordicus,https://www.ebay.com/usr/gordicus?_trksid=p2047675.l2559,Auction,1,1,"Mar 13, 2022

09:37:24 PDT"
item5995f4ff36,Vintage Crown Brand Cigarette Case & Lighter Blue Mother-of-Pearl & Rhinestones,https://www.ebay.com/itm/384767950646?hash=item5995f4ff36:g:xlgAAOSwRO1iJNAU,https://ir.ebaystatic.com/pictures/aw/pics/s_1x2.gif,$61.00,Mar-13 08:20,"Wilson, Kansas, United States",granny74,https://www.ebay.com/usr/granny74?_trksid=p2047675.l2559,Auction,21,1,"Mar 13, 2022

08:20:19 PDT"
item2f76fef97c,Sterling Silver - PERSONA Blue Mother of Pearl Bracelet Charm Bead - 2.5g,https://www.ebay.com/itm/203859884412?hash=item2f76fef97c:g:ZZQAAOSwNGlhZ0lI,https://ir.ebaystatic.com/pictures/aw/pics/s_1x2.gif,$3.25,Mar-12 17:53,"Dallas, Texas, United States",thedelune,https://www.ebay.com/usr/thedelune?_trksid=p2047675.l2559,Auction,3,1,"Mar 12, 2022

17:53:05 PST"
item3da2589775,Vtg Angel Brooch Liz Claiborne Blue Mother of Pearl Tiled Mosaic Silver Tone,https://www.ebay.com/itm/264716719989?hash=item3da2589775:g:BmgAAOSw7wxan0vM,https://ir.ebaystatic.com/pictures/aw/pics/s_1x2.gif,$12.74,Mar-12 13:01,"Robertsdale, Alabama, United States",bamagulfwinds,https://www.ebay.com/usr/bamagulfwinds?_trksid=p2047675.l2559,Instant,0,1,
item56a446debf,20mm Round Donut Blue Mother Of Pearl Mosaic Gemstone Bead 15 Inch Strand MB40,https://www.ebay.com/itm/372123295423?hash=item56a446debf:g:t~QAAOSwhQhY5lEf,https://ir.ebaystatic.com/pictures/aw/pics/s_1x2.gif,$22.48,Mar-11 20:20,Unknown,Unknown,Unknown,Instant,0,3,
item5b4011526c,10mm Round Teal Blue Mother Of Pearl Mosaic Bead 15 Inch Strand MB18,https://www.ebay.com/itm/391916900972?hash=item5b4011526c:g:IHYAAOSwpkFY5RsN,https://ir.ebaystatic.com/pictures/aw/pics/s_1x2.gif,$18.49,Mar-11 20:20,"San Tan Valley, Arizona, United States",gemshow7,https://www.ebay.com/usr/gemshow7?_trksid=p2047675.l2559,Instant,0,3,
item3b5ccc5f4d,LIZ CLAIBORNE CHRISTMAS ANGEL BROOCH/PIN Blue Mother Of Pearl w/ Rhinestones NIB,https://www.ebay.com/itm/254959968077?hash=item3b5ccc5f4d:g:GWYAAOSw~apftGoy,https://ir.ebaystatic.com/pictures/aw/pics/s_1x2.gif,$17.49,Mar-11 18:05,"Cincinnati, Ohio, United States",stad-kels,https://www.ebay.com/usr/stad-kels?_trksid=p2047675.l2559,Instant,0,1,
item23fbe01bd2,STERLING SILVER 925 BLUE MOTHER OF PEARL UNIQUE SHAPE RING SIZE: 8.5,https://www.ebay.com/itm/154549623762?hash=item23fbe01bd2:g:v9IAAOSwFz1hAwjo,https://ir.ebaystatic.com/pictures/aw/pics/s_1x2.gif,$34.47,Mar-11 10:29,"Leechburg, Pennsylvania, United States",silver1304adam,https://www.ebay.com/usr/silver1304adam?_trksid=p2047675.l2559,Instant,0,1,
item5ba30bd609,Blue mother of pearl brass- choker necklace,https://www.ebay.com/itm/393577485833?hash=item5ba30bd609:g:M18AAOSwjtphQ7Fy,https://ir.ebaystatic.com/pictures/aw/pics/s_1x2.gif,$14.99,Mar-11 09:46,"Indio, California, United States",angelview353,https://www.ebay.com/usr/angelview353?_trksid=p2047675.l2559,Instant,0,1,
item5df431c28b,"Judith Ripka ""London"" Blue Mother of Pearl And CZ Gold Plated Stainless 7.5""",https://www.ebay.com/itm/403528860299?hash=item5df431c28b:g:cvgAAOSwRhtiIjwu,https://ir.ebaystatic.com/pictures/aw/pics/s_1x2.gif,$60.00,Mar-10 07:15,Unknown,Unknown,Unknown,Instant,0,1,
item2d574554e2,Iredescent Sterling Silver Blue Mother Of Pearl Necklace Long,https://www.ebay.com/itm/194737689826?hash=item2d574554e2:g:RlUAAOSwollh4d-z,https://ir.ebaystatic.com/pictures/aw/pics/s_1x2.gif,$18.50,Mar-10 05:49,"Lincoln, Nebraska, United States",nami_1856,https://www.ebay.com/usr/nami_1856?_trksid=p2047675.l2559,Instant,0,1,
item1d085d8ad9,"NEW OFFICINA BERNARDI Sterling Silver Blue Mother of Pearl Floral Bracelet 6.5""",https://www.ebay.com/itm/124694399705?hash=item1d085d8ad9:g:Ck4AAOSw8Hdggw-S,https://ir.ebaystatic.com/pictures/aw/pics/s_1x2.gif,$29.99,Mar-09 12:57,"Fayetteville, Arkansas, United States",bcarne1,https://www.ebay.com/usr/bcarne1?_trksid=p2047675.l2559,Instant,0,1,
item1d259fa3f4,ROBERT LEE MORRIS Moonrise Brown Leather and Blue Mother of Pearl Necklace,https://www.ebay.com/itm/125185270772?epid=25021133649&hash=item1d259fa3f4:g:OPwAAOSwB1ViJOWD,https://ir.ebaystatic.com/pictures/aw/pics/s_1x2.gif,$24.99,Mar-08 18:38,Unknown,Unknown,Unknown,Instant,0,1,
item4dd708f4d0,Vintage BARRETTE Hair Clip - ALPACA MEXICO - Blue/Mother of Pearl/Abalone FLOWER,https://www.ebay.com/itm/334320170192?hash=item4dd708f4d0:g:9nQAAOSwMYtiAH-P,https://ir.ebaystatic.com/pictures/aw/pics/s_1x2.gif,$10.99,Mar-08 15:23,"Charleston, West Virginia, United States",wildandwonderfulvintage,https://www.ebay.com/usr/wildandwonderfulvintage?_trksid=p2047675.l2559,Instant,0,1,
item240f677aee,Sterling Silver Blue Mother of Pearl Pendant,https://www.ebay.com/itm/154877262574?hash=item240f677aee:g:yZQAAOSwH2tiHouD,https://ir.ebaystatic.com/pictures/aw/pics/s_1x2.gif,$6.48,Mar-08 13:10,"Saxilby, Lincolnshire, United Kingdom",prelovedjems,https://www.ebay.com/usr/prelovedjems?_trksid=p2047675.l2559,Auction,4,1,"Mar 08, 2022

13:10:37 PST"
item4248817b33,Pre-owned Tag Heuer Aquaracer Blue Mother of Pearl Quartz Watch WBD1325.BB0320,https://www.ebay.com/itm/284684286771?epid=4048331636&hash=item4248817b33:g:960AAOSwD2xiI6G1,https://ir.ebaystatic.com/pictures/aw/pics/s_1x2.gif,"$1,033.70",Mar-08 09:47,Unknown,Unknown,Unknown,Instant,0,1,
item344fbcdf92,Movado Museum 0607354 Women Stainless Steel Blue Mother of Pearl Dial Watch BL95,https://www.ebay.com/itm/224676077458?epid=5042578618&hash=item344fbcdf92:g:nYoAAOSwRZphhCPJ,https://ir.ebaystatic.com/pictures/aw/pics/s_1x2.gif,$199.99,Mar-07 20:06,Unknown,Unknown,Unknown,Instant,0,2,
