id,title,link,image,price_sold,end_date,origin,seller_name,seller_link,sell_type,num_bids,num_sold,auction_end_date
item342b519ea8,12 PACK STARBUCKS JAMAICA HIGH MOUNTAIN WHOLE BEAN COFFEE 8.8 OZ EACH BB 7/20,https://www.ebay.com/itm/224065068712?hash=item342b519ea8:g:26YAAOSwKWdfEfo~,https://i.ebayimg.com/thumbs/images/g/26YAAOSwKWdfEfo~/s-l225.jpg,$24.77,Jun-01 13:42,"Miami, Florida, United States",dusodeals,https://www.ebay.com/usr/dusodeals?_trksid=p2047675.l2559,Instant,0,185,
item3b60eb1713,Goartea Supreme Taiwan Dongding Oolong Tea High Mountain Tung-Ting Green Tea,https://www.ebay.com/itm/255029090067?hash=item3b60eb1713:g:FosAAOSwUdlWc9j-,https://i.ebayimg.com/thumbs/images/g/FosAAOSwUdlWc9j-/s-l225.jpg,$14.98 to $95.32,Jun-01 02:47,Unknown,Unknown,Unknown,Instant,0,7,
item4012ba578e,Tactical Camouflage Balaclava Full Face Mask Hunting Neck Gaiter Ninja Hood Hats,https://www.ebay.com/itm/275192108942?hash=item4012ba578e:g:qhEAAOSwngFhZoD3,https://i.ebayimg.com/thumbs/images/g/qhEAAOSwngFhZoD3/s-l225.jpg,$9.69,May-31 23:13,Unknown,Unknown,Unknown,Instant,0,49,
item2f610da528,Camouflage Cycling Ski Motorcycle Cap Balaclava Hats Full Face Mask Scarf Hood,https://www.ebay.com/itm/203491747112?hash=item2f610da528:g:NcUAAOSwia9g9~b3,https://i.ebayimg.com/thumbs/images/g/NcUAAOSwia9g9~b3/s-l225.jpg,$9.05,May-31 20:39,Unknown,Unknown,Unknown,Instant,0,172,
item5997295244,Black Oolong Tea Tie Guan Ying Roasted High Mountain Olong Tea for Oily Meals黑乌龙,https://www.ebay.com/itm/384788156996?hash=item5997295244:g:QnYAAOSwxOlhYBeI,https://i.ebayimg.com/thumbs/images/g/QnYAAOSwxOlhYBeI/s-l225.jpg,$19.81 to $65.69,May-31 20:27,Unknown,Unknown,Unknown,Instant,0,1,
item28ad509947,Organic Small Canned Green Tea Yunnan High Mountain Biluochun Tea Healthy Drink,https://www.ebay.com/itm/174706432327?hash=item28ad509947:g:OMcAAOSwY~laG2px,https://i.ebayimg.com/thumbs/images/g/OMcAAOSwY~laG2px/s-l225.jpg,$8.03,May-31 13:39,Unknown,Unknown,Unknown,Instant,0,6,
item445e126098,Van Cheong High Mountain Oolong Tea 123 (300 Grams) - BRAND NEW,https://www.ebay.com/itm/293636038808?hash=item445e126098:g:u2cAAOSwjd5e~4OZ,https://i.ebayimg.com/thumbs/images/g/u2cAAOSwjd5e~4OZ/s-l225.jpg,$52.99,May-31 09:22,Unknown,Unknown,Unknown,Instant,0,11,
item1f233b0c6f,Taiwan Alishan Oolong Tea Premium Formosa Alishan High Mountain Wulong Tea 250g,https://www.ebay.com/itm/133735058543?hash=item1f233b0c6f:g:B6cAAOSwqMlgfueh,https://i.ebayimg.com/thumbs/images/g/B6cAAOSwqMlgfueh/s-l225.jpg,$26.99 to $49.99,May-30 07:17,Unknown,Unknown,Unknown,Instant,0,3,
item46a06abe83,Tactical Camo Balaclava Face Mask Army Military Hunting Shooting Headwear Hats,https://www.ebay.com/itm/303339060867?hash=item46a06abe83:g:VuMAAOSwXI1d3hqP,https://i.ebayimg.com/thumbs/images/g/VuMAAOSwXI1d3hqP/s-l225.jpg,$9.99,May-30 00:51,Unknown,Unknown,Unknown,Instant,0,75,
item524e4e803f,2013 Fuding High Mountain White Tea Gong Mei Tribute Eyebrow Cake 350g Shoumei,https://www.ebay.com/itm/353501085759?hash=item524e4e803f:g:zJ0AAOSwxr5go-lO,https://i.ebayimg.com/thumbs/images/g/zJ0AAOSwxr5go-lO/s-l225.jpg,$14.99,May-28 15:17,Unknown,Unknown,Unknown,Instant,0,4,
item4b0453c4db,HIGH MOUNTAIN OOLONG TEA (TAIWAN ALISHAN) 150g - WINTER HARVEST,https://www.ebay.com/itm/322195145947?hash=item4b0453c4db:g:qRgAAOSwtnpXi1Z3,https://i.ebayimg.com/thumbs/images/g/qRgAAOSwtnpXi1Z3/s-l225.jpg,$27.98,May-28 01:59,Unknown,Unknown,Unknown,Instant,0,67,
item1f21d0587d,Ji Bian Oolong Tea Yunnan TENG CHONG High Mountain Tea Jade Taiwan Oolong 150g,https://www.ebay.com/itm/133711288445?hash=item1f21d0587d:g:gtUAAOSw-oZgZfW3,https://i.ebayimg.com/thumbs/images/g/gtUAAOSw-oZgZfW3/s-l225.jpg,$10.91,May-27 19:36,Unknown,Unknown,Unknown,Instant,0,11,
item3a9530999b,Black Oolong Tea Fresh Nature Slimming Tea High mountain Black Tea Tie guan yin,https://www.ebay.com/itm/251611093403?hash=item3a9530999b:g:5l8AAOSwnw9aOpjV,https://i.ebayimg.com/thumbs/images/g/5l8AAOSwnw9aOpjV/s-l225.jpg,$4.91,May-27 14:45,Unknown,Unknown,Unknown,Instant,0,225,
item491bb7ee28,pak himalayan shilajit 100% natural authentic shilajit high mountain resin 30grm,https://www.ebay.com/itm/313997651496?hash=item491bb7ee28:g:yOgAAOSwyFBhUgwC,https://i.ebayimg.com/thumbs/images/g/yOgAAOSwyFBhUgwC/s-l225.jpg,$29.99,May-27 03:22,Unknown,Unknown,Unknown,Instant,0,1,
item3d8ba81b4c,Huang Shan Mao Feng Green Tea Famous Green tea Loose Tea  High Mountain 1/2 LB,https://www.ebay.com/itm/264336055116?hash=item3d8ba81b4c:g:cmgAAOxygj5SfuEF,https://i.ebayimg.com/thumbs/images/g/cmgAAOxygj5SfuEF/s-l225.jpg,$39.00,May-26 19:16,Unknown,Unknown,Unknown,Instant,0,17,
item2b190ef804,Tactical Hunting Balaclava Army Military SWAT Gear Face Scarf Windproof Hood NEW,https://www.ebay.com/itm/185104005124?hash=item2b190ef804:g:JPUAAOSwYZJhZoK9,https://i.ebayimg.com/thumbs/images/g/JPUAAOSwYZJhZoK9/s-l225.jpg,$9.69,May-26 15:15,Unknown,Unknown,Unknown,Instant,0,14,
item56f3230c44,2021 Taiwan High Mountain Tea Jade Oolong Tea Floral Flavor DaYuLing Wulong 150g,https://www.ebay.com/itm/373446347844?hash=item56f3230c44:g:1lMAAOSwzeRhua6m,https://i.ebayimg.com/thumbs/images/g/1lMAAOSwzeRhua6m/s-l225.jpg,$31.63,May-26 13:41,Unknown,Unknown,Unknown,Instant,0,21,
item344e2ab5f4,"Four Season Oolong Tea, High Mountain tea, Flowery Aroma, 100% Natural, 3.5oz",https://www.ebay.com/itm/224649721332?hash=item344e2ab5f4:g:lFMAAOSwys5WU00Z,https://i.ebayimg.com/thumbs/images/g/lFMAAOSwys5WU00Z/s-l225.jpg,$9.59,May-26 04:53,Unknown,Unknown,Unknown,Instant,0,3,
item3d25dcca7e,Milk Oolong Tea Milk Tea Organic GreenTea 100g Taiwan High Mountain Jin Xuan Tea,https://www.ebay.com/itm/262628231806?hash=item3d25dcca7e:g:Y5IAAOSwhOVXf9cA,https://i.ebayimg.com/thumbs/images/g/Y5IAAOSwhOVXf9cA/s-l225.jpg,$4.91,May-26 04:31,Unknown,Unknown,Unknown,Instant,0,536,
item4db185cbf2,GOARTEA 250g Supreme Taiwan Milk Oolong Tea Jinxuan Alishan High Mountain Loose,https://www.ebay.com/itm/333690817522?hash=item4db185cbf2:g:TOwAAOSwxUFfOe86,https://i.ebayimg.com/thumbs/images/g/TOwAAOSwxUFfOe86/s-l225.jpg,$25.99,May-25 12:09,Unknown,Unknown,Unknown,Instant,0,140,
item366ae7dcd3,2021 High Mountain Green Tea Loose Leaf Yunwu Maojian Slimming Tea 125g,https://www.ebay.com/itm/233721814227?hash=item366ae7dcd3:g:UuEAAOSwd39facab,https://i.ebayimg.com/thumbs/images/g/UuEAAOSwd39facab/s-l225.jpg,$17.78,May-25 11:03,Unknown,Unknown,Unknown,Instant,0,37,
item366b0811d4,2021 Chinese Yunwu Maojian High Mountain Tea Green Loose leaf 500g,https://www.ebay.com/itm/233723924948?hash=item366b0811d4:g:JUYAAOSwfaZfbF0s,https://i.ebayimg.com/thumbs/images/g/JUYAAOSwfaZfbF0s/s-l225.jpg,$17.72,May-25 11:03,Unknown,Unknown,Unknown,Instant,0,32,
item28b9ec3787,Pu-erh Raw Tea Wild Ancient Trees Yunnan  High Mountain Sheng Puer Tea Cake 100g,https://www.ebay.com/itm/174917957511?hash=item28b9ec3787:g:u4gAAOSwhW1ckzLV,https://i.ebayimg.com/thumbs/images/g/u4gAAOSwhW1ckzLV/s-l225.jpg,$5.36,May-25 01:26,Unknown,Unknown,Unknown,Instant,0,2,
item56efe68592,2022 Premium Ali Mountain High Mountain Tea Fresh Taiwan Oolong Tea 250g,https://www.ebay.com/itm/373392049554?hash=item56efe68592:g:lKAAAOSw7UBdwokl,https://i.ebayimg.com/thumbs/images/g/lKAAAOSw7UBdwokl/s-l225.jpg,$19.66,May-24 23:28,Unknown,Unknown,Unknown,Instant,0,35,
item1f21e07d2a,Fujian Wuyi Non-Smoked Lapsang Souchong Tea Black Tea High Mountain Tea 125g,https://www.ebay.com/itm/133712346410?hash=item1f21e07d2a:g:lokAAOSwAKxgZzTs,https://i.ebayimg.com/thumbs/images/g/lokAAOSwAKxgZzTs/s-l225.jpg,$9.99,May-24 21:04,Unknown,Unknown,Unknown,Instant,0,8,
item3b26091653,250g Milk Oolong Tea High Quality Green Tea Organic Taiwan High Mountain Wu Long,https://www.ebay.com/itm/254041200211?hash=item3b26091653:g:FiUAAOSwYj9b6-dC,https://i.ebayimg.com/thumbs/images/g/FiUAAOSwYj9b6-dC/s-l225.jpg,$10.50,May-24 16:15,Unknown,Unknown,Unknown,Instant,0,78,
item422be6664f,North American Herb & Spice BoneActiv High Mountain Power - 1 fl oz / 30 mL,https://www.ebay.com/itm/284204361295?epid=1541496896&hash=item422be6664f:g:iIUAAOSwPEBgPj4T,https://i.ebayimg.com/thumbs/images/g/iIUAAOSwPEBgPj4T/s-l225.jpg,$17.99,May-24 05:35,Unknown,Unknown,Unknown,Instant,0,1,
item5244671a3e,2015yr Fuding High Mountain Bai Cha Shou Mei Loose Leaf Wild Old White Tea 350g,https://www.ebay.com/itm/353334925886?hash=item5244671a3e:g:JbkAAOSwRkVf6ubZ,https://i.ebayimg.com/thumbs/images/g/JbkAAOSwRkVf6ubZ/s-l225.jpg,$9.84,May-23 19:33,Unknown,Unknown,Unknown,Instant,0,77,
item3687ef2174,125g China Yunwu Maojian Loose Leaf Green Tea Top-Grade High Mountain Green Tea,https://www.ebay.com/itm/234208829812?hash=item3687ef2174:g:6F4AAOSw-P5hNyX2,https://i.ebayimg.com/thumbs/images/g/6F4AAOSw-P5hNyX2/s-l225.jpg,$16.08,May-23 13:08,Unknown,Unknown,Unknown,Instant,0,1,
item1a48826d46,250g Milk Oolong Tea Dongding Wulong tea Taiwan High Mountain JinXuan Tea Green,https://www.ebay.com/itm/112885656902?hash=item1a48826d46:g:-nUAAOSwcOFaO219,https://i.ebayimg.com/thumbs/images/g/-nUAAOSwcOFaO219/s-l225.jpg,$11.72,May-23 11:05,Unknown,Unknown,Unknown,Instant,0,75,
item3ddd2eb3f7,La Sportiva Nepal Extreme Technical High Mountain Insulated Crampon Boot Euro 43,https://www.ebay.com/itm/265703830519?hash=item3ddd2eb3f7:g:r7YAAOSw-wpigUMD,https://i.ebayimg.com/thumbs/images/g/r7YAAOSw-wpigUMD/s-l225.jpg,$157.54,May-23 08:08,"Matlock, near the Sainsbury’s , United Kingdom",btr_reynaldo,https://www.ebay.com/usr/btr_reynaldo?_trksid=p2047675.l2559,Instant,0,1,
item3ddbf1d237,Taiwan Alishan high mountain Oolong tea  150g hand-picked,https://www.ebay.com/itm/265683063351?hash=item3ddbf1d237:g:ylgAAOSwGhxbpJ3A,https://i.ebayimg.com/thumbs/images/g/ylgAAOSwGhxbpJ3A/s-l225.jpg,$16.00,May-23 05:48,Unknown,Unknown,Unknown,Instant,0,2,
item3b49d3f706,GOARTEA Organic Premium Taiwan Alishan High Mountain Jinxuan Milk Oolong Tea,https://www.ebay.com/itm/254641698566?hash=item3b49d3f706:g:f5IAAOSw7Bde~Fmy,https://i.ebayimg.com/thumbs/images/g/f5IAAOSw7Bde~Fmy/s-l225.jpg,$9.86 to $80.43,May-23 04:44,Unknown,Unknown,Unknown,Instant,0,73,
item3fe83da29f,GOARTEA 250g Organic Supreme High Mountain Tung Ting Dong Ding Taiwan Oolong Tea,https://www.ebay.com/itm/274479293087?hash=item3fe83da29f:g:yDUAAOSwZ1lWdMRu,https://i.ebayimg.com/thumbs/images/g/yDUAAOSwZ1lWdMRu/s-l225.jpg,$25.09,May-23 02:33,"Guangzhou, Guangdong, China",goarteaau,https://www.ebay.com/usr/goarteaau?_trksid=p2047675.l2559,Instant,0,1,
item4dbbff8e71,GOARTEA Supreme Emei High Mountain Zhuyeqing Spring Bamboo Chinese GREEN TEA,https://www.ebay.com/itm/333866569329?hash=item4dbbff8e71:g:OtMAAOSw1PZfVwNC,https://i.ebayimg.com/thumbs/images/g/OtMAAOSw1PZfVwNC/s-l225.jpg,$15.98 to $104.98,May-22 21:59,Unknown,Unknown,Unknown,Instant,0,4,
item3dc532519c,Taiwan Shan Lin Si  high mountain Oolong tea hand-picked 150g,https://www.ebay.com/itm/265301414300?hash=item3dc532519c:g:PQwAAOSwi9Fig74x,https://i.ebayimg.com/thumbs/images/g/PQwAAOSwi9Fig74x/s-l225.jpg,$16.00,May-22 19:30,Unknown,Unknown,Unknown,Instant,0,12,
item218740545f,"High Mountain Elk Puzzle 1000 Piece bonus Diagram (Sealed, 2009)",https://www.ebay.com/itm/144003060831?hash=item218740545f:g:vIYAAOSwBehgcI13,https://i.ebayimg.com/thumbs/images/g/vIYAAOSwBehgcI13/s-l225.jpg,$10.00,May-22 13:58,"Peoria, Arizona, United States",bsgoods,https://www.ebay.com/usr/bsgoods?_trksid=p2047675.l2559,Instant,0,1,
item525291d3d4,Gaba Tea Taiwan High Mountain Oolong Tea Loose Leaf Gabaron Tea 50g,https://www.ebay.com/itm/353572606932?hash=item525291d3d4:g:dcIAAOSwFzZcvXNp,https://i.ebayimg.com/thumbs/images/g/dcIAAOSwFzZcvXNp/s-l225.jpg,$8.73 to $63.42,May-22 08:35,Unknown,Unknown,Unknown,Instant,0,8,
item34622c322a,FIRST GEAR  1949 DODGE POWER WAGON - BRUSH TRUCK - 10-3346 HIGH MOUNTAIN,https://www.ebay.com/itm/224985362986?hash=item34622c322a:g:GCQAAOSwIvFidY5y,https://i.ebayimg.com/thumbs/images/g/GCQAAOSwIvFidY5y/s-l225.jpg,$50.00,May-20 15:50,"Rancho Cucamonga, California, United States",rw6580,https://www.ebay.com/usr/rw6580?_trksid=p2047675.l2559,Auction,1,1,"May 20, 2022

15:50:36 PDT"
item46c353a0f0,250g Taiwan High Mountain Jinxuan Milk Oolong Tea Tiguanyin Green Tea Green Food,https://www.ebay.com/itm/303924748528?epid=1967667066&hash=item46c353a0f0:g:FfcAAOSwA65b6-eD,https://i.ebayimg.com/thumbs/images/g/FfcAAOSwA65b6-eD/s-l225.jpg,$10.34,May-20 15:21,Unknown,Unknown,Unknown,Instant,0,1,
item2f6662c38e,Top Yunnan High Mountain Ancient Tree White Tea 500g Honey Fragrance White Tea,https://www.ebay.com/itm/203581211534?hash=item2f6662c38e:g:uAsAAOSwewlg8U58,https://i.ebayimg.com/thumbs/images/g/uAsAAOSwewlg8U58/s-l225.jpg,$26.23,May-20 13:46,Unknown,Unknown,Unknown,Instant,0,1,
item2f3851e66e,250g Taiwan Alishan High Mountain Green Tea Peach Flavour Oolong Tea Organic Tea,https://www.ebay.com/itm/202808354414?hash=item2f3851e66e:g:4c4AAOSwgcVbB~ye,https://i.ebayimg.com/thumbs/images/g/4c4AAOSwgcVbB~ye/s-l225.jpg,$12.48,May-20 13:46,Unknown,Unknown,Unknown,Instant,0,1,
item2f2dfa1745,Sheng Pu-erh Raw Tea High Mountain Wild Ancient Trees Puer Tea Cake  Yunnan 100g,https://www.ebay.com/itm/202634827589?hash=item2f2dfa1745:g:~ycAAOSwyhVckzLN,https://i.ebayimg.com/thumbs/images/g/~ycAAOSwyhVckzLN/s-l225.jpg,$5.01,May-20 13:29,Unknown,Unknown,Unknown,Instant,0,1,
item2f67b33daf,Shou Mei Premuim Wild Aged White Tea 350g 2015 Fuding High Mountain Bai Cha Cake,https://www.ebay.com/itm/203603262895?hash=item2f67b33daf:g:aqYAAOSwUSxhOIAM,https://i.ebayimg.com/thumbs/images/g/aqYAAOSwUSxhOIAM/s-l225.jpg,$12.55,May-20 13:01,Unknown,Unknown,Unknown,Instant,0,1,
item2f057feabf,250g Taiwan High Mountain Tea Alishan Oolong Tea Vacuum Milk Oolong Tea Candid,https://www.ebay.com/itm/201955732159?hash=item2f057feabf:g:nsEAAOSwq~tZQg3H,https://i.ebayimg.com/thumbs/images/g/nsEAAOSwq~tZQg3H/s-l225.jpg,$10.89,May-20 12:53,Unknown,Unknown,Unknown,Instant,0,1,
item421ebf2f15,New Milk Oolong Tea 250g Tie Guan Yin Organic Green Tea Taiwan High Mountain Tea,https://www.ebay.com/itm/283983687445?epid=1967667066&hash=item421ebf2f15:g:P8IAAOSwn91b6-g-,https://i.ebayimg.com/thumbs/images/g/P8IAAOSwn91b6-g-/s-l225.jpg,$9.68,May-20 12:18,Unknown,Unknown,Unknown,Instant,0,47,
item1f38f085f4,Traditional Charcoal Roasted Taiwan High Mountain Dong Ding Oolong Tea 250g,https://www.ebay.com/itm/134099273204?hash=item1f38f085f4:g:VecAAOSw25NiaUNz,https://i.ebayimg.com/thumbs/images/g/VecAAOSw25NiaUNz/s-l225.jpg,$29.99,May-20 10:14,Unknown,Unknown,Unknown,Instant,0,1,
item42328d0280,GOARTEA 100g Supreme High Mountain Tung Ting Dong Ding Taiwan Oolong Tea,https://www.ebay.com/itm/284315943552?hash=item42328d0280:g:yDUAAOSwZ1lWdMRu,https://i.ebayimg.com/thumbs/images/g/yDUAAOSwZ1lWdMRu/s-l225.jpg,$12.90,May-20 09:25,Unknown,Unknown,Unknown,Instant,0,2,
item3d758ab548,"Beer Bar Coaster NEW BELGIUM BREWING CO. ""High Mountain Fashion"" Postcard",https://www.ebay.com/itm/263965029704?hash=item3d758ab548:g:pDkAAOSwj0RbEOLB,https://i.ebayimg.com/thumbs/images/g/pDkAAOSwj0RbEOLB/s-l225.jpg,$4.75,May-20 08:50,"Lockhart, Texas, United States",mgrace1988,https://www.ebay.com/usr/mgrace1988?_trksid=p2047675.l2559,Instant,0,1,
item369bb2804a,GOARTEA 250g Premium Yunwu Cloud Mist Green Tea High Mountain Lushan Green Tea,https://www.ebay.com/itm/234540400714?hash=item369bb2804a:g:-IMAAOSwF9td3jnW,https://i.ebayimg.com/thumbs/images/g/-IMAAOSwF9td3jnW/s-l225.jpg,$27.83,May-20 02:55,Unknown,Unknown,Unknown,Instant,0,1,
item1f230f493a,Teamonk Wa High Mountain Oolong Tea Loose Leaf 150 cups | Premium Oolong Tea | |,https://www.ebay.com/itm/133732190522?hash=item1f230f493a:g:FiUAAOSwzFVge8gh,https://i.ebayimg.com/thumbs/images/g/FiUAAOSwzFVge8gh/s-l225.jpg,$60.48,May-20 01:03,"US, United States",america_fast_shipping,https://www.ebay.com/usr/america_fast_shipping?_trksid=p2047675.l2559,Instant,0,1,
item5dab47fa4c,Organic Green Tea Loose 250g Alishan High Mountain Tea Peach Flavor Oolong Tea,https://www.ebay.com/itm/402305579596?epid=16010690009&hash=item5dab47fa4c:g:T7QAAOSwO9RbB~c3,https://i.ebayimg.com/thumbs/images/g/T7QAAOSwO9RbB~c3/s-l225.jpg,$9.98,May-19 22:34,Unknown,Unknown,Unknown,Instant,0,6,
item56f46eab63,2021 LiShan Taiwan High Mountain Tea Natural Taiwan Oolong Tea Box Packing 150g,https://www.ebay.com/itm/373468080995?hash=item56f46eab63:g:F2UAAOSwkYleFuRQ,https://i.ebayimg.com/thumbs/images/g/F2UAAOSwkYleFuRQ/s-l225.jpg,$29.81,May-19 16:14,Unknown,Unknown,Unknown,Instant,0,16,
item345ecdaf14,Tactical Military Balaclava Camouflage Face Mask Hunting Neck Tube Hood Ski Mask,https://www.ebay.com/itm/224928837396?hash=item345ecdaf14:g:hnsAAOSwgz9iUCRs,https://i.ebayimg.com/thumbs/images/g/hnsAAOSwgz9iUCRs/s-l225.jpg,$9.69,May-19 12:02,Unknown,Unknown,Unknown,Instant,0,3,
item2b190eaa3b,Tactical Camouflage Balaclava Military Hunting Face Mask Shield Neck Gaiter Hood,https://www.ebay.com/itm/185103985211?hash=item2b190eaa3b:g:8RgAAOSwmcNhZoB5,https://i.ebayimg.com/thumbs/images/g/8RgAAOSwmcNhZoB5/s-l225.jpg,$9.69,May-19 07:01,Unknown,Unknown,Unknown,Instant,0,78,
item267886707f,Jemez Chile Seed - native to the high mountain valleys near Jemez Pueblo,https://www.ebay.com/itm/165230833791?hash=item267886707f:g:v~4AAOSwh~RhtpcL,https://i.ebayimg.com/thumbs/images/g/v~4AAOSwh~RhtpcL/s-l225.jpg,$4.95,May-18 19:01,Unknown,Unknown,Unknown,Instant,0,3,
item40195c26c6,Coca Cola Vintage 1996 Olympic Rings Green Cap Hat Snapback by High Mountain,https://www.ebay.com/itm/275303376582?hash=item40195c26c6:g:fZ4AAOSw07didvt~,https://i.ebayimg.com/thumbs/images/g/fZ4AAOSw07didvt~/s-l225.jpg,$18.89,May-18 03:09,Unknown,Unknown,Unknown,Instant,0,1,
item3fe64ef46f,GOARTEA Organic Supreme High Mountain Tung Ting Dong Ding Taiwan Oolong Tea,https://www.ebay.com/itm/274446873711?hash=item3fe64ef46f:g:wJAAAOSwk1JWg-9a,https://i.ebayimg.com/thumbs/images/g/wJAAAOSwk1JWg-9a/s-l225.jpg,$9.31 to $86.07,May-16 17:09,Unknown,Unknown,Unknown,Instant,0,9,
item421db911da,GOARTEA Organic Supreme Taiwan High Mountain Jinxuan Jin Xuan Milk Oolong Tea,https://www.ebay.com/itm/283966509530?hash=item421db911da:g:TOwAAOSwxUFfOe86,https://i.ebayimg.com/thumbs/images/g/TOwAAOSwxUFfOe86/s-l225.jpg,$8.59 to $75.31,May-16 17:09,Unknown,Unknown,Unknown,Instant,0,10,
item3d71d891d4,Tenren Premium Taiwan Oolong Tea Bags Whole Leaves High Mountain 100 Bag Ten Ren,https://www.ebay.com/itm/263903023572?epid=25023133564&hash=item3d71d891d4:g:9NIAAOSwanhbhP0Q,https://i.ebayimg.com/thumbs/images/g/9NIAAOSwanhbhP0Q/s-l225.jpg,$15.06,May-16 02:49,Unknown,Unknown,Unknown,Instant,0,23,
item4462ff7a33,250g Tie Guan Yin Organic Green Tea New Milk Oolong Tea Taiwan High Mountain Tea,https://www.ebay.com/itm/293718686259?epid=1967667066&hash=item4462ff7a33:g:P8IAAOSwn91b6-g-,https://i.ebayimg.com/thumbs/images/g/P8IAAOSwn91b6-g-/s-l225.jpg,$9.68,May-15 23:03,Unknown,Unknown,Unknown,Instant,0,12,
item1a84ffb7ba,Puer Tea Cake Yunnan 100g Sheng Pu-erh Raw Tea High Mountain Wild Ancient Trees,https://www.ebay.com/itm/113900500922?hash=item1a84ffb7ba:g:u4gAAOSwhW1ckzLV,https://i.ebayimg.com/thumbs/images/g/u4gAAOSwhW1ckzLV/s-l225.jpg,$5.40,May-15 22:10,Unknown,Unknown,Unknown,Instant,0,2,
item1a3defcd6e,250g Top Alishan High Mountain Tea Peach Tea Flavor Oolong Tea Organic Green Tea,https://www.ebay.com/itm/112708275566?epid=28012007936&hash=item1a3defcd6e:g:6rYAAOSwJ7dbB~Xj,https://i.ebayimg.com/thumbs/images/g/6rYAAOSwJ7dbB~Xj/s-l225.jpg,$9.27,May-15 21:54,Unknown,Unknown,Unknown,Instant,0,24,
item54a51d7d7a,400g Tibetan tea brick dark tea YaAn famous top grade tea high mountain tree tea,https://www.ebay.com/itm/363547426170?hash=item54a51d7d7a:g:bGIAAOSw~I9ih09l,https://i.ebayimg.com/thumbs/images/g/bGIAAOSw~I9ih09l/s-l225.jpg,$68.00,May-15 20:30,Unknown,Unknown,Unknown,Instant,0,1,
item3cebc4d3c1,Organic high mountain green tea loose leave tea 4 OZ,https://www.ebay.com/itm/261653582785?hash=item3cebc4d3c1:g:OXIAAOSwA3dYgEWW,https://i.ebayimg.com/thumbs/images/g/OXIAAOSwA3dYgEWW/s-l225.jpg,$14.75,May-15 15:37,Unknown,Unknown,Unknown,Instant,0,16,
item2414e5dddb,925 Silver - Vintage Peridot High Mountain School 1973 Ring Sz 7.5 - RG12218,https://www.ebay.com/itm/154969431515?hash=item2414e5dddb:g:z2gAAOSwbhFiarm0,https://i.ebayimg.com/thumbs/images/g/z2gAAOSwbhFiarm0/s-l225.jpg,$69.97,May-15 14:26,"New York, New York, United States",jewelrydeals4ucom,https://www.ebay.com/usr/jewelrydeals4ucom?_trksid=p2047675.l2559,Instant,0,1,
item2f72b2dec4,High Mountain Biluochun Green Tea 100g Natural Jasmine Tea Green Tea Health Care,https://www.ebay.com/itm/203787787972?hash=item2f72b2dec4:g:HGsAAOSwkAJhubMs,https://i.ebayimg.com/thumbs/images/g/HGsAAOSwkAJhubMs/s-l225.jpg,$8.24,May-15 11:14,Unknown,Unknown,Unknown,Instant,0,2,
item3dd9801308,2013 High Mountain Gong Mei 350g Chinese Old Tree Fuding White Tea Cake ShouMei,https://www.ebay.com/itm/265642054408?hash=item3dd9801308:g:vjcAAOSwrOlfy4nt,https://i.ebayimg.com/thumbs/images/g/vjcAAOSwrOlfy4nt/s-l225.jpg,$32.21,May-15 11:05,Unknown,Unknown,Unknown,Instant,0,1,
item2b190ec277,Tactical Camouflage Balaclava Windproof Hunting Face Mask Shield Neck Gaiter,https://www.ebay.com/itm/185103991415?hash=item2b190ec277:g:qhEAAOSwngFhZoD3,https://i.ebayimg.com/thumbs/images/g/qhEAAOSwngFhZoD3/s-l225.jpg,$9.69,May-15 09:56,Unknown,Unknown,Unknown,Instant,0,358,
item4ddd27c3be,High Mountain Truss Logo Green Adjustable Strap Back Baseball Cap Hat,https://www.ebay.com/itm/334422852542?hash=item4ddd27c3be:g:PtsAAOSwWSBia1bs,https://i.ebayimg.com/thumbs/images/g/PtsAAOSwWSBia1bs/s-l225.jpg,$2.98,May-14 09:20,"Palm Harbor, Florida, United States",ortons,https://www.ebay.com/usr/ortons?_trksid=p2047675.l2559,Instant,0,1,
item48fcf665ce,pak himalayan shilajit 100% natural authentic shilajit high mountain resin 60grm,https://www.ebay.com/itm/313481651662?hash=item48fcf665ce:g:dOcAAOSwUDFhUgxQ,https://i.ebayimg.com/thumbs/images/g/dOcAAOSwUDFhUgxQ/s-l225.jpg,$55.99,May-12 22:32,Unknown,Unknown,Unknown,Instant,0,1,
item4ad8c86ece,HIGH MOUNTAIN OOLONG TEA (TAIWAN ALISHAN) SPRING SEASON - 150g,https://www.ebay.com/itm/321464594126?hash=item4ad8c86ece:g:myUAAOSwJcddGgoS,https://i.ebayimg.com/thumbs/images/g/myUAAOSwJcddGgoS/s-l225.jpg,$25.82,May-12 07:42,Unknown,Unknown,Unknown,Instant,0,158,
item4db185abdc,GOARTEA 250g Premium Taiwan Milk Oolong Tea Jinxuan Alishan High Mountain Loose,https://www.ebay.com/itm/333690809308?epid=1071059522&hash=item4db185abdc:g:f5IAAOSw7Bde~Fmy,https://i.ebayimg.com/thumbs/images/g/f5IAAOSw7Bde~Fmy/s-l225.jpg,$21.99,May-11 16:13,Unknown,Unknown,Unknown,Instant,0,194,
item3b66a580c8,125g Top-Grade High Mountain Green Tea China Yunwu Maojian Loose Leaf Green Tea,https://www.ebay.com/itm/255125192904?hash=item3b66a580c8:g:6T0AAOSw4VxhNyXA,https://i.ebayimg.com/thumbs/images/g/6T0AAOSw4VxhNyXA/s-l225.jpg,$16.08,May-11 05:03,Unknown,Unknown,Unknown,Instant,0,11,
item5db984254a,Vtg. postcard: High mountain life on Iceland (from Øxnadalen) ca. 1920 pok.1077,https://www.ebay.com/itm/402544403786?hash=item5db984254a:g:N88AAOSw2mhfqbzA,https://i.ebayimg.com/thumbs/images/g/N88AAOSw2mhfqbzA/s-l225.jpg,$6.50,May-11 01:57,"Frederiksberg, Frederiksberg, Denmark",tema-penne.dk,https://www.ebay.com/usr/tema-penne.dk?_trksid=p2047675.l2559,Instant,0,1,
item2f75802db7,2018yr Fuding High Mountain Bai Cha Shou Mei Loose Leaf Wild Old White Tea 300g,https://www.ebay.com/itm/203834797495?epid=2263064202&hash=item2f75802db7:g:7x8AAOSwnwZZx7Ww,https://i.ebayimg.com/thumbs/images/g/7x8AAOSwnwZZx7Ww/s-l225.jpg,$11.75,May-10 18:16,Unknown,Unknown,Unknown,Instant,0,2,
item2411333ccc,High-mountain Two,https://www.ebay.com/itm/154907393228?epid=52635083&hash=item2411333ccc:g:SXkAAOSwgSBf~njQ,https://i.ebayimg.com/thumbs/images/g/SXkAAOSwgSBf~njQ/s-l225.jpg,$20.15,May-09 16:05,Unknown,Unknown,Unknown,Instant,0,1,
item56e8d06a2c,2022 Premium Taiwan High Mountain Tea Alishan Tea Jinxuan Milk Oolong,https://www.ebay.com/itm/373273160236?hash=item56e8d06a2c:g:z1UAAOSwRPhbmNHr,https://i.ebayimg.com/thumbs/images/g/z1UAAOSwRPhbmNHr/s-l225.jpg,$15.56,May-08 16:24,Unknown,Unknown,Unknown,Instant,0,46,
item4db0b9ccc1,GOARTEA Premium Spring Yunwu Cloud Mist High Mountain Chinese Lushan Green Tea,https://www.ebay.com/itm/333677448385?hash=item4db0b9ccc1:g:-IMAAOSwF9td3jnW,https://i.ebayimg.com/thumbs/images/g/-IMAAOSwF9td3jnW/s-l225.jpg,$10.98 to $94.98,May-08 09:50,Unknown,Unknown,Unknown,Instant,0,8,
item3dc52fc312,Taiwan Alishan high mountain Oolong tea  150g hand-picked,https://www.ebay.com/itm/265301246738?hash=item3dc52fc312:g:ylgAAOSwGhxbpJ3A,https://i.ebayimg.com/thumbs/images/g/ylgAAOSwGhxbpJ3A/s-l225.jpg,$16.00,May-08 05:45,"Seattle, Washington, United States",cybadminton,https://www.ebay.com/usr/cybadminton?_trksid=p2047675.l2559,Instant,0,17,
item1a9bee5b4c,100% Jamaican High Mountain 4oz whole bean curated to offer layered taste,https://www.ebay.com/itm/114285239116?hash=item1a9bee5b4c:g:PpYAAOSw9jdetIt8,https://i.ebayimg.com/thumbs/images/g/PpYAAOSw9jdetIt8/s-l225.jpg,$6.99,May-07 16:50,Unknown,Unknown,Unknown,Instant,0,2,
item1ab9c1a466,100% Jamaican High Mountain 12oz whole bean curated to offer layered taste,https://www.ebay.com/itm/114785625190?hash=item1ab9c1a466:g:PpYAAOSw9jdetIt8,https://i.ebayimg.com/thumbs/images/g/PpYAAOSw9jdetIt8/s-l225.jpg,$17.99,May-07 16:50,Unknown,Unknown,Unknown,Instant,0,1,
item1d218ab8f5,"Tang liangxing High Mountain, flowing water Trad. Chinese Pipa Music (C1405)",https://www.ebay.com/itm/125116791029?hash=item1d218ab8f5:g:O8cAAOSw~0dh7xIQ,https://i.ebayimg.com/thumbs/images/g/O8cAAOSw~0dh7xIQ/s-l225.jpg,$16.80,May-07 13:27,"Olsbrücken, Germany",zz-furtwaengler,https://www.ebay.com/usr/zz-furtwaengler?_trksid=p2047675.l2559,Instant,0,1,
item2b07b7be1b,Tactical Military Balaclava Face Scarf Paintball Airsoft Neck Warmer CS Headgear,https://www.ebay.com/itm/184813075995?hash=item2b07b7be1b:g:gP8AAOSw3d9d~Nai,https://i.ebayimg.com/thumbs/images/g/gP8AAOSw3d9d~Nai/s-l225.jpg,$7.55,May-07 11:03,Unknown,Unknown,Unknown,Instant,0,20,
