id,title,link,image,price_sold,end_date,origin,seller_name,seller_link,sell_type,num_bids,num_sold,auction_end_date
item34485efc41,"LY0140 Eumedonia eumedon antigua 1m Lycaenidae Tajikistan, Turkestan Mt. R.",https://www.ebay.com/itm/224552483905?hash=item34485efc41:g:DNYAAOSwifZhA3ev,https://i.ebayimg.com/thumbs/images/g/DNYAAOSwifZhA3ev/s-l225.jpg,$3.00,Aug-08 12:47,"Ulan-Ude, default, Russian Federation",karatsiberia,https://www.ebay.com/usr/karatsiberia?_trksid=p2047675.l2559,Auction,1,1,"Aug 08, 2021

12:47:17 PDT"
item28b43efd5b,Lepidoptera Lycaenidae Eumedonia eumedon Kyrgyzstan,https://www.ebay.com/itm/174822718811?hash=item28b43efd5b:g:0K0AAOSwlypcJn~2,https://i.ebayimg.com/thumbs/images/g/0K0AAOSwlypcJn~2/s-l225.jpg,$3.00,Jul-29 08:47,"Nizhny Novgorod, Russian Federation",dpotanin,https://www.ebay.com/usr/dpotanin?_trksid=p2047675.l2559,Instant,0,1,
item597499bade,"Lycaenidae eumedonia eumedon eumedon, times from Lithuania",https://www.ebay.com/itm/384208321246?hash=item597499bade:g:x4wAAOSw~sJgvPGG,https://i.ebayimg.com/thumbs/images/g/x4wAAOSw~sJgvPGG/s-l225.jpg,$2.95,Jun-13 09:02,"Vilnius, default, Lithuania",galijotas,https://www.ebay.com/usr/galijotas?_trksid=p2047675.l2559,Auction,3,1,"Jun 13, 2021

09:02:23 PDT"
