id,title,link,image,price_sold,end_date,origin,seller_name,seller_link,sell_type,num_bids,num_sold,auction_end_date
item1cee6a10ac,"Sweet Acacia, Farnesiana Vachellia Farnesiana, Yellow Flowers (30+ Seeds) (022B)",https://www.ebay.com/itm/124259012780?hash=item1cee6a10ac:g:2H8AAOSwqOVfDK58,https://i.ebayimg.com/thumbs/images/g/2H8AAOSwqOVfDK58/s-l225.jpg,$4.35,Aug-26 05:43,"North Las Vegas, Nevada, United States",acaver100,https://www.ebay.com/usr/acaver100?_trksid=p2047675.l2559,Instant,0,30,
item3fff482965,10 SWEET ACACIA Mimosa Tree Seeds Acacia farnesiana Wattle Flower Fast Growing,https://www.ebay.com/itm/274865858917?hash=item3fff482965:g:zUMAAOSw7gdhA1Om,https://i.ebayimg.com/thumbs/images/g/zUMAAOSw7gdhA1Om/s-l225.jpg,$6.75,Aug-23 03:07,"Lincolnton, North Carolina, United States",subculture9,https://www.ebay.com/usr/subculture9?_trksid=p2047675.l2559,Instant,0,1,
item3b3375f872,35 Acacia Farnesiana Mimosa ~ Sweet Acacia ~ Mealy Wattle ~ Needle Bush,https://www.ebay.com/itm/254266439794?hash=item3b3375f872:g:eU0AAOSwVZtdBv65,https://i.ebayimg.com/thumbs/images/g/eU0AAOSwVZtdBv65/s-l225.jpg,$6.99,Aug-08 08:29,"Mesa, Arizona, United States",oneillseedco,https://www.ebay.com/usr/oneillseedco?_trksid=p2047675.l2559,Instant,0,23,
item4b849643ec,Sweet Acacia   Huisache   Acacia farnesiana   10 Seeds   (Free US Shipping),https://www.ebay.com/itm/324346987500?hash=item4b849643ec:g:tewAAOSwVrNflDZ5,https://i.ebayimg.com/thumbs/images/g/tewAAOSwVrNflDZ5/s-l225.jpg,$9.79,Aug-05 04:00,"Gainesville, Florida, United States",gottliebraphael1,https://www.ebay.com/usr/gottliebraphael1?_trksid=p2047675.l2559,Instant,0,6,
item3fd5c66d72,Cassie (Sweet Acacia) Pure & Natural Essential Oil Acacia farnesiana by Bangota,https://www.ebay.com/itm/274169490802?hash=item3fd5c66d72:g:Dy4AAOSwArteByeN,https://i.ebayimg.com/thumbs/images/g/Dy4AAOSwArteByeN/s-l225.jpg,$9.95 to $22.92,Jul-30 23:01,"Delhi, DELHI, India",bangotainternational,https://www.ebay.com/usr/bangotainternational?_trksid=p2047675.l2559,Instant,0,9,
item3fe2d4c2ce,Cassie (Sweet Acacia) Pure & Natural Oil 15 ml Acacia farnesiana by Bangota,https://www.ebay.com/itm/274388533966?hash=item3fe2d4c2ce:g:WMQAAOSwPW9e2mzc,https://i.ebayimg.com/thumbs/images/g/WMQAAOSwPW9e2mzc/s-l225.jpg,$13.61,Jun-27 12:17,"Delhi, DELHI, India",bangotainternational,https://www.ebay.com/usr/bangotainternational?_trksid=p2047675.l2559,Instant,0,1,
item56f2330ded,"Acacia Bonsai Tree Flowering Dwarf Sweet Acacia Farnesiana 11 y. old, 14"" tall",https://www.ebay.com/itm/373430619629?hash=item56f2330ded:g:Uh8AAOSwXuFgA0FV,https://i.ebayimg.com/thumbs/images/g/Uh8AAOSwXuFgA0FV/s-l225.jpg,$119.95,Jun-17 14:24,"Patchogue, New York, United States",greeenlife,https://www.ebay.com/usr/greeenlife?_trksid=p2047675.l2559,Instant,0,4,
