id,title,link,image,price_sold,end_date,origin,seller_name,seller_link,sell_type,num_bids,num_sold,auction_end_date
item59081f53c1,Diaethria clymena ONE REAL BUTTERFLY RED WHITE 88 UNMOUNTED WINGS CLOSED,https://www.ebay.com/itm/382388360129?hash=item59081f53c1:g:7NQAAOSwBG9cgtOh,https://i.ebayimg.com/thumbs/images/g/7NQAAOSwBG9cgtOh/s-l225.jpg,$8.00,Aug-27 01:33,"Sahuarita, Arizona, United States",bicbugs,https://www.ebay.com/usr/bicbugs?_trksid=p2047675.l2559,Instant,0,80,
item2d3cae2143,ACEO Original Modern Art Card Diaethria Clymena Butterfly Insect Flower Gift,https://www.ebay.com/itm/194291573059?hash=item2d3cae2143:g:G3oAAOSwnaBhBrOb,https://i.ebayimg.com/thumbs/images/g/G3oAAOSwnaBhBrOb/s-l225.jpg,$0.01,Aug-23 22:11,"Galle,Unawatuna, Sri Lanka",paintboost,https://www.ebay.com/usr/paintboost?_trksid=p2047675.l2559,Auction,1,1,"Aug 23, 2021

22:11:25 PDT"
item3d9616913e,Cramers Eighty-eight Butterfly Diaethria clymena Folded FAST FROM USA,https://www.ebay.com/itm/264511066430?hash=item3d9616913e:g:k2EAAOSwB-1YvuFR,https://i.ebayimg.com/thumbs/images/g/k2EAAOSwB-1YvuFR/s-l225.jpg,$3.99,Aug-22 23:43,"Jupiter, Florida, United States",ynot601,https://www.ebay.com/usr/ynot601?_trksid=p2047675.l2559,Instant,0,55,
item5701634839,DIAETHRIA CLYMENA SSP. FROM ECUADOR,https://www.ebay.com/itm/373685438521?hash=item5701634839:g:URcAAOSw4RZhGOSF,https://i.ebayimg.com/thumbs/images/g/URcAAOSw4RZhGOSF/s-l225.jpg,$1.25,Aug-22 10:45,"Munich, Germany",ilo44,https://www.ebay.com/usr/ilo44?_trksid=p2047675.l2559,Auction,1,1,"Aug 22, 2021

10:45:55 PDT"
item3b4cc46650,Lot of 10 Cramer's Eighty-eight Butterfly Diaethria clymena Folded FAST FROM USA,https://www.ebay.com/itm/254691010128?hash=item3b4cc46650:g:k2EAAOSwB-1YvuFR,https://i.ebayimg.com/thumbs/images/g/k2EAAOSwB-1YvuFR/s-l225.jpg,$29.99,Aug-17 20:43,"Jupiter, Florida, United States",ynot601,https://www.ebay.com/usr/ynot601?_trksid=p2047675.l2559,Instant,0,8,
item3b61cff272,Lot of 25 Cramer's Eighty-eight Butterfly Diaethria clymena Folded FAST FROM USA,https://www.ebay.com/itm/255044088434?hash=item3b61cff272:g:k2EAAOSwB-1YvuFR,https://i.ebayimg.com/thumbs/images/g/k2EAAOSwB-1YvuFR/s-l225.jpg,$74.99,Aug-06 20:15,"Jupiter, Florida, United States",ynot601,https://www.ebay.com/usr/ynot601?_trksid=p2047675.l2559,Instant,0,1,
item2eef355cc3,Diaethria clymena Folded Butterfly Taxidermy REAL Unmounted,https://www.ebay.com/itm/201581747395?hash=item2eef355cc3:g:wrIAAOSwjXNad8j8,https://i.ebayimg.com/thumbs/images/g/wrIAAOSwjXNad8j8/s-l225.jpg,$2.50,Aug-02 15:53,"Sainte-Brigitte-de-Laval, Quebec, Canada",taxentomo-store,https://www.ebay.com/usr/taxentomo-store?_trksid=p2047675.l2559,Instant,0,113,
item3b4cc46833,Lot of 25 Cramer's Eighty-eight Butterfly Diaethria clymena Folded FAST FROM USA,https://www.ebay.com/itm/254691010611?hash=item3b4cc46833:g:k2EAAOSwB-1YvuFR,https://i.ebayimg.com/thumbs/images/g/k2EAAOSwB-1YvuFR/s-l225.jpg,$74.99,Jun-21 20:22,"Jupiter, Florida, United States",ynot601,https://www.ebay.com/usr/ynot601?_trksid=p2047675.l2559,Instant,0,3,
item590a351fdd,Diaethria clymena REAL FRAMED BUTTERFLY RED WHITE BLUE 88 OCHO VERSO PERU,https://www.ebay.com/itm/382423343069?hash=item590a351fdd:g:gRsAAOSwKJtavFQG,https://i.ebayimg.com/thumbs/images/g/gRsAAOSwKJtavFQG/s-l225.jpg,$28.00,Jun-01 11:43,"Sahuarita, Arizona, United States",bicbugs,https://www.ebay.com/usr/bicbugs?_trksid=p2047675.l2559,Instant,0,44,
