id,title,link,image,price_sold,end_date,origin,seller_name,seller_link,sell_type,num_bids,num_sold,auction_end_date
item4b5c54339a,50 collection unmounted butterfly Tirumala septentrionis CHINA GUANGXI A1 A1-,https://www.ebay.com/itm/323671569306?hash=item4b5c54339a:g:U3IAAOSwiwZcJDjj,https://i.ebayimg.com/thumbs/images/g/U3IAAOSwiwZcJDjj/s-l225.jpg,$39.00,Aug-24 17:53,"mainland, China",xzcyj,https://www.ebay.com/usr/xzcyj?_trksid=p2047675.l2559,Instant,0,3,
item447fc67105,Real Insect/Butterfly Set Spread B7349 Danaus Tirumala septentrionis Blue Tiger,https://www.ebay.com/itm/294201487621?hash=item447fc67105:g:0L4AAOSwt89gstvz,https://i.ebayimg.com/thumbs/images/g/0L4AAOSwt89gstvz/s-l225.jpg,$5.73,Jun-08 20:19,"Goolwa, South Australia, Australia",uniquebutterfliesandinsects,https://www.ebay.com/usr/uniquebutterfliesandinsects?_trksid=p2047675.l2559,Instant,0,1,
item3ffb10c6bc,Blue Tiger butterfly Tirumala septentrionis SET x1 FM A- missing antenna #j01,https://www.ebay.com/itm/274795120316?hash=item3ffb10c6bc:g:HEsAAOSwaVVgnAsj,https://i.ebayimg.com/thumbs/images/g/HEsAAOSwaVVgnAsj/s-l225.jpg,$9.55,Jun-08 08:31,"Sleaford, United Kingdom",themothman35,https://www.ebay.com/usr/themothman35?_trksid=p2047675.l2559,Instant,0,1,
item3ffb10dd64,Blue Tiger butterfly Tirumala septentrionis SET x1 Male A- China #j01,https://www.ebay.com/itm/274795126116?hash=item3ffb10dd64:g:YW4AAOSwCitgnAyk,https://i.ebayimg.com/thumbs/images/g/YW4AAOSwCitgnAyk/s-l225.jpg,$10.24,Jun-08 08:31,"Sleaford, United Kingdom",themothman35,https://www.ebay.com/usr/themothman35?_trksid=p2047675.l2559,Instant,0,1,
item48dac46bfc,WHOLESALE 25 PAIR unmounted butterfly Tirumala septentrionis CHINA A1 A1-,https://www.ebay.com/itm/312907951100?hash=item48dac46bfc:g:plEAAOSwstxVO14s,https://i.ebayimg.com/thumbs/images/g/plEAAOSwstxVO14s/s-l225.jpg,$42.00,Jun-01 05:14,"beijing, China",china*butterfly,https://www.ebay.com/usr/china*butterfly?_trksid=p2047675.l2559,Instant,0,1,
