id,title,link,image,price_sold,end_date,origin,seller_name,seller_link,sell_type,num_bids,num_sold,auction_end_date
item1d12138ccf,Apricot Sulphur in Box Frame (Phoebis argante),https://www.ebay.com/itm/124857322703?hash=item1d12138ccf:g:LNQAAOSwKdJhG4al,https://i.ebayimg.com/thumbs/images/g/LNQAAOSwKdJhG4al/s-l225.jpg,$48.09,Aug-27 01:11,"Hitchin, United Kingdom",minibeastuk,https://www.ebay.com/usr/minibeastuk?_trksid=p2047675.l2559,Instant,0,1,
item3dbb2e5ff8,Orange Sulphur Butterfly  A- SET x1 Phoebis Argante Antenna Damage Entomology.,https://www.ebay.com/itm/265133383672?hash=item3dbb2e5ff8:g:2mUAAOSw2JBggWQ3,https://i.ebayimg.com/thumbs/images/g/2mUAAOSw2JBggWQ3/s-l225.jpg,$10.93,Aug-04 09:55,"Sleaford, United Kingdom",themothman35,https://www.ebay.com/usr/themothman35?_trksid=p2047675.l2559,Instant,0,4,
item3dbb2e4ca6,Orange Sulphur Butterfly  A1- SET x1 Phoebis Argante dried Insect Art Framing,https://www.ebay.com/itm/265133378726?hash=item3dbb2e4ca6:g:~~8AAOSwks5ggWL8,https://i.ebayimg.com/thumbs/images/g/~~8AAOSwks5ggWL8/s-l225.jpg,$12.30,Jul-18 06:18,"Sleaford, United Kingdom",themothman35,https://www.ebay.com/usr/themothman35?_trksid=p2047675.l2559,Instant,0,2,
item2ce2b99d35,Phoebis argante yellow Butterfly (FOLDED) Taxidermy REAL Unmounted,https://www.ebay.com/itm/192782376245?hash=item2ce2b99d35:g:s8AAAOSw8iZcMket,https://i.ebayimg.com/thumbs/images/g/s8AAAOSw8iZcMket/s-l225.jpg,$3.25,Jun-19 23:14,"Sainte-Brigitte-de-Laval, Quebec, Canada",taxentomo-store,https://www.ebay.com/usr/taxentomo-store?_trksid=p2047675.l2559,Instant,0,108,
item591a0b9813,Phoebis argante ONE REAL BUTTERFLY ORANGE PERU UNMOUNTED WINGS CLOSED,https://www.ebay.com/itm/382689056787?hash=item591a0b9813:g:C1QAAOSwDX5cHuS~,https://i.ebayimg.com/thumbs/images/g/C1QAAOSwDX5cHuS~/s-l225.jpg,$8.00,Jun-02 09:56,"Sahuarita, Arizona, United States",bicbugs,https://www.ebay.com/usr/bicbugs?_trksid=p2047675.l2559,Instant,0,19,
