id,title,link,image,price_sold,end_date,origin,seller_name,seller_link,sell_type,num_bids,num_sold,auction_end_date
item447361c30d,Real Dried Insect/Butterfly/Moth Non set B7026 Blue Papilio Graphium leonidas,https://www.ebay.com/itm/293993562893?hash=item447361c30d:g:VOkAAOSwxARgIL9B,https://i.ebayimg.com/thumbs/images/g/VOkAAOSwxARgIL9B/s-l225.jpg,$2.81,Aug-14 22:30,"Goolwa, South Australia, Australia",uniquebutterfliesandinsects,https://www.ebay.com/usr/uniquebutterfliesandinsects?_trksid=p2047675.l2559,Instant,0,20,
item2d24d85730,Graphium leonidas Butterfly Taxidermy REAL Insect (Unmounted) A-,https://www.ebay.com/itm/193891686192?hash=item2d24d85730:g:Li8AAOSwCWRgKIeC,https://i.ebayimg.com/thumbs/images/g/Li8AAOSwCWRgKIeC/s-l225.jpg,$3.00,Jul-27 20:53,"Sainte-Brigitte-de-Laval, Quebec, Canada",taxentomo-store,https://www.ebay.com/usr/taxentomo-store?_trksid=p2047675.l2559,Instant,0,7,
item46c082c667,Real Insect/Butterfly/Moth Set/Spread B7043 Blue/Black Graphium leonidas Africa,https://www.ebay.com/itm/303877506663?hash=item46c082c667:g:zCAAAOSw9zVgIL6k,https://i.ebayimg.com/thumbs/images/g/zCAAAOSw9zVgIL6k/s-l225.jpg,$5.73,Jul-17 15:51,"Goolwa, South Australia, Australia",uniquebutterfliesandinsects,https://www.ebay.com/usr/uniquebutterfliesandinsects?_trksid=p2047675.l2559,Instant,0,1,
item1f27814b63,Butterfly -  Graphium leonidas. x 2. From Uganda,https://www.ebay.com/itm/133806771043?hash=item1f27814b63:g:LqwAAOSwqZ9gyJxb,https://i.ebayimg.com/thumbs/images/g/LqwAAOSwqZ9gyJxb/s-l225.jpg,$2.41,Jul-10 02:10,"Hurst, Berkshire, United Kingdom",dh1255,https://www.ebay.com/usr/dh1255?_trksid=p2047675.l2559,Auction,1,1,"Jul 10, 2021

02:10:59 PDT"
item3dbbec693b,Veined Swallowtail Butterfly Graphium leonidas SET x1 A1- Entomology insect.,https://www.ebay.com/itm/265145837883?hash=item3dbbec693b:g:NgUAAOSwNJ1gju~O,https://i.ebayimg.com/thumbs/images/g/NgUAAOSwNJ1gju~O/s-l225.jpg,$10.93,Jun-16 02:41,"Sleaford, United Kingdom",themothman35,https://www.ebay.com/usr/themothman35?_trksid=p2047675.l2559,Instant,0,1,
