id,title,link,image,price_sold,end_date,origin,seller_name,seller_link,sell_type,num_bids,num_sold,auction_end_date
item3b5904bfa6,Pretty Swallowtail Butterfly Papilio torquatus torquatus Male Folded FAST USA,https://www.ebay.com/itm/254896553894?hash=item3b5904bfa6:g:fHMAAOSwhLReE6Qz,https://i.ebayimg.com/thumbs/images/g/fHMAAOSwhLReE6Qz/s-l225.jpg,$3.86,Aug-28 12:38,"Jupiter, Florida, United States",ynot601,https://www.ebay.com/usr/ynot601?_trksid=p2047675.l2559,Instant,0,10,
item48f9057f7f,"REAL Papilio torquatus, Torquatus Swallowtail Butterfly, Unmounted Ships from US",https://www.ebay.com/itm/313415532415?hash=item48f9057f7f:g:RNEAAOSweRBfQeFz,https://i.ebayimg.com/thumbs/images/g/RNEAAOSweRBfQeFz/s-l225.jpg,$3.85,Aug-25 20:41,"Estes Park, Colorado, United States",little_caterpillar_butterfly_art,https://www.ebay.com/usr/little_caterpillar_butterfly_art?_trksid=p2047675.l2559,Instant,0,12,
item3db82a3b37,Lot of 10 Pretty Swallowtail Butterfly Papilio torquatus torquatus Male Folded,https://www.ebay.com/itm/265082780471?hash=item3db82a3b37:g:fHMAAOSwhLReE6Qz,https://i.ebayimg.com/thumbs/images/g/fHMAAOSwhLReE6Qz/s-l225.jpg,$33.99,Aug-17 10:01,"Jupiter, Florida, United States",ynot601,https://www.ebay.com/usr/ynot601?_trksid=p2047675.l2559,Instant,0,2,
item447a4d0a03,Butterfly/Insect/Moth Non Set B6491 Colourful Papilio torquatus Peru,https://www.ebay.com/itm/294109645315?hash=item447a4d0a03:g:SaYAAOSw-ntfUGtJ,https://i.ebayimg.com/thumbs/images/g/SaYAAOSw-ntfUGtJ/s-l225.jpg,$3.98,Aug-08 18:07,"Goolwa, South Australia, Australia",uniquebutterfliesandinsects,https://www.ebay.com/usr/uniquebutterfliesandinsects?_trksid=p2047675.l2559,Instant,0,5,
item4b9be6e78e,UNMOUNTED BUTTERFLY PAPILIO TORQUATUS  1 PC,https://www.ebay.com/itm/324738148238?hash=item4b9be6e78e:g:KlcAAOSwkOlgyCpP,https://i.ebayimg.com/thumbs/images/g/KlcAAOSwkOlgyCpP/s-l225.jpg,$2.99,Aug-07 20:52,"pattaya, chonburi, Thailand",wthongmai,https://www.ebay.com/usr/wthongmai?_trksid=p2047675.l2559,Auction,1,1,"Aug 07, 2021

20:52:55 PDT"
item2cac4dc5e4,Papilio torquatus Folded Butterfly Taxidermy REAL Unmounted,https://www.ebay.com/itm/191869339108?hash=item2cac4dc5e4:g:QfEAAOSwrslagdhe,https://i.ebayimg.com/thumbs/images/g/QfEAAOSwrslagdhe/s-l225.jpg,$2.50,Aug-05 16:08,"Sainte-Brigitte-de-Laval, Quebec, Canada",taxentomo-store,https://www.ebay.com/usr/taxentomo-store?_trksid=p2047675.l2559,Instant,0,25,
