id,title,link,image,price_sold,end_date,origin,seller_name,seller_link,sell_type,num_bids,num_sold,auction_end_date
item343ad802a8,Callicore hystaspes verso red yellow butterfly Peru unmounted wings closed,https://www.ebay.com/itm/224325534376?hash=item343ad802a8:g:rMYAAOSwQdhgC4vA,https://i.ebayimg.com/thumbs/images/g/rMYAAOSwQdhgC4vA/s-l225.jpg,$6.00,Aug-27 01:33,"Sahuarita, Arizona, United States",bicbugs,https://www.ebay.com/usr/bicbugs?_trksid=p2047675.l2559,Instant,0,1,
item3abc2cb809,Zelphanta Numberwing Butterfly Callicore hystaspes Folded FAST FROM USA,https://www.ebay.com/itm/252265150473?hash=item3abc2cb809:g:noAAAOSw-zxWpUAB,https://i.ebayimg.com/thumbs/images/g/noAAAOSw-zxWpUAB/s-l225.jpg,$5.12,Aug-26 23:52,"Jupiter, Florida, United States",ynot601,https://www.ebay.com/usr/ynot601?_trksid=p2047675.l2559,Instant,0,36,
item3dc2305ff1,"Unmounted Butterfly / Nymphalidae - Callicore hystaspes, male, A-",https://www.ebay.com/itm/265250955249?hash=item3dc2305ff1:g:XuwAAOSwd5xhCCeg,https://i.ebayimg.com/thumbs/images/g/XuwAAOSwd5xhCCeg/s-l225.jpg,$1.89,Aug-15 21:50,"Sieraków Wielkopolski, Poland",butterfly-shade,https://www.ebay.com/usr/butterfly-shade?_trksid=p2047675.l2559,Instant,0,1,
item343ad7f8fd,Callicore hystaspes pink red blue butterfly Peru unmounted wings closed,https://www.ebay.com/itm/224325531901?hash=item343ad7f8fd:g:Mz0AAOSwbs1gC4s0,https://i.ebayimg.com/thumbs/images/g/Mz0AAOSwbs1gC4s0/s-l225.jpg,$6.00,Aug-09 21:18,"Sahuarita, Arizona, United States",bicbugs,https://www.ebay.com/usr/bicbugs?_trksid=p2047675.l2559,Instant,0,9,
item448166b9a8,Real Dried Insect/Butterfly Non set B7395 Rare Colourful Callicore hystaspes,https://www.ebay.com/itm/294228769192?hash=item448166b9a8:g:7gsAAOSwgsRg0Ao3,https://i.ebayimg.com/thumbs/images/g/7gsAAOSwgsRg0Ao3/s-l225.jpg,$3.98,Jul-21 09:57,"Goolwa, South Australia, Australia",uniquebutterfliesandinsects,https://www.ebay.com/usr/uniquebutterfliesandinsects?_trksid=p2047675.l2559,Instant,0,8,
item3b5693bf27,"Unmounted Butterfly/Nymphalidae - Callicore hystaspes, male, A-",https://www.ebay.com/itm/254855593767?hash=item3b5693bf27:g:I0oAAOSwFzNgG6vG,https://i.ebayimg.com/thumbs/images/g/I0oAAOSwFzNgG6vG/s-l225.jpg,$1.89,Jul-13 16:31,"Sieraków Wielkopolski, Poland",butterfly-shade,https://www.ebay.com/usr/butterfly-shade?_trksid=p2047675.l2559,Instant,0,10,
item46ca0e3881,Real Insect/Butterfly/Moth Set Spread B7404 Colourful Callicore hystaspes,https://www.ebay.com/itm/304037640321?hash=item46ca0e3881:g:nCUAAOSwZ0dgzTH-,https://i.ebayimg.com/thumbs/images/g/nCUAAOSwZ0dgzTH-/s-l225.jpg,$7.19,Jul-09 15:33,"Goolwa, South Australia, Australia",uniquebutterfliesandinsects,https://www.ebay.com/usr/uniquebutterfliesandinsects?_trksid=p2047675.l2559,Instant,0,1,
item3db59c1277,"Unmounted Butterfly/Nymphalidae - Callicore hystaspes, male, Peru",https://www.ebay.com/itm/265039909495?hash=item3db59c1277:g:I0oAAOSwFzNgG6vG,https://i.ebayimg.com/thumbs/images/g/I0oAAOSwFzNgG6vG/s-l225.jpg,$2.58,Jul-05 22:48,"Sieraków Wielkopolski, Poland",butterfly-shade,https://www.ebay.com/usr/butterfly-shade?_trksid=p2047675.l2559,Instant,0,7,
