id,title,link,price,origin,image,seller_name,seller_link,sell_type,num_bids,num_watchers,num_stock,date
item524afa2371,120ml African Leopard EDP Unisex Spray Fragrance Long-Lasting Perfume PARIS CORN,https://www.ebay.com/itm/353445225329?hash=item524afa2371:g:AGcAAOSwmFFgE2SS,$59.99,"Orlando, Florida, United States",https://i.ebayimg.com/thumbs/images/g/AGcAAOSwmFFgE2SS/s-l225.jpg,nomwas_0,https://www.ebay.com/usr/nomwas_0?_trksid=p2047675.l2559,Instant,0,0,More than 10,"Jul 11, 2021 11:24:26 PDT"
item36852dfcec,"Purse, Anuschka African Leopard Crossbody, Front Section Acts As A Wallet￼. EUC",https://www.ebay.com/itm/234162617580?hash=item36852dfcec:g:XV4AAOSw1wNhKqDs,$119.99,"Midland, Pennsylvania, United States",https://i.ebayimg.com/thumbs/images/g/XV4AAOSw1wNhKqDs/s-l225.jpg,michaeld1861,https://www.ebay.com/usr/michaeld1861?_trksid=p2047675.l2559,Instant,0,0,1,"Aug 29, 2021 02:41:29 PDT"
item597cd9e994,Anuschka Hand-Painted Leather Satchel & Accessories African Leopard NWT,https://www.ebay.com/itm/384346745236?hash=item597cd9e994:g:8r8AAOSw0ZJhHBZd,$139.92,"Clearwater, Florida, United States",https://i.ebayimg.com/thumbs/images/g/8r8AAOSw0ZJhHBZd/s-l225.jpg,12181977,https://www.ebay.com/usr/12181977?_trksid=p2047675.l2559,Instant,0,0,1,Unknown
item21309d892b,2017 Republic of Ghana 5 Cedi 1 oz Silver African Leopard BU,https://www.ebay.com/itm/142549551403?epid=11041351357&hash=item21309d892b:g:~JAAAOSwK0ZhCc0H,$41.92,"Oklahoma City, Oklahoma, United States",https://i.ebayimg.com/thumbs/images/g/~JAAAOSwK0ZhCc0H/s-l225.jpg,apmex,https://www.ebay.com/str/apmex?_trksid=p2047675.l2563,Instant,0,0,More than 10,"Aug 30, 2021 08:53:37 PDT"
item48f99cb706,African Leopard Unisex EDP Fragrance Scent Spray PARIS CORNER PERFUME,https://www.ebay.com/itm/313425442566?hash=item48f99cb706:g:32MAAOSwqx5gL~6f,$52.00,"Orlando, Florida, United States",https://i.ebayimg.com/thumbs/images/g/32MAAOSwqx5gL~6f/s-l225.jpg,reliance_fl,https://www.ebay.com/usr/reliance_fl?_trksid=p2047675.l2559,Instant,0,0,3,Unknown
item525723815b,2018 5 Cedis Republic of Ghana African Leopard 1oz Fine Silver Coin in Capsule,https://www.ebay.com/itm/353649262939?hash=item525723815b:g:xD4AAOSw0F9hLEFT,$54.99,"Philadelphia, Pennsylvania, United States",https://i.ebayimg.com/thumbs/images/g/xD4AAOSw0F9hLEFT/s-l225.jpg,phillywriter,https://www.ebay.com/usr/phillywriter?_trksid=p2047675.l2559,Instant,0,0,2,Unknown
item4002616c36,2020 South African LEOPARD  THE BIG 5 Silver 5 Rand Coin,https://www.ebay.com/itm/274917846070?epid=17035629071&hash=item4002616c36:g:O60AAOSw~Cxg77gW,$105.00,"Riverview, Florida, United States",https://i.ebayimg.com/thumbs/images/g/O60AAOSw~Cxg77gW/s-l225.jpg,jora632,https://www.ebay.com/usr/jora632?_trksid=p2047675.l2559,Instant,0,0,1,Unknown
item3dc3bc66fc,Anuschka Hand-Painted Leather Organizer Wallet-African Leopard Tan-NWT-Orig.$99,https://www.ebay.com/itm/265276909308?hash=item3dc3bc66fc:g:2e8AAOSw5JhhH8lM,$59.95,"Largo, Florida, United States",https://i.ebayimg.com/thumbs/images/g/2e8AAOSw5JhhH8lM/s-l225.jpg,rsch2277,https://www.ebay.com/usr/rsch2277?_trksid=p2047675.l2559,Instant,0,0,1,"Aug 20, 2021 08:25:24 PDT"
item343fe16f4b,Anuschka  African Leopard Tan Leather Crossbody Organizer NWT,https://www.ebay.com/itm/224410038091?hash=item343fe16f4b:g:~r8AAOSwFd9gZ6F4,$156.31,"Brandon, Florida, United States",https://i.ebayimg.com/thumbs/images/g/~r8AAOSwFd9gZ6F4/s-l225.jpg,mamamcgarrell,https://www.ebay.com/usr/mamamcgarrell?_trksid=p2047675.l2559,Instant,0,0,1,"Jun 23, 2021 13:37:56 PDT"
item597b222026,Anuschka Hand-Painted Leather Crossbody Organizer African Leopard Tan NWT,https://www.ebay.com/itm/384317923366?hash=item597b222026:g:IgEAAOSwp45hDxCO,$114.36,"Clearwater, Florida, United States",https://i.ebayimg.com/thumbs/images/g/IgEAAOSwp45hDxCO/s-l225.jpg,12181977,https://www.ebay.com/usr/12181977?_trksid=p2047675.l2559,Instant,0,0,1,Unknown
item4dac584ff1,Breyer CollectA #88866 African Leopard NEW!,https://www.ebay.com/itm/333603950577?hash=item4dac584ff1:g:44IAAOSwSGtfLa5J,$7.99,"Frankfort, Michigan, United States",https://i.ebayimg.com/thumbs/images/g/44IAAOSwSGtfLa5J/s-l225.jpg,cornertoystore,https://www.ebay.com/usr/cornertoystore?_trksid=p2047675.l2559,Instant,0,0,Last one,"Aug 25, 2021 01:03:31 PDT"
item5489b1e415,Breyer CollectA 88866  African Leopard  well made <><,https://www.ebay.com/itm/363087389717?hash=item5489b1e415:g:dZIAAOSwLGRfRqhn,$8.89,"Butternut, Wisconsin, United States",https://i.ebayimg.com/thumbs/images/g/dZIAAOSwLGRfRqhn/s-l225.jpg,spring-water,https://www.ebay.com/usr/spring-water?_trksid=p2047675.l2559,Instant,0,0,4,"Aug 26, 2020 13:20:34 PDT"
item3db75b8773,ANUSCHKA AFRICAN LEOPARD HAND PAINTED PASSPORT ORGANIZER WALLET - NWT,https://www.ebay.com/itm/265069234035?hash=item3db75b8773:g:lx4AAOSwzGNgjefi,$65.00,"Tampa, Florida, United States",https://i.ebayimg.com/thumbs/images/g/lx4AAOSwzGNgjefi/s-l225.jpg,boutiquesparkle,https://www.ebay.com/usr/boutiquesparkle?_trksid=p2047675.l2559,Instant,0,0,1,"Aug 16, 2021 15:30:57 PDT"
item23fdd94873,NWT Francis + Benedict Skirt Plus Size African Leopard Print Batik 40” Waist,https://www.ebay.com/itm/154582730867?hash=item23fdd94873:g:O7AAAOSwb0VhJWL2,$40.00,"Mount Pleasant, South Carolina, United States",https://i.ebayimg.com/thumbs/images/g/O7AAAOSwb0VhJWL2/s-l225.jpg,divathreads4u,https://www.ebay.com/usr/divathreads4u?_trksid=p2047675.l2559,Instant,0,0,1,Unknown
item218c7160fa,2017 5 cedis Ghana African Leopard 1 oz Silver Coin - Sealed Lot of 2,https://www.ebay.com/itm/144090161402?hash=item218c7160fa:g:-f8AAOSwSnJhAEAu,$69.00,"Spring Lake, Michigan, United States",https://i.ebayimg.com/thumbs/images/g/-f8AAOSwSnJhAEAu/s-l225.jpg,sjjm49456,https://www.ebay.com/usr/sjjm49456?_trksid=p2047675.l2559,Instant,0,0,1,"Jul 30, 2021 23:59:40 PDT"
item5ddae9d409,CollectA Wildlife Collection Miniature Figure | African Leopard,https://www.ebay.com/itm/403104715785?hash=item5ddae9d409:g:1bcAAOSwGu5hJvHz,$13.99,"Addison, Illinois, United States",https://i.ebayimg.com/thumbs/images/g/1bcAAOSwGu5hJvHz/s-l225.jpg,toynk,https://www.ebay.com/usr/toynk?_trksid=p2047675.l2559,Instant,0,0,10,"Aug 25, 2021 20:05:51 PDT"
item422f46b41e,The African Leopard: Ecology and Behavior 1993 Bailey Felines Big Cats HCDJ,https://www.ebay.com/itm/284261004318?hash=item422f46b41e:g:UAwAAOSwdMtgekTv,$40.00,"Tucson, Arizona, United States",https://i.ebayimg.com/thumbs/images/g/UAwAAOSwdMtgekTv/s-l225.jpg,mturchi,https://www.ebay.com/usr/mturchi?_trksid=p2047675.l2559,Instant,0,0,1,"Jun 10, 2021 20:01:43 PDT"
item2160cbb5df,2019 Republic of Ghana 1 oz Silver 5 Cedi African Leopard BU - SKU#195101,https://www.ebay.com/itm/143357883871?epid=5043238652&hash=item2160cbb5df:g:FmkAAOSwOlZhHnA5,$39.88,"Oklahoma City, Oklahoma, United States",https://i.ebayimg.com/thumbs/images/g/FmkAAOSwOlZhHnA5/s-l225.jpg,apmex,https://www.ebay.com/str/apmex?_trksid=p2047675.l2563,Instant,0,0,More than 10,"Aug 30, 2021 08:53:36 PDT"
item23fe015868,ANUSCHKA Hand Painted Leather Crossbody Organizer  ~ African Leopard (Tan),https://www.ebay.com/itm/154585356392?hash=item23fe015868:g:7XAAAOSw9XBhJ9VI,$148.27,"Hudson, Florida, United States",https://i.ebayimg.com/thumbs/images/g/7XAAAOSw9XBhJ9VI/s-l225.jpg,avastropicaltreasures,https://www.ebay.com/usr/avastropicaltreasures?_trksid=p2047675.l2559,Instant,0,0,1,Unknown
item266d2bdafc,Anuschka  African Leopard Tan Leather Crossbody Organizer NWT,https://www.ebay.com/itm/165040347900?hash=item266d2bdafc:g:Vq8AAOSw6mNhIu9V,$149.95,"Saint Petersburg, Florida, United States",https://i.ebayimg.com/thumbs/images/g/Vq8AAOSw6mNhIu9V/s-l225.jpg,find*it*for*u,https://www.ebay.com/usr/find*it*for*u?_trksid=p2047675.l2559,Instant,0,0,1,"Aug 27, 2021 12:38:27 PDT"
item56fc2c0efd,Anuschka African Leopard Tan - Hand Painted Leather Crossbody Organizer NWT,https://www.ebay.com/itm/373597933309?hash=item56fc2c0efd:g:ep4AAOSwwyZgs~Py,$144.90,"Holiday, Florida, United States",https://i.ebayimg.com/thumbs/images/g/ep4AAOSwwyZgs~Py/s-l225.jpg,blueriverroad2000,https://www.ebay.com/usr/blueriverroad2000?_trksid=p2047675.l2559,Instant,0,0,1,"Aug 07, 2021 07:48:51 PDT"
item3653f47b82,AFRICAN LEOPARD Replica 88866 ~ NEW for 2019! ~ Ships Free w/ $25+ CollectA,https://www.ebay.com/itm/233336765314?epid=3032632702&hash=item3653f47b82:g:dk0AAOSw671dC83P,$16.97,"Saugerties, New York, United States",https://i.ebayimg.com/thumbs/images/g/dk0AAOSw671dC83P/s-l225.jpg,bobchris72,https://www.ebay.com/usr/bobchris72?_trksid=p2047675.l2559,Instant,0,0,Last one,"Aug 04, 2021 15:35:46 PDT"
item5489d3b24e,"Charles Frace African Leopard Art Print - 12.25""x9.25""",https://www.ebay.com/itm/363089605198?hash=item5489d3b24e:g:LbcAAOSwRPdgCmPU,$12.95,"Annandale, Minnesota, United States",https://i.ebayimg.com/thumbs/images/g/LbcAAOSwRPdgCmPU/s-l225.jpg,member065874,https://www.ebay.com/usr/member065874?_trksid=p2047675.l2559,Instant,0,0,4,"Mar 25, 2021 00:55:49 PDT"
item4b9dc2f6ed,CollectA African Leopard Big Cat Collectible Toy Animal Figure 88866,https://www.ebay.com/itm/324769347309?hash=item4b9dc2f6ed:g:KQUAAOSwaMxhKmu4,$11.99,"Webster, Massachusetts, United States",https://i.ebayimg.com/thumbs/images/g/KQUAAOSwaMxhKmu4/s-l225.jpg,mhlj,https://www.ebay.com/usr/mhlj?_trksid=p2047675.l2559,Instant,0,0,1,Unknown
item5b62a9c565,AFRICAN LEOPARD BY PARIS CORNER 120 ML,https://www.ebay.com/itm/392497317221?hash=item5b62a9c565:g:isMAAOSwfiddsVga,$69.90,"INDIA, India",https://i.ebayimg.com/thumbs/images/g/isMAAOSwfiddsVga/s-l225.jpg,premium_parfumes,https://www.ebay.com/usr/premium_parfumes?_trksid=p2047675.l2559,Instant,0,0,2,"Aug 18, 2021 22:26:43 PDT"
item1f1166b47f,Anuschka Anna African Leopard Twin Zip Top Tote W/Wallet NWT,https://www.ebay.com/itm/133435929727?hash=item1f1166b47f:g:dSsAAOSw08Fe4k6i,$289.00,"Blanchard, Oklahoma, United States",https://i.ebayimg.com/thumbs/images/g/dSsAAOSw08Fe4k6i/s-l225.jpg,sgri4991,https://www.ebay.com/usr/sgri4991?_trksid=p2047675.l2559,Instant,0,0,1,"Feb 11, 2021 07:39:26 PST"
item3dc449fd3a,Anuschka Anna NWT🐆Twin Zip Top Double Handle Satchel-African Leopard 8397-ALP,https://www.ebay.com/itm/265286188346?epid=16047138629&hash=item3dc449fd3a:g:1E4AAOSwEfdgsacY,$189.99,"Mayer, Arizona, United States",https://i.ebayimg.com/thumbs/images/g/1E4AAOSwEfdgsacY/s-l225.jpg,sunsluvpam,https://www.ebay.com/usr/sunsluvpam?_trksid=p2047675.l2559,Instant,0,0,1,Unknown
item1d0f4099fd,"1oz..999 SILVER ""AFRICAN LEOPARD""4th N SERIES,COLORIZED BRILLIANT,FREE EASEL/CAP",https://www.ebay.com/itm/124809943549?hash=item1d0f4099fd:g:3JUAAOSwVulggEms,$54.99,"Stroudsburg, Pennsylvania, United States",https://i.ebayimg.com/thumbs/images/g/3JUAAOSwVulggEms/s-l225.jpg,catrack49,https://www.ebay.com/usr/catrack49?_trksid=p2047675.l2559,Instant,0,0,2,"Aug 25, 2021 07:17:51 PDT"
item3dc3a5ebc2,Anuschka Hand-Painted Leather Crossbody Organizer-African Leopard-NWT-$199.00,https://www.ebay.com/itm/265275435970?hash=item3dc3a5ebc2:g:sWwAAOSw8cphBCL9,$149.95,"Largo, Florida, United States",https://i.ebayimg.com/thumbs/images/g/sWwAAOSw8cphBCL9/s-l225.jpg,rsch2277,https://www.ebay.com/usr/rsch2277?_trksid=p2047675.l2559,Instant,0,0,2,"Aug 21, 2021 09:28:25 PDT"
item56ff9ec956,Anuschka AFRICAN LEOPARD Hand Painted Passport Organizer Wallet NWT Box & Cards,https://www.ebay.com/itm/373655783766?hash=item56ff9ec956:g:KCoAAOSw4UVg93l8,$62.95,"Saint Petersburg, Florida, United States",https://i.ebayimg.com/thumbs/images/g/KCoAAOSw4UVg93l8/s-l225.jpg,1-bid-away,https://www.ebay.com/usr/1-bid-away?_trksid=p2047675.l2559,Instant,0,0,1,"Aug 24, 2021 08:50:26 PDT"
item3650d3d19c,"Handcarved African Leopard from Zimbabwe, heavy",https://www.ebay.com/itm/233284293020?hash=item3650d3d19c:g:y2cAAOSwFpddJmJy,$8.95,"Maple Valley, Washington, United States",https://i.ebayimg.com/thumbs/images/g/y2cAAOSwFpddJmJy/s-l225.jpg,cheetahsa-nc,https://www.ebay.com/usr/cheetahsa-nc?_trksid=p2047675.l2559,Instant,0,0,1,"Feb 02, 2021 11:27:31 PST"
item3db00b90e4,ANUSCHKA AFRICAN LEOPARD HAND PAINTED LEATHER SHOULDER TOTE PURSE - NWT,https://www.ebay.com/itm/264946553060?hash=item3db00b90e4:g:9NEAAOSwWK1g1rVA,$239.70,"Tampa, Florida, United States",https://i.ebayimg.com/thumbs/images/g/9NEAAOSwWK1g1rVA/s-l225.jpg,boutiquesparkle,https://www.ebay.com/usr/boutiquesparkle?_trksid=p2047675.l2559,Instant,0,0,2,"Jun 25, 2021 22:04:09 PDT"
item3b6257a3f5,"Ledebouria Socialis African Leopard Lily Silver Squill Plant Pictured, 4” Pot",https://www.ebay.com/itm/255052981237?hash=item3b6257a3f5:g:cPwAAOSwkC9g7gYv,$22.00,"Jensen Beach, Florida, United States",https://i.ebayimg.com/thumbs/images/g/cPwAAOSwkC9g7gYv/s-l225.jpg,aweberrysplants,https://www.ebay.com/usr/aweberrysplants?_trksid=p2047675.l2559,Instant,0,0,1,Unknown
item265002e4e5,2020 Republic of Ghana African Leopard 1oz Silver Coin 10K MINTED In Capsule,https://www.ebay.com/itm/164551124197?hash=item265002e4e5:g:5KEAAOSw0UJfxpN4,$46.00,"Summerfield, North Carolina, United States",https://i.ebayimg.com/thumbs/images/g/5KEAAOSw0UJfxpN4/s-l225.jpg,moderngradedcoin,https://www.ebay.com/usr/moderngradedcoin?_trksid=p2047675.l2559,Instant,0,0,1,"Aug 26, 2021 06:29:30 PDT"
item3dc3c1f020,2018 5 Cedis Republic of Ghana African Leopard 1oz Fine Silver Coin w/ Capsule,https://www.ebay.com/itm/265277272096?hash=item3dc3c1f020:g:gBsAAOSwoIhgHNHP,$68.00,"Seattle, Washington, United States",https://i.ebayimg.com/thumbs/images/g/gBsAAOSwoIhgHNHP/s-l225.jpg,wheelervintage428,https://www.ebay.com/usr/wheelervintage428?_trksid=p2047675.l2559,Instant,0,0,1,Unknown
item5256db8639,2017 GHANA 5 CEDIS AFRICAN LEOPARD NGC MS70 HIGH GRADE STUNNING LUSTER SILVER,https://www.ebay.com/itm/353644545593?hash=item5256db8639:g:iH0AAOSwFOtg716v,$165.00,"Littleton, Colorado, United States",https://i.ebayimg.com/thumbs/images/g/iH0AAOSwFOtg716v/s-l225.jpg,a-world-of-coins,https://www.ebay.com/usr/a-world-of-coins?_trksid=p2047675.l2559,Instant,0,0,1,Unknown
item34274cb60c,2019 Republic of Ghana African Leopard 1 oz Silver Coin 5 CEDIS,https://www.ebay.com/itm/223997638156?hash=item34274cb60c:g:7LwAAOSw6LFg4olY,$50.00,"Manassas, Virginia, United States",https://i.ebayimg.com/thumbs/images/g/7LwAAOSw6LFg4olY/s-l225.jpg,lookin4art,https://www.ebay.com/usr/lookin4art?_trksid=p2047675.l2559,Instant,0,0,More than 10,"Jul 04, 2021 21:27:22 PDT"
item4b8ae2cd1f,2018 5 Cedis Republic of Ghana African Leopard 1oz Fine Silver Coin w/ Capsule,https://www.ebay.com/itm/324452666655?hash=item4b8ae2cd1f:g:9SoAAOSwYTtgAIgt,$71.05,"Richmond, Virginia, United States",https://i.ebayimg.com/thumbs/images/g/9SoAAOSwYTtgAIgt/s-l225.jpg,familycoin2011,https://www.ebay.com/str/familycoin2011?_trksid=p2047675.l2563,Instant,0,0,2,"Aug 16, 2021 10:21:40 PDT"
item2f636ada1d,2017 GHANA 100 CEDIS SILVER AFRICAN LEOPARD - STRIP OF 5 - UNCERTIFIED,https://www.ebay.com/itm/203531409949?hash=item2f636ada1d:g:KbAAAOSwDFJg93ZY,$475.88,"New Waverly, Texas, United States",https://i.ebayimg.com/thumbs/images/g/KbAAAOSwDFJg93ZY/s-l225.jpg,namvette68,https://www.ebay.com/usr/namvette68?_trksid=p2047675.l2559,Instant,0,0,1,"Jul 22, 2021 11:11:46 PDT"
item218f13e9cb,THE SILVER KRUGER AFRICAN LEOPARD 1OZ SILVER ANTIQUE PROOF COIN W COA,https://www.ebay.com/itm/144134367691?hash=item218f13e9cb:g:g6AAAOSwQZFhBeOO,$150.00,"High Springs, Florida, United States",https://i.ebayimg.com/thumbs/images/g/g6AAAOSwQZFhBeOO/s-l225.jpg,thieryla,https://www.ebay.com/usr/thieryla?_trksid=p2047675.l2559,Instant,0,0,1,Unknown
item266cc30dda,2018 5 Cedis Republic of Ghana African Leopard 1oz Fine Silver Coin w/ Capsule,https://www.ebay.com/itm/165033479642?hash=item266cc30dda:g:ZlMAAOSw~s5gwRNp,$65.99,"Lake in the Hills, Illinois, United States",https://i.ebayimg.com/thumbs/images/g/ZlMAAOSw~s5gwRNp/s-l225.jpg,lewbll_h5dsd8l8x,https://www.ebay.com/usr/lewbll_h5dsd8l8x?_trksid=p2047675.l2559,Instant,0,0,1,Unknown
item266634cdc0,"2019 Silver 1oz Republic of Ghana African Leopard Mintage 25,000 Capsule",https://www.ebay.com/itm/164923493824?hash=item266634cdc0:g:J6EAAOSwtXJg0LPB,$46.00,"Summerfield, North Carolina, United States",https://i.ebayimg.com/thumbs/images/g/J6EAAOSwtXJg0LPB/s-l225.jpg,moderngradedcoin,https://www.ebay.com/usr/moderngradedcoin?_trksid=p2047675.l2559,Instant,0,0,2,"Aug 25, 2021 09:02:07 PDT"
item42212c0baa,"New Digital African Leopard Fabric Panel 23.5""W x 45""L Kaufman Quilting Sewing",https://www.ebay.com/itm/284024376234?hash=item42212c0baa:g:Bp0AAOSwzoJfbnbd,$10.44,"Stryker, Ohio, United States",https://i.ebayimg.com/thumbs/images/g/Bp0AAOSwzoJfbnbd/s-l225.jpg,nowandthenfabrics,https://www.ebay.com/usr/nowandthenfabrics?_trksid=p2047675.l2559,Instant,0,0,More than 10,"Mar 25, 2021 16:10:26 PDT"
item1f1abfde5a,😃2020 Republic of Ghana African Leopard 1 Oz 999 Silver Coin 10K MINTED!,https://www.ebay.com/itm/133592768090?hash=item1f1abfde5a:g:wNYAAOSwpxNfxUle,$79.99,"Saint Petersburg, Florida, United States",https://i.ebayimg.com/thumbs/images/g/wNYAAOSwpxNfxUle/s-l225.jpg,mikezcardz,https://www.ebay.com/usr/mikezcardz?_trksid=p2047675.l2559,Instant,0,0,1,"May 06, 2021 14:14:53 PDT"
item3d87c4c562,"African Leopard Mask Bozo Bamana 8"" H",https://www.ebay.com/itm/264270824802?hash=item3d87c4c562:g:LsoAAOSwjr5cp5M5,$135.00,"Hartsdale, New York, United States",https://i.ebayimg.com/thumbs/images/g/LsoAAOSwjr5cp5M5/s-l225.jpg,dannyc20,https://www.ebay.com/usr/dannyc20?_trksid=p2047675.l2559,Instant,0,0,1,"May 06, 2019 08:36:52 PDT"
item266d5d5b9f,2018 Republic of Ghana 1 oz .999 Silver African Leopard Scottsdale Mint. SEALED,https://www.ebay.com/itm/165043592095?hash=item266d5d5b9f:g:YtwAAOSwIJNeSJIK,$369.99,"San Luis Obispo, California, United States",https://i.ebayimg.com/thumbs/images/g/YtwAAOSwIJNeSJIK/s-l225.jpg,rockpapaman,https://www.ebay.com/usr/rockpapaman?_trksid=p2047675.l2559,Instant,0,0,1,Unknown
item46bfb9cb95,Hand Carved African Leopard Approximately 5” Long,https://www.ebay.com/itm/303864335253?hash=item46bfb9cb95:g:wvkAAOSwPPZgE0to,$20.00,"Manassas, Virginia, United States",https://i.ebayimg.com/thumbs/images/g/wvkAAOSwPPZgE0to/s-l225.jpg,brad_1102,https://www.ebay.com/usr/brad_1102?_trksid=p2047675.l2559,Instant,0,0,1,Unknown
item423918cb32,"Handcarved Wood African Leopard From Kenya, 8.5"" X 4""",https://www.ebay.com/itm/284425767730?hash=item423918cb32:g:7VMAAOSwxpJg8F68,$9.95,"California City, California, United States",https://i.ebayimg.com/thumbs/images/g/7VMAAOSwxpJg8F68/s-l225.jpg,626daphne,https://www.ebay.com/usr/626daphne?_trksid=p2047675.l2559,Instant,0,0,1,Unknown
item423472fb09,"2019 Silver 1oz Republic of Ghana African Leopard Mintage 25,000 NGC MS69 LOC3",https://www.ebay.com/itm/284347792137?hash=item423472fb09:g:zsMAAOSwM6hg1tOD,$119.99,"Pembroke Pines, Florida, United States",https://i.ebayimg.com/thumbs/images/g/zsMAAOSwM6hg1tOD/s-l225.jpg,valentesales,https://www.ebay.com/usr/valentesales?_trksid=p2047675.l2559,Instant,0,0,1,"Jun 26, 2021 00:19:27 PDT"
item52316184f6,2017 GHANA 5 CEDIS AFRICAN LEOPARD 1oz 0.999 Silver PROOF,https://www.ebay.com/itm/353015792886?hash=item52316184f6:g:cSsAAOSwDX9edlGz,$60.00,"Cranston, Rhode Island, United States",https://i.ebayimg.com/thumbs/images/g/cSsAAOSwDX9edlGz/s-l225.jpg,unicomri,https://www.ebay.com/usr/unicomri?_trksid=p2047675.l2559,Instant,0,0,1,"Nov 14, 2020 05:38:38 PST"
item423355f8a6,2021 Somali Republic 1 oz Silver 100 Shilling African Leopard FAST FREE SHIPPING,https://www.ebay.com/itm/284329113766?hash=item423355f8a6:g:kcYAAOSwjNBgw1hT,$57.63,"Hove, United Kingdom",https://i.ebayimg.com/thumbs/images/g/kcYAAOSwjNBgw1hT/s-l225.jpg,winning.lines,https://www.ebay.com/usr/winning.lines?_trksid=p2047675.l2559,Instant,0,0,2,Unknown
item1cec662a8d,2017 Scottsdale Mint Ghana 5 Cedis African Leopard 1 oz .999 Silver Coin,https://www.ebay.com/itm/124225202829?hash=item1cec662a8d:g:~EgAAOSw6Uxe6Njb,$58.36,"Malaysia, Malaysia",https://i.ebayimg.com/thumbs/images/g/~EgAAOSw6Uxe6Njb/s-l225.jpg,silber-emergency,https://www.ebay.com/usr/silber-emergency?_trksid=p2047675.l2559,Instant,0,0,2,"Jul 18, 2021 21:09:47 PDT"
item422f3d4c41,2017 1 oz .999 Silver Republic of Ghana African Leopard Proof like Coin,https://www.ebay.com/itm/284260387905?hash=item422f3d4c41:g:1z0AAOSwq4tfjhsC,$51.47,"Edmonton, AB, Canada",https://i.ebayimg.com/thumbs/images/g/1z0AAOSwq4tfjhsC/s-l225.jpg,pure-silver-spot,https://www.ebay.com/usr/pure-silver-spot?_trksid=p2047675.l2559,Instant,0,0,1,"Jun 04, 2021 11:59:25 PDT"
item5490850d7a,Ghana - 5 ACQUTSTTIONOF 2020-African Leopard-Premium Plant Coin - 1 OZ Silver ST,https://www.ebay.com/itm/363201891706?hash=item5490850d7a:g:B9kAAOSwiI9fxPO~,$53.04,"Erftstadt, Germany",https://i.ebayimg.com/thumbs/images/g/B9kAAOSwiI9fxPO~/s-l225.jpg,www_emk_com,https://www.ebay.com/usr/www_emk_com?_trksid=p2047675.l2559,Instant,0,0,6,"May 18, 2021 08:04:21 PDT"
item26668e8083,2019 Republic of Ghana 5 Cedi 1 oz Silver African Leopard Bullion coin,https://www.ebay.com/itm/164929372291?hash=item26668e8083:g:4egAAOSwmxxg1UXx,$46.95,"Kelowna, British Columbia, Canada",https://i.ebayimg.com/thumbs/images/g/4egAAOSwmxxg1UXx/s-l225.jpg,ok_bullions,https://www.ebay.com/usr/ok_bullions?_trksid=p2047675.l2559,Instant,0,0,5,"Aug 04, 2021 17:57:02 PDT"
item3fdc777d32,African Leopard Cheetah Tiger Snake Animal Skin Print 4 Way Spandex Fabric,https://www.ebay.com/itm/274281758002?var=574375633558&hash=item3fdc777d32:g:OJYAAOSwFR5eUC5O,$16.48,"Leicester, United Kingdom",https://i.ebayimg.com/thumbs/images/g/OJYAAOSwFR5eUC5O/s-l225.jpg,24*7onlineshop,https://www.ebay.com/usr/24*7onlineshop?_trksid=p2047675.l2559,Instant,0,0,More than 10,"May 26, 2021 11:52:08 PDT"
item2665cd6a0e,2017 Republic of Ghana 5 Cedi 1 oz Silver African Leopard Bullion coin,https://www.ebay.com/itm/164916718094?hash=item2665cd6a0e:g:oGYAAOSwcNhgytv7,$44.95,"Kelowna, British Columbia, Canada",https://i.ebayimg.com/thumbs/images/g/oGYAAOSwcNhgytv7/s-l225.jpg,ok_bullions,https://www.ebay.com/usr/ok_bullions?_trksid=p2047675.l2559,Instant,0,0,7,"Aug 04, 2021 17:57:04 PDT"
item3449331d2c,Bronze African Leopard head BENIN Nigeria. Old. Beautiful patina and condition.,https://www.ebay.com/itm/224566385964?hash=item3449331d2c:g:fAgAAOSwHCdhEZDc,$725.00,"Far Rockaway, New York, United States",https://i.ebayimg.com/thumbs/images/g/fAgAAOSwHCdhEZDc/s-l225.jpg,allamerican-0,https://www.ebay.com/usr/allamerican-0?_trksid=p2047675.l2559,Instant,0,0,1,Unknown
item49045cbfb8,The African leopard-gold black empire 1 oz silver coin 5 cedis ghana 2020,https://www.ebay.com/itm/313605799864?hash=item49045cbfb8:g:58oAAOSw7kBg8bPn,$106.02,"STRASBOURG, France",https://i.ebayimg.com/thumbs/images/g/58oAAOSw7kBg8bPn/s-l225.jpg,www_coinsandmore_fr,https://www.ebay.com/usr/www_coinsandmore_fr?_trksid=p2047675.l2559,Instant,0,0,3,"Jul 23, 2021 23:01:55 PDT"
item3db745128a,ANUSCHKA AFRICAN LEOPARD TAN HAND PAINTED LEATHER CROSSBODY ORGANIZER - NWT,https://www.ebay.com/itm/265067762314?hash=item3db745128a:g:KkcAAOSwReZgkxy9,$125.00,"Tampa, Florida, United States",https://i.ebayimg.com/thumbs/images/g/KkcAAOSwReZgkxy9/s-l225.jpg,boutiquesparkle,https://www.ebay.com/usr/boutiquesparkle?_trksid=p2047675.l2559,Instant,0,0,2,"Aug 25, 2021 14:40:02 PDT"
item3dc49c6422,ANUSCHKA NWT🐆Double Handle Satchel+Pouches/Strap African Leopard 7461-ALP,https://www.ebay.com/itm/265291588642?hash=item3dc49c6422:g:pDgAAOSwc3RgbQco,$219.99,"Mayer, Arizona, United States",https://i.ebayimg.com/thumbs/images/g/pDgAAOSwc3RgbQco/s-l225.jpg,sunsluvpam,https://www.ebay.com/usr/sunsluvpam?_trksid=p2047675.l2559,Instant,0,0,1,Unknown
item34433a59dd,1 Troy Oz .999 Silver 2017 Ghana AFRICAN LEOPARD QUEEN ELIZABETH Token Coin,https://www.ebay.com/itm/224466196957?hash=item34433a59dd:g:kfcAAOSwGpFgo9Zd,$45.00,"Princeton, Wisconsin, United States",https://i.ebayimg.com/thumbs/images/g/kfcAAOSwGpFgo9Zd/s-l225.jpg,mnmantiques,https://www.ebay.com/usr/mnmantiques?_trksid=p2047675.l2559,Instant,0,0,1,Unknown
item3fed9ec28c,African Leopard Moon Print 12 yards,https://www.ebay.com/itm/274569544332?hash=item3fed9ec28c:g:KrsAAOSww0tfqrRr,$73.99,"Euless, Texas, United States",https://i.ebayimg.com/thumbs/images/g/KrsAAOSww0tfqrRr/s-l225.jpg,usafricanstore2015,https://www.ebay.com/usr/usafricanstore2015?_trksid=p2047675.l2559,Instant,0,0,1,"Jul 21, 2021 00:25:10 PDT"
item23fdd803cd,2020 South African LEOPARD  THE BIG 5 Silver 5 Rand Coin,https://www.ebay.com/itm/154582647757?epid=17035629071&hash=item23fdd803cd:g:YDUAAOSwOKVhJU6K,$120.00,"Haverhill, Massachusetts, United States",https://i.ebayimg.com/thumbs/images/g/YDUAAOSwOKVhJU6K/s-l225.jpg,mrlano,https://www.ebay.com/usr/mrlano?_trksid=p2047675.l2559,Instant,0,0,1,"Aug 24, 2021 13:05:07 PDT"
item3b6257a20c,"Ledebouria Socialis African Leopard Lily Silver Squill Plant Pictured, 4” Pot",https://www.ebay.com/itm/255052980748?hash=item3b6257a20c:g:fOoAAOSwg39g7gXx,$25.00,"Jensen Beach, Florida, United States",https://i.ebayimg.com/thumbs/images/g/fOoAAOSwg39g7gXx/s-l225.jpg,aweberrysplants,https://www.ebay.com/usr/aweberrysplants?_trksid=p2047675.l2559,Instant,0,0,1,Unknown
item56f2d088a2,African Leopard Long Hair Fur,https://www.ebay.com/itm/373440940194?hash=item56f2d088a2:g:NW8AAOSwUQZgEKSF,$23.50,"Los Angeles, California, United States",https://i.ebayimg.com/thumbs/images/g/NW8AAOSwUQZgEKSF/s-l225.jpg,elotexfabric,https://www.ebay.com/usr/elotexfabric?_trksid=p2047675.l2559,Instant,0,0,More than 10,"Jul 23, 2021 09:45:57 PDT"
item56c50a20b9,African leopard Oil painting Wall art HD Giclee Printed on canvas L2555,https://www.ebay.com/itm/372672962745?var=641463147595&hash=item56c50a20b9:g:Uy0AAOSwDI5c4MYt,$12.99 to $30.99,"Fu Jian, China",https://i.ebayimg.com/thumbs/images/g/Uy0AAOSwDI5c4MYt/s-l225.jpg,baobei-store,https://www.ebay.com/usr/baobei-store?_trksid=p2047675.l2559,Instant,0,0,3,"Jul 17, 2021 21:51:51 PDT"
