id,title,link,price,origin,image,seller_name,seller_link,sell_type,num_bids,num_watchers,num_stock,date
item23f57a4557,"Leucaena leucocephala Seeds, กระถิน (15seeds)",https://www.ebay.com/itm/154442286423?hash=item23f57a4557:g:nIcAAOSwWwNgk9Iu,$9.00,"Pembroke, Massachusetts, United States",https://i.ebayimg.com/thumbs/images/g/nIcAAOSwWwNgk9Iu/s-l225.jpg,2pegarden,https://www.ebay.com/usr/2pegarden?_trksid=p2047675.l2559,Instant,0,0,More than 10,Unknown
item28886ff5cd,"Miracle Lead tree seeds. Leucaena leucocephala Seeds. Tamarind, Subabul, popinac",https://www.ebay.com/itm/174087730637?hash=item28886ff5cd:g:UcwAAOSwT6ldwpWN,$3.85,"Jacksonville, Florida, United States",https://i.ebayimg.com/thumbs/images/g/UcwAAOSwT6ldwpWN/s-l225.jpg,7thwonderholisticsllc,https://www.ebay.com/usr/7thwonderholisticsllc?_trksid=p2047675.l2559,Instant,0,0,More than 10,"Apr 02, 2021 16:47:12 PDT"
item35ebede612,"Leucaena Leucocephala, Miracle Lead Tree, Koa Haole 20/150 Seeds, Fixes Nitrogen",https://www.ebay.com/itm/231591503378?hash=item35ebede612:g:OywAAOSwgApW~Aga,$2.50 to $8.12,"Venice, Florida, United States",https://i.ebayimg.com/thumbs/images/g/OywAAOSwgApW~Aga/s-l225.jpg,theplantattraction,https://www.ebay.com/usr/theplantattraction?_trksid=p2047675.l2559,Instant,0,0,More than 10,"Mar 27, 2021 17:23:14 PDT"
item58be2290ed,Leucaena leucocephala LEAD TREE Seeds!,https://www.ebay.com/itm/381147058413?hash=item58be2290ed:g:TowAAOSw8d9U0tPX,$4.99,"Walterboro, South Carolina, United States",https://i.ebayimg.com/thumbs/images/g/TowAAOSw8d9U0tPX/s-l225.jpg,greg17086,https://www.ebay.com/usr/greg17086?_trksid=p2047675.l2559,Instant,0,0,More than 10,"Nov 05, 2020 15:12:24 PST"
item1a4c1b0b39,15 Seed Lead Tree Leucaena leucocephala latisiluqua Wild Tamarind Popinac Mimosa,https://www.ebay.com/itm/112945990457?hash=item1a4c1b0b39:g:oGUAAOSwLkJa1kLR,$25.00,"Chino Valley, Arizona, United States",https://i.ebayimg.com/thumbs/images/g/oGUAAOSwLkJa1kLR/s-l225.jpg,cactus.sam,https://www.ebay.com/usr/cactus.sam?_trksid=p2047675.l2559,Instant,0,0,1,"May 21, 2021 08:22:31 PDT"
