id,title,link,price,origin,image,seller_name,seller_link,sell_type,num_bids,num_watchers,num_stock,date
item52500cbff3,Charles Frace African Leopard Head Matted Mini Art Print,https://www.ebay.com/itm/353530331123?hash=item52500cbff3:g:5dYAAOSwAgNgwpNi,$19.95,"Dexter, Missouri, United States",https://i.ebayimg.com/thumbs/images/g/5dYAAOSwAgNgwpNi/s-l225.jpg,chrismanart,https://www.ebay.com/usr/chrismanart?_trksid=p2047675.l2559,Instant,0,0,1,Unknown
item54a3ba95d4,Queen Lace Crystal Kenyan African Leopard Wine Glass 6 3/8”,https://www.ebay.com/itm/363524167124?hash=item54a3ba95d4:g:KIMAAOSwb1RhLDnH,$79.98,"Highland Lakes, New Jersey, United States",https://i.ebayimg.com/thumbs/images/g/KIMAAOSwb1RhLDnH/s-l225.jpg,clearance-rack,https://www.ebay.com/usr/clearance-rack?_trksid=p2047675.l2559,Instant,0,0,1,Unknown
item3db798729f,ANUSCHKA AFRICAN LEOPARD HAND-PAINTED LEATHER EYE GLASS CASE - NWT,https://www.ebay.com/itm/265073226399?hash=item3db798729f:g:hbIAAOSw3DtgkOnd,$60.00,"Tampa, Florida, United States",https://i.ebayimg.com/thumbs/images/g/hbIAAOSw3DtgkOnd/s-l225.jpg,boutiquesparkle,https://www.ebay.com/usr/boutiquesparkle?_trksid=p2047675.l2559,Instant,0,0,1,"Aug 18, 2021 14:03:34 PDT"
item3dba81cbd5,ANUSCHKA AFRICAN LEOPARD TAN HAND-PAINTED SLIM CROSSBODY PHONE ORGANIZER - NWT,https://www.ebay.com/itm/265122073557?hash=item3dba81cbd5:g:nqIAAOSwP6JgkOR9,$95.00,"Tampa, Florida, United States",https://i.ebayimg.com/thumbs/images/g/nqIAAOSwP6JgkOR9/s-l225.jpg,boutiquesparkle,https://www.ebay.com/usr/boutiquesparkle?_trksid=p2047675.l2559,Instant,0,0,1,"Aug 16, 2021 15:27:37 PDT"
item3b62579d85,"Ledebouria Socialis African Leopard Lily Silver Squill Plant Pictured, 4” Pot",https://www.ebay.com/itm/255052979589?hash=item3b62579d85:g:qAMAAOSw3f1g7gTU,$22.00,"Jensen Beach, Florida, United States",https://i.ebayimg.com/thumbs/images/g/qAMAAOSw3f1g7gTU/s-l225.jpg,aweberrysplants,https://www.ebay.com/usr/aweberrysplants?_trksid=p2047675.l2559,Instant,0,0,1,Unknown
item34331b76d5," African Leopard Tortoise, Concrete Garden Decor by American Artist R. Warsin",https://www.ebay.com/itm/224195737301?hash=item34331b76d5:g:kzYAAOSwwX9fB6~W,$59.99,"Rockingham, North Carolina, United States",https://i.ebayimg.com/thumbs/images/g/kzYAAOSwwX9fB6~W/s-l225.jpg,warsinstudio,https://www.ebay.com/usr/warsinstudio?_trksid=p2047675.l2559,Instant,0,0,2,"Jul 12, 2021 12:48:44 PDT"
item1d0c874a85,LIMOGES FRANCE BOX - AFRICAN LEOPARD IN THE JUNGLE - WILD CAT - GRASS & ROCKS,https://www.ebay.com/itm/124764244613?hash=item1d0c874a85:g:0wsAAOSwx2dYIjcc,$124.99,"Las Vegas, Nevada, United States",https://i.ebayimg.com/thumbs/images/g/0wsAAOSwx2dYIjcc/s-l225.jpg,vegasbarbie,https://www.ebay.com/usr/vegasbarbie?_trksid=p2047675.l2559,Instant,0,0,1,"Aug 29, 2021 14:29:43 PDT"
item4dcaefa056,2019 Republic of Ghana African Leopard 1 oz Silver Coin 5 CEDIS,https://www.ebay.com/itm/334117183574?hash=item4dcaefa056:g:wLsAAOSwDEdhHE2g,$47.00,"Gunnison, Colorado, United States",https://i.ebayimg.com/thumbs/images/g/wLsAAOSwDEdhHE2g/s-l225.jpg,perdim.9149,https://www.ebay.com/usr/perdim.9149?_trksid=p2047675.l2559,Instant,0,0,1,Unknown
item3db8032bf9,ANUSCHKA AFRICAN LEOPARD HAND PAINTED LEATHER CROSSBODY ORGANIZER/UMBRELLA - NWT,https://www.ebay.com/itm/265080220665?hash=item3db8032bf9:g:2E8AAOSwAXFg639V,$220.90,"Tampa, Florida, United States",https://i.ebayimg.com/thumbs/images/g/2E8AAOSwAXFg639V/s-l225.jpg,boutiquesparkle,https://www.ebay.com/usr/boutiquesparkle?_trksid=p2047675.l2559,Instant,0,0,1,"Jul 11, 2021 16:31:50 PDT"
item4238ca1999,2020 1 Oz Silver 5 Cedis Ghana AFRICAN LEOPARD BU Coin.,https://www.ebay.com/itm/284420610457?hash=item4238ca1999:g:TecAAOSwKiZgqGt7,$59.95,"Pleasantville, New Jersey, United States",https://i.ebayimg.com/thumbs/images/g/TecAAOSwKiZgqGt7/s-l225.jpg,coinmaster83,https://www.ebay.com/usr/coinmaster83?_trksid=p2047675.l2559,Instant,0,0,2,Unknown
item3449d38ea9,2019 republic of Ghana 5 cedi 1 oz silver African leopard bullion coin,https://www.ebay.com/itm/224576900777?hash=item3449d38ea9:g:vAUAAOSwoDFhHMn8,$50.56,"Sewen, France",https://i.ebayimg.com/thumbs/images/g/vAUAAOSwoDFhHMn8/s-l225.jpg,silver-collectors68,https://www.ebay.com/usr/silver-collectors68?_trksid=p2047675.l2559,Instant,0,0,2,"Aug 24, 2021 01:35:10 PDT"
item2600d2a8e0,African Leopard by Charles Frace  Print 12x9,https://www.ebay.com/itm/163222563040?hash=item2600d2a8e0:g:kj4AAOSwz8Nbgx-G,$12.50,"Fair Oaks, California, United States",https://i.ebayimg.com/thumbs/images/g/kj4AAOSwz8Nbgx-G/s-l225.jpg,skebus,https://www.ebay.com/usr/skebus?_trksid=p2047675.l2559,Instant,0,0,5,"Jul 04, 2020 09:09:44 PDT"
item2ad1d3a771,African Leopard African Wildlife Toy Model Figure by CollectA 88866 Brand New,https://www.ebay.com/itm/183908935537?epid=5033697018&hash=item2ad1d3a771:g:I8YAAOSwfmddRe6u,$15.81,"BALSALL COMMON, United Kingdom",https://i.ebayimg.com/thumbs/images/g/I8YAAOSwfmddRe6u/s-l225.jpg,redworldtoysandmodels,https://www.ebay.com/usr/redworldtoysandmodels?_trksid=p2047675.l2559,Instant,0,0,2,"Aug 18, 2021 04:53:27 PDT"
item5472133ff3,"African Leopard Men ~ Lindskog ~ 1954 Hardcover, Ex-library",https://www.ebay.com/itm/362691117043?hash=item5472133ff3:g:~GsAAOSwazpdGiVt,$27.14,"Shepherdsville, Kentucky, United States",https://i.ebayimg.com/thumbs/images/g/~GsAAOSwazpdGiVt/s-l225.jpg,lhammbookfactor,https://www.ebay.com/usr/lhammbookfactor?_trksid=p2047675.l2559,Instant,0,0,1,"Sep 30, 2020 13:49:18 PDT"
item23fe3ea431,LARGE AFRICAN LEOPARD TORTOISE SHELL - (GEOCHELONE PARDALIS) TAXIDERMY -PERFECT,https://www.ebay.com/itm/154589373489?hash=item23fe3ea431:g:EOkAAOSwSRBdlRai,$475.00,"West Sacramento, California, United States",https://i.ebayimg.com/thumbs/images/g/EOkAAOSwSRBdlRai/s-l225.jpg,12littleone,https://www.ebay.com/usr/12littleone?_trksid=p2047675.l2559,Instant,0,0,1,Unknown
item3dc460f2a1,Anuschka Anna NWT🐆Tri-Fold Clutch/Wallet-African Leopard 1860-ALP,https://www.ebay.com/itm/265287692961?hash=item3dc460f2a1:g:wGQAAOSwrmdg9GOP,$113.98,"Mayer, Arizona, United States",https://i.ebayimg.com/thumbs/images/g/wGQAAOSwrmdg9GOP/s-l225.jpg,sunsluvpam,https://www.ebay.com/usr/sunsluvpam?_trksid=p2047675.l2559,Instant,0,0,1,Unknown
item367079443c,5 ACQUTSTTIONOF African Leopard African Leopard Ghana 1 OZ Silver 2020,https://www.ebay.com/itm/233815229500?hash=item367079443c:g:xyAAAOSwh-df0SNb,$45.91,"Mainz, Germany",https://i.ebayimg.com/thumbs/images/g/xyAAAOSwh-df0SNb/s-l225.jpg,muenzdachs,https://www.ebay.com/usr/muenzdachs?_trksid=p2047675.l2559,Instant,0,0,6,"Feb 05, 2021 13:37:19 PST"
item3b2cac7e80,African Leopard Panther Cheetah Figure Wild Animal Model Collector Toy Kids Gift,https://www.ebay.com/itm/254152572544?var=553501140479&hash=item3b2cac7e80:g:4ZEAAOSwPtBcf18l,$5.99 to $6.99,"Shanghai, China",https://i.ebayimg.com/thumbs/images/g/4ZEAAOSwPtBcf18l/s-l225.jpg,la-na-time-shop,https://www.ebay.com/usr/la-na-time-shop?_trksid=p2047675.l2559,Instant,0,0,More than 10,"Jul 31, 2021 15:47:54 PDT"
item5d6ef993a5,"LEOPARDS. African Leopard, antique print, 1860",https://www.ebay.com/itm/401293808549?hash=item5d6ef993a5:g:tMgAAOSwiHpaDu9o,$15.10,"London, United Kingdom",https://i.ebayimg.com/thumbs/images/g/tMgAAOSwiHpaDu9o/s-l225.jpg,richben1066,https://www.ebay.com/usr/richben1066?_trksid=p2047675.l2559,Instant,0,0,Last one,"Jun 15, 2021 07:01:52 PDT"
item2af219ed64,Cix Models 54mm 1/35 African Leopard with Prey on Acacia Tree (2 Figs) CIXM54019,https://www.ebay.com/itm/184450411876?hash=item2af219ed64:g:uGgAAOSw3nJfYitd,$59.95,"Sterling, Virginia, United States",https://i.ebayimg.com/thumbs/images/g/uGgAAOSw3nJfYitd/s-l225.jpg,dragon-hobby,https://www.ebay.com/usr/dragon-hobby?_trksid=p2047675.l2559,Instant,0,0,2,"Mar 21, 2021 00:48:37 PDT"
item2d3d36bb7b,"Beautiful Oil Painting of South African Leopard by R.W. Krahtz, Fine! NOT FRAMED",https://www.ebay.com/itm/194300525435?hash=item2d3d36bb7b:g:kwUAAOSwl49hH87g,$850.00,"Orlando, Florida, United States",https://i.ebayimg.com/thumbs/images/g/kwUAAOSwl49hH87g/s-l225.jpg,henningfineart,https://www.ebay.com/usr/henningfineart?_trksid=p2047675.l2559,Instant,0,0,1,"Aug 20, 2021 09:02:08 PDT"
item56fea43562,Anuschka African Leopard Tan - Umbrella & Leather Crossbody Organizer NWT,https://www.ebay.com/itm/373639361890?hash=item56fea43562:g:IEMAAOSwQAJg41Dp,$189.90,"Holiday, Florida, United States",https://i.ebayimg.com/thumbs/images/g/IEMAAOSwQAJg41Dp/s-l225.jpg,blueriverroad2000,https://www.ebay.com/usr/blueriverroad2000?_trksid=p2047675.l2559,Instant,0,0,1,"Aug 07, 2021 07:52:48 PDT"
item3ff425bf41,Vtg Ethnic African LEOPARD  ZEBRA PAIR Taper Candles Hand Painted Boho Chic,https://www.ebay.com/itm/274679054145?hash=item3ff425bf41:g:G7sAAOSwdUdgJDAP,$24.00,"Port Saint Lucie, Florida, United States",https://i.ebayimg.com/thumbs/images/g/G7sAAOSwdUdgJDAP/s-l225.jpg,jwal5992,https://www.ebay.com/usr/jwal5992?_trksid=p2047675.l2559,Instant,0,0,1,"Feb 22, 2021 07:07:02 PST"
item2f2e413ef5,Vintage Brass Stampings /African Leopard/  XL / Small (pair)  /  Tiny (3 pairs),https://www.ebay.com/itm/202639490805?var=502716927479&hash=item2f2e413ef5:g:~fEAAOSw6QpbLvp7,$2.99 to $3.99,"Los Angeles, California, United States",https://i.ebayimg.com/thumbs/images/g/~fEAAOSw6QpbLvp7/s-l225.jpg,ommmax88,https://www.ebay.com/usr/ommmax88?_trksid=p2047675.l2559,Instant,0,0,More than 10,"Aug 02, 2021 14:26:40 PDT"
item3682f229a2,Charles Frace African Leopard Tree Branch Mini Art Print,https://www.ebay.com/itm/234125142434?hash=item3682f229a2:g:LREAAOSwnq5hDaiG,$11.95,"Dexter, Missouri, United States",https://i.ebayimg.com/thumbs/images/g/LREAAOSwnq5hDaiG/s-l225.jpg,chrismanart,https://www.ebay.com/usr/chrismanart?_trksid=p2047675.l2559,Instant,0,0,1,Unknown
item5dd7498503,African Leopard - JFK Kennedy Half Dollar,https://www.ebay.com/itm/403043878147?hash=item5dd7498503:g:vuoAAOSw1AdhCuCP,$7.99,"Erie, Pennsylvania, United States",https://i.ebayimg.com/thumbs/images/g/vuoAAOSw1AdhCuCP/s-l225.jpg,dempseyandbaxter,https://www.ebay.com/str/dempseyandbaxter?_trksid=p2047675.l2563,Instant,0,0,1,Unknown
item343a187a01,"POLAR BEARS & AFRICAN LEOPARD, Charles Frace, Set of Signed Prints",https://www.ebay.com/itm/224312982017?hash=item343a187a01:g:jkwAAOSwna5cP5SG,$99.00,"Longmont, Colorado, United States",https://i.ebayimg.com/thumbs/images/g/jkwAAOSwna5cP5SG/s-l225.jpg,stvrainhfh,https://www.ebay.com/usr/stvrainhfh?_trksid=p2047675.l2559,Instant,0,0,1,"May 20, 2021 15:25:47 PDT"
item1f1f1ef7d4,"Charles Frace Limited Edition Signed Print ""African Leopard"" (Head)",https://www.ebay.com/itm/133666109396?hash=item1f1f1ef7d4:g:ntoAAOSwA75fFHxZ,$59.95,"West Chester, Ohio, United States",https://i.ebayimg.com/thumbs/images/g/ntoAAOSwA75fFHxZ/s-l225.jpg,arlcollectibles,https://www.ebay.com/usr/arlcollectibles?_trksid=p2047675.l2559,Instant,0,0,1,Unknown
item56da7d631e,"CHETAH, AFRICAN LEOPARD, Vintage 1897 Chromolithograph Print, Antique, 008",https://www.ebay.com/itm/373032837918?hash=item56da7d631e:g:qqwAAOSwGmtepK6e,$14.99,"Chico, California, United States",https://i.ebayimg.com/thumbs/images/g/qqwAAOSwGmtepK6e/s-l225.jpg,labelman,https://www.ebay.com/usr/labelman?_trksid=p2047675.l2559,Instant,0,0,1,Unknown
item4b9d6a4163,Lone Hunter by Charles Frace Wildlife African Leopard Hand Signed LE 2379 / 2500,https://www.ebay.com/itm/324763533667?hash=item4b9d6a4163:g:NSIAAOSw4BFeUDMG,$39.95,"Dry Ridge, Kentucky, United States",https://i.ebayimg.com/thumbs/images/g/NSIAAOSw4BFeUDMG/s-l225.jpg,pianoworshipman,https://www.ebay.com/usr/pianoworshipman?_trksid=p2047675.l2559,Instant,0,0,1,Unknown
item2b075641c7,2019 Silver 1 oz Republic of Ghana African Leopard,https://www.ebay.com/itm/184806687175?hash=item2b075641c7:g:u7AAAOSwWrxgjesl,$50.00,"Gaithersburg, Maryland, United States",https://i.ebayimg.com/thumbs/images/g/u7AAAOSwWrxgjesl/s-l225.jpg,marylandmetal3,https://www.ebay.com/usr/marylandmetal3?_trksid=p2047675.l2559,Instant,0,0,1,Unknown
item4001ab8be8,Tribal African Leopard Cheetah Spicy 100% Cotton Sateen Sheet Set by Roostery,https://www.ebay.com/itm/274905926632?var=575176091814&hash=item4001ab8be8:g:h9kAAOSwDCNhGGbp,$184.00 to $254.00,"Durham, NC, United States",https://i.ebayimg.com/thumbs/images/g/h9kAAOSwDCNhGGbp/s-l225.jpg,spoonflowerhome,https://www.ebay.com/usr/spoonflowerhome?_trksid=p2047675.l2559,Instant,0,0,7,"Aug 20, 2021 09:26:22 PDT"
item2f649dcaf7,Charles Frace AFRICAN LEOPARD  CANVAS Art,https://www.ebay.com/itm/203551525623?hash=item2f649dcaf7:g:ERQAAOSwJbhgup4F,$19.99,"Schertz, Texas, United States",https://i.ebayimg.com/thumbs/images/g/ERQAAOSwJbhgup4F/s-l225.jpg,happyplace87,https://www.ebay.com/usr/happyplace87?_trksid=p2047675.l2559,Instant,0,0,1,Unknown
item570238d726,AFRICAN LEOPARD AND SHOW OF CAMELLIAS AT NURSERY NEWSPAPER ENGRAVING FROM 1860,https://www.ebay.com/itm/373699434278?hash=item570238d726:g:QJUAAOSwJHVg2msl,$10.00,"Trenton, New Jersey, United States",https://i.ebayimg.com/thumbs/images/g/QJUAAOSwJHVg2msl/s-l225.jpg,politicaltreasuresnowandthen1,https://www.ebay.com/usr/politicaltreasuresnowandthen1?_trksid=p2047675.l2559,Instant,0,0,1,Unknown
item3674f63f98,W.S.George “African Leopard” Plate by Charles Frace’ Most Magnificent Cats 1991,https://www.ebay.com/itm/233890529176?hash=item3674f63f98:g:7HAAAOSwJ9dgIzbL,$15.00,"Tuckasegee, North Carolina, United States",https://i.ebayimg.com/thumbs/images/g/7HAAAOSwJ9dgIzbL/s-l225.jpg,jazz36511,https://www.ebay.com/usr/jazz36511?_trksid=p2047675.l2559,Instant,0,0,1,Unknown
item447f8bc2eb,NEW!  2021 .999 silver bullion 1 oz African Leopard Proof like in capsule,https://www.ebay.com/itm/294197641963?hash=item447f8bc2eb:g:nH0AAOSwczBgsAri,$52.95,"Marietta, Georgia, United States",https://i.ebayimg.com/thumbs/images/g/nH0AAOSwczBgsAri/s-l225.jpg,silvergirl555,https://www.ebay.com/usr/silvergirl555?_trksid=p2047675.l2559,Instant,0,0,10,"Jul 27, 2021 19:24:29 PDT"
item3b66045768,"Joy Adamson: Queen Of Sheba, The Story Of An African Leopard 1980",https://www.ebay.com/itm/255114631016?hash=item3b66045768:g:PM4AAOSwKTNhEOTy,$4.12,"Wisbech, United Kingdom",https://i.ebayimg.com/thumbs/images/g/PM4AAOSwKTNhEOTy/s-l225.jpg,101leafcatch,https://www.ebay.com/usr/101leafcatch?_trksid=p2047675.l2559,Instant,0,0,1,Unknown
item3d8f8c9d05,"5046 SS African Leopard 4"" x 18"" Novelty Street Sign Aluminum",https://www.ebay.com/itm/264401362181?hash=item3d8f8c9d05:g:HOAAAOSw8PpdL2F8,$9.99,"Port Washington, Ohio, United States",https://i.ebayimg.com/thumbs/images/g/HOAAAOSw8PpdL2F8/s-l225.jpg,magnet_pi,https://www.ebay.com/usr/magnet_pi?_trksid=p2047675.l2559,Instant,0,0,More than 10,"Mar 30, 2021 05:07:52 PDT"
item1aa7d50cba,"Lot x 3 Mens Big Cat Design T-Shirt Tops: Snow Leopard, Tiger, African Leopard",https://www.ebay.com/itm/114484907194?hash=item1aa7d50cba:g:pmsAAOSwE-JfBym-,$27.47,"Stourbridge, United Kingdom",https://i.ebayimg.com/thumbs/images/g/pmsAAOSwE-JfBym-/s-l225.jpg,pentaxconcord,https://www.ebay.com/usr/pentaxconcord?_trksid=p2047675.l2559,Instant,0,0,1,"Jan 26, 2021 22:32:09 PST"
item4d4d460b1c,1973 Zulu (BK) AFRICAN LEOPARD Bronze Mardi Gras Doubloon,https://www.ebay.com/itm/332008917788?hash=item4d4d460b1c:g:fxIAAOSwCGVX5vao,$6.00,"Ponchatoula, Louisiana, United States",https://i.ebayimg.com/thumbs/images/g/fxIAAOSwCGVX5vao/s-l225.jpg,benchecano,https://www.ebay.com/usr/benchecano?_trksid=p2047675.l2559,Instant,0,0,1,"Apr 01, 2019 13:49:39 PDT"
item41fd75764e,Hunting the African Leopard Jim Rikhoff Signed,https://www.ebay.com/itm/283425207886?hash=item41fd75764e:g:yF4AAOSwJcdckyQ3,$500.00,"Spring Branch, Texas, United States",https://i.ebayimg.com/thumbs/images/g/yF4AAOSwJcdckyQ3/s-l225.jpg,tno1,https://www.ebay.com/usr/tno1?_trksid=p2047675.l2559,Instant,0,0,1,"Jul 26, 2021 14:20:05 PDT"
item218e77f9bb,"Charles Frace Signed Limited Edition Signed Print ""Lone Hunter"" African Leopard",https://www.ebay.com/itm/144124148155?hash=item218e77f9bb:g:omYAAOSwnydg-uox,$49.95,"Cincinnati, Ohio, United States",https://i.ebayimg.com/thumbs/images/g/omYAAOSwnydg-uox/s-l225.jpg,fabuken,https://www.ebay.com/usr/fabuken?_trksid=p2047675.l2559,Instant,0,0,1,Unknown
item365064a583,African Leopard Cat Cubs in Tree Animal Wildlife Wall Picture 8x10 Art Print,https://www.ebay.com/itm/233277007235?hash=item365064a583:g:sSUAAOSwaQ9dG5cB,$8.87,"Springdale, Arkansas, United States",https://i.ebayimg.com/thumbs/images/g/sSUAAOSwaQ9dG5cB/s-l225.jpg,wesellart,https://www.ebay.com/usr/wesellart?_trksid=p2047675.l2559,Instant,0,0,4,"Nov 27, 2019 23:42:09 PST"
item56c76a4aa9,"Charles Frace "" African Leopard ""  #269/2500 W/RMK RARE MINT 1977",https://www.ebay.com/itm/372712819369?hash=item56c76a4aa9:g:2CEAAOSwojhbS-Po,$629.00,"Pullman, Washington, United States",https://i.ebayimg.com/thumbs/images/g/2CEAAOSwojhbS-Po/s-l225.jpg,murdocs,https://www.ebay.com/usr/murdocs?_trksid=p2047675.l2559,Instant,0,0,1,"Mar 08, 2020 22:33:26 PDT"
item21911beaa1,DUNOON Kenya by Ruth Boden African Leopard Coffee Mug,https://www.ebay.com/itm/144168446625?hash=item21911beaa1:g:23AAAOSwvfBf-k4i,$14.00,"Gaines, Michigan, United States",https://i.ebayimg.com/thumbs/images/g/23AAAOSwvfBf-k4i/s-l225.jpg,kym219,https://www.ebay.com/usr/kym219?_trksid=p2047675.l2559,Instant,0,0,1,"Aug 25, 2021 13:49:45 PDT"
item524da84fc9,African Leopard  Large Wild Feline Cat Africa Vintage Trade Ad Card,https://www.ebay.com/itm/353490194377?hash=item524da84fc9:g:LbkAAOSwG8dgmaY-,$2.99,"S.E. USA, United States",https://i.ebayimg.com/thumbs/images/g/LbkAAOSwG8dgmaY-/s-l225.jpg,ajdmba,https://www.ebay.com/usr/ajdmba?_trksid=p2047675.l2559,Instant,0,0,1,Unknown
item3d472a9e5f,Antique 19ThC Colored Quadruped Print African Leopard Circa 1860,https://www.ebay.com/itm/263186980447?hash=item3d472a9e5f:g:ILoAAOSwVGFZra61,$44.79,"Manchester, Connecticut, United States",https://i.ebayimg.com/thumbs/images/g/ILoAAOSwVGFZra61/s-l225.jpg,michaelantique8wgn,https://www.ebay.com/usr/michaelantique8wgn?_trksid=p2047675.l2559,Instant,0,0,1,"Mar 18, 2020 20:17:50 PDT"
item3dc460f29e,ANUSCHKA NWT🐆CrossBody RFID Travel Organizer-African Leopard Tan 7437-ALP-Tan,https://www.ebay.com/itm/265287692958?hash=item3dc460f29e:g:UEQAAOSwRrtgWCKa,$197.99,"Mayer, Arizona, United States",https://i.ebayimg.com/thumbs/images/g/UEQAAOSwRrtgWCKa/s-l225.jpg,sunsluvpam,https://www.ebay.com/usr/sunsluvpam?_trksid=p2047675.l2559,Instant,0,0,1,Unknown
item3b5fee2977,Wild African Leopard On A Tree Women's Tee -Image by Shutterstock,https://www.ebay.com/itm/255012514167?var=554947175578&hash=item3b5fee2977:g:vRMAAOSwsldgwn04,$10.99 to $12.99,"San Jose, California, United States",https://i.ebayimg.com/thumbs/images/g/vRMAAOSwsldgwn04/s-l225.jpg,smartprints,https://www.ebay.com/usr/smartprints?_trksid=p2047675.l2559,Instant,0,0,10,"Jul 29, 2021 18:08:46 PDT"
item56dd34ca0a,Rayon challis fabric by the yard. African leopard animal dress fabric. Viscose,https://www.ebay.com/itm/373078411786?hash=item56dd34ca0a:g:FY8AAOSw86de3qnw,$9.00,"Orlando, Florida, United States",https://i.ebayimg.com/thumbs/images/g/FY8AAOSw86de3qnw/s-l225.jpg,citybefab0,https://www.ebay.com/usr/citybefab0?_trksid=p2047675.l2559,Instant,0,0,3,"Feb 08, 2021 18:42:57 PST"
item3677f540f2,Harry Antis African Leopard's Domain Signed Limited Edition Art Print,https://www.ebay.com/itm/233940795634?hash=item3677f540f2:g:mO4AAOSwUZhgWl1F,$49.95,"Dexter, Missouri, United States",https://i.ebayimg.com/thumbs/images/g/mO4AAOSwUZhgWl1F/s-l225.jpg,chrismanart,https://www.ebay.com/usr/chrismanart?_trksid=p2047675.l2559,Instant,0,0,1,Unknown
item4b9c5cf588,NEW Zippo Mazzi African Leopard Animal Cat Black Matte Lighter BNIB 49068,https://www.ebay.com/itm/324745885064?hash=item4b9c5cf588:g:DA0AAOSwGLxhEP1h,$41.22,"Bewdley, United Kingdom",https://i.ebayimg.com/thumbs/images/g/DA0AAOSwGLxhEP1h/s-l225.jpg,christmasheart365,https://www.ebay.com/usr/christmasheart365?_trksid=p2047675.l2559,Instant,0,0,1,Unknown
item5b9a05dcda,New NORDSTROM BP. Ivory egret african leopard Fleece Cardigan woman's size SM,https://www.ebay.com/itm/393426099418?hash=item5b9a05dcda:g:aeoAAOSwOupg4kAP,$39.00,"New York, New York, United States",https://i.ebayimg.com/thumbs/images/g/aeoAAOSwOupg4kAP/s-l225.jpg,stalis_closet,https://www.ebay.com/usr/stalis_closet?_trksid=p2047675.l2559,Instant,0,0,1,Unknown
item263fb27ef0,Charles Frace African Leopard  Framed Print,https://www.ebay.com/itm/164277419760?var=463894551115&hash=item263fb27ef0:g:D1sAAOSwh7RfAg9Y,$39.99,"Fair Oaks, California, United States",https://i.ebayimg.com/thumbs/images/g/D1sAAOSwh7RfAg9Y/s-l225.jpg,skebus,https://www.ebay.com/usr/skebus?_trksid=p2047675.l2559,Instant,0,0,4,"Aug 04, 2020 16:04:19 PDT"
item2658d9b776,"Ty 1993 Attic Treasure Isabella African Leopard 13"" Jointed Plush Bear Retired",https://www.ebay.com/itm/164699420534?epid=1500749726&hash=item2658d9b776:g:T4IAAOSw6yBgJhf1,$5.60,"Chicago, Illinois, United States",https://i.ebayimg.com/thumbs/images/g/T4IAAOSw6yBgJhf1/s-l225.jpg,ts101proof12,https://www.ebay.com/usr/ts101proof12?_trksid=p2047675.l2559,Instant,0,0,1,Unknown
item367b58124b,5 ACQUTSTTIONOF African Leopard African Leopard Ghana 1 OZ Silver 2018,https://www.ebay.com/itm/233997603403?hash=item367b58124b:g:1r4AAOSw3T5b2tXZ,$64.76,"Mainz, Germany",https://i.ebayimg.com/thumbs/images/g/1r4AAOSw3T5b2tXZ/s-l225.jpg,muenzdachs,https://www.ebay.com/usr/muenzdachs?_trksid=p2047675.l2559,Instant,0,0,4,Unknown
item443e086a18,Liberia - 2015 - WILDLIFE OF AFRICA- AFRICAN LEOPARD  Souvenir Sheet - MNH,https://www.ebay.com/itm/293098514968?hash=item443e086a18:g:NxMAAOSwODpc4~xJ,$5.80,"Brooklyn, New York, United States",https://i.ebayimg.com/thumbs/images/g/NxMAAOSwODpc4~xJ/s-l225.jpg,imperialmintny,https://www.ebay.com/usr/imperialmintny?_trksid=p2047675.l2559,Instant,0,0,6,"Aug 17, 2020 14:55:40 PDT"
item549d749e26,"P.R. CONGO 270 - African Leopard ""Panthera pardus"" (pf94031)",https://www.ebay.com/itm/363418918438?hash=item549d749e26:g:hWUAAOSwRGNgtjJf,$0.79,"Ottawa, Ontario, Canada",https://i.ebayimg.com/thumbs/images/g/hWUAAOSwRGNgtjJf/s-l225.jpg,perforations,https://www.ebay.com/usr/perforations?_trksid=p2047675.l2559,Instant,0,0,1,"Aug 21, 2021 15:51:47 PDT"
item2cd0c228f4,zulu african leopard 1973 thick 10 ga Mardi Gras Doubloon Coin new orleans,https://www.ebay.com/itm/192480946420?hash=item2cd0c228f4:g:0LIAAOSwTb5af5II,$2.75,"Harvey, Louisiana, United States",https://i.ebayimg.com/thumbs/images/g/0LIAAOSwTb5af5II/s-l225.jpg,lsuwil,https://www.ebay.com/usr/lsuwil?_trksid=p2047675.l2559,Instant,0,0,More than 10,"Apr 11, 2020 19:38:20 PDT"
item440a773698,METAL MAGNET African Leopard Sitting Travel Africa Cat Leopards Cats MAGNET,https://www.ebay.com/itm/292233361048?hash=item440a773698:g:BvMAAOSwSQFZ9LxI,$5.36,"Shawnee, Oklahoma, United States",https://i.ebayimg.com/thumbs/images/g/BvMAAOSwSQFZ9LxI/s-l225.jpg,catmarbles,https://www.ebay.com/usr/catmarbles?_trksid=p2047675.l2559,Instant,0,0,9,"Aug 27, 2021 13:54:48 PDT"
item3ff1f7d791,Majestic Cats Charles Frace's African Leopard Porcelain Ornament Collection,https://www.ebay.com/itm/274642491281?hash=item3ff1f7d791:g:ML8AAOSw669f-i85,$14.99,"Schurz, Nevada, United States",https://i.ebayimg.com/thumbs/images/g/ML8AAOSw669f-i85/s-l225.jpg,beadspurplehorse,https://www.ebay.com/usr/beadspurplehorse?_trksid=p2047675.l2559,Instant,0,0,1,Unknown
item4b92f08ee8,Yvonne Ellen London Anthropologie Wild Cat Mug African Leopard Cheetah,https://www.ebay.com/itm/324587785960?hash=item4b92f08ee8:g:flMAAOSw2Stgg3d-,$7.99,"Cedarburg, Wisconsin, United States",https://i.ebayimg.com/thumbs/images/g/flMAAOSw2Stgg3d-/s-l225.jpg,tweelink,https://www.ebay.com/usr/tweelink?_trksid=p2047675.l2559,Instant,0,0,1,"Aug 13, 2021 19:29:51 PDT"
item1ee16b2d69,Scottsdale Mint Ghana 5 Cedis African Leopard 2017 1 oz .999 Silver Coin,https://www.ebay.com/itm/132630916457?hash=item1ee16b2d69:g:NsAAAOSwrptbAoWz,$55.00,"Malaysia, Malaysia",https://i.ebayimg.com/thumbs/images/g/NsAAAOSwrptbAoWz/s-l225.jpg,vpreciousmetal,https://www.ebay.com/usr/vpreciousmetal?_trksid=p2047675.l2559,Instant,0,0,2,"Aug 28, 2021 04:20:44 PDT"
item1f2abcb92f,T. N. Bailey THE AFRICAN LEOPARD Ecology and Behavior of a Solitary Field 1st Ed,https://www.ebay.com/itm/133860997423?hash=item1f2abcb92f:g:PJYAAOSwqKFhKO7W,$289.95,"Pomona, New York, United States",https://i.ebayimg.com/thumbs/images/g/PJYAAOSwqKFhKO7W/s-l225.jpg,rare-book-cellar,https://www.ebay.com/usr/rare-book-cellar?_trksid=p2047675.l2559,Instant,0,0,1,Unknown
item5b8b4a553c,Reproduction African Leopard Skull Set for sale SKU 1677,https://www.ebay.com/itm/393178928444?hash=item5b8b4a553c:g:~ZwAAOSwjwJgRsBp,$545.00,"Wrightstown, Wisconsin, United States",https://i.ebayimg.com/thumbs/images/g/~ZwAAOSwjwJgRsBp/s-l225.jpg,all-taxidermy,https://www.ebay.com/usr/all-taxidermy?_trksid=p2047675.l2559,Instant,0,0,1,"Mar 08, 2021 16:27:32 PST"
item218e8973be,"Charles Frace Signed Limited Edition Signed Print ""African Leopard” Head",https://www.ebay.com/itm/144125293502?hash=item218e8973be:g:L~MAAOSw1ilg~C0L,$49.95,"Cincinnati, Ohio, United States",https://i.ebayimg.com/thumbs/images/g/L~MAAOSw1ilg~C0L/s-l225.jpg,fabuken,https://www.ebay.com/usr/fabuken?_trksid=p2047675.l2559,Instant,0,0,1,Unknown
item288b302f1a,WP~Raymond Waites Safari African Leopard & Horse Decorations Vtg. 2 Pc. Set,https://www.ebay.com/itm/174133882650?hash=item288b302f1a:g:DXMAAOSw4gVd8dIG,$14.00,"Austin, Texas, United States",https://i.ebayimg.com/thumbs/images/g/DXMAAOSw4gVd8dIG/s-l225.jpg,jgmartinez1007,https://www.ebay.com/usr/jgmartinez1007?_trksid=p2047675.l2559,Instant,0,0,1,"Aug 18, 2021 09:43:52 PDT"
item3b4e18be1b,"Vintage Signed African Leopard Lithograph Framed Matted, by John Frace', 26.5""",https://www.ebay.com/itm/254713314843?hash=item3b4e18be1b:g:UBIAAOSwZ8ZfLvSQ,$44.99,"Ocala, Florida, United States",https://i.ebayimg.com/thumbs/images/g/UBIAAOSwZ8ZfLvSQ/s-l225.jpg,montelgolfer,https://www.ebay.com/usr/montelgolfer?_trksid=p2047675.l2559,Instant,0,0,1,"Aug 24, 2021 08:09:32 PDT"
