id,title,link,price,origin,image,seller_name,seller_link,sell_type,num_bids,num_watchers,num_stock,date
item4238260497,Seiko Mod 6105 Diver/Blue Mother-Of-Pearl Dial,https://www.ebay.com/itm/284409857175?hash=item4238260497:g:uqoAAOSw7CNhF9L6,$812.02,"Japan, Japan",https://i.ebayimg.com/thumbs/images/g/uqoAAOSw7CNhF9L6/s-l225.jpg,monshop_zero,https://www.ebay.com/usr/monshop_zero?_trksid=p2047675.l2559,Instant,0,0,1,Unknown
item48d2996041,GUCCI G-Frame Square Blue Mother of pearl Dial Women's Watch YA128531,https://www.ebay.com/itm/312770912321?epid=26026488952&hash=item48d2996041:g:z48AAOSwu~Zdf7Lz,$610.40,"Los Angeles, California, United States",https://i.ebayimg.com/thumbs/images/g/z48AAOSwu~Zdf7Lz/s-l225.jpg,watchwarehouse,https://www.ebay.com/usr/watchwarehouse?_trksid=p2047675.l2559,Instant,0,0,1,"Aug 30, 2021 21:18:53 PDT"
item3b3b56e37c,"RARE,UNIQUE Women's SWISS Watch WENGER SWISS MILITARY 79173.Blue Mother Of Pearl",https://www.ebay.com/itm/254398620540?hash=item3b3b56e37c:g:a7IAAOSweHtdsSgE,$50.00,"Aurora, Illinois, United States",https://i.ebayimg.com/thumbs/images/g/a7IAAOSweHtdsSgE/s-l225.jpg,111saxa,https://www.ebay.com/usr/111saxa?_trksid=p2047675.l2559,Instant,0,0,1,"Jun 05, 2021 08:49:51 PDT"
item4233471a0d,GRUEN Women Watch Blue Mother of Pearl Rhinestone Trim Genuine Leather 100-94,https://www.ebay.com/itm/284328139277?hash=item4233471a0d:g:XyEAAOSwRAdgsCAE,$19.99,"Kings Mountain, North Carolina, United States",https://i.ebayimg.com/thumbs/images/g/XyEAAOSwRAdgsCAE/s-l225.jpg,memorymarielane,https://www.ebay.com/usr/memorymarielane?_trksid=p2047675.l2559,Instant,0,0,1,"Aug 13, 2021 15:37:21 PDT"
item1d08c4edd3,Bulova  96L288 Stainless Steel Swarovski Crystal Blue Mother-Of-Pearl Dial Watch,https://www.ebay.com/itm/124701175251?hash=item1d08c4edd3:g:mp0AAOSw5xBgieaf,$169.50,"Fresno, California, United States",https://i.ebayimg.com/thumbs/images/g/mp0AAOSw5xBgieaf/s-l225.jpg,allbestwatches4less,https://www.ebay.com/usr/allbestwatches4less?_trksid=p2047675.l2559,Instant,0,0,2,"May 20, 2021 18:23:03 PDT"
item3dbe16ee97,"Judith Ripka ""London"" Blue Mother of Pearl And CZ Gold Plated Stainless 7.5""",https://www.ebay.com/itm/265182178967?hash=item3dbe16ee97:g:IXQAAOSwoa9gttpg,$119.00,"Hemet, California, United States",https://i.ebayimg.com/thumbs/images/g/IXQAAOSwoa9gttpg/s-l225.jpg,lovegemsxx,https://www.ebay.com/usr/lovegemsxx?_trksid=p2047675.l2559,Instant,0,0,1,"Aug 26, 2021 09:44:44 PDT"
item5dbfe42dae,Invicta Men's 46mm Blue Mother of Pearl Swiss Capsule Chronograph Watch 28796,https://www.ebay.com/itm/402651360686?epid=27031143637&hash=item5dbfe42dae:g:Ch4AAOSwNgtgy3VK,$144.28,"South Jordan, Utah, United States",https://i.ebayimg.com/thumbs/images/g/Ch4AAOSwNgtgy3VK/s-l225.jpg,klawkwatches,https://www.ebay.com/usr/klawkwatches?_trksid=p2047675.l2559,Instant,0,0,Last one,"Aug 26, 2021 21:02:54 PDT"
item364ade490e,Seiko Women Solar Silver Stainless Steel Blue Mother of Pearl Dial Watch SUP385,https://www.ebay.com/itm/233184315662?hash=item364ade490e:g:ntoAAOSwUZNatqZ6,$159.99,"New York, New York, United States",https://i.ebayimg.com/thumbs/images/g/ntoAAOSwUZNatqZ6/s-l225.jpg,dltjoyhh,https://www.ebay.com/usr/dltjoyhh?_trksid=p2047675.l2559,Instant,0,0,2,"Jun 07, 2021 09:00:15 PDT"
item2186b496df,Rolex Dial Dial Datejust Blue Mother of Pearl Light Blue Mother of Pearl,https://www.ebay.com/itm/143993902815?hash=item2186b496df:g:iicAAOSwjv9gZKg5,$529.19,"Bagnolo San Vito (MN), Italy",https://i.ebayimg.com/thumbs/images/g/iicAAOSwjv9gZKg5/s-l225.jpg,italianfashionista,https://www.ebay.com/usr/italianfashionista?_trksid=p2047675.l2559,Instant,0,0,1,Unknown
item2ac9a9974a,Moog Paris 0309 with Blue Mother of Pearl Dial and Swarovski Crystals  Women's W,https://www.ebay.com/itm/183771961162?hash=item2ac9a9974a:g:luYAAOSw-9xZ1npN,$67.00,"Altamonte Springs, Florida, United States",https://i.ebayimg.com/thumbs/images/g/luYAAOSw-9xZ1npN/s-l225.jpg,dankazakevicien_0,https://www.ebay.com/usr/dankazakevicien_0?_trksid=p2047675.l2559,Instant,0,0,1,"Mar 12, 2021 10:24:43 PST"
item2f63580cb3,Accutime Women's Blue Mother of Pearl Watch Face w/Blue Band LST22WM 0218,https://www.ebay.com/itm/203530177715?hash=item2f63580cb3:g:f9YAAOSwqhpg9ccI,$35.00,"Vernon, Michigan, United States",https://i.ebayimg.com/thumbs/images/g/f9YAAOSwqhpg9ccI/s-l225.jpg,vernonstudio,https://www.ebay.com/usr/vernonstudio?_trksid=p2047675.l2559,Instant,0,0,1,"Aug 27, 2021 15:01:58 PDT"
item48dde138a2,"Tag Heuer Women's Watch, WP1410 Alter Ego Model, Blue Mother of Pearl Face",https://www.ebay.com/itm/312960170146?hash=item48dde138a2:g:nDMAAOSw1iNa5Oir,$499.99,"Colorado Springs, Colorado, United States",https://i.ebayimg.com/thumbs/images/g/nDMAAOSw1iNa5Oir/s-l225.jpg,designertimepieces,https://www.ebay.com/usr/designertimepieces?_trksid=p2047675.l2559,Instant,0,0,1,Unknown
item423198b173,Calvin klein Blue Mother of Pearl Ladies Watch K2G2314X,https://www.ebay.com/itm/284299932019?epid=1773859811&hash=item423198b173:g:70oAAOSwChtgpVnK,$64.95,"Miami, Florida, United States",https://i.ebayimg.com/thumbs/images/g/70oAAOSwChtgpVnK/s-l225.jpg,discount-gifts,https://www.ebay.com/usr/discount-gifts?_trksid=p2047675.l2559,Instant,0,0,1,"May 21, 2021 09:02:15 PDT"
item28b946ae35,Ladies Peugeot Watch Light Blue Mother of Pearl With Crystals,https://www.ebay.com/itm/174907108917?hash=item28b946ae35:g:7HIAAOSw~vxc7X8r,$15.10,"Minoa, New York, United States",https://i.ebayimg.com/thumbs/images/g/7HIAAOSw~vxc7X8r/s-l225.jpg,morgamarin-6,https://www.ebay.com/usr/morgamarin-6?_trksid=p2047675.l2559,Instant,0,0,1,Unknown
item46924532b3,Bertha Ashley Blue Mother of Pearl (Owl and Moon) Crystal-set Dial BTHBR3007,https://www.ebay.com/itm/303101719219?epid=1441120654&hash=item46924532b3:g:eSgAAOSwzZNb9c0j,$100.00,"Northridge, California, United States",https://i.ebayimg.com/thumbs/images/g/eSgAAOSwzZNb9c0j/s-l225.jpg,robert7604,https://www.ebay.com/usr/robert7604?_trksid=p2047675.l2559,Instant,0,0,1,"Feb 19, 2021 12:48:04 PST"
item1a95f9a628,Ebel Beluga 18k Yellow Gold w/ Blue Mother of Pearl Dial and Diamond Markers,https://www.ebay.com/itm/114185315880?epid=1600596218&hash=item1a95f9a628:g:7D0AAOSwuhZelKsT,"$4,999.00","Columbus, Ohio, United States",https://i.ebayimg.com/thumbs/images/g/7D0AAOSwuhZelKsT/s-l225.jpg,fineandrare,https://www.ebay.com/usr/fineandrare?_trksid=p2047675.l2559,Instant,0,0,1,"Mar 13, 2021 08:42:24 PST"
item3d7f55bf2d,New Bulova Women's Diamond Watch Blue Mother Of Pearl Two Tone Bracelet 98P157,https://www.ebay.com/itm/264129330989?epid=25009465315&hash=item3d7f55bf2d:g:JvQAAOSwo1pa96l3,$329.99,"Saint Paul, Minnesota, United States",https://i.ebayimg.com/thumbs/images/g/JvQAAOSwo1pa96l3/s-l225.jpg,jewelersfashionpassion,https://www.ebay.com/usr/jewelersfashionpassion?_trksid=p2047675.l2559,Instant,0,0,1,"Feb 10, 2021 12:34:25 PST"
item5977482f6b,Wenger Swiss Blue Mother of Pearl Dial Watch 79173,https://www.ebay.com/itm/384253308779?hash=item5977482f6b:g:uKMAAOSwAs5g3khW,$25.00,"Landisville, Pennsylvania, United States",https://i.ebayimg.com/thumbs/images/g/uKMAAOSwAs5g3khW/s-l225.jpg,og.resale.shop,https://www.ebay.com/usr/og.resale.shop?_trksid=p2047675.l2559,Instant,0,0,1,Unknown
item5dc86f88ef,Skagen Denmark Ladies Grenen Steel-Link Blue Mother of Pearl Dial NIB SKW6519,https://www.ebay.com/itm/402794711279?epid=7033730139&hash=item5dc86f88ef:g:YPwAAOSwSMZgfamR,$59.49,"Houston, Texas, United States",https://i.ebayimg.com/thumbs/images/g/YPwAAOSwSMZgfamR/s-l225.jpg,thesuperiordeals,https://www.ebay.com/usr/thesuperiordeals?_trksid=p2047675.l2559,Instant,0,0,1,"Jul 08, 2021 09:38:34 PDT"
item5dda474bb5,Invicta Pro Diver Men's 48mm Blue Mother of Pearl Black Stainless Watch 23069,https://www.ebay.com/itm/403094064053?epid=2255404000&hash=item5dda474bb5:g:BQwAAOSwfwphIhTO,$110.99,"South Jordan, Utah, United States",https://i.ebayimg.com/thumbs/images/g/BQwAAOSwfwphIhTO/s-l225.jpg,klawkwatches,https://www.ebay.com/usr/klawkwatches?_trksid=p2047675.l2559,Instant,0,0,1,"Aug 26, 2021 21:02:45 PDT"
item239a3934e4,Calvin Klein K3G2312N Blue Mother of Pearl Dial Silver-Tone Band Ladies Watch,https://www.ebay.com/itm/152911295716?epid=1344705267&hash=item239a3934e4:g:U6QAAOSwDkdah2v3,$79.99,"Sugar Land, Texas, United States",https://i.ebayimg.com/thumbs/images/g/U6QAAOSwDkdah2v3/s-l225.jpg,houstonsunny,https://www.ebay.com/usr/houstonsunny?_trksid=p2047675.l2559,Instant,0,0,Last one,"Mar 16, 2021 21:32:52 PDT"
item1a5a4c7e76,Silver Watch with Blue Mother of Pearl Dial & Crystal Accented Design 30M-WR,https://www.ebay.com/itm/113184112246?hash=item1a5a4c7e76:g:Q4kAAOSwejdbZj6T,$24.99,"Miami, Florida, United States",https://i.ebayimg.com/thumbs/images/g/Q4kAAOSwejdbZj6T/s-l225.jpg,ventas01,https://www.ebay.com/usr/ventas01?_trksid=p2047675.l2559,Instant,0,0,2,"Sep 16, 2018 20:48:39 PDT"
item4207d0210a,EBEL Beluga Blue Mother Of Pearl Diamond Dial Ladies Watch Stainless Steel Swiss,https://www.ebay.com/itm/283598921994?hash=item4207d0210a:g:qckAAOSw94pdaVcw,"$1,099.00","Philadelphia, Pennsylvania, United States",https://i.ebayimg.com/thumbs/images/g/qckAAOSw94pdaVcw/s-l225.jpg,quality-jewels,https://www.ebay.com/usr/quality-jewels?_trksid=p2047675.l2559,Instant,0,0,1,"Aug 27, 2021 14:32:43 PDT"
item28aec3b5db,Rolex Oyster Perpetual Date 34mm Blue Mother of Pearl Diamond 1501 2YWTY #1123-1,https://www.ebay.com/itm/174730753499?hash=item28aec3b5db:g:21YAAOSwc3RgdZbG,"$6,295.00","Miami, Florida, United States",https://i.ebayimg.com/thumbs/images/g/21YAAOSwc3RgdZbG/s-l225.jpg,swisstimebuyers,https://www.ebay.com/usr/swisstimebuyers?_trksid=p2047675.l2559,Instant,0,0,1,"Aug 11, 2021 14:36:20 PDT"
item340d7bd796,Joe Rodeo Men's Blue Mother of Pearl Dial White Rubber Band Watch JJM29,https://www.ebay.com/itm/223564519318?hash=item340d7bd796:g:X-IAAOSwmyBfdy4l,$995.00,"Rochelle Park, New Jersey, United States",https://i.ebayimg.com/thumbs/images/g/X-IAAOSwmyBfdy4l/s-l225.jpg,eliadamsjewelers,https://www.ebay.com/usr/eliadamsjewelers?_trksid=p2047675.l2559,Instant,0,0,1,"Jan 24, 2021 13:26:23 PST"
item3ffd60c5bd,Skagen Anita Blue Mother Of Pearl Dial Quartz SKW2862 Women's Watch,https://www.ebay.com/itm/274833917373?epid=9044267016&hash=item3ffd60c5bd:g:NWQAAOSwIp1gyFb4,$94.00,"Singapore, Singapore",https://i.ebayimg.com/thumbs/images/g/NWQAAOSwIp1gyFb4/s-l225.jpg,creationwatches,https://www.ebay.com/usr/creationwatches?_trksid=p2047675.l2559,Instant,0,0,5,"Aug 07, 2021 03:44:41 PDT"
item2f4a6a496f,Stuhrling 3955 3 Crystal Accented Blue Mother of Pearl Bracelet Womens Watch,https://www.ebay.com/itm/203111942511?hash=item2f4a6a496f:g:X1QAAOSwdipfaMeO,$115.00,"Brooklyn, New York, United States",https://i.ebayimg.com/thumbs/images/g/X1QAAOSwdipfaMeO/s-l225.jpg,yourdreamizhere,https://www.ebay.com/usr/yourdreamizhere?_trksid=p2047675.l2559,Instant,0,0,1,"Aug 03, 2021 11:40:36 PDT"
item5d83d88651,Watch Gear TOURNEAU Crystal Accented Blue Mother of Pearl Dial Silver Tone Watch,https://www.ebay.com/itm/401643963985?hash=item5d83d88651:g:w8wAAOSwnhlb-azT,$259.00,"Fresno, California, United States",https://i.ebayimg.com/thumbs/images/g/w8wAAOSwnhlb-azT/s-l225.jpg,allbestwatches4less,https://www.ebay.com/usr/allbestwatches4less?_trksid=p2047675.l2559,Instant,0,0,2,"Jul 20, 2020 18:09:42 PDT"
item2b11e4e78d,Bulova Marine Star Midnight Blue Mother of Pearl Diamond Bezel Women's Watch,https://www.ebay.com/itm/184983807885?epid=2255152536&hash=item2b11e4e78d:g:cgAAAOSwS~BhDAjR,$446.25,"Nashville, Tennessee, United States",https://i.ebayimg.com/thumbs/images/g/cgAAAOSwS~BhDAjR/s-l225.jpg,electronic_express,https://www.ebay.com/usr/electronic_express?_trksid=p2047675.l2559,Instant,0,0,9,"Aug 10, 2021 15:44:04 PDT"
item1cd95c8341,Jowissa Women's Safira Blue Mother-Of-Pearl Dial Wristwatch,https://www.ebay.com/itm/123905803073?hash=item1cd95c8341:g:DlgAAOSwddZde9Me,$129.99,"Fernandina Beach, Florida, United States",https://i.ebayimg.com/thumbs/images/g/DlgAAOSwddZde9Me/s-l225.jpg,mtimesales148,https://www.ebay.com/usr/mtimesales148?_trksid=p2047675.l2559,Instant,0,0,1,"Aug 24, 2021 11:20:17 PDT"
item23d5a661f3,SEIKO WOMEN'S SUJ707 STAINLESS STEEL BLUE MOTHER OF PEARL DIAL WATCH,https://www.ebay.com/itm/153908306419?epid=153025204&hash=item23d5a661f3:g:grwAAOSwf1Reo18v,$145.00,"Reseda, California, United States",https://i.ebayimg.com/thumbs/images/g/grwAAOSwf1Reo18v/s-l225.jpg,topbrandwatches,https://www.ebay.com/usr/topbrandwatches?_trksid=p2047675.l2559,Instant,0,0,1,"Jan 24, 2021 13:56:00 PST"
item41aa6c2fc1,EMPORIO ARMANI WOMEN'S BLUE MOTHER OF PEARL TOP WATCH AR7323,https://www.ebay.com/itm/282032091073?hash=item41aa6c2fc1:g:BGQAAOSwDk5T7fJG,$200.00,"Manassas, Virginia, United States",https://i.ebayimg.com/thumbs/images/g/BGQAAOSwDk5T7fJG/s-l225.jpg,jcfashion12,https://www.ebay.com/usr/jcfashion12?_trksid=p2047675.l2559,Instant,0,0,Last one,"Aug 21, 2021 18:09:56 PDT"
item52485e51d2,Vintage Disney Lorus Mickey Mouse Blue Mother of Pearl Watch Quartz Japan,https://www.ebay.com/itm/353401459154?hash=item52485e51d2:g:psMAAOSwWHtfKJ9P,$19.99,"Burbank, California, United States",https://i.ebayimg.com/thumbs/images/g/psMAAOSwWHtfKJ9P/s-l225.jpg,heatherfeatherpins,https://www.ebay.com/usr/heatherfeatherpins?_trksid=p2047675.l2559,Instant,0,0,1,Unknown
item2647e53e12,Ladies ROLEX Oyster Perpetual Datejust Steel Blue MOTHER-OF-PEARL Dial Diamonds,https://www.ebay.com/itm/164414963218?hash=item2647e53e12:g:~xUAAOSwFT9fd5OH,"$7,395.00","Los Angeles, California, United States",https://i.ebayimg.com/thumbs/images/g/~xUAAOSwFT9fd5OH/s-l225.jpg,lajollajewelry,https://www.ebay.com/usr/lajollajewelry?_trksid=p2047675.l2559,Instant,0,0,Limited quantity,"May 27, 2021 17:11:10 PDT"
item2ee25a8608,Akribos XXIV AK805BU Blue Mother of Pearl Dial White Leather Strap Womens Watch,https://www.ebay.com/itm/201366078984?hash=item2ee25a8608:g:ngIAAOSwawBbUOLc,$79.99,"Brooklyn, New York, United States",https://i.ebayimg.com/thumbs/images/g/ngIAAOSwawBbUOLc/s-l225.jpg,yourdreamizhere,https://www.ebay.com/usr/yourdreamizhere?_trksid=p2047675.l2559,Instant,0,0,Last one,"May 19, 2021 11:47:01 PDT"
item3dba03b1e7,New Seiko SUP307 Solar Recraft Series Blue Mother of Pearl Dial Womens Watch,https://www.ebay.com/itm/265113809383?hash=item3dba03b1e7:g:bS8AAOSwNMtga5JI,$160.00,"Saint Petersburg, Florida, United States",https://i.ebayimg.com/thumbs/images/g/bS8AAOSwNMtga5JI/s-l225.jpg,agmerax,https://www.ebay.com/usr/agmerax?_trksid=p2047675.l2559,Instant,0,0,1,"Jun 04, 2021 20:09:13 PDT"
item2f4c05889b,Stuhrling 3959 4 Quartz Chronograph Blue Mother of Pearl Bracelet Womens Watch,https://www.ebay.com/itm/203138893979?hash=item2f4c05889b:g:NXsAAOSwPLlfhcR6,$125.00,"Brooklyn, New York, United States",https://i.ebayimg.com/thumbs/images/g/NXsAAOSwPLlfhcR6/s-l225.jpg,yourdreamizhere,https://www.ebay.com/usr/yourdreamizhere?_trksid=p2047675.l2559,Instant,0,0,1,"Aug 03, 2021 11:40:35 PDT"
item344417efb6,Judith Ripka Stainless Steel Blue Mother of Pearl Diamonique MONACO WATCH,https://www.ebay.com/itm/224480718774?hash=item344417efb6:g:1ocAAOSwIe1gtOoC,$99.00,"McGregor, Texas, United States",https://i.ebayimg.com/thumbs/images/g/1ocAAOSwIe1gtOoC/s-l225.jpg,yates3510,https://www.ebay.com/usr/yates3510?_trksid=p2047675.l2559,Instant,0,0,1,Unknown
item3ffea81fea,Tommy Hilfiger Ladie’s Watch Silver Mesh Blue Mother Of Pearl 1782041 New,https://www.ebay.com/itm/274855370730?epid=5029511241&hash=item3ffea81fea:g:qUMAAOSwnQVgHFAu,$127.00,"Las Vegas, Nevada, United States",https://i.ebayimg.com/thumbs/images/g/qUMAAOSwnQVgHFAu/s-l225.jpg,tothemoon.and.back,https://www.ebay.com/usr/tothemoon.and.back?_trksid=p2047675.l2559,Instant,0,0,1,Unknown
item5b9f02882d,Seiko Mod Blue Sub Blue Mother-Of-Pearl Dial Automatic 40mm,https://www.ebay.com/itm/393509767213?hash=item5b9f02882d:g:aU4AAOSwOTRhGUIA,"$1,011.10","Japan, Japan",https://i.ebayimg.com/thumbs/images/g/aU4AAOSwOTRhGUIA/s-l225.jpg,dragon-star,https://www.ebay.com/usr/dragon-star?_trksid=p2047675.l2559,Instant,0,0,1,"Aug 15, 2021 09:35:30 PDT"
item28b9a3f397,Calvin Klein Simplicity Unisex Pale Blue Mother of Pearl Stainless Steel Watch,https://www.ebay.com/itm/174913221527?epid=1854023529&hash=item28b9a3f397:g:TusAAOSwFhxea8jn,$151.18,"Blackburn, United Kingdom",https://i.ebayimg.com/thumbs/images/g/TusAAOSwFhxea8jn/s-l225.jpg,beckham198181,https://www.ebay.com/usr/beckham198181?_trksid=p2047675.l2559,Instant,0,0,1,Unknown
item3f8767a0f7,Genuine Tag Heuer Women's Blue Mother of Pearl Aquaracer WAF1417.BA0812 Watch,https://www.ebay.com/itm/272854655223?hash=item3f8767a0f7:g:JV8AAOSwNZtZwb9C,"$1,386.15","Sydney , New South Wales, Australia",https://i.ebayimg.com/thumbs/images/g/JV8AAOSwNZtZwb9C/s-l225.jpg,aurecx,https://www.ebay.com/usr/aurecx?_trksid=p2047675.l2559,Instant,0,0,1,"Jul 01, 2021 00:11:05 PDT"
item1ee9dc2d37,Womens Wristwatch LORENZ WAVE 030028BB Silicone Light Blue Mother of Pearl,https://www.ebay.com/itm/132772539703?hash=item1ee9dc2d37:g:3swAAOSwpyBdpKDk,$108.16,"81025 Marcianise (CE), Italy",https://i.ebayimg.com/thumbs/images/g/3swAAOSwpyBdpKDk/s-l225.jpg,golden.outlet,https://www.ebay.com/str/goldenoutletstore?_trksid=p2047675.l2563,Instant,0,0,3,"Jul 30, 2021 08:15:37 PDT"
item1a45cee3ae,Women's Rolex 31mm Datejust 2 Tone Baby Blue Mother Of Pearl Dial with Diamond,https://www.ebay.com/itm/112840336302?hash=item1a45cee3ae:g:CaUAAOSwpaxZzmOi,"$9,142.50","New York, New York, United States",https://i.ebayimg.com/thumbs/images/g/CaUAAOSwpaxZzmOi/s-l225.jpg,watch_my_diamonds,https://www.ebay.com/usr/watch_my_diamonds?_trksid=p2047675.l2559,Instant,0,0,2,"Apr 20, 2021 14:58:01 PDT"
item1f160ae2c6,KAREN MILLEN Blue Mother of PEARL dial Ladies Watch RRP £189 NEW IDEAL GIFT!(KM7,https://www.ebay.com/itm/133513798342?hash=item1f160ae2c6:g:VMsAAOSwqgFdstUF,$82.45,"Birmingham, West Midlands, United Kingdom",https://i.ebayimg.com/thumbs/images/g/VMsAAOSwqgFdstUF/s-l225.jpg,khashayar2005,https://www.ebay.com/usr/khashayar2005?_trksid=p2047675.l2559,Instant,0,0,2,"Mar 25, 2021 08:40:03 PDT"
item1edac8bae9,Ladies Rolex 26mm Datejust two tone Baby Blue Mother Of Pearl Dial with Diamond,https://www.ebay.com/itm/132519607017?hash=item1edac8bae9:g:06IAAOSw241YeSE1,"$5,999.00","New York, New York, United States",https://i.ebayimg.com/thumbs/images/g/06IAAOSw241YeSE1/s-l225.jpg,watch_my_diamonds,https://www.ebay.com/usr/watch_my_diamonds?_trksid=p2047675.l2559,Instant,0,0,2,"Jun 02, 2021 14:12:36 PDT"
item2cd23cc366,BRAND NEW $125 Women's KC4831 Slim Blue Mother of Pearl Dial Bracelet Watch,https://www.ebay.com/itm/192505758566?hash=item2cd23cc366:g:yhMAAOSwFLBaXPgT,$79.98,"Brooklyn, New York, United States",https://i.ebayimg.com/thumbs/images/g/yhMAAOSwFLBaXPgT/s-l225.jpg,dealcatch,https://www.ebay.com/usr/dealcatch?_trksid=p2047675.l2559,Instant,0,0,1,"Aug 04, 2021 07:51:38 PDT"
item2860237394,"BREITLING Blue Mother of Pearl Callistino, Ref. A72345",https://www.ebay.com/itm/173411627924?epid=6046978532&hash=item2860237394:g:0KQAAOSwXSJbHxxs,"$3,092.29","London, United Kingdom",https://i.ebayimg.com/thumbs/images/g/0KQAAOSwXSJbHxxs/s-l225.jpg,timespec-watches,https://www.ebay.com/usr/timespec-watches?_trksid=p2047675.l2559,Instant,0,0,1,"Jul 19, 2021 05:19:12 PDT"
item2139dd0e58,Rolex 31mm Datejust Blue Mother Of Pearl Dial Sapphire & Diamond Bezel 2 Tone,https://www.ebay.com/itm/142704709208?hash=item2139dd0e58:g:tb8AAOSwZ1hb5fFa,"$9,947.50","New York, New York, United States",https://i.ebayimg.com/thumbs/images/g/tb8AAOSwZ1hb5fFa/s-l225.jpg,watch_my_diamonds,https://www.ebay.com/usr/watch_my_diamonds?_trksid=p2047675.l2559,Instant,0,0,2,"Apr 20, 2021 14:58:03 PDT"
item1edad67908,Ladies Rolex Datejust 31mm Steel Baby Blue Mother Of Pearl Diamond Dial Watch,https://www.ebay.com/itm/132520507656?hash=item1edad67908:g:L7kAAOSwlV9WT48C,"$9,947.50","New York, New York, United States",https://i.ebayimg.com/thumbs/images/g/L7kAAOSwlV9WT48C/s-l225.jpg,watch_my_diamonds,https://www.ebay.com/usr/watch_my_diamonds?_trksid=p2047675.l2559,Instant,0,0,2,"Apr 20, 2021 14:58:16 PDT"
item4afbfbc388,Men's Elgin Watch FG355 Water Resistant Japan Movement Blue Mother of Pearl,https://www.ebay.com/itm/322055160712?hash=item4afbfbc388:g:lg8AAOSwjVVVlNWc,$200.00,"Beaumont, California, United States",https://i.ebayimg.com/thumbs/images/g/lg8AAOSwjVVVlNWc/s-l225.jpg,bowiewatchesandmore,https://www.ebay.com/usr/bowiewatchesandmore?_trksid=p2047675.l2559,Instant,0,0,1,"Jun 05, 2016 18:29:00 PDT"
item5dcceafd64,NWOT Free People Blue Mother Of Pearl Collar Muscle Tee Size Large,https://www.ebay.com/itm/402869910884?hash=item5dcceafd64:g:jnQAAOSwK3tgq~re,$49.99,"Yukon, Oklahoma, United States",https://i.ebayimg.com/thumbs/images/g/jnQAAOSwK3tgq~re/s-l225.jpg,lovelandvtg,https://www.ebay.com/usr/lovelandvtg?_trksid=p2047675.l2559,Instant,0,0,1,Unknown
item3fbfc59458,BERTOLUCCI FASCINO #913 BLUE MOTHER OF PEARL DIAMOND DIAL,https://www.ebay.com/itm/273800336472?hash=item3fbfc59458:g:R2AAAOSwOgdYm9Hg,$80.00,"Boca Raton, Florida, United States",https://i.ebayimg.com/thumbs/images/g/R2AAAOSwOgdYm9Hg/s-l225.jpg,mike55spike,https://www.ebay.com/usr/mike55spike?_trksid=p2047675.l2559,Instant,0,0,1,"Jan 09, 2021 14:59:01 PST"
item211cd315c1,"13/16"" BLUE MOTHER OF PEARL SHELL 925 STERLING SILVER earrings",https://www.ebay.com/itm/142217516481?hash=item211cd315c1:g:-jgAAOSwVqlaMfqf,$17.95,"New York, New York, United States",https://i.ebayimg.com/thumbs/images/g/-jgAAOSwVqlaMfqf/s-l225.jpg,hurky68,https://www.ebay.com/usr/hurky68?_trksid=p2047675.l2559,Instant,0,0,Last one,"Oct 12, 2020 02:56:04 PDT"
item1f289f69fb,925 sterling necklace blue mother of pearl and celery,https://www.ebay.com/itm/133825522171?hash=item1f289f69fb:g:4esAAOSwysBgqU4K,$14.00,"Rochester, Minnesota, United States",https://i.ebayimg.com/thumbs/images/g/4esAAOSwysBgqU4K/s-l225.jpg,danielles*worldwide*shoes,https://www.ebay.com/usr/danielles*worldwide*shoes?_trksid=p2047675.l2559,Instant,0,0,1,Unknown
item5dd76a26b8,Sterling Silver Pink & Blue Mother of Pearl Mary Quant style Flower Ring Size L,https://www.ebay.com/itm/403046016696?hash=item5dd76a26b8:g:NDIAAOSwuoxhC-CW,$24.72,"NORTH SOMERSET, United Kingdom",https://i.ebayimg.com/thumbs/images/g/NDIAAOSwuoxhC-CW/s-l225.jpg,tresccredits,https://www.ebay.com/usr/tresccredits?_trksid=p2047675.l2559,Instant,0,0,1,"Aug 22, 2021 05:09:31 PDT"
item4b68611722,Sekonda Midnight Star Women's Watch with Blue Mother of Pearl Dial 2147,https://www.ebay.com/itm/323873740578?hash=item4b68611722:g:0kcAAOSwD6BgtkQA,$50.84,"Glasgow, United Kingdom",https://i.ebayimg.com/thumbs/images/g/0kcAAOSwD6BgtkQA/s-l225.jpg,gbwatchshop,https://www.ebay.com/usr/gbwatchshop?_trksid=p2047675.l2559,Instant,0,0,More than 10,"Jun 01, 2021 07:28:12 PDT"
item488f9c5b43,Charles Winston Blue Mother of Pearl Dial Black Satin Strap Ladies Watch WS0292,https://www.ebay.com/itm/311647034179?hash=item488f9c5b43:g:2F4AAOSwgY9XdZxr,$38.25,"Fort Lauderdale, Florida, United States",https://i.ebayimg.com/thumbs/images/g/2F4AAOSwgY9XdZxr/s-l225.jpg,bizcool1998,https://www.ebay.com/usr/bizcool1998?_trksid=p2047675.l2559,Instant,0,0,3,"Jan 30, 2021 14:28:33 PST"
item2139980ab1,Rolex 36mm Datejust Baby Blue Mother Of Pearl Diamond Dial Stainless Steel Watch,https://www.ebay.com/itm/142700186289?hash=item2139980ab1:g:rtEAAOSw51JbbI1h,"$9,234.00","New York, New York, United States",https://i.ebayimg.com/thumbs/images/g/rtEAAOSw51JbbI1h/s-l225.jpg,watch_my_diamonds,https://www.ebay.com/usr/watch_my_diamonds?_trksid=p2047675.l2559,Instant,0,0,2,"May 18, 2021 12:25:18 PDT"
item1ac0801038,Citizen Eco-Drive EM0910-80N Blue Mother Of Pearl Elegant Ladies Analog Watch,https://www.ebay.com/itm/114898767928?hash=item1ac0801038:g:uR0AAOSwujtg9mqx,$299.00,"Singapore, Singapore",https://i.ebayimg.com/thumbs/images/g/uR0AAOSwujtg9mqx/s-l225.jpg,kriswatches,https://www.ebay.com/usr/kriswatches?_trksid=p2047675.l2559,Instant,0,0,3,"Jul 28, 2021 02:05:40 PDT"
item41e149f477,Ceramic & Steel Blue Mother of Pearl Face White Bracelet Ladies Quartz Watch,https://www.ebay.com/itm/282952594551?hash=item41e149f477:g:LYMAAOSwOhda7NfE,$89.95,"Boca Raton, Florida, United States",https://i.ebayimg.com/thumbs/images/g/LYMAAOSwOhda7NfE/s-l225.jpg,americanpawninbocaraton,https://www.ebay.com/usr/americanpawninbocaraton?_trksid=p2047675.l2559,Instant,0,0,1,"Nov 05, 2019 13:01:49 PST"
item21760a2dff,Vintage Sterling Silver Blue Mother of Pearl Oval Ring Size 5 3/4,https://www.ebay.com/itm/143714299391?hash=item21760a2dff:g:zeQAAOSw0GlfTpn-,$49.00,"Garwood, New Jersey, United States",https://i.ebayimg.com/thumbs/images/g/zeQAAOSw0GlfTpn-/s-l225.jpg,garcoininc,https://www.ebay.com/usr/garcoininc?_trksid=p2047675.l2559,Instant,0,0,1,Unknown
item213997cbf7,Unisex Rolex 36mm Datejust 2 Tone Baby Blue Mother Of Pearl Emerald Diamond,https://www.ebay.com/itm/142700170231?hash=item213997cbf7:g:2dcAAOSw4DJYhkMR,"$7,576.88","New York, New York, United States",https://i.ebayimg.com/thumbs/images/g/2dcAAOSw4DJYhkMR/s-l225.jpg,watch_my_diamonds,https://www.ebay.com/usr/watch_my_diamonds?_trksid=p2047675.l2559,Instant,0,0,2,"Apr 20, 2021 15:06:50 PDT"
item23fcb064a6,Casio LTP-1282P Blue Mother Of Pearl Arabic Numerals Woman's Wristwatch Silver,https://www.ebay.com/itm/154563273894?epid=5037808043&hash=item23fcb064a6:g:kmMAAOSw3rlekIQK,$48.09,"Barnet, United Kingdom",https://i.ebayimg.com/thumbs/images/g/kmMAAOSw3rlekIQK/s-l225.jpg,kamelia_s,https://www.ebay.com/usr/kamelia_s?_trksid=p2047675.l2559,Instant,0,0,1,Unknown
item1a45b7ac4b,Ladies Rolex 26mm Datejust 2 Tone Baby Blue Mother Of Pearl Dial with Diamond,https://www.ebay.com/itm/112838814795?hash=item1a45b7ac4b:g:MiEAAOSw5cNYfTeJ,"$6,999.00","New York, New York, United States",https://i.ebayimg.com/thumbs/images/g/MiEAAOSw5cNYfTeJ/s-l225.jpg,watch_my_diamonds,https://www.ebay.com/usr/watch_my_diamonds?_trksid=p2047675.l2559,Instant,0,0,2,"Jun 02, 2021 14:37:14 PDT"
