id,title,link,price,origin,image,seller_name,seller_link,sell_type,num_bids,num_watchers,num_stock,date
item1abbae2e51,Daniel Mink Blue Mother of Pearl Dial Ladies Watch Swiss Made RSL411SS,https://www.ebay.com/itm/114817904209?hash=item1abbae2e51:g:0BoAAOSwI~lgpmRL,$69.00,"Suffern, New York, United States",https://i.ebayimg.com/thumbs/images/g/0BoAAOSwI~lgpmRL/s-l225.jpg,formotif,https://www.ebay.com/usr/formotif?_trksid=p2047675.l2559,Instant,0,0,Last one,"Jun 24, 2021 16:29:23 PDT"
item4487dd6550,Deep Blue SeaRam 500m diver Men's Watch Blue Mother of Pearl Dial Ceramic bezel,https://www.ebay.com/itm/294337209680?hash=item4487dd6550:g:bcUAAOSwbithGR2T,$345.99,"Greenville, North Carolina, United States",https://i.ebayimg.com/thumbs/images/g/bcUAAOSwbithGR2T/s-l225.jpg,deals_in_time,https://www.ebay.com/usr/deals_in_time?_trksid=p2047675.l2559,Instant,0,0,1,"Aug 15, 2021 07:03:43 PDT"
item28b9223284,Android Virtuoso Tourbillon Moonphase blue mother of pearl watch,https://www.ebay.com/itm/174904717956?hash=item28b9223284:g:uJwAAOSwAo1hIwSz,$820.00,"Brooklyn, New York, United States",https://i.ebayimg.com/thumbs/images/g/uJwAAOSwAo1hIwSz/s-l225.jpg,unitedbargains,https://www.ebay.com/usr/unitedbargains?_trksid=p2047675.l2559,Instant,0,0,1,Unknown
item40029b3274,ANDROID VIRTUOSO TOURBILLON GMT TUNGSTEN STEEL BLUE MOTHER OF PEARL SUN MOON LE,https://www.ebay.com/itm/274921632372?hash=item40029b3274:g:fVUAAOSwTT1hJ7WZ,"$1,795.00","Pompano Beach, Florida, United States",https://i.ebayimg.com/thumbs/images/g/fVUAAOSwTT1hJ7WZ/s-l225.jpg,thesutorhouse,https://www.ebay.com/usr/thesutorhouse?_trksid=p2047675.l2559,Instant,0,0,1,Unknown
item5242958a3d,New Bulova Classic Blue Mother of Pearl Diamond Dial Women's Watch 96P191,https://www.ebay.com/itm/353304414781?epid=19016567133&hash=item5242958a3d:g:EnwAAOSwep9hBk5T,$219.31,"Brooklyn, New York, United States",https://i.ebayimg.com/thumbs/images/g/EnwAAOSwep9hBk5T/s-l225.jpg,watchmaxx,https://www.ebay.com/usr/watchmaxx?_trksid=p2047675.l2559,Instant,0,0,8,"Aug 30, 2021 07:39:36 PDT"
item2d392e951e,"TAG Heuer Ladies Alter Ego Quartz Watch Blue Mother of Pearl Dial 6.5"" - WP1312",https://www.ebay.com/itm/194232882462?hash=item2d392e951e:g:7bUAAOSwwhRg8c8O,$339.00,"Brooklyn, New York, United States",https://i.ebayimg.com/thumbs/images/g/7bUAAOSwwhRg8c8O/s-l225.jpg,jvjewelrynmore,https://www.ebay.com/usr/jvjewelrynmore?_trksid=p2047675.l2559,Instant,0,0,1,"Aug 26, 2021 19:09:44 PDT"
item52399fde47,New Bulova Marine Star Blue Mother of Pearl Diamond Dial Women's Watch 96R215,https://www.ebay.com/itm/353154096711?epid=2255152536&hash=item52399fde47:g:wCAAAOSwTlNhJREP,$277.55,"Brooklyn, New York, United States",https://i.ebayimg.com/thumbs/images/g/wCAAAOSwTlNhJREP/s-l225.jpg,watchmaxx,https://www.ebay.com/usr/watchmaxx?_trksid=p2047675.l2559,Instant,0,0,8,"Aug 24, 2021 08:32:30 PDT"
item23cad8dbe3,Skagen Women's 36mm Blue Mother of Pearl Dial Leather Watch SKW2731 NEW!,https://www.ebay.com/itm/153727065059?epid=22025416696&hash=item23cad8dbe3:g:CvoAAOSwK~pd0AgE,$62.97,"North Las Vegas, Nevada, United States",https://i.ebayimg.com/thumbs/images/g/CvoAAOSwK~pd0AgE/s-l225.jpg,sapphirediamondace,https://www.ebay.com/usr/sapphirediamondace?_trksid=p2047675.l2559,Instant,0,0,Last one,"May 24, 2021 15:13:10 PDT"
item44893658d3,INVICTA PRO DRIVER BLUE MOTHER OF PEARL DIAL MEN'S WATCH 23067 $225.00,https://www.ebay.com/itm/294359816403?epid=2254645604&hash=item44893658d3:g:EJ0AAOSwwzZhEZnD,$66.95,"Fort Worth, Texas, United States",https://i.ebayimg.com/thumbs/images/g/EJ0AAOSwwzZhEZnD/s-l225.jpg,thegemstones,https://www.ebay.com/usr/thegemstones?_trksid=p2047675.l2559,Instant,0,0,1,Unknown
item2661ebd075,Buccellati 5211 Audachron Blue Mother of Pearl Roman Automatic Movement Watch,https://www.ebay.com/itm/164851601525?hash=item2661ebd075:g:DlcAAOSwY8BgkwK2,"$7,467.00","Pikesville, Maryland, United States",https://i.ebayimg.com/thumbs/images/g/DlcAAOSwY8BgkwK2/s-l225.jpg,radcliffe_jewelers,https://www.ebay.com/usr/radcliffe_jewelers?_trksid=p2047675.l2559,Instant,0,0,1,"Aug 24, 2021 11:37:12 PDT"
item2139f6f3b5,Mens Rolex Stainless Steel Datejust Watch Blue Mother of Pearl Roman Dial 16030,https://www.ebay.com/itm/142706406325?hash=item2139f6f3b5:g:6n4AAOSwRYFalyYr,"$4,913.98","Keller, Texas, United States",https://i.ebayimg.com/thumbs/images/g/6n4AAOSwRYFalyYr/s-l225.jpg,beckertime,https://www.ebay.com/usr/beckertime?_trksid=p2047675.l2559,Instant,0,0,Last one,"Jul 19, 2021 08:18:04 PDT"
item4dc7b01b4a,Technomarine TM-718005 Sea  48mm Blue Mother of Pearl Chronograph Watch,https://www.ebay.com/itm/334062689098?epid=6035050139&hash=item4dc7b01b4a:g:kBoAAOSwyzJg35RS,$150.90,"Miami, Florida, United States",https://i.ebayimg.com/thumbs/images/g/kBoAAOSwyzJg35RS/s-l225.jpg,jkvdluxurygoods,https://www.ebay.com/usr/jkvdluxurygoods?_trksid=p2047675.l2559,Instant,0,0,1,"Jul 02, 2021 15:36:10 PDT"
item3fdb801b2e,Alexander Blue Mother of Pearl Moon phase Face Swiss Made Women's Quartz Watch,https://www.ebay.com/itm/274265545518?epid=2254613847&hash=item3fdb801b2e:g:PZkAAOSwWbReOHpB,$199.99,"Brooklyn, New York, United States",https://i.ebayimg.com/thumbs/images/g/PZkAAOSwWbReOHpB/s-l225.jpg,stuhrling,https://www.ebay.com/usr/stuhrling?_trksid=p2047675.l2559,Instant,0,0,More than 10,"Aug 29, 2021 01:40:42 PDT"
item3dc12d47a3,"925 Sterling Silver Blue Mother of Pearl Filigree Pendant Necklace 19-21"" Adj",https://www.ebay.com/itm/265233975203?hash=item3dc12d47a3:g:vs8AAOSwL6xg8z5q,$27.99,"Gladewater, Texas, United States",https://i.ebayimg.com/thumbs/images/g/vs8AAOSwL6xg8z5q/s-l225.jpg,gingergraf1,https://www.ebay.com/usr/gingergraf1?_trksid=p2047675.l2559,Instant,0,0,1,"Aug 18, 2021 14:02:23 PDT"
item26672b0c76,Aquacy Cave Diver Blue Mother of Pearl MOP Dial Automatic 42 mm w Black Leather,https://www.ebay.com/itm/164939631734?hash=item26672b0c76:g:0KEAAOSwwCVg3ka1,$225.00,"San Juan, Puerto Rico, United States",https://i.ebayimg.com/thumbs/images/g/0KEAAOSwwCVg3ka1/s-l225.jpg,tropicalia_pr,https://www.ebay.com/usr/tropicalia_pr?_trksid=p2047675.l2559,Instant,0,0,1,"Aug 29, 2021 15:32:47 PDT"
item5ddaf849a6,Invicta Speedway 40mm Blue Mother of Pearl Dial Two-Tone Chronograph Watch 28668,https://www.ebay.com/itm/403105663398?hash=item5ddaf849a6:g:FowAAOSwt9NhJ1rX,$126.59,"South Jordan, Utah, United States",https://i.ebayimg.com/thumbs/images/g/FowAAOSwt9NhJ1rX/s-l225.jpg,klawkwatches,https://www.ebay.com/usr/klawkwatches?_trksid=p2047675.l2559,Instant,0,0,2,"Aug 26, 2021 21:03:11 PDT"
item28b8e6f83f,Breitling Windrider Blue Mother of Pearl Women's Watch - A71340,https://www.ebay.com/itm/174900836415?epid=17044269260&hash=item28b8e6f83f:g:UkgAAOSwEV1hHzCB,"$2,500.00","Buena Park, California, United States",https://i.ebayimg.com/thumbs/images/g/UkgAAOSwEV1hHzCB/s-l225.jpg,aljam_asee,https://www.ebay.com/usr/aljam_asee?_trksid=p2047675.l2559,Instant,0,0,1,Unknown
item368404e814,MOVADO CONCERTO Blue Mother Of Pearl Museum Dial St Steel Swiss Quartz Watch,https://www.ebay.com/itm/234143148052?epid=1604123035&hash=item368404e814:g:sAsAAOSwouFhGvC9,$195.00,"Bozeman, Montana, United States",https://i.ebayimg.com/thumbs/images/g/sAsAAOSwouFhGvC9/s-l225.jpg,kasiart,https://www.ebay.com/usr/kasiart?_trksid=p2047675.l2559,Instant,0,0,1,Unknown
item3430289134,Rare TAG Heuer Blue Mother of Pearl Women’s Link Watch -Price Drop!,https://www.ebay.com/itm/224146264372?hash=item3430289134:g:-h0AAOSwG-dfU7zv,$500.00,"Knoxville, Tennessee, United States",https://i.ebayimg.com/thumbs/images/g/-h0AAOSwG-dfU7zv/s-l225.jpg,kati.clev,https://www.ebay.com/usr/kati.clev?_trksid=p2047675.l2559,Instant,0,0,1,"Aug 06, 2021 10:46:04 PDT"
item28b2a81309,ROLEX LADIES DATEJUST ICE BABY BLUE MOTHER OF PEARL DIAMOND WATCH + ROLEX BAND,https://www.ebay.com/itm/174796051209?hash=item28b2a81309:g:mKwAAOSweMhgv5Ql,"$3,940.00","Chino Hills, California, United States",https://i.ebayimg.com/thumbs/images/g/mKwAAOSweMhgv5Ql/s-l225.jpg,purewatches,https://www.ebay.com/usr/purewatches?_trksid=p2047675.l2559,Instant,0,0,1,"Aug 30, 2021 03:46:47 PDT"
item1f2ae5567d,WOMEN'S BLUE MOTHER OF PEARL SILVER TONE AND CRYSTAL WATCH,https://www.ebay.com/itm/133863659133?hash=item1f2ae5567d:g:iWUAAOSwpjlggHPQ,$25.00,"Little Neck, New York, United States",https://i.ebayimg.com/thumbs/images/g/iWUAAOSwpjlggHPQ/s-l225.jpg,sparkledreams,https://www.ebay.com/usr/sparkledreams?_trksid=p2047675.l2559,Instant,0,0,1,Unknown
item1d1206cb4a,Breitling B50 Cockpit Night Mission Limited Blue Mother of Pearl VB5010,https://www.ebay.com/itm/124856486730?hash=item1d1206cb4a:g:nbMAAOSwYbhhGq9q,"$6,395.00","Greenwich, Connecticut, United States",https://i.ebayimg.com/thumbs/images/g/nbMAAOSwYbhhGq9q/s-l225.jpg,watchfanaticct,https://www.ebay.com/usr/watchfanaticct?_trksid=p2047675.l2559,Instant,0,0,1,"Aug 16, 2021 11:33:40 PDT"
item3fc22e870b,"Navy Blue Mother Of Pearl Buttons Set (MOP) For Suit, Blazer, or Sportcoat",https://www.ebay.com/itm/273840768779?hash=item3fc22e870b:g:dEwAAOSwNXpc1buB,$26.99,"Carmel, Indiana, United States",https://i.ebayimg.com/thumbs/images/g/dEwAAOSwNXpc1buB/s-l225.jpg,thediscerningsupply,https://www.ebay.com/usr/thediscerningsupply?_trksid=p2047675.l2559,Instant,0,0,More than 10,"Jan 10, 2021 09:58:36 PST"
item23f0e2cece,TAG Heuer Alter Ego Blue Mother of Pearl Women's Watch - WP1312.BA0750,https://www.ebay.com/itm/154365251278?epid=19043781354&hash=item23f0e2cece:g:KtEAAOSwqo1gR5Qc,$545.00,"Madison, Alabama, United States",https://i.ebayimg.com/thumbs/images/g/KtEAAOSwqo1gR5Qc/s-l225.jpg,cynful2no,https://www.ebay.com/usr/cynful2no?_trksid=p2047675.l2559,Instant,0,0,1,"May 07, 2021 06:02:12 PDT"
item59750a7d18,Caravelle by Bulova Women's Diamond watch 43P000 Blue Mother of Pearl Diall,https://www.ebay.com/itm/384215711000?hash=item59750a7d18:g:H1wAAOSwpUtgwpE9,$59.00,"Reseda, California, United States",https://i.ebayimg.com/thumbs/images/g/H1wAAOSwpUtgwpE9/s-l225.jpg,topbrandwatches,https://www.ebay.com/usr/topbrandwatches?_trksid=p2047675.l2559,Instant,0,0,8,"Jun 10, 2021 15:36:27 PDT"
item1d1107948d,TAG Heuer Aquaracer Blue Mother of Pearl Women's Watch - WAF1419.BA0824,https://www.ebay.com/itm/124839761037?epid=28043778603&hash=item1d1107948d:g:FlkAAOSwYB5hC~B9,$749.99,"Swannanoa, North Carolina, United States",https://i.ebayimg.com/thumbs/images/g/FlkAAOSwYB5hC~B9/s-l225.jpg,scottbuy4less,https://www.ebay.com/usr/scottbuy4less?_trksid=p2047675.l2559,Instant,0,0,1,"Aug 20, 2021 13:15:36 PDT"
item3fe9628543,PALE BLUE MOTHER OF PEARL  PEARLESCENT SEASHELL DANGLE  EARRINGS 80's VINTAGE,https://www.ebay.com/itm/274498487619?hash=item3fe9628543:g:0~sAAOSwNlVef4Tz,$13.00,"Capitola, California, United States",https://i.ebayimg.com/thumbs/images/g/0~sAAOSwNlVef4Tz/s-l225.jpg,starbirdsplace,https://www.ebay.com/usr/starbirdsplace?_trksid=p2047675.l2559,Instant,0,0,2,"Aug 30, 2021 15:14:49 PDT"
item46b3969e17,Skagen SKW6519 Grenen Blue Mother of Pearl Dial Silver Stainless Men's Watch NWT,https://www.ebay.com/itm/303660703255?epid=7033730139&hash=item46b3969e17:g:LHwAAOSw2gJfPxdB,$59.55,"Atlanta, Georgia, United States",https://i.ebayimg.com/thumbs/images/g/LHwAAOSw2gJfPxdB/s-l225.jpg,auntiecarolescloset,https://www.ebay.com/usr/auntiecarolescloset?_trksid=p2047675.l2559,Instant,0,0,1,"May 19, 2021 18:29:13 PDT"
item4200c16f20,Navy Blue Mother Of Pearl Dress Shirt Buttons Set (MOP),https://www.ebay.com/itm/283480518432?hash=item4200c16f20:g:Q84AAOSwtRNc1bv3,$22.99,"Carmel, Indiana, United States",https://i.ebayimg.com/thumbs/images/g/Q84AAOSwtRNc1bv3/s-l225.jpg,thediscerningsupply,https://www.ebay.com/usr/thediscerningsupply?_trksid=p2047675.l2559,Instant,0,0,More than 10,"Mar 10, 2021 10:01:15 PST"
item5b8627bb53,NWT Michael Kors Darci Blue Mother of Pearl Capri Chic 39mm Watch MK3515,https://www.ebay.com/itm/393092774739?hash=item5b8627bb53:g:2AsAAOSwScBf~Pqu,$139.99,"Fort Myers, Florida, United States",https://i.ebayimg.com/thumbs/images/g/2AsAAOSwScBf~Pqu/s-l225.jpg,lovestoshopboutique*com,https://www.ebay.com/usr/lovestoshopboutique*com?_trksid=p2047675.l2559,Instant,0,0,Last one,"Aug 02, 2021 19:19:39 PDT"
item3b65f29c77,Seiko Women Solar Silver Stainless St Blue Mother of Pearl Dial Watch SUP385-H1,https://www.ebay.com/itm/255113469047?hash=item3b65f29c77:g:914AAOSwQC9eihW9,$49.99,"Sarasota, Florida, United States",https://i.ebayimg.com/thumbs/images/g/914AAOSwQC9eihW9/s-l225.jpg,nashbids,https://www.ebay.com/usr/nashbids?_trksid=p2047675.l2559,Instant,0,0,1,Unknown
item597d6c63a9,"Vintage Watch SEIKO Diver 7002 Mod w/""Fishbone"" Set on Blue Mother of Pearl Dial",https://www.ebay.com/itm/384356344745?hash=item597d6c63a9:g:59cAAOSww4lhKf~f,$37.21,"Pelican Waters, QLD, Australia",https://i.ebayimg.com/thumbs/images/g/59cAAOSww4lhKf~f/s-l225.jpg,kontrolsports,https://www.ebay.com/usr/kontrolsports?_trksid=p2047675.l2559,Instant,0,0,1,Unknown
item23fbe5e228,Silver & Rich Blue Mother of Pearl Chip Dangle Hoop Earrings. Beach.,https://www.ebay.com/itm/154550002216?hash=item23fbe5e228:g:hbEAAOSwg4JhA23J,$6.99,"Aliso Viejo, California, United States",https://i.ebayimg.com/thumbs/images/g/hbEAAOSwg4JhA23J/s-l225.jpg,katlovebeads,https://www.ebay.com/usr/katlovebeads?_trksid=p2047675.l2559,Instant,0,0,5,"Jul 29, 2021 20:11:32 PDT"
item56fd08cd24,JD 925 Blue Mother of Pearl Long Beaded 60” necklace 3 Bracelets & Earrings Set,https://www.ebay.com/itm/373612399908?hash=item56fd08cd24:g:1fMAAOSw~2JgxEFE,$20.00,"La Habra, California, United States",https://i.ebayimg.com/thumbs/images/g/1fMAAOSw~2JgxEFE/s-l225.jpg,dingdingzdoodlez,https://www.ebay.com/usr/dingdingzdoodlez?_trksid=p2047675.l2559,Instant,0,0,1,"Aug 15, 2021 00:30:02 PDT"
item3db72b0b00,Bulova 96R230  Blue  Mother-of-Pearl Dial Ladies Quartz,https://www.ebay.com/itm/265066056448?epid=4036440917&hash=item3db72b0b00:g:wH0AAOSwQkVg1hvB,$155.00,"Tucson, Arizona, United States",https://i.ebayimg.com/thumbs/images/g/wH0AAOSwQkVg1hvB/s-l225.jpg,richardso_37,https://www.ebay.com/usr/richardso_37?_trksid=p2047675.l2559,Instant,0,0,1,"Jun 29, 2021 12:32:03 PDT"
item3da1795935,Sterling Silver Denim Blue Mother Of Pearl Necklace,https://www.ebay.com/itm/264702089525?hash=item3da1795935:g:NTcAAOSwaeBemKpN,$4.00,"Jeffersonville, Kentucky, United States",https://i.ebayimg.com/thumbs/images/g/NTcAAOSwaeBemKpN/s-l225.jpg,gman2u0,https://www.ebay.com/usr/gman2u0?_trksid=p2047675.l2559,Instant,0,0,More than 10,"Mar 20, 2021 06:43:27 PDT"
item1ac0cacff8,Invicta 2688 Men's Pro Diver Stainless Steel Blue Mother of Pearl Dial,https://www.ebay.com/itm/114903666680?hash=item1ac0cacff8:g:PiIAAOSwQnxg-utZ,$90.00,"Oregon, Ohio, United States",https://i.ebayimg.com/thumbs/images/g/PiIAAOSwQnxg-utZ/s-l225.jpg,tooleedoo,https://www.ebay.com/usr/tooleedoo?_trksid=p2047675.l2559,Instant,0,0,1,"Jul 29, 2021 05:29:28 PDT"
item1d0d549527,Judith Ripka Blue Mother Of Pearl CZ Topaz Rope Twist Textured Band Ladies Watch,https://www.ebay.com/itm/124777698599?hash=item1d0d549527:g:hrwAAOSwMbZgzOhE,$129.00,"Albany, New York, United States",https://i.ebayimg.com/thumbs/images/g/hrwAAOSwMbZgzOhE/s-l225.jpg,romanjewelsgold,https://www.ebay.com/usr/romanjewelsgold?_trksid=p2047675.l2559,Instant,0,0,1,"Jul 11, 2021 18:11:57 PDT"
item2ad370910d,Blue Mother of Pearl Grips for Taurus Tracker Model 415 425 445 450 606 617 627,https://www.ebay.com/itm/183935996173?hash=item2ad370910d:g:T00AAOSw5QZdajYy,$970.00,"BKK, Thailand",https://i.ebayimg.com/thumbs/images/g/T00AAOSw5QZdajYy/s-l225.jpg,vitoonmakers,https://www.ebay.com/usr/vitoonmakers?_trksid=p2047675.l2559,Instant,0,0,Last one,"Aug 04, 2021 20:57:34 PDT"
item1d02e75cc0,LIA SOPHIA 'Victoria' Silver Blue Mother of Pearl Long or Layer Beaded Necklace,https://www.ebay.com/itm/124602768576?hash=item1d02e75cc0:g:nHIAAOSwBSpfx~TP,$13.49,"Mesquite, Texas, United States",https://i.ebayimg.com/thumbs/images/g/nHIAAOSwBSpfx~TP/s-l225.jpg,ausseys_treasures,https://www.ebay.com/usr/ausseys_treasures?_trksid=p2047675.l2559,Instant,0,0,Last one,"Aug 11, 2021 11:58:39 PDT"
item3b5b1318d0,EMPORIO ARMANI AR1959 Retro Sea Blue Mother Of Pearl Dial Ladies Watch,https://www.ebay.com/itm/254931048656?hash=item3b5b1318d0:g:Ak4AAOSwmVFgbGi-,$199.00,"Springfield, Virginia, United States",https://i.ebayimg.com/thumbs/images/g/Ak4AAOSwmVFgbGi-/s-l225.jpg,watch-and-parts,https://www.ebay.com/usr/watch-and-parts?_trksid=p2047675.l2559,Instant,0,0,1,"Aug 24, 2021 10:16:46 PDT"
item42392de163,Vintage Alpaca Mexico Silver Blue Mother of Pearl Inlay Dangle Pierced Earrings,https://www.ebay.com/itm/284427149667?hash=item42392de163:g:pZoAAOSwm8dhKRHj,$2.99,"New Port Richey, Florida, United States",https://i.ebayimg.com/thumbs/images/g/pZoAAOSwm8dhKRHj/s-l225.jpg,ptc6845,https://www.ebay.com/usr/ptc6845?_trksid=p2047675.l2559,Instant,0,0,1,Unknown
item344a17a0e6,Judith Ripka Stainless Steel Watch Blue Mother of Pearl Diamonique Accents Swiss,https://www.ebay.com/itm/224581361894?hash=item344a17a0e6:g:I-QAAOSwaNBgrFbQ,$94.99,"Salem, Massachusetts, United States",https://i.ebayimg.com/thumbs/images/g/I-QAAOSwaNBgrFbQ/s-l225.jpg,ren890,https://www.ebay.com/usr/ren890?_trksid=p2047675.l2559,Instant,0,0,1,Unknown
item2afcf2a1cc,"Ladies DKNY Blue Mother of Pearl Silver Tone Watch, Date, Gray Leather NY8037",https://www.ebay.com/itm/184632385996?hash=item2afcf2a1cc:g:WP4AAOSwCa1gCyMk,$20.99,"Arlington, Virginia, United States",https://i.ebayimg.com/thumbs/images/g/WP4AAOSwCa1gCyMk/s-l225.jpg,sloan_time,https://www.ebay.com/usr/sloan_time?_trksid=p2047675.l2559,Instant,0,0,1,"Aug 18, 2021 16:34:56 PDT"
item3ff7ad2cdb,TURQUOISE BLUE MOTHER OF PEARL  DANGLE BEADED EARRINGS 80's VINTAGE,https://www.ebay.com/itm/274738261211?hash=item3ff7ad2cdb:g:PXQAAOSwe95gYgTc,$13.00,"Capitola, California, United States",https://i.ebayimg.com/thumbs/images/g/PXQAAOSwe95gYgTc/s-l225.jpg,starbirdsplace,https://www.ebay.com/usr/starbirdsplace?_trksid=p2047675.l2559,Instant,0,0,Last one,Unknown
item3fe961dd72,PALE BLUE MOTHER OF PEARL SEASHELL DANGLE EARRINGS WITH MARCASITE  CAP 80',https://www.ebay.com/itm/274498444658?hash=item3fe961dd72:g:2SAAAOSwN1pef53s,$14.00,"Capitola, California, United States",https://i.ebayimg.com/thumbs/images/g/2SAAAOSwN1pef53s/s-l225.jpg,starbirdsplace,https://www.ebay.com/usr/starbirdsplace?_trksid=p2047675.l2559,Instant,0,0,Last one,"Oct 02, 2020 13:46:31 PDT"
item2f66a311f3,AVENUE Brand Dyed Blue Mother of Pearl Fashion Necklace Double Strand Pretty!,https://www.ebay.com/itm/203585425907?hash=item2f66a311f3:g:sy0AAOSwdFxhKtVT,$12.88,"San Antonio, Texas, United States",https://i.ebayimg.com/thumbs/images/g/sy0AAOSwdFxhKtVT/s-l225.jpg,memorylanetreasures727,https://www.ebay.com/usr/memorylanetreasures727?_trksid=p2047675.l2559,Instant,0,0,1,Unknown
item23fdffa3df,🌸 Ladies Silver Blue Mother of Pearl Inlay Bracelet (B5)🌸,https://www.ebay.com/itm/154585244639?hash=item23fdffa3df:g:UgoAAOSwnLthJ78C,$10.99,"Abilene, Texas, United States",https://i.ebayimg.com/thumbs/images/g/UgoAAOSwnLthJ78C/s-l225.jpg,dblay2012,https://www.ebay.com/usr/dblay2012?_trksid=p2047675.l2559,Instant,0,0,1,"Aug 29, 2021 10:47:47 PDT"
item52565ee6ff,Victorian antique  blue  mother of pearl satin glass miniature oil  lamp,https://www.ebay.com/itm/353636378367?hash=item52565ee6ff:g:xb8AAOSwbUthIXHx,$349.00,"Upper Sandusky, Ohio, United States",https://i.ebayimg.com/thumbs/images/g/xb8AAOSwbUthIXHx/s-l225.jpg,jhenry114,https://www.ebay.com/usr/jhenry114?_trksid=p2047675.l2559,Instant,0,0,1,Unknown
item1abfec660d,Invicta Chronograph Diamond Bezel Blue Mother of Pearl Dial Women's Watch,https://www.ebay.com/itm/114889090573?hash=item1abfec660d:g:2hwAAOSwS8Jg7J-M,$40.00,"Patchogue, New York, United States",https://i.ebayimg.com/thumbs/images/g/2hwAAOSwS8Jg7J-M/s-l225.jpg,baseballbobbyg,https://www.ebay.com/usr/baseballbobbyg?_trksid=p2047675.l2559,Instant,0,0,1,"Jul 24, 2021 17:49:01 PDT"
item2f6691c404,Sterling Silver - PERSONA Blue Mother of Pearl Bracelet Charm Bead - 2.5g,https://www.ebay.com/itm/203584291844?hash=item2f6691c404:g:ZlMAAOSwjWlhC08L,$2.99,"Dallas, Texas, United States",https://i.ebayimg.com/thumbs/images/g/ZlMAAOSwjWlhC08L/s-l225.jpg,thedelune,https://www.ebay.com/usr/thedelune?_trksid=p2047675.l2559,Instant,0,0,1,Unknown
item1a45202cb7,Men's Rolex 36mm Datejust two Tone 16013 Blue  Mother Of Pearl Diamond,https://www.ebay.com/itm/112828886199?hash=item1a45202cb7:g:gtEAAOSwr7ZW8FL8,"$6,994.83","New York, New York, United States",https://i.ebayimg.com/thumbs/images/g/gtEAAOSwr7ZW8FL8/s-l225.jpg,watch_my_diamonds,https://www.ebay.com/usr/watch_my_diamonds?_trksid=p2047675.l2559,Instant,0,0,2,"Apr 20, 2021 15:06:34 PDT"
item1ac3cd4ea5,"Vintage Vivid Blue Mother of Pearl Buckle 2 1/2"" x 1 3/8"" metal hook closure",https://www.ebay.com/itm/114954161829?hash=item1ac3cd4ea5:g:~KgAAOSwDHNhJqR4,$4.99,"Murray, Kentucky, United States",https://i.ebayimg.com/thumbs/images/g/~KgAAOSwDHNhJqR4/s-l225.jpg,55fox,https://www.ebay.com/usr/55fox?_trksid=p2047675.l2559,Instant,0,0,1,"Aug 26, 2021 07:47:06 PDT"
item3b59a69f15,Tag Heuer Ladies Aquaracer Quartz Watch Blue Mother Of Pearl WAF1417 MOP,https://www.ebay.com/itm/254907162389?hash=item3b59a69f15:g:btUAAOSwTwZfyQ1J,$849.99,"Winston-Salem, North Carolina, United States",https://i.ebayimg.com/thumbs/images/g/btUAAOSwTwZfyQ1J/s-l225.jpg,veva29,https://www.ebay.com/usr/veva29?_trksid=p2047675.l2559,Instant,0,0,1,Unknown
item2f4c057ce3,Stuhrling 3959 3 Quartz Chronograph Blue Mother of Pearl Bracelet Womens Watch,https://www.ebay.com/itm/203138890979?hash=item2f4c057ce3:g:Pv8AAOSws0tfhcN5,$125.00,"Brooklyn, New York, United States",https://i.ebayimg.com/thumbs/images/g/Pv8AAOSws0tfhcN5/s-l225.jpg,yourdreamizhere,https://www.ebay.com/usr/yourdreamizhere?_trksid=p2047675.l2559,Instant,0,0,1,"Aug 03, 2021 11:40:34 PDT"
item3dc44cb83f,Judith Ripka Light Blue Mother of Pearl Dial All Stainless Quartz Watch C2382,https://www.ebay.com/itm/265286367295?hash=item3dc44cb83f:g:E8YAAOSwruBhHtmt,$149.00,"Westmont, Illinois, United States",https://i.ebayimg.com/thumbs/images/g/E8YAAOSwruBhHtmt/s-l225.jpg,americash16,https://www.ebay.com/str/lvjce1?_trksid=p2047675.l2563,Instant,0,0,1,Unknown
item4b1fb53f99,Vintage Blue Mother of Pearl Flakes,https://www.ebay.com/itm/322654519193?hash=item4b1fb53f99:g:D~UAAOSwBRVbpqf6,$15.00,"Uniontown, Ohio, United States",https://i.ebayimg.com/thumbs/images/g/D~UAAOSwBRVbpqf6/s-l225.jpg,truman3840,https://www.ebay.com/usr/truman3840?_trksid=p2047675.l2559,Instant,0,0,3,"Nov 13, 2020 16:45:55 PST"
item1eda8c264a,Rolex 36mm Datejust Baby Blue Mother Of Pearl Roman Numeral SS Diamond Watch,https://www.ebay.com/itm/132515636810?hash=item1eda8c264a:g:zwoAAOSwIqJbbI~w,"$9,234.00","New York, New York, United States",https://i.ebayimg.com/thumbs/images/g/zwoAAOSwIqJbbI~w/s-l225.jpg,watch_my_diamonds,https://www.ebay.com/usr/watch_my_diamonds?_trksid=p2047675.l2559,Instant,0,0,2,"May 18, 2021 12:25:13 PDT"
item1cdd2f1bd2,Vintage Blue Mother of Pearl Inlay Sterling Silver Heart Shaped Ring Size 5,https://www.ebay.com/itm/123969936338?hash=item1cdd2f1bd2:g:Ew0AAOSw9xJdxxk1,$49.99,"East Brunswick, New Jersey, United States",https://i.ebayimg.com/thumbs/images/g/Ew0AAOSw9xJdxxk1/s-l225.jpg,leek252,https://www.ebay.com/usr/leek252?_trksid=p2047675.l2559,Instant,0,0,1,"Dec 01, 2020 08:13:36 PST"
item5b6b7a0df4,Blue Mother-of-Pearl Beads Gold-Plated Rosary from Italy,https://www.ebay.com/itm/392645185012?hash=item5b6b7a0df4:g:kQwAAOSwYk5eJKUZ,$8.99,"Kingman, Arizona, United States",https://i.ebayimg.com/thumbs/images/g/kQwAAOSwYk5eJKUZ/s-l225.jpg,webtradeincorporated,https://www.ebay.com/usr/webtradeincorporated?_trksid=p2047675.l2559,Instant,0,0,3,"Apr 13, 2021 09:17:30 PDT"
item2f5506168e,3 Blue Mother Of Pearl And Brass Bangle Bracelets,https://www.ebay.com/itm/203289925262?hash=item2f5506168e:g:zJAAAOSwxjZgOKeG,$15.00,"Kahoka, Missouri, United States",https://i.ebayimg.com/thumbs/images/g/zJAAAOSwxjZgOKeG/s-l225.jpg,ziraape,https://www.ebay.com/usr/ziraape?_trksid=p2047675.l2559,Instant,0,0,1,Unknown
item5d89621ae4,New Dior Christal 38mm Blue Mother Of Pearl Diamond Women's Watch CD114510M001,https://www.ebay.com/itm/401736866532?epid=746429583&hash=item5d89621ae4:g:nbMAAOSwdr5g7E7u,"$7,478.00","Brooklyn, New York, United States",https://i.ebayimg.com/thumbs/images/g/nbMAAOSwdr5g7E7u/s-l225.jpg,watchmaxx,https://www.ebay.com/usr/watchmaxx?_trksid=p2047675.l2559,Instant,0,0,Limited quantity,"Jul 12, 2021 07:17:17 PDT"
item5ba0e9fc82,Chanel Leather Jacket Blue Mother of Pearl Signature Open Front,https://www.ebay.com/itm/393541713026?hash=item5ba0e9fc82:g:6ZgAAOSw1UphLRHW,$349.95,"Atlanta, Georgia, United States",https://i.ebayimg.com/thumbs/images/g/6ZgAAOSw1UphLRHW/s-l225.jpg,asleeponthebeach,https://www.ebay.com/usr/asleeponthebeach?_trksid=p2047675.l2559,Instant,0,0,1,Unknown
item3fec21fefe,BLUE MOTHER OF PEARL  PEARLESCENT SEASHELL DANGLE  EARRINGS 80's VINTAGE,https://www.ebay.com/itm/274544590590?hash=item3fec21fefe:g:oNIAAOSwdWZed-LR,$13.00,"Capitola, California, United States",https://i.ebayimg.com/thumbs/images/g/oNIAAOSwdWZed-LR/s-l225.jpg,starbirdsplace,https://www.ebay.com/usr/starbirdsplace?_trksid=p2047675.l2559,Instant,0,0,2,"Jul 14, 2021 18:09:59 PDT"
item4b76f8dc23,Bering Women's Rose Gold w/Blue Mother of Pearl & Blue Milanaese 10128-368,https://www.ebay.com/itm/324118567971?epid=21031606240&hash=item4b76f8dc23:g:U1cAAOSwM05ef-cP,$179.00,"Redding, California, United States",https://i.ebayimg.com/thumbs/images/g/U1cAAOSwM05ef-cP/s-l225.jpg,mariesjewels,https://www.ebay.com/usr/mariesjewels?_trksid=p2047675.l2559,Instant,0,0,1,Unknown
item262d49fcbf,Hublot MDM Blue Mother of Pearl (MOP) Dial,https://www.ebay.com/itm/163968580799?hash=item262d49fcbf:g:mv4AAOSwOIpd4uuJ,"$1,897.00","Tempe, Arizona, United States",https://i.ebayimg.com/thumbs/images/g/mv4AAOSwOIpd4uuJ/s-l225.jpg,elitefinejewelers,https://www.ebay.com/usr/elitefinejewelers?_trksid=p2047675.l2559,Instant,0,0,1,"Dec 30, 2020 14:34:12 PST"
