id,title,link,price,origin,image,seller_name,seller_link,sell_type,num_bids,num_watchers,num_stock,date
item3640519ca1,Glass Bead Zebra White Nymph Midge Fly Mustad Signature Hooks - 12 Flies,https://www.ebay.com/itm/233007324321?var=532519794532&hash=item3640519ca1:g:2QIAAOSwgCpcSiwu,$8.00,"Houston, Texas, United States",https://i.ebayimg.com/thumbs/images/g/2QIAAOSwgCpcSiwu/s-l225.jpg,regionfishing,https://www.ebay.com/usr/regionfishing?_trksid=p2047675.l2559,Instant,0,0,More than 10,"Jul 26, 2021 13:05:38 PDT"
item33ef67cf28,Attractive tungsten UV White Nymph Pink tagged Wet Fly Trout and Grayling x3,https://www.ebay.com/itm/223059889960?var=521873711754&hash=item33ef67cf28:g:oYgAAOSwwh5bkWjp,$4.26,"Mexborough, United Kingdom",https://i.ebayimg.com/thumbs/images/g/oYgAAOSwwh5bkWjp/s-l225.jpg,gethookedflies,https://www.ebay.com/usr/gethookedflies?_trksid=p2047675.l2559,Instant,0,0,More than 10,"Jul 22, 2021 04:05:38 PDT"
item1edcfb0f69,House Of Goebel White Nymph Bud Vase Excellent Condition,https://www.ebay.com/itm/132556459881?hash=item1edcfb0f69:g:IrgAAOSwACRaui8z,$50.00,"Red Bank, New Jersey, United States",https://i.ebayimg.com/thumbs/images/g/IrgAAOSwACRaui8z/s-l225.jpg,cafazzdonn-0,https://www.ebay.com/usr/cafazzdonn-0?_trksid=p2047675.l2559,Instant,0,0,1,"May 13, 2021 10:19:00 PDT"
item3dbc2a9c1b,House Of Goebel White Nymph Bud Vase,https://www.ebay.com/itm/265149914139?hash=item3dbc2a9c1b:g:kgIAAOSwnopdQjPJ,$21.86,"Joliet, Illinois, United States",https://i.ebayimg.com/thumbs/images/g/kgIAAOSwnopdQjPJ/s-l225.jpg,blue.trees,https://www.ebay.com/usr/blue.trees?_trksid=p2047675.l2559,Instant,0,0,1,"Aug 27, 2021 13:58:30 PDT"
item3ff4029bc5,Calvin Klein Plus Size Modern Cotton Thong Panty QF5117  Pink Black Grey White,https://www.ebay.com/itm/274676751301?var=574902731022&hash=item3ff4029bc5:g:KZIAAOSwXwhgIa4z,$16.50,"Orlando, Florida, United States",https://i.ebayimg.com/thumbs/images/g/KZIAAOSwXwhgIa4z/s-l225.jpg,fashiondealsforyou,https://www.ebay.com/usr/fashiondealsforyou?_trksid=p2047675.l2559,Instant,0,0,4,"Jul 28, 2021 10:44:21 PDT"
item2171acb512,New Art Jugendstil Nymph Figure Porcelain Green And White / Nymph Figurine,https://www.ebay.com/itm/143641064722?hash=item2171acb512:g:sQYAAOSw2H1d34JZ,$43.66,"Nantes, Pays de la Loire, France",https://i.ebayimg.com/thumbs/images/g/sQYAAOSw2H1d34JZ/s-l225.jpg,broc-et-chic,https://www.ebay.com/usr/broc-et-chic?_trksid=p2047675.l2559,Instant,0,0,1,"Aug 30, 2021 09:47:04 PDT"
