id,title,link,price,origin,image,seller_name,seller_link,sell_type,num_bids,num_watchers,num_stock,date
item233aebe721,Bauhinia Galpinii rare RED ORCHID TREE exotic flower bonsai plant  seed 10 seeds,https://www.ebay.com/itm/151312394017?hash=item233aebe721:g:L44AAOxyx0JTg9Cz,$7.99,"Miami, Florida, United States",https://i.ebayimg.com/images/g/L44AAOxyx0JTg9Cz/s-l300.jpg,exotic_cactus_collection,https://www.ebay.com/usr/exotic_cactus_collection?_trksid=p2047675.l2559,Instant,0,0,More than 10,"Jan 29, 2021 20:58:36 PST"
item3fc0a93584,Bauhinia Galpinii - Red Orchid Tree  - Rare Tropical Plant Bonsai Tree Seeds (5),https://www.ebay.com/itm/273815254404?hash=item3fc0a93584:g:hU0AAOxy4YdTQwSe,$3.00,"North Fort Myers, Florida, United States",https://i.ebayimg.com/images/g/hU0AAOxy4YdTQwSe/s-l300.jpg,therealflorida101,https://www.ebay.com/usr/therealflorida101?_trksid=p2047675.l2559,Instant,0,0,More than 10,"Nov 09, 2020 03:32:13 PST"
item54191ef1d0,RED ORCHID TREE Bauhinia Galpinii exotic flower bonsai rare plant seed 10 seeds,https://www.ebay.com/itm/361198711248?hash=item54191ef1d0:g:dwUAAOSw-W5Uxq~y,$7.99,"Miami, Florida, United States",https://i.ebayimg.com/images/g/dwUAAOSw-W5Uxq~y/s-l300.jpg,exotic_cactus_collection,https://www.ebay.com/usr/exotic_cactus_collection?_trksid=p2047675.l2559,Instant,0,0,More than 10,"Jan 29, 2021 20:43:26 PST"
item233aebe859,Bauhinia Galpinii rare RED ORCHID TREE exotic flower bonsai plant  seed 25 seeds,https://www.ebay.com/itm/151312394329?hash=item233aebe859:g:L44AAOxyx0JTg9Cz,$9.98,"Miami, Florida, United States",https://i.ebayimg.com/images/g/L44AAOxyx0JTg9Cz/s-l300.jpg,exotic_cactus_collection,https://www.ebay.com/usr/exotic_cactus_collection?_trksid=p2047675.l2559,Instant,0,0,More than 10,"Jan 29, 2021 20:58:39 PST"
item218923b6c0,Swaziland Bauhinia galpinii imala crocodile stamps (3 stamps total),https://www.ebay.com/itm/144034739904?hash=item218923b6c0:g:se4AAOSwBT5gmGoB,$1.99,"Palmdale, California, United States",https://i.ebayimg.com/images/g/se4AAOSwBT5gmGoB/s-l300.jpg,rahdsma,https://www.ebay.com/usr/rahdsma?_trksid=p2047675.l2559,Instant,0,0,1,Unknown
