id,title,link,image,price_sold,end_date,origin,seller_name,seller_link,sell_type,num_bids,num_sold,auction_end_date
item5264d57539,Barbie Fashionistas 2015 Plus Size Curvy type of body Brown Eyes & Hair,https://www.ebay.com/itm/353879029049?epid=16009822922&hash=item5264d57539:g:ntYAAOSwMFFh8txh,https://i.ebayimg.com/thumbs/images/g/ntYAAOSwMFFh8txh/s-l225.jpg,$12.95,Feb-19 17:57,Unknown,Unknown,Unknown,Instant,0,1,
item46b5ccdb2b,Flexi Rubber Wheel Arch Flare Universal 3m x 75mm Suit All type of 4WD for Hilux,https://www.ebay.com/itm/303697812267?hash=item46b5ccdb2b:g:SEIAAOSwcy1gRmm4&vxp=mtr,https://i.ebayimg.com/thumbs/images/g/SEIAAOSwcy1gRmm4/s-l225.jpg,$29.00,Feb-19 17:52,"Coopers Plains, Australia",Unknown,Unknown,Instant,0,46,
item2d5e3d8744,Kenmore Grill Wall Mounted - Grilling all type of Food Items.,https://www.ebay.com/itm/194854618948?hash=item2d5e3d8744:g:BuwAAOSwUYphx5u2,https://i.ebayimg.com/thumbs/images/g/BuwAAOSwUYphx5u2/s-l225.jpg,$180.00,Feb-19 17:38,Unknown,Unknown,Unknown,Instant,0,1,
item5993cb57b3,MEXICO C331A MNH SOUVENIR SHEET OLYMPIC GAMES TYPE OF 1967 SCV 7.50 *,https://www.ebay.com/itm/384731666355?hash=item5993cb57b3:g:b0oAAOSwNk5hx-yO,https://i.ebayimg.com/thumbs/images/g/b0oAAOSwNk5hx-yO/s-l225.jpg,$0.17,Feb-19 17:03,"Pittsburgh, Pennsylvania, United States",hunter-james,https://www.ebay.com/usr/hunter-james?_trksid=p2047675.l2559,Auction,2,1,"Feb 19, 2022

17:03:23 PST"
item36946d413e,MEXICO C329A MNH SOUVENIR SHEET OLYMPIC GAME TYPE OF 1967 SCV 5.50 *,https://www.ebay.com/itm/234418422078?hash=item36946d413e:g:eM0AAOSwR7hhx-v7,https://i.ebayimg.com/thumbs/images/g/eM0AAOSwR7hhx-v7/s-l225.jpg,$1.25,Feb-19 17:03,"Pittsburgh, Pennsylvania, United States",hunter-james,https://www.ebay.com/usr/hunter-james?_trksid=p2047675.l2559,Auction,4,1,"Feb 19, 2022

17:03:21 PST"
item3dd0541243,1839 Large Cent Coronet Head  ANACS EF-45   Type of 1840  N-8,https://www.ebay.com/itm/265488175683?hash=item3dd0541243:g:xiUAAOSw60th160J,https://i.ebayimg.com/thumbs/images/g/xiUAAOSw60th160J/s-l225.jpg,$305.00,Feb-19 15:14,"Wentzville, Missouri, United States",msticks,https://www.ebay.com/usr/msticks?_trksid=p2047675.l2559,Instant,0,1,
item4dd77c7c4c,"EAST INDIA COMPANY WILLIAM IIII 1/4 RUPEE AD 1835 WITH DIFFT TYPE OF "" 8 "" RARE",https://www.ebay.com/itm/334327741516?hash=item4dd77c7c4c:g:Dt8AAOSwZiliCD65,https://i.ebayimg.com/thumbs/images/g/Dt8AAOSwZiliCD65/s-l225.jpg,$89.46,Feb-19 15:12,"INDIA , India",thehobbysworld,https://www.ebay.com/usr/thehobbysworld?_trksid=p2047675.l2559,Auction,2,1,"Feb 19, 2022

15:12:08 PST"
item25d5b37469,Chevelle - this Type of Thinking (Could Do Us In) [CD New],https://www.ebay.com/itm/162499097705?hash=item25d5b37469:g:cZEAAOSwYzZg7N7Y,https://i.ebayimg.com/thumbs/images/g/cZEAAOSwYzZg7N7Y/s-l225.jpg,$14.04,Feb-19 12:34,"Shepherdsville, Kentucky, United States",Unknown,Unknown,Instant,0,3,
item1f3362f7ba,ISO OPTION #2 PERM KIT for Every Type Of Color-Treated Hair Professional 11.50oz,https://www.ebay.com/itm/134006110138?hash=item1f3362f7ba:g:x0MAAOSwU99gsGgj,https://i.ebayimg.com/thumbs/images/g/x0MAAOSwU99gsGgj/s-l225.jpg,$15.03,Feb-19 10:22,"Ridgefield, New Jersey, United States",kbeautyout,https://www.ebay.com/usr/kbeautyout?_trksid=p2047675.l2559,Instant,0,3,
item28c56d8f87,*Imperfect* Chevelle - THIS TYPE OF THINKING - Vinyl LP - NEW & SEALED!!,https://www.ebay.com/itm/175110983559?hash=item28c56d8f87:g:CWAAAOSwKD5h4hb5,https://i.ebayimg.com/thumbs/images/g/CWAAAOSwKD5h4hb5/s-l225.jpg,$59.97,Feb-19 07:33,"Kalamazoo, Michigan, United States",justright3553_9,https://www.ebay.com/usr/justright3553_9?_trksid=p2047675.l2559,Instant,0,1,
item597bf5f69e,AUSTRIA - private S/S type of Scott 565-567 - on cover to USA - 1950,https://www.ebay.com/itm/384331806366?hash=item597bf5f69e:g:JrcAAOSwOTthGBep,https://i.ebayimg.com/thumbs/images/g/JrcAAOSwOTthGBep/s-l225.jpg,$19.97,Feb-19 04:06,"Rochester, Minnesota, United States",ddaannv,https://www.ebay.com/usr/ddaannv?_trksid=p2047675.l2559,Instant,0,1,
item4246763094,"This Type of Thinking (Could Do Us In) by Chevelle (CD, Sep-2004, Epic)",https://www.ebay.com/itm/284649992340?epid=30991671&hash=item4246763094:g:c1YAAOSw2DNh~f48,https://i.ebayimg.com/thumbs/images/g/c1YAAOSw2DNh~f48/s-l225.jpg,$3.00,Feb-18 20:34,Unknown,Unknown,Unknown,Instant,0,1,
item1d235229c7,"Canon 4 type of LP1216, LP1222, LP1319, LP1424 Soft Lens Case / Pouch from Japan",https://www.ebay.com/itm/125146638791?hash=item1d235229c7:g:3ycAAOSwOptiCNQJ,https://i.ebayimg.com/thumbs/images/g/3ycAAOSwOptiCNQJ/s-l225.jpg,$50.00,Feb-18 19:58,"Tokyo, Japan",Unknown,Unknown,Instant,0,1,
item240b8a3c1e,"Croatia - Fastest electric car Nevera-Rimac, all 5 type of Crypto Stamps, MNH",https://www.ebay.com/itm/154812431390?hash=item240b8a3c1e:g:KI8AAOSwY5lhcSK1,https://i.ebayimg.com/thumbs/images/g/KI8AAOSwY5lhcSK1/s-l225.jpg,$149.99,Feb-18 15:40,"zagreb, default, Croatia, Republic of",hobistahr,https://www.ebay.com/usr/hobistahr?_trksid=p2047675.l2559,Instant,0,1,
item4dd72d0d82,LL COOL J I’m That Type Of Guy Single 12” VG+ Vinyl in Shrink,https://www.ebay.com/itm/334322535810?epid=1400933894&hash=item4dd72d0d82:g:ImQAAOSw4Vxg4z6Y,https://i.ebayimg.com/thumbs/images/g/ImQAAOSw4Vxg4z6Y/s-l225.jpg,$9.00,Feb-18 14:58,Unknown,Unknown,Unknown,Instant,0,1,
item3457797c98,GERMANY BERLIN SCOTT 9NB171 - 9NB174 MNH SET - WILDFLOWER TYPE OF 1980,https://www.ebay.com/itm/224805878936?hash=item3457797c98:g:jfgAAOSwsw1h7uNF,https://i.ebayimg.com/thumbs/images/g/jfgAAOSwsw1h7uNF/s-l225.jpg,$2.79,Feb-18 13:28,"Marshall, Michigan, United States",midweststamptrader,https://www.ebay.com/usr/midweststamptrader?_trksid=p2047675.l2559,Instant,0,1,
item2f6a152f16,Jaclock white swivel restrictor with security screws fits all type of windows,https://www.ebay.com/itm/203643236118?hash=item2f6a152f16:g:~RMAAOSw32FeXomp,https://i.ebayimg.com/thumbs/images/g/~RMAAOSw32FeXomp/s-l225.jpg,$8.68,Feb-18 13:17,"Darlington, United Kingdom",Unknown,Unknown,Instant,0,1,
item216ff221d0,"Chinese Style Bonsai Handle Casting Scissors 5"" perfect for all type of work usa",https://www.ebay.com/itm/143612060112?hash=item216ff221d0:g:BkoAAMXQgJRRANYe,https://i.ebayimg.com/thumbs/images/g/BkoAAMXQgJRRANYe/s-l225.jpg,$6.99,Feb-18 12:57,"Los Angeles, California, United States",Unknown,Unknown,Instant,0,20,
item2b12e1ffca,"Japan Z614-Z619 Flower type of 1990 USED Stamps, 2004)",https://www.ebay.com/itm/185000394698?hash=item2b12e1ffca:g:7gkAAOSwmEJhGavW,https://i.ebayimg.com/thumbs/images/g/7gkAAOSwmEJhGavW/s-l225.jpg,$1.49,Feb-18 11:54,"La Pine, Oregon, United States",Unknown,Unknown,Instant,0,3,
item44a39ab47f,SOME TYPE OF COIN / MEDAL FOUND IN HOUSE CLEARANCE UNKNOWN HISTORY 99p NO RESERV,https://www.ebay.com/itm/294802601087?hash=item44a39ab47f:g:L-8AAOSw9YNiAj-Z,https://i.ebayimg.com/thumbs/images/g/L-8AAOSw9YNiAj-Z/s-l225.jpg,$84.49,Feb-18 02:05,"Gloucestershire, United Kingdom",abbotscorner,https://www.ebay.com/usr/abbotscorner?_trksid=p2047675.l2559,Auction,20,1,"Feb 18, 2022

02:05:52 PST"
item525f43c3e6,Wireless bluetooth earphones ( for all type of smart phones),https://www.ebay.com/itm/353785594854?hash=item525f43c3e6:g:CRIAAOSwEM9hnRUM,https://i.ebayimg.com/thumbs/images/g/CRIAAOSwEM9hnRUM/s-l225.jpg,$9.99,Feb-18 00:04,"Tokyo, Japan",Unknown,Unknown,Instant,0,1,
item52493dfe20,2 Pcs BRIDE Gradation Seat Belt Cover Shoulder Pads Fabric Racing Seat Material,https://www.ebay.com/itm/353416117792?hash=item52493dfe20:g:bgMAAOSwdohfmOMP&vxp=mtr,https://i.ebayimg.com/thumbs/images/g/bgMAAOSwdohfmOMP/s-l225.jpg,$11.88,Feb-17 23:00,"WenZhou,Zhejiang, China",Unknown,Unknown,Instant,0,5,
item219f935a6d,yellow studs for all type of earrings back,https://www.ebay.com/itm/144411155053?hash=item219f935a6d:g:i0gAAOSwDDJiCI7L,https://i.ebayimg.com/thumbs/images/g/i0gAAOSwDDJiCI7L/s-l225.jpg,$0.01,Feb-17 20:53,"New York, New York, United States",diamondforgood9,https://www.ebay.com/usr/diamondforgood9?_trksid=p2047675.l2559,Auction,1,1,"Feb 17, 2022

20:53:30 PST"
item240d3f21ce,~LARGE~ GROUP OF MIXED TYPE OF TOY LEAD SOLDIERS FOR ONE MONEY (NR),https://www.ebay.com/itm/154841063886?hash=item240d3f21ce:g:IWgAAOSw~JhiBejj,https://i.ebayimg.com/thumbs/images/g/IWgAAOSw~JhiBejj/s-l225.jpg,$18.62,Feb-17 20:41,"INDIANA, United States",larrysantiques_201swgstreet,https://www.ebay.com/usr/larrysantiques_201swgstreet?_trksid=p2047675.l2559,Auction,3,1,"Feb 17, 2022

20:41:09 PST"
item422692989c,Two Boxes Iso Option 2 Perm For Every Type Of Color Treated Hair New,https://www.ebay.com/itm/284114983068?epid=1237551172&hash=item422692989c:g:dIIAAOSwYHFf17qg,https://i.ebayimg.com/thumbs/images/g/dIIAAOSwYHFf17qg/s-l225.jpg,$29.50,Feb-17 18:42,"Davis, California, United States",Unknown,Unknown,Instant,0,14,
item240cba0e7b,"This Type of Thinking (Could Do Us In) by Chevelle (CD, Sep-2004, Epic)",https://www.ebay.com/itm/154832342651?epid=30991671&hash=item240cba0e7b:g:KKMAAOSwwrZiAFFK,https://i.ebayimg.com/thumbs/images/g/KKMAAOSwwrZiAFFK/s-l225.jpg,$4.20,Feb-17 15:42,Unknown,Unknown,Unknown,Instant,0,1,
item3690474569,3 in 1 Premium Metal Guitar Stand For All Standard Type of Guitars 5Core GSH 3N1,https://www.ebay.com/itm/234348823913?hash=item3690474569:g:gRMAAOSwVdphziN-,https://i.ebayimg.com/thumbs/images/g/gRMAAOSwVdphziN-/s-l225.jpg,$25.99,Feb-17 15:41,"Corona, California, United States",5coreinc,https://www.ebay.com/usr/5coreinc?_trksid=p2047675.l2559,Instant,0,40,
item219f8ee4a5,backings for any type of earrings Yellow metal,https://www.ebay.com/itm/144410862757?hash=item219f8ee4a5:g:wg8AAOSwkDBiCDmU,https://i.ebayimg.com/thumbs/images/g/wg8AAOSwkDBiCDmU/s-l225.jpg,$0.01,Feb-17 14:49,"New York, New York, United States",diamondforgood9,https://www.ebay.com/usr/diamondforgood9?_trksid=p2047675.l2559,Auction,1,1,"Feb 17, 2022

14:49:54 PST"
item2d452a4a8e,3618a Washington Type of 2001 23¢ Booklet of 10 Stamps,https://www.ebay.com/itm/194433927822?hash=item2d452a4a8e:g:dhsAAOSwIwpfqtFQ,https://i.ebayimg.com/thumbs/images/g/dhsAAOSwIwpfqtFQ/s-l225.jpg,$3.00,Feb-17 10:15,"Saint Louis, Missouri, United States",Unknown,Unknown,Instant,0,1,
item2ebc20b8e4,Dialux Polishing Compound 8 Bars Set Every Type of Jewelers Rouge Polish Tripoli,https://www.ebay.com/itm/200724756708?epid=1458691291&hash=item2ebc20b8e4:g:-0AAAOSwTBReYa~Z,https://i.ebayimg.com/thumbs/images/g/-0AAAOSwTBReYa~Z/s-l225.jpg,$48.85,Feb-17 09:59,"North Hollywood, California, United States",Unknown,Unknown,Instant,0,383,
item2d5be0ef6a,"antique Cabinet Photo Or Tin Type of 3 chiefs,warrior and a union man 1874 look",https://www.ebay.com/itm/194814996330?hash=item2d5be0ef6a:g:uL0AAOSwilxh8s3H,https://i.ebayimg.com/thumbs/images/g/uL0AAOSwilxh8s3H/s-l225.jpg,$275.00,Feb-17 08:56,"El Sobrante, California, United States",tisha2355,https://www.ebay.com/usr/tisha2355?_trksid=p2047675.l2559,Auction,1,1,"Feb 17, 2022

08:56:47 PST"
item46c0b34af3,"Set of 4 Wheel Cylinder 5/8"" Cups good for any type of brake fluid!",https://www.ebay.com/itm/303880686323?hash=item46c0b34af3:g:zXsAAOSwaRFgI~qc&vxp=mtr,https://i.ebayimg.com/thumbs/images/g/zXsAAOSwaRFgI~qc/s-l225.jpg,$9.95,Feb-17 07:20,"Duluth, Minnesota, United States",Unknown,Unknown,Instant,0,3,
item33ccf40aa9,80g Fresh live Organic Rye Sourdough Starter Can be used with any type of flour!,https://www.ebay.com/itm/222481877673?epid=14006904155&hash=item33ccf40aa9:g:X2MAAOSwxg5XyHwf,https://i.ebayimg.com/thumbs/images/g/X2MAAOSwxg5XyHwf/s-l225.jpg,$5.67,Feb-16 23:08,"Jersey, United Kingdom",Unknown,Unknown,Instant,0,79,
item219f7c4fe1,aluminium on silicon rubber 1 pair backing for all type of earring,https://www.ebay.com/itm/144409645025?hash=item219f7c4fe1:g:H8sAAOSwuIViBxVt,https://i.ebayimg.com/thumbs/images/g/H8sAAOSwuIViBxVt/s-l225.jpg,$0.06,Feb-16 18:03,"New York, New York, United States",diamondforgood9,https://www.ebay.com/usr/diamondforgood9?_trksid=p2047675.l2559,Auction,2,1,"Feb 16, 2022

18:03:23 PST"
item219f7b3319,aluminium silicon rubber stud backing for all type of earring 1 pair,https://www.ebay.com/itm/144409572121?hash=item219f7b3319:g:ZqYAAOSwntxiBwlw,https://i.ebayimg.com/thumbs/images/g/ZqYAAOSwntxiBwlw/s-l225.jpg,$0.06,Feb-16 17:12,"New York, New York, United States",diamondforgood9,https://www.ebay.com/usr/diamondforgood9?_trksid=p2047675.l2559,Auction,2,1,"Feb 16, 2022

17:12:14 PST"
item599370aef9,MEXICO C329A MNH SOUVENIR SHEET OLYMPIC GAME TYPE OF 1967 SCV 5.50 *,https://www.ebay.com/itm/384725724921?hash=item599370aef9:g:eM0AAOSwR7hhx-v7,https://i.ebayimg.com/thumbs/images/g/eM0AAOSwR7hhx-v7/s-l225.jpg,$0.35,Feb-16 16:54,"Pittsburgh, Pennsylvania, United States",hunter-james,https://www.ebay.com/usr/hunter-james?_trksid=p2047675.l2559,Auction,4,1,"Feb 16, 2022

16:54:37 PST"
item599370ae95,MEXICO C331A MNH SOUVENIR SHEET OLYMPIC GAMES TYPE OF 1967 SCV 7.50 *,https://www.ebay.com/itm/384725724821?hash=item599370ae95:g:b0oAAOSwNk5hx-yO,https://i.ebayimg.com/thumbs/images/g/b0oAAOSwNk5hx-yO/s-l225.jpg,$0.38,Feb-16 16:54,"Pittsburgh, Pennsylvania, United States",hunter-james,https://www.ebay.com/usr/hunter-james?_trksid=p2047675.l2559,Auction,4,1,"Feb 16, 2022

16:54:36 PST"
item54a0d85ae2,2 x Sky Zone eyelash extension Gel type of remover,https://www.ebay.com/itm/363475786466?hash=item54a0d85ae2:g:WsoAAOSwWG5ekSac,https://i.ebayimg.com/thumbs/images/g/WsoAAOSwWG5ekSac/s-l225.jpg,$23.23,Feb-16 15:57,"Newtown, Australia",vividbeautyclub,https://www.ebay.com/usr/vividbeautyclub?_trksid=p2047675.l2559,Instant,0,13,
item1d11df6198,L2036 Postcard some type of gypsy woman Salome multiple creasing  colorized,https://www.ebay.com/itm/124853903768?hash=item1d11df6198:g:dP0AAOSwADRhBf5f,https://i.ebayimg.com/thumbs/images/g/dP0AAOSwADRhBf5f/s-l225.jpg,$4.99,Feb-16 14:00,"Winnebago, Illinois, United States",ekimasil2003,https://www.ebay.com/usr/ekimasil2003?_trksid=p2047675.l2559,Instant,0,1,
item423bf4d74f,The Grip Jar Opener Under Cabinet Lid Opens Any Size Type Of Perfect For Weak,https://www.ebay.com/itm/284473743183?hash=item423bf4d74f:g:g0wAAOSwU8BhWIo6,https://i.ebayimg.com/thumbs/images/g/g0wAAOSwU8BhWIo6/s-l225.jpg,$11.99,Feb-16 12:21,"Shanghai, China",Unknown,Unknown,Instant,0,22,
item5263707069,Gynocup Intimate Lightening Serum For All Skin Type Of Underarms And Bikini Area,https://www.ebay.com/itm/353855631465?hash=item5263707069:g:5cgAAOSwIMth4BPz,https://i.ebayimg.com/thumbs/images/g/5cgAAOSwIMth4BPz/s-l225.jpg,$12.99,Feb-16 11:03,"DELHI, DELHI, India",Unknown,Unknown,Instant,0,1,
item2886690fd3,All Steel 37/64-28 TPI Jam Nut For All Type of .45 Muzzle Brake,https://www.ebay.com/itm/174053724115?hash=item2886690fd3:g:6B4AAOSwhQpdl8cw,https://i.ebayimg.com/thumbs/images/g/6B4AAOSwhQpdl8cw/s-l225.jpg,$14.99,Feb-16 09:22,"Ontario, California, United States",Unknown,Unknown,Instant,0,5,
item2b0805556c,ZENGAZ  Pure Torch Jet ZT-68 soft rubberized handle 2 type of flame /1300C,https://www.ebay.com/itm/184818161004?hash=item2b0805556c:g:tWUAAOSwuidgk0Mi,https://i.ebayimg.com/thumbs/images/g/tWUAAOSwuidgk0Mi/s-l225.jpg,$19.99,Feb-16 08:08,"Burbank, California, United States",Unknown,Unknown,Instant,0,8,
item4010d93dd2,"Madame X – Just That Type Of Girl 12"" Single - Atlantic - 1987 Promo Rare",https://www.ebay.com/itm/275160579538?hash=item4010d93dd2:g:L7IAAOSwW-NhoUfj,https://i.ebayimg.com/thumbs/images/g/L7IAAOSwW-NhoUfj/s-l225.jpg,$8.00,Feb-16 07:36,"Sterling Heights, Michigan, United States",umhygienist,https://www.ebay.com/usr/umhygienist?_trksid=p2047675.l2559,Auction,1,1,"Feb 16, 2022

07:36:05 PST"
item3dd373026d,The Workbench Book Scott Landis Craftman's Guide for Every Type of Woodworking,https://www.ebay.com/itm/265540534893?hash=item3dd373026d:g:C98AAOSw9hxiAtyp,https://i.ebayimg.com/thumbs/images/g/C98AAOSw9hxiAtyp/s-l225.jpg,$24.99,Feb-16 07:13,Unknown,Unknown,Unknown,Instant,0,1,
item46b7e88b97,MASTER Set for all CLOCK Key - Total 18 type of Key Set in BOX (5020),https://www.ebay.com/itm/303733181335?hash=item46b7e88b97:g:2p8AAOSwTEtd63sx,https://i.ebayimg.com/thumbs/images/g/2p8AAOSwTEtd63sx/s-l225.jpg,$19.99,Feb-16 03:31,"BHAVNAGAR, GUJARAT, India",Unknown,Unknown,Instant,0,38,
item54af9bdd90,5.10mm backings for any type of earrings Yellow metal,https://www.ebay.com/itm/363723480464?hash=item54af9bdd90:g:kQIAAOSwlbJiBdqV,https://i.ebayimg.com/thumbs/images/g/kQIAAOSwlbJiBdqV/s-l225.jpg,$0.01,Feb-15 19:40,"New York, New York, United States",diamondforgood9,https://www.ebay.com/usr/diamondforgood9?_trksid=p2047675.l2559,Auction,1,1,"Feb 15, 2022

19:40:03 PST"
item3458e2bbf0,"Cover carriage of Unspecified, Unknown Type of Silver. Weight 240g/ 8.45oz.",https://www.ebay.com/itm/224829553648?hash=item3458e2bbf0:g:454AAOSwjZFiAyoZ,https://i.ebayimg.com/thumbs/images/g/454AAOSwjZFiAyoZ/s-l225.jpg,$19.99,Feb-15 18:55,"Toyonaka-shi, Osaka, Japan",hirolicur,https://www.ebay.com/usr/hirolicur?_trksid=p2047675.l2559,Auction,1,1,"Feb 15, 2022

18:55:19 PST"
item5bb7dfb709,1 pair push backs for yellow type of studs earrings,https://www.ebay.com/itm/393926915849?hash=item5bb7dfb709:g:e7MAAOSwIrpiBbtj,https://i.ebayimg.com/thumbs/images/g/e7MAAOSwIrpiBbtj/s-l225.jpg,$0.01,Feb-15 17:26,"New York, New York, United States",diamondforgood9,https://www.ebay.com/usr/diamondforgood9?_trksid=p2047675.l2559,Auction,1,1,"Feb 15, 2022

17:26:58 PST"
item219ec900fe,Vintage  'Barber Pole'  Type of Used Razor Blade Holder and Two Safety Razors,https://www.ebay.com/itm/144397893886?hash=item219ec900fe:g:X34AAOSwxDFh~X~x,https://i.ebayimg.com/thumbs/images/g/X34AAOSwxDFh~X~x/s-l225.jpg,$19.50,Feb-15 17:00,"Stillwater, Minnesota, United States",krkurt4,https://www.ebay.com/usr/krkurt4?_trksid=p2047675.l2559,Auction,1,1,"Feb 15, 2022

17:00:01 PST"
item524cc01f8e,2pcs BRIDE Gradation Seat Belt Cover Shoulder Pads Fabric Racing Seat Material,https://www.ebay.com/itm/353474977678?epid=26040901329&hash=item524cc01f8e:g:uJQAAOSw9Q9fmOJg&vxp=mtr,https://i.ebayimg.com/thumbs/images/g/uJQAAOSw9Q9fmOJg/s-l225.jpg,$10.88,Feb-15 15:33,"WenZhou,Zhejiang, China",Unknown,Unknown,Instant,0,4,
item2d468ba3c3,Humdard Marham Kharish Jadid 50gm For All Type Of Itching By USA FAST FREE SHIP.,https://www.ebay.com/itm/194457084867?hash=item2d468ba3c3:g:4JkAAOSw6yZhclf-,https://i.ebayimg.com/thumbs/images/g/4JkAAOSw6yZhclf-/s-l225.jpg,$24.99,Feb-15 13:41,"Brooklyn, New York, United States",Unknown,Unknown,Instant,0,1,
