id,title,link,image,price_sold,end_date,origin,seller_name,seller_link,sell_type,num_bids,num_sold,auction_end_date
item1f34e3b129,8 Fl Oz Black All Purpose Liquid Dye Easy Dye Technique to Any Type Of Fabric,https://www.ebay.com/itm/134031323433?hash=item1f34e3b129:g:lE8AAOSwog9iE~a9,https://i.ebayimg.com/thumbs/images/g/lE8AAOSwog9iE~a9/s-l225.jpg,$7.40,Feb-25 06:33,"Miami, Florida, United States",Unknown,Unknown,Instant,0,4,
item2a7bdaba35,STOVAX Replacement Vermiculite Stove Brick All type of Bricks with great Quality,https://www.ebay.com/itm/182466558517?hash=item2a7bdaba35:g:dMEAAOSwx6pYsFnf,https://i.ebayimg.com/thumbs/images/g/dMEAAOSwx6pYsFnf/s-l225.jpg,$23.71 to $54.86,Feb-25 03:42,"Chessington, United Kingdom",Unknown,Unknown,Instant,0,90,
item4dd80006dc,Disney Water Bottle - My Favourite Type of People Are Dogs Bottled Flask,https://www.ebay.com/itm/334336362204?hash=item4dd80006dc:g:0kEAAOSwNHViEVJ2,https://i.ebayimg.com/thumbs/images/g/0kEAAOSwNHViEVJ2/s-l225.jpg,$13.34,Feb-25 03:15,"Sheffield, United Kingdom",Unknown,Unknown,Instant,0,1,
item3fec070bcf,MASTER Set for all ANTIQUE CLOCK Key - Total 18 type of Key (5020),https://www.ebay.com/itm/274542824399?hash=item3fec070bcf:g:JooAAOSwmcJd63sS,https://i.ebayimg.com/thumbs/images/g/JooAAOSwmcJd63sS/s-l225.jpg,$21.77,Feb-25 02:58,"India, India",Unknown,Unknown,Instant,0,41,
item289f94cf44,Funny Encouragement Maxine One Type Of Man Men Break Up Hallmark Greeting Card,https://www.ebay.com/itm/174476021572?hash=item289f94cf44:g:f9oAAOSwTStfhDBh,https://i.ebayimg.com/thumbs/images/g/f9oAAOSwTStfhDBh/s-l225.jpg,$5.99,Feb-24 21:52,"Clearwater, Florida, United States",honeybeehello,https://www.ebay.com/usr/honeybeehello?_trksid=p2047675.l2559,Instant,0,1,
item56ddf00c49,Stamp Russia USSR SC 5118-22 Set 1983 Gliders type of 1982 Airplanes Soviet MNH,https://www.ebay.com/itm/373090683977?hash=item56ddf00c49:g:-xMAAOSwvRNiGOII,https://i.ebayimg.com/thumbs/images/g/-xMAAOSwvRNiGOII/s-l225.jpg,$3.20,Feb-24 16:46,"Lacey, Washington, United States",Unknown,Unknown,Instant,0,1,
item1ad5c7c2b7,COIL   # 550p?   2 SINGLE  FROM 2 TYPE OF PAPER,https://www.ebay.com/itm/115255788215?hash=item1ad5c7c2b7:g:lFUAAOSwLjdh6LTN,https://i.ebayimg.com/thumbs/images/g/lFUAAOSwLjdh6LTN/s-l225.jpg,$1.97,Feb-24 16:29,"St-Jean sur Richelieu, Canada",transbus2,https://www.ebay.com/usr/transbus2?_trksid=p2047675.l2559,Auction,1,1,"Feb 24, 2022

16:29:49 PST"
item5df0ebb91d,"🔔2020 Nickel 5c, is unique with this type of mint error.  certified by NGC",https://www.ebay.com/itm/403473938717?hash=item5df0ebb91d:g:AoUAAOSwe65iCtr-,https://i.ebayimg.com/thumbs/images/g/AoUAAOSwe65iCtr-/s-l225.jpg,$41.00,Feb-24 14:56,"Norwalk, Connecticut, United States",h-coins,https://www.ebay.com/usr/h-coins?_trksid=p2047675.l2559,Auction,7,1,"Feb 24, 2022

14:56:39 PST"
item21a044c100,backings for any type of earrings Yellow metal,https://www.ebay.com/itm/144422781184?hash=item21a044c100:g:TI8AAOSwFrNiEWUB,https://i.ebayimg.com/thumbs/images/g/TI8AAOSwFrNiEWUB/s-l225.jpg,$0.06,Feb-24 13:45,"New York, New York, United States",diamondforgood9,https://www.ebay.com/usr/diamondforgood9?_trksid=p2047675.l2559,Auction,2,1,"Feb 24, 2022

13:45:36 PST"
item5893f568e9,ZINN BECK Vintage Game Used Bat stamped Type of Bat Used By Harry Heilmann,https://www.ebay.com/itm/380439455977?hash=item5893f568e9:g:46sAAOxy3lFRCZHt,https://i.ebayimg.com/thumbs/images/g/46sAAOxy3lFRCZHt/s-l225.jpg,"$1,700.00",Feb-24 11:11,"North Bergen, New Jersey, United States",jcm331,https://www.ebay.com/usr/jcm331?_trksid=p2047675.l2559,Instant,0,1,
item366649c784,Algeria #B71 MNH Stamp Day/Type of 1954/Overprinted in Black,https://www.ebay.com/itm/233644345220?hash=item366649c784:g:M5wAAOSwqLFfIvS0,https://i.ebayimg.com/thumbs/images/g/M5wAAOSwqLFfIvS0/s-l225.jpg,$1.49,Feb-24 11:00,"Conroe, Texas, United States",Unknown,Unknown,Instant,0,1,
item366649c790,Algeria #B85 MNH Stamp Day/Type of 1956 Overprinted in Black,https://www.ebay.com/itm/233644345232?hash=item366649c790:g:Go4AAOSwOWlfIvS0,https://i.ebayimg.com/thumbs/images/g/Go4AAOSwOWlfIvS0/s-l225.jpg,$1.49,Feb-24 11:00,"Conroe, Texas, United States",Unknown,Unknown,Instant,0,1,
item366649c77e,Algeria #B64 MNH Stamp Day/Type of 1952/Overprinted in Dark Blue,https://www.ebay.com/itm/233644345214?hash=item366649c77e:g:PiYAAOSwJ59fIvS0,https://i.ebayimg.com/thumbs/images/g/PiYAAOSwJ59fIvS0/s-l225.jpg,$1.49,Feb-24 11:00,"Conroe, Texas, United States",Unknown,Unknown,Instant,0,1,
item5bb9106b75,yellow studs for all type of earrings back,https://www.ebay.com/itm/393946884981?hash=item5bb9106b75:g:2eMAAOSw8sRiESzJ,https://i.ebayimg.com/thumbs/images/g/2eMAAOSw8sRiESzJ/s-l225.jpg,$0.11,Feb-24 09:45,"New York, New York, United States",diamondforgood9,https://www.ebay.com/usr/diamondforgood9?_trksid=p2047675.l2559,Auction,3,1,"Feb 24, 2022

09:45:43 PST"
item219fbc6b5f,Morocco Agencies 1936 Edward VIII SG 71/72 & 71a/72a both type of overprint-Mint,https://www.ebay.com/itm/144413846367?hash=item219fbc6b5f:g:3mEAAOSwD5FhkrvP,https://i.ebayimg.com/thumbs/images/g/3mEAAOSwD5FhkrvP/s-l225.jpg,$1.32,Feb-24 08:45,"Lossiemouth, United Kingdom",woodyxv,https://www.ebay.com/usr/woodyxv?_trksid=p2047675.l2559,Auction,1,1,"Feb 24, 2022

08:45:42 PST"
item2647d81fd0,"Gardman Vision Window Bird Feeder with Strong Suction Pads, For All Type of Seed",https://www.ebay.com/itm/164414103504?epid=1564840260&hash=item2647d81fd0:g:Q3kAAOSw6oVh3z3R,https://i.ebayimg.com/thumbs/images/g/Q3kAAOSw6oVh3z3R/s-l225.jpg,$11.67,Feb-24 07:24,"Belfast, United Kingdom",Unknown,Unknown,Instant,0,174,
item40113ad669,1831 CAPPED BUST QUARTER BETTER GRADE 1ST YEAR TYPE OF THE SMALLER SIZE,https://www.ebay.com/itm/275166975593?hash=item40113ad669:g:m2sAAOSwmRBiCYCU,https://i.ebayimg.com/thumbs/images/g/m2sAAOSwmRBiCYCU/s-l225.jpg,$155.00,Feb-24 06:39,"Marmora, New Jersey, United States",trulscool,https://www.ebay.com/usr/trulscool?_trksid=p2047675.l2559,Instant,0,1,
item3dd2971cc8,Magnif Bowmaker W/Bow Pins & Instruction Booklet 2002 Makes Any Type Of Bow USA,https://www.ebay.com/itm/265526123720?hash=item3dd2971cc8:g:3jEAAOSwO8xh9yxZ,https://i.ebayimg.com/thumbs/images/g/3jEAAOSwO8xh9yxZ/s-l225.jpg,$13.00,Feb-24 06:33,"Adrian, Michigan, United States",sistersue57,https://www.ebay.com/usr/sistersue57?_trksid=p2047675.l2559,Instant,0,1,
item23cd242f1f,HIGH QUALITY MULTICORE SOLDER PASTE FOR ALL TYPE OF SMD/ BGA REWORKING 15g TUBES,https://www.ebay.com/itm/153765555999?hash=item23cd242f1f:g:XdEAAOSwZVhWSc4Y,https://i.ebayimg.com/thumbs/images/g/XdEAAOSwZVhWSc4Y/s-l225.jpg,$7.20,Feb-24 04:24,"Newcastle upon Tyne, United Kingdom",Unknown,Unknown,Instant,0,176,
item1ac2e61247,"6 PACK RECYCLING STICKERS WHEELIE BIN, RUBBISH AND DIFFERENT TYPE OF WASTE BINS",https://www.ebay.com/itm/114939007559?epid=23043390706&hash=item1ac2e61247:g:vbQAAOSwsbthbUky,https://i.ebayimg.com/thumbs/images/g/vbQAAOSwsbthbUky/s-l225.jpg,$2.63,Feb-24 03:55,Unknown,Unknown,Unknown,Instant,0,1,
item3febe02ee0,MASTER Set for all ANTIQUE CLOCK Key - Total 18 type of Key  (5020),https://www.ebay.com/itm/274540277472?hash=item3febe02ee0:g:WQ0AAOSwoSld63s9,https://i.ebayimg.com/thumbs/images/g/WQ0AAOSwoSld63s9/s-l225.jpg,$19.99,Feb-24 03:40,"BHAVNAGAR, GUJARAT, India",Unknown,Unknown,Instant,0,47,
item49151f0d67,"3 SPANISH FIGURINES,NAO OR LLANDRO TYPE OF 2 GEISHAS AND 1 OTHER - ALL UNMARKED",https://www.ebay.com/itm/313886969191?hash=item49151f0d67:g:Gk4AAOSwiCNg~WAd,https://i.ebayimg.com/thumbs/images/g/Gk4AAOSwiCNg~WAd/s-l225.jpg,$12.02,Feb-24 03:40,"Wellingborough, United Kingdom",troutyman,https://www.ebay.com/usr/troutyman?_trksid=p2047675.l2559,Instant,0,1,
item2d5ee8c5a3,1000cc AUTOMOTIVE SYRINGE WITH VITON SEALS FOR ANY TYPE OF FLUID,https://www.ebay.com/itm/194865841571?epid=3010714718&hash=item2d5ee8c5a3:g:oeUAAOSwZzVeIvZb,https://i.ebayimg.com/thumbs/images/g/oeUAAOSwZzVeIvZb/s-l225.jpg,$39.95,Feb-24 02:40,"Watertown, Massachusetts, United States",Unknown,Unknown,Instant,0,1,
item345777b0f5,GERMANY BERLIN SCOTT 9NB182 - 9NB185 MNH SET - 1981 PLANT TYPE OF 1981 SEMI,https://www.ebay.com/itm/224805761269?hash=item345777b0f5:g:xmUAAOSwkiNh7sKg,https://i.ebayimg.com/thumbs/images/g/xmUAAOSwkiNh7sKg/s-l225.jpg,$2.95,Feb-23 23:47,"Marshall, Michigan, United States",midweststamptrader,https://www.ebay.com/usr/midweststamptrader?_trksid=p2047675.l2559,Instant,0,1,
item3694e82b84,3 in 1 Premium Metal Guitar Stand Holder For All Standard Type of Guitars 5Core,https://www.ebay.com/itm/234426477444?hash=item3694e82b84:g:ZrIAAOSwnQRiDtqf,https://i.ebayimg.com/thumbs/images/g/ZrIAAOSwnQRiDtqf/s-l225.jpg,$15.99 to $25.99,Feb-23 21:30,"Riverside, California, United States",Unknown,Unknown,Instant,0,1,
item424303730f,KISS 5 in 1 curling iron Interchangeable Ceramic Tourmaline For All Type Of Hair,https://www.ebay.com/itm/284592141071?epid=0&hash=item424303730f:g:fZsAAOSwgSFh0cBj,https://i.ebayimg.com/thumbs/images/g/fZsAAOSwgSFh0cBj/s-l225.jpg,$24.00,Feb-23 21:12,"Morrice, Michigan, United States",kassa517,https://www.ebay.com/usr/kassa517?_trksid=p2047675.l2559,Instant,0,1,
item4905cd1028,Pilates for Everyone: 50 Exercises for Every Type of Body (Paperback or Softback,https://www.ebay.com/itm/313629937704?epid=9050387276&hash=item4905cd1028:g:w28AAOSw-Vth60sq,https://i.ebayimg.com/thumbs/images/g/w28AAOSw-Vth60sq/s-l225.jpg,$17.03,Feb-23 19:34,"Grand Rapids, Michigan, United States",Unknown,Unknown,Instant,0,1,
item21a00096bd,ZENGAZ  Pure Torch Jet lighter soft rubberized handle 2 type of flame /1300C,https://www.ebay.com/itm/144418313917?hash=item21a00096bd:g:8rEAAOSwEV5hypND,https://i.ebayimg.com/thumbs/images/g/8rEAAOSwEV5hypND/s-l225.jpg,$15.00,Feb-23 19:23,"Adelanto, California, United States",kids.w_3,https://www.ebay.com/usr/kids.w_3?_trksid=p2047675.l2559,Auction,1,1,"Feb 23, 2022

19:23:53 PST"
item21a00091a1,ZENGAZ  Pure Torch Jet lighter soft rubberized handle 2 type of flame /1300C,https://www.ebay.com/itm/144418312609?hash=item21a00091a1:g:aSUAAOSw6oVhzSML,https://i.ebayimg.com/thumbs/images/g/aSUAAOSw6oVhzSML/s-l225.jpg,$15.00,Feb-23 19:21,"Adelanto, California, United States",kids.w_3,https://www.ebay.com/usr/kids.w_3?_trksid=p2047675.l2559,Auction,1,1,"Feb 23, 2022

19:21:49 PST"
item2185e1a927,"DEMINERALIZER FILTER RESIN FOR GRAVITY IRONS,1 pack,works with any type of iron",https://www.ebay.com/itm/143980079399?hash=item2185e1a927:g:NsoAAOSwuRBbTXkT,https://i.ebayimg.com/thumbs/images/g/NsoAAOSwuRBbTXkT/s-l225.jpg,$14.99,Feb-23 17:03,"Los Angeles, California, United States",Unknown,Unknown,Instant,0,6,
item3694cbed63,MEXICO C329A MNH SOUVENIR SHEET OLYMPIC GAME TYPE OF 1967 SCV 5.50 *,https://www.ebay.com/itm/234424626531?hash=item3694cbed63:g:eM0AAOSwR7hhx-v7,https://i.ebayimg.com/thumbs/images/g/eM0AAOSwR7hhx-v7/s-l225.jpg,$1.10,Feb-23 17:02,"Pittsburgh, Pennsylvania, United States",hunter-james,https://www.ebay.com/usr/hunter-james?_trksid=p2047675.l2559,Auction,5,1,"Feb 23, 2022

17:02:14 PST"
item3694cbed21,MEXICO C331A MNH SOUVENIR SHEET OLYMPIC GAMES TYPE OF 1967 SCV 7.50 *,https://www.ebay.com/itm/234424626465?hash=item3694cbed21:g:b0oAAOSwNk5hx-yO,https://i.ebayimg.com/thumbs/images/g/b0oAAOSwNk5hx-yO/s-l225.jpg,$0.07,Feb-23 17:02,"Pittsburgh, Pennsylvania, United States",hunter-james,https://www.ebay.com/usr/hunter-james?_trksid=p2047675.l2559,Auction,2,1,"Feb 23, 2022

17:02:11 PST"
item2847429bac,SINGER 421326 Bobbin Case For All Type Of Drop In Bobbin Sewing Machine,https://www.ebay.com/itm/172994239404?hash=item2847429bac:g:fKQAAOSw8b1aAlxo,https://i.ebayimg.com/thumbs/images/g/fKQAAOSw8b1aAlxo/s-l225.jpg,$6.33,Feb-23 16:20,"Lakewood, New Jersey, United States",Unknown,Unknown,Instant,0,"1,133",
item3ffb9d61f6,Lot of 11 Futaba Different Type Of Electronics FM AM Receivers And Micro Servos,https://www.ebay.com/itm/274804335094?hash=item3ffb9d61f6:g:SbEAAOSw4BRgk69h,https://i.ebayimg.com/thumbs/images/g/SbEAAOSw4BRgk69h/s-l225.jpg,$75.00,Feb-23 13:52,"Kansas City, Missouri, United States",mo_reclaimed_freight,https://www.ebay.com/usr/mo_reclaimed_freight?_trksid=p2047675.l2559,Instant,0,1,
item466236314c,"AVERY DENNISON TAGGING GUN , Mark III  STANDARD FOR ALL TYPE OF GARMENTS #10651",https://www.ebay.com/itm/302295429452?epid=135448506&hash=item466236314c:g:fIQAAOxyeZNTUsNX,https://i.ebayimg.com/thumbs/images/g/fIQAAOxyeZNTUsNX/s-l225.jpg,$23.95,Feb-23 12:39,"Los Angeles, California, United States",Unknown,Unknown,Instant,0,5,
item3fff6e3115,"CENTURY DRILL AND TOOL 72744 Bolt Cutters 36"" Type Of Cut Center",https://www.ebay.com/itm/274868351253?hash=item3fff6e3115:g:Ap0AAOSwWZtg8DIE,https://i.ebayimg.com/thumbs/images/g/Ap0AAOSwWZtg8DIE/s-l225.jpg,$66.73,Feb-23 12:17,"Buffalo Grove, Illinois, United States",zoro_us,https://www.ebay.com/usr/zoro_us?_trksid=p2047675.l2559,Instant,0,2,
item2f6954b40c,Microgreens Spicy Yosemite mix salad sprout micro green Organic 5 Type of seeds,https://www.ebay.com/itm/203630621708?hash=item2f6954b40c:g:MDwAAOSwxrBearAS,https://i.ebayimg.com/thumbs/images/g/MDwAAOSwxrBearAS/s-l225.jpg,$7.99,Feb-23 09:54,"Sparks, Nevada, United States",Unknown,Unknown,Instant,0,29,
item367eaeff18,"Allen Wormicid Tablets (25g) All Type of Worms, Hook Worm, Tape Worm, Pin Worm,",https://www.ebay.com/itm/234053631768?hash=item367eaeff18:g:T~MAAOSwyHtgxIQH,https://i.ebayimg.com/thumbs/images/g/T~MAAOSwyHtgxIQH/s-l225.jpg,$8.48,Feb-23 09:21,"MUMBAI, MAHARASHTRA, India",Unknown,Unknown,Instant,0,4,
item3b7572dacc,"Ford Pinto Hubcaps  (2),, ""dog dish type, of 1971 Pinto",https://www.ebay.com/itm/255373531852?hash=item3b7572dacc:g:3JEAAOSwvdhiAEFu&vxp=mtr,https://i.ebayimg.com/thumbs/images/g/3JEAAOSwvdhiAEFu/s-l225.jpg,$20.00,Feb-23 07:41,"Somerville, New Jersey, United States",toqueen55,https://www.ebay.com/usr/toqueen55?_trksid=p2047675.l2559,Instant,0,1,
item424590e6d9,"Dressing Your Truth, Discover Your Type of Beauty",https://www.ebay.com/itm/284634965721?epid=122440820&hash=item424590e6d9:g:ssIAAOSwSJpf~sgc,https://i.ebayimg.com/thumbs/images/g/ssIAAOSwSJpf~sgc/s-l225.jpg,$4.50,Feb-23 05:02,Unknown,Unknown,Unknown,Instant,0,1,
item3d86c2ed18,Shiseido ISO Option #2 Perm Lotion Curly Hair Every Type Of Color Treated Hair +,https://www.ebay.com/itm/264253926680?hash=item3d86c2ed18:g:0RgAAOSwuTxV74JK,https://i.ebayimg.com/thumbs/images/g/0RgAAOSwuTxV74JK/s-l225.jpg,$25.30,Feb-23 03:15,"Muang, NR, Thailand",Unknown,Unknown,Instant,0,2,
item287763a121,Fabsil Ice Grips Anti Slip for Boots Shoes Grips Spike fits most type of boots,https://www.ebay.com/itm/173801709857?hash=item287763a121:g:DhQAAOSwntRcZ~qn,https://i.ebayimg.com/thumbs/images/g/DhQAAOSwntRcZ~qn/s-l225.jpg,$6.66 to $8.00,Feb-23 00:31,"Brdadford, United Kingdom",Unknown,Unknown,Instant,0,6,
item5494c83606,Stanley Bostitch Staplers & Staple Guns   Type: Plier Stapler    Type of Powe...,https://www.ebay.com/itm/363273401862?epid=2255632489&hash=item5494c83606:g:6dgAAOSw~fZhV0IW,https://i.ebayimg.com/thumbs/images/g/6dgAAOSw~fZhV0IW/s-l225.jpg,$52.73,Feb-22 19:11,"Melville, New York, United States",Unknown,Unknown,Instant,0,10,
item2656043c4c,1 Trio of VIP Top Grade A+ Guppy - Customer Choice - Pick Your Own Type of Guppy,https://www.ebay.com/itm/164651875404?hash=item2656043c4c:g:WCYAAOSw53tgBVDp,https://i.ebayimg.com/thumbs/images/g/WCYAAOSw53tgBVDp/s-l225.jpg,$48.70 to $109.70,Feb-22 18:35,"Houston, Texas, United States",Unknown,Unknown,Instant,0,21,
item2f74ebc8c3,Aquarium Fish Food Bloodworm Cubes Freeze Dried Worms Any Type of Fish 10g / 25g,https://www.ebay.com/itm/203825072323?hash=item2f74ebc8c3:g:EbYAAOSwDRxh0K9f,https://i.ebayimg.com/thumbs/images/g/EbYAAOSwDRxh0K9f/s-l225.jpg,$1.99 to $7.99,Feb-22 17:39,"Panadura, Sri Lanka",Unknown,Unknown,Instant,0,1,
item34515dc769,Costume Jewelry Lot. You select type of item or lot and wait!,https://www.ebay.com/itm/224703399785?hash=item34515dc769:g:D7oAAOSwqs9hmZ-y,https://i.ebayimg.com/thumbs/images/g/D7oAAOSwqs9hmZ-y/s-l225.jpg,$2.00 to $18.00,Feb-22 16:54,"Springfield, Oregon, United States",Unknown,Unknown,Instant,0,24,
item54ad93748f,PHOTO  THE PACKET BOAT MAIN ROAD BOLTON LE SANDS WAS THIS A TYPE OF CANAL BARGE,https://www.ebay.com/itm/363689374863?hash=item54ad93748f:g:-ZIAAOSwXdlh4GnE,https://i.ebayimg.com/thumbs/images/g/-ZIAAOSwXdlh4GnE/s-l225.jpg,$2.27,Feb-22 14:37,"Tadley, United Kingdom",davebowman28,https://www.ebay.com/usr/davebowman28?_trksid=p2047675.l2559,Instant,0,1,
item1ad3287fdb,EARLY TYPE OF DOCUMENT WITH ORIGINAL MEDAL FOR BATTLE Merit  SOVIET WWII RUSSIAN,https://www.ebay.com/itm/115211796443?hash=item1ad3287fdb:g:03UAAOSwbd1hJRhb,https://i.ebayimg.com/thumbs/images/g/03UAAOSwbd1hJRhb/s-l225.jpg,$161.56,Feb-22 13:20,"Southport, Merseyside, United Kingdom",beniorra,https://www.ebay.com/usr/beniorra?_trksid=p2047675.l2559,Instant,0,1,
item28490260d8,Monaco 1960 #469 Knight Type of 1954 - MH,https://www.ebay.com/itm/173023584472?hash=item28490260d8:g:NUcAAOSwevlaK-JB,https://i.ebayimg.com/thumbs/images/g/NUcAAOSwevlaK-JB/s-l225.jpg,$5.40,Feb-22 11:05,"White Rock, British Columbia, Canada",suarkj,https://www.ebay.com/usr/suarkj?_trksid=p2047675.l2559,Instant,0,1,
item2a98e78126,Monaco 1959 #432 Knight Type of 1954 - MH,https://www.ebay.com/itm/182953935142?hash=item2a98e78126:g:FmsAAOSwTO9aK-Ah,https://i.ebayimg.com/thumbs/images/g/FmsAAOSwTO9aK-Ah/s-l225.jpg,$2.20,Feb-22 11:05,"White Rock, British Columbia, Canada",suarkj,https://www.ebay.com/usr/suarkj?_trksid=p2047675.l2559,Instant,0,1,
item2a98e7a892,Monaco 1960 #467 Knight Type of 1954 - MH,https://www.ebay.com/itm/182953945234?hash=item2a98e7a892:g:uRMAAOSwQS1aK-Hr,https://i.ebayimg.com/thumbs/images/g/uRMAAOSwQS1aK-Hr/s-l225.jpg,$2.20,Feb-22 11:05,"White Rock, British Columbia, Canada",suarkj,https://www.ebay.com/usr/suarkj?_trksid=p2047675.l2559,Instant,0,1,
item2b248c07e4,"""5 Pieces"" Lot of fabric.  Total 4+ yards. All type of BLUES COTTON FABRIC",https://www.ebay.com/itm/185296750564?hash=item2b248c07e4:g:UAAAAOSwordh-U7k,https://i.ebayimg.com/thumbs/images/g/UAAAAOSwordh-U7k/s-l225.jpg,$19.00,Feb-22 07:20,"Springfield, Massachusetts, United States",debbyquilter,https://www.ebay.com/usr/debbyquilter?_trksid=p2047675.l2559,Auction,1,1,"Feb 22, 2022

07:20:39 PST"
item1a788aa9db,5 x CHILD SAFETY QUICK RELEASE CORD LOCKS for any type of ROMAN BLIND SPARE PART,https://www.ebay.com/itm/113691503067?hash=item1a788aa9db:g:aoEAAOSwcdBcPK6i,https://i.ebayimg.com/thumbs/images/g/aoEAAOSwcdBcPK6i/s-l225.jpg,$2.00,Feb-22 07:11,"maulden, United Kingdom",Unknown,Unknown,Instant,0,14,
item5deb7db000,Antique Tin Type Of A Woman Framed OLD!!,https://www.ebay.com/itm/403382841344?hash=item5deb7db000:g:th4AAOSwPHhhzLDo,https://i.ebayimg.com/thumbs/images/g/th4AAOSwPHhhzLDo/s-l225.jpg,$24.99,Feb-21 21:07,"Corona, New York, United States",officialtissue718,https://www.ebay.com/usr/officialtissue718?_trksid=p2047675.l2559,Instant,0,1,
item4b2efc0533,Power Steering Fluid-Pentosin CHF 11S Synthetic Hydraulic Fluid - 1 Liter German,https://www.ebay.com/itm/322910815539?epid=112632699&hash=item4b2efc0533:g:YKQAAOSwRzZcRjKd&vxp=mtr,https://i.ebayimg.com/thumbs/images/g/YKQAAOSwRzZcRjKd/s-l225.jpg,$38.33,Feb-21 19:42,"Van Nuys, California, United States",Unknown,Unknown,Instant,0,105,
item2d5d01dafa,Andre 3000 Which Type of Stereo Are You T Shirt Black Lives Matter New Unworn ,https://www.ebay.com/itm/194833931002?hash=item2d5d01dafa:g:oi8AAOSw4jxiCxdZ,https://i.ebayimg.com/thumbs/images/g/oi8AAOSw4jxiCxdZ/s-l225.jpg,$30.00,Feb-21 19:04,"Raleigh, North Carolina, United States",katze.us2015,https://www.ebay.com/usr/katze.us2015?_trksid=p2047675.l2559,Auction,1,1,"Feb 21, 2022

19:04:36 PST"
item2d40695ba4,"50mm-150mm Ball Head Magnetic Screwdriver Drill Bits H2-H5 Impact 1/4"" Hex Shank",https://www.ebay.com/itm/194354174884?hash=item2d40695ba4:g:U30AAOSwPGdhOek5,https://i.ebayimg.com/thumbs/images/g/U30AAOSwPGdhOek5/s-l225.jpg,$2.55 to $20.85,Feb-21 14:56,"Dongguan, GD, China",Unknown,Unknown,Instant,0,1,
item5ddf652098,Brush Set Power Kit Scrubber Drill Attachments For All type of Cleaning Yellow,https://www.ebay.com/itm/403179905176?epid=14030646174&hash=item5ddf652098:g:ECIAAOSwP79hSgQ1,https://i.ebayimg.com/thumbs/images/g/ECIAAOSwP79hSgQ1/s-l225.jpg,$6.95,Feb-21 08:13,Unknown,Unknown,Unknown,Instant,0,1,
item565be49610,Coolant Reservoir For 2007-2014 GMC Acadia w/ cap & hose,https://www.ebay.com/itm/370908894736?hash=item565be49610:g:qf4AAOSw-mRhgSS6&vxp=mtr,https://i.ebayimg.com/thumbs/images/g/qf4AAOSw-mRhgSS6/s-l225.jpg,$27.90,Feb-21 06:07,"La Salle, Illinois, United States",Unknown,Unknown,Instant,0,128,
item34591ad342,Women Vintage Silver Band Rings TYPE OF CAT'S EYE.,https://www.ebay.com/itm/224833229634?hash=item34591ad342:g:Dy0AAOSwVdZh3Cgt,https://i.ebayimg.com/thumbs/images/g/Dy0AAOSwVdZh3Cgt/s-l225.jpg,$5.50,Feb-21 04:29,"Afula, Israel",vasili_chucnenko_7,https://www.ebay.com/usr/vasili_chucnenko_7?_trksid=p2047675.l2559,Auction,3,1,"Feb 21, 2022

04:29:37 PST"
item4dc8ddd333,"DDR 1980 SC# 2119 - 2120, B192 - Olympic Type of 1980 - Used Lot # 394",https://www.ebay.com/itm/334082462515?hash=item4dc8ddd333:g:9rsAAOSwPS1g9ZKR,https://i.ebayimg.com/thumbs/images/g/9rsAAOSwPS1g9ZKR/s-l225.jpg,$1.58,Feb-20 18:29,"Thunder Bay, Ontario, Canada",807bluebird,https://www.ebay.com/usr/807bluebird?_trksid=p2047675.l2559,Instant,0,1,
item2b236e52e0,JUDAICA - Maroc - Type de femme israélite à Rabat - - Morocco - Type of jewish w,https://www.ebay.com/itm/185278026464?hash=item2b236e52e0:g:z~kAAOSwh2Fh-VWC,https://i.ebayimg.com/thumbs/images/g/z~kAAOSwh2Fh-VWC/s-l225.jpg,$17.99,Feb-20 14:17,"Paris, France",www.postcardman.net,https://www.ebay.com/usr/www.postcardman.net?_trksid=p2047675.l2559,Instant,0,1,
item262f348da2,GS Hair Surgery Cirugia Capilar For all type of Hair  34oz / 1000ml,https://www.ebay.com/itm/164000730530?hash=item262f348da2:g:IGcAAOSw2Rdff63C,https://i.ebayimg.com/thumbs/images/g/IGcAAOSw2Rdff63C/s-l225.jpg,$99.95,Feb-20 11:51,"Hialeah, Florida, United States",Unknown,Unknown,Instant,0,1,
item344aac2c15,PHOTO  R. TILNEY AND SON BECCLES A SOMEWHAT RARE TYPE OF SHOP IN ANY TOWN.,https://www.ebay.com/itm/224591096853?hash=item344aac2c15:g:AzcAAOSwma1hLNy8,https://i.ebayimg.com/thumbs/images/g/AzcAAOSwma1hLNy8/s-l225.jpg,$2.47,Feb-20 11:24,"Tadley, United Kingdom",davebowman28,https://www.ebay.com/usr/davebowman28?_trksid=p2047675.l2559,Instant,0,1,
item2d4ef05f88,Ancient Coin SAMARIA Helmeted Athena and Owl Silver Obol Rare Type of Owl Coin!,https://www.ebay.com/itm/194597904264?hash=item2d4ef05f88:g:QFwAAOSwl7phslEU,https://i.ebayimg.com/thumbs/images/g/QFwAAOSwl7phslEU/s-l225.jpg,$149.10,Feb-20 10:28,"Miami, Florida, United States",timelessthing,https://www.ebay.com/usr/timelessthing?_trksid=p2047675.l2559,Instant,0,1,
item3ffc48f90e,The Anatomy of a Principled Leader: A Field Guide to Being the Type of Le - GOOD,https://www.ebay.com/itm/274815580430?epid=144097079&hash=item3ffc48f90e:g:2IkAAOSwl2Nf~ee3,https://i.ebayimg.com/thumbs/images/g/2IkAAOSwl2Nf~ee3/s-l225.jpg,$4.31,Feb-20 08:08,"Montgomery, Illinois, United States",Unknown,Unknown,Instant,0,1,
item57044aebee,"Older/VIntage 40"" x 100"" Satin Type of Fabric with Circles Designs 2.7 Yards",https://www.ebay.com/itm/373734173678?hash=item57044aebee:g:nvwAAOSwjnlhT11W,https://i.ebayimg.com/thumbs/images/g/nvwAAOSwjnlhT11W/s-l225.jpg,$15.00,Feb-20 08:00,"Whitewater, Wisconsin, United States",treeinyard,https://www.ebay.com/usr/treeinyard?_trksid=p2047675.l2559,Instant,0,1,
item218bdefc98,"H, L OR K Leg Foot Treadle ( COMPLETE SET )WILL FIT ANY TYPE OF INDUSTRIAL LEGS",https://www.ebay.com/itm/144080567448?epid=11034141913&hash=item218bdefc98:g:N3EAAOSwOKVZ2qkw,https://i.ebayimg.com/thumbs/images/g/N3EAAOSwOKVZ2qkw/s-l225.jpg,$24.99,Feb-20 06:55,"Los Angeles, California, United States",Unknown,Unknown,Instant,0,46,
item28c85754c3,Chevelle 5 CD LOT Wonder This Type of Thinking Vena Sera Sci-Fi Crimes Hats Off,https://www.ebay.com/itm/175159858371?hash=item28c85754c3:g:7VoAAOSw-zpiC7FL,https://i.ebayimg.com/thumbs/images/g/7VoAAOSw-zpiC7FL/s-l225.jpg,$12.50,Feb-20 05:58,"Honesdale, Pennsylvania, United States",killer1599,https://www.ebay.com/usr/killer1599?_trksid=p2047675.l2559,Auction,7,1,"Feb 20, 2022

05:58:31 PST"
item4910d90f88,Handmade Wooden SPOONS Spatula Spoon Kitchen Cooking Utensils Tools Turner Set,https://www.ebay.com/itm/313815273352?hash=item4910d90f88:g:E68AAOSwf75h0EIL,https://i.ebayimg.com/thumbs/images/g/E68AAOSwf75h0EIL/s-l225.jpg,$21.22,Feb-20 05:47,"surat, India",Unknown,Unknown,Instant,0,2,
item2f2a91b6de,Players Type of Horses 1939 - The Active Vanner No. 12,https://www.ebay.com/itm/202577655518?hash=item2f2a91b6de:g:iWkAAOSwAbFcTaAj,https://i.ebayimg.com/thumbs/images/g/iWkAAOSwAbFcTaAj/s-l225.jpg,$1.99,Feb-20 04:25,"Huntingdon, United Kingdom",gum.cards,https://www.ebay.com/usr/gum.cards?_trksid=p2047675.l2559,Instant,0,1,
item3cfe3da629,Space Saving Wine Bottle Rack Holder for All Type of Fridges 3 Bottles Holder,https://www.ebay.com/itm/261963490857?hash=item3cfe3da629:g:BMIAAOSwogJgth67,https://i.ebayimg.com/thumbs/images/g/BMIAAOSwogJgth67/s-l225.jpg,$8.67,Feb-19 23:22,"WILTSHIRE, United Kingdom",Unknown,Unknown,Instant,0,146,
item52672037e4,Two Men Riding some type of TRACTOR? Early Real Photo Postcard,https://www.ebay.com/itm/353917482980?hash=item52672037e4:g:4bgAAOSw-hFiDk8t,https://i.ebayimg.com/thumbs/images/g/4bgAAOSw-hFiDk8t/s-l225.jpg,$8.00,Feb-19 21:30,"Tempe, Arizona, United States",postcards_at_the_trove,https://www.ebay.com/usr/postcards_at_the_trove?_trksid=p2047675.l2559,Instant,0,1,
item216f69ef4a,2 PCS 421326 Bobbin Case For SINGER All Type Of Drop In Bobbin Sewing Machine,https://www.ebay.com/itm/143603134282?hash=item216f69ef4a:g:pVoAAOSwPexfHilE,https://i.ebayimg.com/thumbs/images/g/pVoAAOSwPexfHilE/s-l225.jpg,$8.10,Feb-19 18:08,"武汉市, China",Unknown,Unknown,Instant,0,37,
