id,title,link,image,price_sold,end_date,origin,seller_name,seller_link,sell_type,num_bids,num_sold,auction_end_date
item345a438e0b,TIN TYPE OF A YOUNG WOMEN 1/9 PLATE (melainotype and ferrotype) Circa 1860's #1,https://www.ebay.com/itm/224852676107?hash=item345a438e0b:g:qvgAAOSwNqhiFjYl,https://i.ebayimg.com/thumbs/images/g/qvgAAOSwNqhiFjYl/s-l225.jpg,$1.32,Mar-02 05:40,"Dalkeith, United Kingdom",midwinterfox,https://www.ebay.com/usr/midwinterfox?_trksid=p2047675.l2559,Auction,2,1,"Mar 02, 2022

05:40:16 PST"
item49152d3af1,Metal - Some type of Russian Metal  - Dated 1972,https://www.ebay.com/itm/313887898353?hash=item49152d3af1:g:gKEAAOSwtJxhuOJl,https://i.ebayimg.com/thumbs/images/g/gKEAAOSwtJxhuOJl/s-l225.jpg,$7.99,Mar-02 00:33,"Saltville, Virginia, United States",pennysdream,https://www.ebay.com/usr/pennysdream?_trksid=p2047675.l2559,Auction,1,1,"Mar 02, 2022

00:33:29 PST"
item2f408c3c6b,Microgreens Pacific mix salad sprout micro green Organic 5 Type of seeds,https://www.ebay.com/itm/202946395243?hash=item2f408c3c6b:g:qG8AAOSwYNpearn2,https://i.ebayimg.com/thumbs/images/g/qG8AAOSwYNpearn2/s-l225.jpg,$7.99,Mar-01 20:42,"Sparks, Nevada, United States",great_basin_supply,https://www.ebay.com/usr/great_basin_supply?_trksid=p2047675.l2559,Instant,0,839,
item2f76215cb2,ISO OPTION #2 PERM KIT for Every Type Of Color-Treated Hair Professional,https://www.ebay.com/itm/203845360818?epid=1537599644&hash=item2f76215cb2:g:2YgAAOSw6u1iGqSF,https://i.ebayimg.com/thumbs/images/g/2YgAAOSw6u1iGqSF/s-l225.jpg,$10.00,Mar-01 19:29,"Deerfield Beach, Florida, United States",rudy-130,https://www.ebay.com/usr/rudy-130?_trksid=p2047675.l2559,Instant,0,1,
item4baae8b1f5,"Secrets of the Butcher: How to Select, Cut, Prepare, and Cook Every Type of Meat",https://www.ebay.com/itm/324989923829?epid=239519931&hash=item4baae8b1f5:g:JVEAAOSw53tf~ffB,https://i.ebayimg.com/thumbs/images/g/JVEAAOSw53tf~ffB/s-l225.jpg,$8.97,Mar-01 18:36,"North Versailles, Pennsylvania, United States",goodwillswpa,https://www.ebay.com/usr/goodwillswpa?_trksid=p2047675.l2559,Instant,0,1,
item3dd47e3fef,Gale Garnett   My Type Of Folk Songs    LP  RCA  LPM2833 Dynagroove  1965 Mono,https://www.ebay.com/itm/265558048751?hash=item3dd47e3fef:g:xIkAAOSwwL1hy4N2,https://i.ebayimg.com/thumbs/images/g/xIkAAOSwwL1hy4N2/s-l225.jpg,$6.00,Mar-01 18:25,"Colchester, Vermont, United States",vinylrevival33,https://www.ebay.com/usr/vinylrevival33?_trksid=p2047675.l2559,Auction,1,1,"Mar 01, 2022

18:25:04 PST"
item4914dbbc2e,Antique Tin Type of Black Woman in Black Dress & Black Man,https://www.ebay.com/itm/313882557486?hash=item4914dbbc2e:g:lCYAAOSwkIdiEPKY,https://i.ebayimg.com/thumbs/images/g/lCYAAOSwkIdiEPKY/s-l225.jpg,$12.50,Mar-01 17:15,"Harrington, Delaware, United States",jco46,https://www.ebay.com/usr/jco46?_trksid=p2047675.l2559,Auction,6,1,"Mar 01, 2022

17:15:35 PST"
item4914dabf11,Antique Tin Type of a Woman in Black Mourning Dress?,https://www.ebay.com/itm/313882492689?hash=item4914dabf11:g:hkoAAOSwsSliEOdz,https://i.ebayimg.com/thumbs/images/g/hkoAAOSwsSliEOdz/s-l225.jpg,$7.00,Mar-01 17:15,"Harrington, Delaware, United States",jco46,https://www.ebay.com/usr/jco46?_trksid=p2047675.l2559,Auction,1,1,"Mar 01, 2022

17:15:20 PST"
item598e037b96,MEXICO C329A MNH SOUVENIR SHEET OLYMPIC GAME TYPE OF 1967 SCV 5.50 *,https://www.ebay.com/itm/384634682262?hash=item598e037b96:g:eM0AAOSwR7hhx-v7,https://i.ebayimg.com/thumbs/images/g/eM0AAOSwR7hhx-v7/s-l225.jpg,$1.19,Mar-01 17:05,"Pittsburgh, Pennsylvania, United States",hunter-james,https://www.ebay.com/usr/hunter-james?_trksid=p2047675.l2559,Instant,0,5,
item5993e959d1,3-Pack Brush Set Power Kit Scrubber Drill Attachments For All type of Cleaning,https://www.ebay.com/itm/384733632977?hash=item5993e959d1:g:LSMAAOSwkdJiDaHj,https://i.ebayimg.com/thumbs/images/g/LSMAAOSwkdJiDaHj/s-l225.jpg,$6.25,Mar-01 16:51,"Chino, California, United States",Unknown,Unknown,Instant,0,142,
item46dd3f4065,The Grip Jar Opener Under Cabinet Lid Opens Any Size Type Of Perfect For Weak,https://www.ebay.com/itm/304359620709?hash=item46dd3f4065:g:IwUAAOSwfH9iATmb,https://i.ebayimg.com/thumbs/images/g/IwUAAOSwfH9iATmb/s-l225.jpg,$15.99,Mar-01 15:34,"Shanghai, China",sshosh_4,https://www.ebay.com/usr/sshosh_4?_trksid=p2047675.l2559,Instant,0,1,
item42448e82e5,"A new type of ramen noodles with a perforated spoon and fork, set of 5 made in J",https://www.ebay.com/itm/284618031845?hash=item42448e82e5:g:fZ4AAOSwUYph6j1v,https://i.ebayimg.com/thumbs/images/g/fZ4AAOSwUYph6j1v/s-l225.jpg,$15.90,Mar-01 15:22,"Tokyo, Japan",Unknown,Unknown,Instant,0,1,
item1d0918c4c9,set of 2 SEWING MACHINE MAGNETIC SEAM GUIDE (gauge) WILL FIT ALL TYPE OF SEWING,https://www.ebay.com/itm/124706669769?hash=item1d0918c4c9:g:LRgAAOSwUl5bKZ~F,https://i.ebayimg.com/thumbs/images/g/LRgAAOSwUl5bKZ~F/s-l225.jpg,$9.99,Mar-01 14:50,"Los Angeles, California, United States",Unknown,Unknown,Instant,0,20,
item2676b7ee87,"LL Cool J - I'm That Type of Guy (1989) Vinyl 12"" Single",https://www.ebay.com/itm/165200522887?epid=1400933894&hash=item2676b7ee87:g:WsAAAOSwY7Jhno10,https://i.ebayimg.com/thumbs/images/g/WsAAAOSwY7Jhno10/s-l225.jpg,$5.60,Mar-01 14:01,Unknown,Unknown,Unknown,Instant,0,1,
item54b0b92758,backings for any type of earrings Yellow metal,https://www.ebay.com/itm/363742177112?hash=item54b0b92758:g:wmIAAOSw7z5iF~zz,https://i.ebayimg.com/thumbs/images/g/wmIAAOSw7z5iF~zz/s-l225.jpg,$0.01,Mar-01 13:47,"New York, New York, United States",diamondforgood9,https://www.ebay.com/usr/diamondforgood9?_trksid=p2047675.l2559,Auction,1,1,"Mar 01, 2022

13:47:29 PST"
item2f62056677,3 oz Microgreens Pacific mix salad sprout micro green Organic 5 Type of seeds,https://www.ebay.com/itm/203507983991?hash=item2f62056677:g:qG8AAOSwYNpearn2,https://i.ebayimg.com/thumbs/images/g/qG8AAOSwYNpearn2/s-l225.jpg,$7.99,Mar-01 10:42,"Sparks, Nevada, United States",Unknown,Unknown,Instant,0,8,
item2b07435775,"1 X BUNDLE - 3 TYPE OF 5"" SAGES - SAGE - FRENCH LAVENDER - SAGE WITH ROSE PETAL",https://www.ebay.com/itm/184805447541?hash=item2b07435775:g:eSIAAOSw7zZgxfaL,https://i.ebayimg.com/thumbs/images/g/eSIAAOSw7zZgxfaL/s-l225.jpg,$17.29,Mar-01 10:38,"Gloucester, United Kingdom",Unknown,Unknown,Instant,0,3,
item54b0b5869d,yellow studs for all type of earrings back,https://www.ebay.com/itm/363741939357?hash=item54b0b5869d:g:J-0AAOSwgl9iF8Rf,https://i.ebayimg.com/thumbs/images/g/J-0AAOSwgl9iF8Rf/s-l225.jpg,$0.06,Mar-01 09:46,"New York, New York, United States",diamondforgood9,https://www.ebay.com/usr/diamondforgood9?_trksid=p2047675.l2559,Auction,2,1,"Mar 01, 2022

09:46:04 PST"
item5995457d3f,2020-21 O-Pee-Chee Platinum All type of inserts (YOU CHOOSE FROM LIST),https://www.ebay.com/itm/384756448575?hash=item5995457d3f:g:qc4AAOSwHcBiHPwp,https://i.ebayimg.com/thumbs/images/g/qc4AAOSwHcBiHPwp/s-l225.jpg,$0.78 to $11.04,Mar-01 09:12,"Deux-Montagne, Canada",Unknown,Unknown,Instant,0,1,
item2d3d9aab3c,Beat Sugar Addiction Now! Cookbook: Recipes That Cure Your Type of Sugar...,https://www.ebay.com/itm/194307074876?epid=8038382208&hash=item2d3d9aab3c:g:L3YAAOSwJxNhI6NU,https://i.ebayimg.com/thumbs/images/g/L3YAAOSwJxNhI6NU/s-l225.jpg,$4.09,Mar-01 06:02,"Aurora, Illinois, United States",Unknown,Unknown,Instant,0,1,
item3b60458daf,"Allen Wormicid Tablets (25g) All Type of Worms, Hook Worm, Tape Worm, Pin Worm",https://www.ebay.com/itm/255018241455?hash=item3b60458daf:g:T~MAAOSwyHtgxIQH,https://i.ebayimg.com/thumbs/images/g/T~MAAOSwyHtgxIQH/s-l225.jpg,$8.67,Mar-01 03:55,"Mumbai, Maharashtra, India",Unknown,Unknown,Instant,0,21,
item3dab8db5cb,Universal Rubber Wheel Arch Flexi flare 6m x 45mm Suit All type of 4WD for Hilux,https://www.ebay.com/itm/264871196107?hash=item3dab8db5cb:g:qLgAAOSw4tNgRoAW&vxp=mtr,https://i.ebayimg.com/thumbs/images/g/qLgAAOSw4tNgRoAW/s-l225.jpg,$41.34,Mar-01 03:26,"BRISBANE, Australia",Unknown,Unknown,Instant,0,183,
item28ab682f23,Extra Long Bike Brake Cable Inner Wire Suits Most Type of Bicycles 2.3m Cable,https://www.ebay.com/itm/174674423587?hash=item28ab682f23:g:zCkAAOSwftNgw41h,https://i.ebayimg.com/thumbs/images/g/zCkAAOSwftNgw41h/s-l225.jpg,$3.66,Mar-01 02:25,"Nantwich, United Kingdom",Unknown,Unknown,Instant,0,22,
item4bafe931c0,"Malaya 1906 cover with SCARCE type of IPOH date stamped on 1&3c Malaya stamps, s",https://www.ebay.com/itm/325073842624?hash=item4bafe931c0:g:TAwAAOSwhSNf2hay,https://i.ebayimg.com/thumbs/images/g/TAwAAOSwhSNf2hay/s-l225.jpg,$9.99,Mar-01 00:14,"Dubai, United Arab Emirates",aakasaa,https://www.ebay.com/usr/aakasaa?_trksid=p2047675.l2559,Instant,0,1,
item1d1b407643,ISO Option Perm (choose your perm) 1 application,https://www.ebay.com/itm/125011260995?hash=item1d1b407643:g:V40AAOSwUMhhmDde,https://i.ebayimg.com/thumbs/images/g/V40AAOSwUMhhmDde/s-l225.jpg,$13.95,Feb-28 21:39,"Columbia, Missouri, United States",Unknown,Unknown,Instant,0,79,
item59947b56e6,Dearborn Michigan~Type of Old American Town Hall~Real Photo Postcard~RPPC,https://www.ebay.com/itm/384743200486?hash=item59947b56e6:g:xcwAAOSwf~pgoypp,https://i.ebayimg.com/thumbs/images/g/xcwAAOSwf~pgoypp/s-l225.jpg,$0.24,Feb-28 20:33,"Newton, Iowa, United States",refriedjeans,https://www.ebay.com/usr/refriedjeans?_trksid=p2047675.l2559,Auction,2,1,"Feb 28, 2022

20:33:36 PST"
item5bb99a75dc,aluminium silicon rubber stud backing for all type of earring 1 pair,https://www.ebay.com/itm/393955931612?hash=item5bb99a75dc:g:g-0AAOSwJGViFwBS,https://i.ebayimg.com/thumbs/images/g/g-0AAOSwJGViFwBS/s-l225.jpg,$0.06,Feb-28 19:49,"New York, New York, United States",diamondforgood9,https://www.ebay.com/usr/diamondforgood9?_trksid=p2047675.l2559,Auction,2,1,"Feb 28, 2022

19:49:36 PST"
item491196e4a5,YOU PICK! VINTAGE 1914 POPULAR MECHANIC MAGAZINE FEBRUARY - DECEMBER,https://www.ebay.com/itm/313827714213?hash=item491196e4a5:g:1XsAAOSw-2Jh3JU2,https://i.ebayimg.com/thumbs/images/g/1XsAAOSw-2Jh3JU2/s-l225.jpg,$14.00,Feb-28 19:13,"Lusby, Maryland, United States",Unknown,Unknown,Instant,0,8,
item5bb9995b84,aluminium on silicon rubber 1 pair backing for all type of earring,https://www.ebay.com/itm/393955859332?hash=item5bb9995b84:g:cJcAAOSwCmliFvXN,https://i.ebayimg.com/thumbs/images/g/cJcAAOSwCmliFvXN/s-l225.jpg,$0.06,Feb-28 19:04,"New York, New York, United States",diamondforgood9,https://www.ebay.com/usr/diamondforgood9?_trksid=p2047675.l2559,Auction,2,1,"Feb 28, 2022

19:04:43 PST"
item2f759b6ba4,Vintage Clamshell Type Of 3-Tiered Silver Plated Fold Up Serving Tray MCM NICE!,https://www.ebay.com/itm/203836582820?hash=item2f759b6ba4:g:4kEAAOSwsSliD9aL,https://i.ebayimg.com/thumbs/images/g/4kEAAOSwsSliD9aL/s-l225.jpg,$12.95,Feb-28 16:32,"Coquille, Oregon, United States",byers316,https://www.ebay.com/usr/byers316?_trksid=p2047675.l2559,Instant,0,1,
item54b0a6d536,aluminium on silicon rubber earrings stud back for all type of earring,https://www.ebay.com/itm/363740976438?hash=item54b0a6d536:g:ztkAAOSwirxiFsEG,https://i.ebayimg.com/thumbs/images/g/ztkAAOSwirxiFsEG/s-l225.jpg,$0.01,Feb-28 15:19,"New York, New York, United States",diamondforgood9,https://www.ebay.com/usr/diamondforgood9?_trksid=p2047675.l2559,Auction,1,1,"Feb 28, 2022

15:19:32 PST"
item54b0a65709,aluminium on silicon rubber stud for all type of earring,https://www.ebay.com/itm/363740944137?hash=item54b0a65709:g:ghMAAOSwIt9iFrZ8,https://i.ebayimg.com/thumbs/images/g/ghMAAOSwIt9iFrZ8/s-l225.jpg,$0.01,Feb-28 14:34,"New York, New York, United States",diamondforgood9,https://www.ebay.com/usr/diamondforgood9?_trksid=p2047675.l2559,Auction,1,1,"Feb 28, 2022

14:34:35 PST"
item288d94e7c0,Mahida's Sukoon Massage Oil 100ml Pain Relief For All Type Of Joint Free ship,https://www.ebay.com/itm/174174037952?hash=item288d94e7c0:g:noEAAOSwIKVeMSJr,https://i.ebayimg.com/thumbs/images/g/noEAAOSwIKVeMSJr/s-l225.jpg,$9.99,Feb-28 14:26,"DELHI, DELHI, India",Unknown,Unknown,Instant,0,39,
item2152c0b737,ClipHair™ Moisturizing/ Shine Hair Spray| Suitable For All Type of Hair,https://www.ebay.com/itm/143122282295?hash=item2152c0b737:g:gJcAAOSwJgBcXO~z,https://i.ebayimg.com/thumbs/images/g/gJcAAOSwJgBcXO~z/s-l225.jpg,$13.34,Feb-28 12:49,"GB, United Kingdom",Unknown,Unknown,Instant,0,194,
item2f3fbb08a7,1 pack Microgreens Spicy Pacific mix salad sprout micro green 6 Type of seeds,https://www.ebay.com/itm/202932684967?hash=item2f3fbb08a7:g:qG8AAOSwYNpearn2,https://i.ebayimg.com/thumbs/images/g/qG8AAOSwYNpearn2/s-l225.jpg,$7.99,Feb-28 10:45,"Sparks, Nevada, United States",Unknown,Unknown,Instant,0,49,
item2623337418,1 PCS 421326 Bobbin Case+10 Bobbins For SINGER All Type Of Drop In Bobbin Sewing,https://www.ebay.com/itm/163799331864?hash=item2623337418:g:KoAAAOSwvf1dQkgQ,https://i.ebayimg.com/thumbs/images/g/KoAAAOSwvf1dQkgQ/s-l225.jpg,$7.64,Feb-28 09:59,"nantong city, jiangsu province, China",Unknown,Unknown,Instant,0,83,
item57074afdff,Funny Rude Christmas Card Mum Dad Best Friend Sister Brother Son Daughter Couple,https://www.ebay.com/itm/373784509951?hash=item57074afdff:g:RkcAAOSw7YthiQqR,https://i.ebayimg.com/thumbs/images/g/RkcAAOSw7YthiQqR/s-l225.jpg,$3.99,Feb-28 06:03,"Haverhill, United Kingdom",Unknown,Unknown,Instant,0,517,
item28c91b0058,Chevelle This Type of Thinking Could Do Us In Limited Edition DUALDISC,https://www.ebay.com/itm/175172681816?epid=45088167&hash=item28c91b0058:g:E9wAAOSwzgJiC7Hi,https://i.ebayimg.com/thumbs/images/g/E9wAAOSwzgJiC7Hi/s-l225.jpg,$8.00,Feb-28 05:49,Unknown,Unknown,Unknown,Instant,0,1,
item4489a43d95,Zambia 1987 - Bird Type of 1987 - Set of 3v - Scott 433-35 - MNH,https://www.ebay.com/itm/294367018389?hash=item4489a43d95:g:Oc4AAOSwuadhLQbU,https://i.ebayimg.com/thumbs/images/g/Oc4AAOSwuadhLQbU/s-l225.jpg,$3.00,Feb-28 03:38,"Brooklyn, New York, United States",Unknown,Unknown,Instant,0,21,
item28a547176c,Hawkins Gasket For All Type of 1.5 Ltr Pressure Cooker A00-09 Set of 5 AV1,https://www.ebay.com/itm/174571591532?hash=item28a547176c:g:FqkAAOSwOxFgA9es,https://i.ebayimg.com/thumbs/images/g/FqkAAOSwOxFgA9es/s-l225.jpg,$9.49,Feb-28 03:21,"DELHI, DELHI, India",Unknown,Unknown,Instant,0,3,
item265656bc94,Customer Choice - Pick Your Own Type of VIP Guppy Fish - Live Aquarium Guppy USA,https://www.ebay.com/itm/164657282196?hash=item265656bc94:g:rPMAAOSwcARgBVWm,https://i.ebayimg.com/thumbs/images/g/rPMAAOSwcARgBVWm/s-l225.jpg,$14.70 to $58.70,Feb-28 00:18,"Houston, Texas, United States",Unknown,Unknown,Instant,0,270,
item1d04d53a1e,1958 Liechtenstein SC# 320-323 - Sports Type of 1954 - M-H,https://www.ebay.com/itm/124635134494?hash=item1d04d53a1e:g:nAQAAOSw~SZgTlD-,https://i.ebayimg.com/thumbs/images/g/nAQAAOSw~SZgTlD-/s-l225.jpg,$6.94,Feb-27 21:21,"Thunder Bay, Ontario, Canada",jfquast,https://www.ebay.com/usr/jfquast?_trksid=p2047675.l2559,Instant,0,1,
item46dda55593,LL Cool J 45RPM “I’m That Type Of Guy” 1989 Hip Hop Def Jam 7” Vinyl EXC,https://www.ebay.com/itm/304366310803?hash=item46dda55593:g:ERgAAOSwkDZiAIqu,https://i.ebayimg.com/thumbs/images/g/ERgAAOSwkDZiAIqu/s-l225.jpg,$3.00,Feb-27 18:58,"Collingswood, New Jersey, United States",elliottjk,https://www.ebay.com/usr/elliottjk?_trksid=p2047675.l2559,Auction,1,1,"Feb 27, 2022

18:58:40 PST"
item56f4434a00,ONLY HAPPY FEET BRINGS YOU THIS TYPE OF FOOT RELIEF,https://www.ebay.com/itm/373465238016?hash=item56f4434a00:g:7sIAAOSw-IlgLikD,https://i.ebayimg.com/thumbs/images/g/7sIAAOSw-IlgLikD/s-l225.jpg,$19.75,Feb-27 17:49,"shanghai, China",Unknown,Unknown,Instant,0,6,
item4b1d8737b9,"Arginine Ultra - A Better Type of Arginine -  Stearate Free, Bottled in Glass!!!",https://www.ebay.com/itm/322617948089?hash=item4b1d8737b9:g:y20AAOSwzoRZgQPY,https://i.ebayimg.com/thumbs/images/g/y20AAOSwzoRZgQPY/s-l225.jpg,$11.95,Feb-27 16:39,"Palm Beach Gardens, Florida, United States",Unknown,Unknown,Instant,0,51,
item4246f6d898,"Vintage Tin Type of Antique Car, Ladies and Children",https://www.ebay.com/itm/284658423960?hash=item4246f6d898:g:czMAAOSwmUpiDufy,https://i.ebayimg.com/thumbs/images/g/czMAAOSwmUpiDufy/s-l225.jpg,$19.95,Feb-27 16:31,"Stockton Springs, Maine, United States",blacksheepfarmers,https://www.ebay.com/usr/blacksheepfarmers?_trksid=p2047675.l2559,Auction,1,1,"Feb 27, 2022

16:31:28 PST"
item2d5ef6f1b2,"1/32 Vintage Slot car 5.5""  type of car?   V. good shape.   Clean",https://www.ebay.com/itm/194866770354?hash=item2d5ef6f1b2:g:pSgAAOSwjBJiFXVT,https://i.ebayimg.com/thumbs/images/g/pSgAAOSwjBJiFXVT/s-l225.jpg,$9.50,Feb-27 15:47,"Wayland, Michigan, United States",pastoot,https://www.ebay.com/usr/pastoot?_trksid=p2047675.l2559,Auction,7,1,"Feb 27, 2022

15:47:17 PST"
item4011ca1ae6,"1839 Large Cent Coronet Head  Petit head, Type of 1840 ",https://www.ebay.com/itm/275176364774?hash=item4011ca1ae6:g:pKIAAOSwOFFiEo5c,https://i.ebayimg.com/thumbs/images/g/pKIAAOSwOFFiEo5c/s-l225.jpg,$41.02,Feb-27 11:22,"Port Charlotte, Florida, United States",pdagolfer,https://www.ebay.com/usr/pdagolfer?_trksid=p2047675.l2559,Auction,2,1,"Feb 27, 2022

11:22:36 PST"
item1d23e1daad,Type of  Bisharin - Egypt Ethnic -  Africa,https://www.ebay.com/itm/125156055725?hash=item1d23e1daad:g:6PkAAOSwne1iDlxY,https://i.ebayimg.com/thumbs/images/g/6PkAAOSwne1iDlxY/s-l225.jpg,$5.34,Feb-27 08:58,"Birmingham, United Kingdom",guyarab,https://www.ebay.com/usr/guyarab?_trksid=p2047675.l2559,Auction,1,1,"Feb 27, 2022

08:58:46 PST"
item5dd361ae7f,"Automatic Bobbin winder. works with all type of bobbins, auto shut off 110 volt",https://www.ebay.com/itm/402978352767?hash=item5dd361ae7f:g:C9YAAOSwqYZZqL-i,https://i.ebayimg.com/thumbs/images/g/C9YAAOSwqYZZqL-i/s-l225.jpg,$39.99,Feb-27 06:54,"Los Angeles, California, United States",Unknown,Unknown,Instant,0,24,
item266e225cb0,ISO OPTION #2 PERM KIT for Every Type Of Color-Treated Hair Professional,https://www.ebay.com/itm/165056502960?epid=1537599644&hash=item266e225cb0:g:KCkAAOSwKxdhkF04,https://i.ebayimg.com/thumbs/images/g/KCkAAOSwKxdhkF04/s-l225.jpg,$17.25,Feb-27 06:48,"Brooklyn, New York, United States",Unknown,Unknown,Instant,0,34,
item5992841c57,2020-21 O-Pee-Chee Platinum All type of inserts (YOU CHOOSE FROM LIST),https://www.ebay.com/itm/384710220887?hash=item5992841c57:g:IgAAAOSwtkph-OYj,https://i.ebayimg.com/thumbs/images/g/IgAAAOSwtkph-OYj/s-l225.jpg,$0.78 to $15.77,Feb-27 04:45,"Deux-Montagne, Canada",Unknown,Unknown,Instant,0,2,
item2406963504,Orville LPC-85 Les Paul Custom Type of All Mahogany Made in 1998 Electric Guitar,https://www.ebay.com/itm/154729329924?hash=item2406963504:g:sigAAOSw1MphqFcv,https://i.ebayimg.com/thumbs/images/g/sigAAOSw1MphqFcv/s-l225.jpg,"$1,084.00",Feb-26 19:54,"Tokyo, Japan",japantreasures,https://www.ebay.com/usr/japantreasures?_trksid=p2047675.l2559,Instant,0,1,
item4913448da9,Joyin Play Food Pack Kids Kitchen Plastic All Type Of Food New 4 Bags,https://www.ebay.com/itm/313855872425?hash=item4913448da9:g:~tAAAOSwPVJh9t5j,https://i.ebayimg.com/thumbs/images/g/~tAAAOSwPVJh9t5j/s-l225.jpg,$20.00,Feb-26 17:12,"Omaha, Nebraska, United States",whdwhd-y5hbol,https://www.ebay.com/usr/whdwhd-y5hbol?_trksid=p2047675.l2559,Instant,0,1,
item3b76bcd1dd,Beautiful Bowie Type of Knife with Inlaid Handle,https://www.ebay.com/itm/255395156445?hash=item3b76bcd1dd:g:yB4AAOSw5B9iBs-c,https://i.ebayimg.com/thumbs/images/g/yB4AAOSw5B9iBs-c/s-l225.jpg,$45.00,Feb-26 14:06,"Sun City West, Arizona, United States",netennis,https://www.ebay.com/usr/netennis?_trksid=p2047675.l2559,Auction,1,1,"Feb 26, 2022

14:06:54 PST"
item5981ee5b07,Chevelle 2004 Type Of Thinking 2 sided promotional poster Flawless New Old Stock,https://www.ebay.com/itm/384431971079?hash=item5981ee5b07:g:BYcAAOSweTlhXgpx,https://i.ebayimg.com/thumbs/images/g/BYcAAOSweTlhXgpx/s-l225.jpg,$9.99,Feb-26 13:49,"Rutland, Vermont, United States",Unknown,Unknown,Instant,0,2,
item1ac3052e9f,"6 PACK RECYCLING STICKERS WHEELIE BIN, RUBBISH AND DIFFERENT TYPE OF WASTE BINS",https://www.ebay.com/itm/114941046431?epid=23043390706&hash=item1ac3052e9f:g:CowAAOSw~0hhabpx,https://i.ebayimg.com/thumbs/images/g/CowAAOSw~0hhabpx/s-l225.jpg,$2.50,Feb-26 13:10,"London, United Kingdom",Unknown,Unknown,Instant,0,7,
item21a0723967,5.10mm yellow metal studs for any type of 1 pair earrings,https://www.ebay.com/itm/144425761127?hash=item21a0723967:g:stsAAOSwGsFiE97B,https://i.ebayimg.com/thumbs/images/g/stsAAOSwGsFiE97B/s-l225.jpg,$0.01,Feb-26 10:49,"New York, New York, United States",diamondforgood9,https://www.ebay.com/usr/diamondforgood9?_trksid=p2047675.l2559,Auction,1,1,"Feb 26, 2022

10:49:35 PST"
item34188c0328,ISO OPTION # 2 PERM KIT for Every Type Of Color ( Pack of 4 ),https://www.ebay.com/itm/223750128424?epid=1537599644&hash=item34188c0328:g:nj0AAOSwA75dzbMC,https://i.ebayimg.com/thumbs/images/g/nj0AAOSwA75dzbMC/s-l225.jpg,$49.99,Feb-26 09:40,"Palisades Park, New Jersey, United States",Unknown,Unknown,Instant,0,8,
item3fd52e7b51,"Men's Black Leather Belt, 1.25"" Wide, Silver Buckle, Choice Type of Leather",https://www.ebay.com/itm/274159532881?hash=item3fd52e7b51:g:zFMAAOSw~hZeAJrU,https://i.ebayimg.com/thumbs/images/g/zFMAAOSw~hZeAJrU/s-l225.jpg,$12.00 to $18.68,Feb-26 09:21,"BOURNEMOUTH, United Kingdom",Unknown,Unknown,Instant,0,73,
item44a5159e8a,"Mystery Trailing Petunia~65+small plant plugs~Some type of trailing, lost label",https://www.ebay.com/itm/294827433610?hash=item44a5159e8a:g:0bgAAOSwgnxiFOL7,https://i.ebayimg.com/thumbs/images/g/0bgAAOSwgnxiFOL7/s-l225.jpg,$30.00,Feb-26 08:50,"Martinsburg, Pennsylvania, United States",everlastingflowers,https://www.ebay.com/usr/everlastingflowers?_trksid=p2047675.l2559,Auction,19,1,"Feb 26, 2022

08:50:20 PST"
item28a83966be,Flexible flat Flex PIN FFC/FPC Cable 20cm Ribbon Pitch 1mm 0.5mm all type of pin,https://www.ebay.com/itm/174621025982?hash=item28a83966be:g:Tu0AAOSwitZgGGf9,https://i.ebayimg.com/thumbs/images/g/Tu0AAOSwitZgGGf9/s-l225.jpg,$5.56,Feb-26 08:43,"SURBO, Italy",Unknown,Unknown,Instant,0,76,
item3fd229255c,"Men's Black Leather Belt, 1.25"" Wide, Silver Buckle, Choice Type of Leather",https://www.ebay.com/itm/274108851548?hash=item3fd229255c:g:uJAAAOSwEbBd18Te,https://i.ebayimg.com/thumbs/images/g/uJAAAOSwEbBd18Te/s-l225.jpg,$10.67 to $16.01,Feb-26 08:19,"BOURNEMOUTH, United Kingdom",Unknown,Unknown,Instant,0,151,
item344e0f1608,ISO / INT 40 -Some type of Slip Torque / Tapping chuck  - Kennametal?,https://www.ebay.com/itm/224647910920?hash=item344e0f1608:g:XuQAAOSwGSFhaPhL,https://i.ebayimg.com/thumbs/images/g/XuQAAOSwGSFhaPhL/s-l225.jpg,$29.37,Feb-26 03:25,"Hillsborough, United Kingdom",atc-1990,https://www.ebay.com/usr/atc-1990?_trksid=p2047675.l2559,Instant,0,1,
item4dd7c9caff,The Workbench Book: A Craftsman's Guide to Workbenches for Every Type of Woodwor,https://www.ebay.com/itm/334332807935?hash=item4dd7c9caff:g:jQgAAOSwoCFiDbac,https://i.ebayimg.com/thumbs/images/g/jQgAAOSwoCFiDbac/s-l225.jpg,$20.00,Feb-26 01:42,"Trout Creek, Montana, United States",rot46872,https://www.ebay.com/usr/rot46872?_trksid=p2047675.l2559,Instant,0,1,
item368604ce90,"set of 4 stainless swizzle stir sticks, each with a different type of sea shell",https://www.ebay.com/itm/234176695952?hash=item368604ce90:g:-vgAAOSwOQthN57M,https://i.ebayimg.com/thumbs/images/g/-vgAAOSwOQthN57M/s-l225.jpg,$8.75,Feb-25 21:29,"Elkader, Iowa, United States",kishea0,https://www.ebay.com/usr/kishea0?_trksid=p2047675.l2559,Instant,0,1,
item4012239e2b,5+ Ramshorn Snails AND 3 Type of Aquarium Plants ( Hairgrass Moss) BUY2GET1FREE!,https://www.ebay.com/itm/275182231083?hash=item4012239e2b:g:RJoAAOSwcRlf3PUL,https://i.ebayimg.com/thumbs/images/g/RJoAAOSwcRlf3PUL/s-l225.jpg,$17.99,Feb-25 21:29,"San Diego, California, United States",Unknown,Unknown,Instant,0,1,
item2f62057361,1 lbs Microgreens Pacific mix salad sprout micro green Organic 5 Type of seeds,https://www.ebay.com/itm/203507987297?hash=item2f62057361:g:qG8AAOSwYNpearn2,https://i.ebayimg.com/thumbs/images/g/qG8AAOSwYNpearn2/s-l225.jpg,$24.99,Feb-25 19:54,"Sparks, Nevada, United States",Unknown,Unknown,Instant,0,12,
item23e723b9c9,❤ Colourpop So Juicy Plumping Gloss -- YOU PICK ❤,https://www.ebay.com/itm/154201733577?hash=item23e723b9c9:g:7I8AAOSwvJ9ftZ2Q,https://i.ebayimg.com/thumbs/images/g/7I8AAOSwvJ9ftZ2Q/s-l225.jpg,$14.99,Feb-25 16:51,"Buffalo, New York, United States",Unknown,Unknown,Instant,0,9,
item1ceae71af3,"Safety Pins #00 3/4"" pink color (1440) Pcs, great for all type of sewing & craft",https://www.ebay.com/itm/124200098547?hash=item1ceae71af3:g:SQcAAOSw7NNUEKXr,https://i.ebayimg.com/thumbs/images/g/SQcAAOSw7NNUEKXr/s-l225.jpg,$14.99,Feb-25 14:45,"Los Angeles, California, United States",avieleah,https://www.ebay.com/usr/avieleah?_trksid=p2047675.l2559,Instant,0,2,
item54b0690301,aluminium stud silicon rubber earring backing for All type of earring 5.10mm,https://www.ebay.com/itm/363736924929?hash=item54b0690301:g:hCoAAOSw4~JiEqJc,https://i.ebayimg.com/thumbs/images/g/hCoAAOSw4~JiEqJc/s-l225.jpg,$0.06,Feb-25 12:19,"New York, New York, United States",diamondforgood9,https://www.ebay.com/usr/diamondforgood9?_trksid=p2047675.l2559,Auction,2,1,"Feb 25, 2022

12:19:38 PST"
item4913fafca6,"Managing Up: How to Move up, Win at Work, and Succeed with Any Type of Boss by",https://www.ebay.com/itm/313867828390?epid=240624308&hash=item4913fafca6:g:HMIAAOSwqqBgAFOc,https://i.ebayimg.com/thumbs/images/g/HMIAAOSwqqBgAFOc/s-l225.jpg,$10.93,Feb-25 08:26,Unknown,Unknown,Unknown,Instant,0,1,
item1d23dbab76,The Workbench Book: A Craftsman's Guide to Workbenches for Every Type of Woo...,https://www.ebay.com/itm/125155650422?epid=223691&hash=item1d23dbab76:g:F6MAAOSwKkJiD7RJ,https://i.ebayimg.com/thumbs/images/g/F6MAAOSwKkJiD7RJ/s-l225.jpg,$13.47,Feb-25 06:59,Unknown,Unknown,Unknown,Instant,0,1,
item1d21fe9fab,1944 Algeria SC# J28-J30 - Type of 1926 - Postage Due Stamps - M-H,https://www.ebay.com/itm/125124386731?hash=item1d21fe9fab:g:ZhMAAOSwjrlh9XR-,https://i.ebayimg.com/thumbs/images/g/ZhMAAOSwjrlh9XR-/s-l225.jpg,$2.37,Feb-25 06:52,"Thunder Bay, Ontario, Canada",jfquast,https://www.ebay.com/usr/jfquast?_trksid=p2047675.l2559,Instant,0,1,
