id,title,link,price,origin,image,seller_name,seller_link,sell_type,num_bids,num_watchers,num_stock,date
item5973189b83,Ribbon Butterfly Sericinus montelus Clear in Block Education Insect Specimen,https://www.ebay.com/itm/384183081859?hash=item5973189b83:g:uB0AAOxyUrZSxsEM,$16.99,"Hong Kong, Hong Kong",https://i.ebayimg.com/images/g/uB0AAOxyUrZSxsEM/s-l300.jpg,gaofudev,https://www.ebay.com/usr/gaofudev?_trksid=p2047675.l2559,Auction,0,0,1,Unknown
item5968622b84,Ribbon Butterfly Sericinus montelus Clear in Block Education Insect Specimen,https://www.ebay.com/itm/384003353476?hash=item5968622b84:g:uB0AAOxyUrZSxsEM,$17.00,"Hong Kong, Hong Kong",https://i.ebayimg.com/images/g/uB0AAOxyUrZSxsEM/s-l300.jpg,gaofudev,https://www.ebay.com/usr/gaofudev?_trksid=p2047675.l2559,Instant,0,0,Last one,"Apr 15, 2021 01:58:38 PDT"
item1cd3c7b5c8,"Sericinus montelus Male EX zangh Bai MTS., China n720c",https://www.ebay.com/itm/123812165064?hash=item1cd3c7b5c8:g:sCoAAOSw3YtdD4J8,$29.24,"Brachbach, Germany",https://i.ebayimg.com/images/g/sCoAAOSw3YtdD4J8/s-l300.jpg,borboleta555,https://www.ebay.com/usr/borboleta555?_trksid=p2047675.l2559,Instant,0,0,1,"Nov 01, 2020 03:49:40 PST"
item33fffa22f1,COLLECTION 10 pcs umounted butterfly papilionidae sericinus montelus CHINA A1-,https://www.ebay.com/itm/223337915121?hash=item33fffa22f1:g:DVEAAOSwZ8pcRo8L,$8.80,"mainland, China",https://i.ebayimg.com/images/g/DVEAAOSwZ8pcRo8L/s-l300.jpg,xzcyj,https://www.ebay.com/usr/xzcyj?_trksid=p2047675.l2559,Instant,0,0,6,"Feb 02, 2020 03:27:02 PST"
item48d7312384,COLLECTION 5 PCS umounted butterfly papilionidae sericinus montelus CHINA A1-,https://www.ebay.com/itm/312847967108?hash=item48d7312384:g:8CEAAOSwc95a41ca,$4.50,"beijing, China",https://i.ebayimg.com/images/g/8CEAAOSwc95a41ca/s-l300.jpg,china*butterfly,https://www.ebay.com/usr/china*butterfly?_trksid=p2047675.l2559,Instant,0,0,6,"Jan 07, 2021 03:51:12 PST"
