id,title,link,price,origin,image,seller_name,seller_link,sell_type,num_bids,num_watchers,num_stock,date
item2d356f0268,ORNITHOPTERA URVILLIANUS MALE. NGGELA ISLAND.,https://www.ebay.com/itm/194169995880?hash=item2d356f0268:g:rZcAAOSwNEpgs3jv,$39.99,"Anapa, default, Russian Federation",https://i.ebayimg.com/images/g/rZcAAOSwNEpgs3jv/s-l300.jpg,icar7516,https://www.ebay.com/usr/icar7516?_trksid=p2047675.l2559,Auction,0,0,1,Unknown
item2d356ef653,ORNITHOPTERA URVILLIANUS MALE. MALAITA ISLAND.,https://www.ebay.com/itm/194169992787?hash=item2d356ef653:g:4TgAAOSwOoVgs3c-,$39.99,"Anapa, default, Russian Federation",https://i.ebayimg.com/images/g/4TgAAOSwOoVgs3c-/s-l300.jpg,icar7516,https://www.ebay.com/usr/icar7516?_trksid=p2047675.l2559,Auction,0,0,1,Unknown
item2d356efc68,ORNITHOPTERA URVILLIANUS MALE. MARAMASIKE ISLAND.,https://www.ebay.com/itm/194169994344?hash=item2d356efc68:g:FYYAAOSwXatgs3hb,$39.99,"Anapa, default, Russian Federation",https://i.ebayimg.com/images/g/FYYAAOSwXatgs3hb/s-l300.jpg,icar7516,https://www.ebay.com/usr/icar7516?_trksid=p2047675.l2559,Auction,0,0,1,Unknown
item2d356f26fe,ORNITHOPTERA URVILLIANUS MALE. GUADALCANAL ISLAND.,https://www.ebay.com/itm/194170005246?hash=item2d356f26fe:g:MpwAAOSwRAdgs3mn,$39.99,"Anapa, default, Russian Federation",https://i.ebayimg.com/images/g/MpwAAOSwRAdgs3mn/s-l300.jpg,icar7516,https://www.ebay.com/usr/icar7516?_trksid=p2047675.l2559,Auction,0,0,1,Unknown
item445e492750,Ornithoptera urvillianus female form fuscapallida In the frame. Very rare form.,https://www.ebay.com/itm/293639628624?hash=item445e492750:g:7HkAAOSw2z9fBG-d,$25.00,"ruza, mosoblast, Russian Federation",https://i.ebayimg.com/images/g/7HkAAOSw2z9fBG-d/s-l300.jpg,roman-insects,https://www.ebay.com/usr/roman-insects?_trksid=p2047675.l2559,Instant,0,0,1,Unknown
item21627f9572,Ornithoptera urvillianus male in frame made of expensive wood!!,https://www.ebay.com/itm/143386449266?hash=item21627f9572:g:ZpkAAOSwLhFdgdxw,$39.00,"ruza, mosoblast, Russian Federation",https://i.ebayimg.com/images/g/ZpkAAOSwLhFdgdxw/s-l300.jpg,souvenirrus,https://www.ebay.com/usr/souvenirrus?_trksid=p2047675.l2559,Instant,0,0,1,"Nov 26, 2019 01:36:59 PST"
