id,title,link,price,origin,image,seller_name,seller_link,sell_type,num_bids,num_watchers,num_stock,date
item44801d241f,Collectible Stamp Pin Dogface USA 13c Colias eurydice Pinback Free Shipping,https://www.ebay.com/itm/294207169567?hash=item44801d241f:g:fJ8AAOSwWQNgt57n,$6.00,"Astoria, New York, United States",https://i.ebayimg.com/thumbs/images/g/fJ8AAOSwWQNgt57n/s-l225.jpg,telecihuffi0,https://www.ebay.com/usr/telecihuffi0?_trksid=p2047675.l2559,Instant,0,0,1,"Jun 11, 2021 00:08:13 PDT"
item2324b7fbc4,Butterfly Postage Stamp Dogface USA 13c Colias Eurydice Metal Enamel Pin Pinback,https://www.ebay.com/itm/150939892676?hash=item2324b7fbc4:g:S9cAAMXQ9cpRGIo9,$12.99,"Clinton, Washington, United States",https://i.ebayimg.com/thumbs/images/g/S9cAAMXQ9cpRGIo9/s-l225.jpg,will_do,https://www.ebay.com/usr/will_do?_trksid=p2047675.l2559,Instant,0,0,1,"Nov 02, 2020 10:19:39 PST"
item26646e1a84,"1977 Dogface Colias Eurydice Butterfly FDC Stamp - Envelope Indianapolis, IN",https://www.ebay.com/itm/164893694596?hash=item26646e1a84:g:-asAAOSwsldgtqGm,$12.74,"Oklahoma City, Oklahoma, United States",https://i.ebayimg.com/thumbs/images/g/-asAAOSwsldgtqGm/s-l225.jpg,atoadas82,https://www.ebay.com/usr/atoadas82?_trksid=p2047675.l2559,Instant,0,0,1,Unknown
item1a7b094294,Pin's pin butterfly colias Eurydice stamp usa 13 C (ref 020),https://www.ebay.com/itm/113733354132?hash=item1a7b094294:g:PnIAAOSw2s1Uy9vV,$4.70,"Aizenay, France",https://i.ebayimg.com/thumbs/images/g/PnIAAOSw2s1Uy9vV/s-l225.jpg,judomi_fr,https://www.ebay.com/usr/judomi_fr?_trksid=p2047675.l2559,Instant,0,0,1,"Mar 30, 2021 02:17:15 PDT"
item5b7694cfd8,USA POSTAGE STAMP STAMPED 13c DOGFACE Colias Eurydice Butterfly/3842,https://www.ebay.com/itm/392831487960?hash=item5b7694cfd8:g:oiYAAOSwXN5e33Au,$1.18,"Unna, Germany",https://i.ebayimg.com/thumbs/images/g/oiYAAOSwXN5e33Au/s-l225.jpg,briefmarken_paradies,https://www.ebay.com/usr/briefmarken_paradies?_trksid=p2047675.l2559,Instant,0,0,1,"Jan 01, 2021 05:49:21 PST"
item261a77c192,Pins usa stamp butterfly colias Eurydice dogface postage stamp lapel pin,https://www.ebay.com/itm/163652813202?hash=item261a77c192:g:i6EAAOSw5HBbSFw1,$5.89,"la roche sur yon, Pays de la Loire, France",https://i.ebayimg.com/thumbs/images/g/i6EAAOSw5HBbSFw1/s-l225.jpg,pins-broches,https://www.ebay.com/usr/pins-broches?_trksid=p2047675.l2559,Instant,0,0,1,"May 06, 2021 11:39:49 PDT"
item1f2305143c,USA US 1981 CARDS BUTTERFLIES OF THE WORLD COLIAS EURYDICE CALIFORNIA DOGFACE,https://www.ebay.com/itm/133731521596?hash=item1f2305143c:g:XrYAAOSwLYRgKSqr,$4.12,"Herne Bay, United Kingdom",https://i.ebayimg.com/thumbs/images/g/XrYAAOSwLYRgKSqr/s-l225.jpg,bai-7747,https://www.ebay.com/usr/bai-7747?_trksid=p2047675.l2559,Instant,0,0,1,"Aug 08, 2021 06:09:03 PDT"
item4dc0358c01,Pin's 13c usa post stamp post service stamp colias Eurydice pins pin 43,https://www.ebay.com/itm/333937216513?hash=item4dc0358c01:g:PWYAAOSwSixgX9Rf,$2.95,"Besançon, France",https://i.ebayimg.com/thumbs/images/g/PWYAAOSwSixgX9Rf/s-l225.jpg,di-225299,https://www.ebay.com/usr/di-225299?_trksid=p2047675.l2559,Instant,0,0,1,Unknown
