id,title,link,price,origin,image,seller_name,seller_link,sell_type,num_bids,num_watchers,num_stock,date
item4b8e40980e,"Allancastria cerisyi ferdinandi, male, A1 quality (Bulgaria)",https://www.ebay.com/itm/324509145102?hash=item4b8e40980e:g:IhgAAOSwt4Vdl2Ht,$8.00,"Saratov, default, Russian Federation",https://i.ebayimg.com/thumbs/images/g/IhgAAOSwt4Vdl2Ht/s-l225.jpg,arctos16,https://www.ebay.com/usr/arctos16?_trksid=p2047675.l2559,Instant,0,0,1,"Mar 06, 2021 05:55:02 PST"
item4b93e9f904,"Allancastria cerisyi huberi, male, A1+ (Greece)",https://www.ebay.com/itm/324604131588?hash=item4b93e9f904:g:d~QAAOSwJihcr1iq,$15.00,"Saratov, default, Russian Federation",https://i.ebayimg.com/thumbs/images/g/d~QAAOSwJihcr1iq/s-l225.jpg,arctos16,https://www.ebay.com/usr/arctos16?_trksid=p2047675.l2559,Instant,0,0,1,Unknown
item4b8e40b352,"Allancastria cerisyi ferdinandi, female, A1- quality (Bulgaria)",https://www.ebay.com/itm/324509152082?hash=item4b8e40b352:g:n7sAAOSwof5gQ4k7,$12.00,"Saratov, default, Russian Federation",https://i.ebayimg.com/thumbs/images/g/n7sAAOSwof5gQ4k7/s-l225.jpg,arctos16,https://www.ebay.com/usr/arctos16?_trksid=p2047675.l2559,Instant,0,0,1,Unknown
item4b6274feec,"Allancastria cerisyi huberi, female, A1- (Greece)",https://www.ebay.com/itm/323774381804?hash=item4b6274feec:g:ITwAAOSwzqdcr1m7,$15.00,"Saratov, default, Russian Federation",https://i.ebayimg.com/thumbs/images/g/ITwAAOSwzqdcr1m7/s-l225.jpg,arctos16,https://www.ebay.com/usr/arctos16?_trksid=p2047675.l2559,Instant,0,0,1,"Jun 18, 2020 07:44:12 PDT"
item5ddafe83c2,"Papilio Butterfly ALLANCASTRIA cerisyi, Turkey",https://www.ebay.com/itm/403106071490?hash=item5ddafe83c2:g:lQQAAOSwmU9eStyT,$4.71,"Callenberg, Germany",https://i.ebayimg.com/thumbs/images/g/lQQAAOSwmU9eStyT/s-l225.jpg,asth5,https://www.ebay.com/usr/asth5?_trksid=p2047675.l2559,Instant,0,0,1,Unknown
item4482f12391,Laura Balkan allancastria cerisyi eastern gloire butterfly image 1951 card,https://www.ebay.com/itm/294254617489?hash=item4482f12391:g:Bd0AAOSwu95dS~q3,$5.88,"Varna, Bulgaria",https://i.ebayimg.com/thumbs/images/g/Bd0AAOSwu95dS~q3/s-l225.jpg,saintmichelfrance,https://www.ebay.com/usr/saintmichelfrance?_trksid=p2047675.l2559,Instant,0,0,1,Unknown
item46cce128fa,Pieris rapae small white butterfly/allancastria cerisyi eastern gloire card 60s,https://www.ebay.com/itm/304085018874?hash=item46cce128fa:g:1b8AAOSwvgdW3bvf,$5.88,"Varna, Bulgaria",https://i.ebayimg.com/thumbs/images/g/1b8AAOSwvgdW3bvf/s-l225.jpg,saintmichelfrance,https://www.ebay.com/usr/saintmichelfrance?_trksid=p2047675.l2559,Instant,0,0,1,Unknown
