id,title,link,price,origin,image,seller_name,seller_link,sell_type,num_bids,num_watchers,num_stock,date
item2b143f4a4f,"Vintage Hobart Brown Brass Stock Car Belt Buckle (5"" L) (Kinetic Sculpture Race)",https://www.ebay.com/itm/185023285839?hash=item2b143f4a4f:g:xGEAAOSwl~thAG3E,$40.00,"Fortuna, California, United States",https://i.ebayimg.com/thumbs/images/g/xGEAAOSwl~thAG3E/s-l225.jpg,powderhorn123us,https://www.ebay.com/usr/powderhorn123us?_trksid=p2047675.l2559,Instant,0,0,1,Unknown
item23f4951b7f,Gallery Presents Metal Sculpture by Hobart Brown cover title / 1st #93203,https://www.ebay.com/itm/154427267967?hash=item23f4951b7f:g:6oQAAOSwFFhghJhe,$31.25,"Eureka, California, United States",https://i.ebayimg.com/thumbs/images/g/6oQAAOSwFFhghJhe/s-l225.jpg,eurekabookshop,https://www.ebay.com/usr/eurekabookshop?_trksid=p2047675.l2559,Instant,0,0,1,"Aug 24, 2021 19:50:08 PDT"
item2660b19d00,"Joanna Halpert Kraus, Hobart Brown / For the Glory A Two-Act Play 1st ed #93202",https://www.ebay.com/itm/164831010048?hash=item2660b19d00:g:NVsAAOSw8FhghJhY,$31.25,"Eureka, California, United States",https://i.ebayimg.com/thumbs/images/g/NVsAAOSw8FhghJhY/s-l225.jpg,eurekabookshop,https://www.ebay.com/usr/eurekabookshop?_trksid=p2047675.l2559,Instant,0,0,1,"Jul 30, 2021 15:50:08 PDT"
item23f4959efd,Hobart Brown / Book with Handpainted Cover 1980 #206927,https://www.ebay.com/itm/154427301629?hash=item23f4959efd:g:XoQAAOSwEIdghKS3,$106.25,"Eureka, California, United States",https://i.ebayimg.com/thumbs/images/g/XoQAAOSwEIdghKS3/s-l225.jpg,eurekabookshop,https://www.ebay.com/usr/eurekabookshop?_trksid=p2047675.l2559,Instant,0,0,1,Unknown
item2660b26cae,Hobart Brown / Book with Handpainted Cover 1980 #206925,https://www.ebay.com/itm/164831063214?hash=item2660b26cae:g:i9kAAOSwuQdghKSu,$106.25,"Eureka, California, United States",https://i.ebayimg.com/thumbs/images/g/i9kAAOSwuQdghKSu/s-l225.jpg,eurekabookshop,https://www.ebay.com/usr/eurekabookshop?_trksid=p2047675.l2559,Instant,0,0,1,Unknown
item288640fc11,Hobart Brown Sculpture,https://www.ebay.com/itm/174051097617?hash=item288640fc11:g:vroAAOSwF~lalrVc,$450.00,"Mendocino, California, United States",https://i.ebayimg.com/thumbs/images/g/vroAAOSwF~lalrVc/s-l225.jpg,hamvieww,https://www.ebay.com/usr/hamvieww?_trksid=p2047675.l2559,Instant,0,0,1,"Apr 06, 2020 15:40:13 PDT"
item1a9fe6ef9c,Hobart Brown Bronze/Brass Sculpture Of Humpback Whale 1988,https://www.ebay.com/itm/114351861660?hash=item1a9fe6ef9c:g:9jwAAOSwHLRfFJny,$500.00,"San Francisco, California, United States",https://i.ebayimg.com/thumbs/images/g/9jwAAOSwHLRfFJny/s-l225.jpg,hillx,https://www.ebay.com/usr/hillx?_trksid=p2047675.l2559,Instant,0,0,1,"Aug 31, 2020 11:15:18 PDT"
item46a88a1bf0,"ECCO WOMENS HOBART BROWN DISTRESSED LEATHER BOOTS SZ 36, US 5.5-6 BUCKLE EUC",https://www.ebay.com/itm/303475334128?hash=item46a88a1bf0:g:eoIAAOSwsWpefnlB,$24.99,"Aptos, California, United States",https://i.ebayimg.com/thumbs/images/g/eoIAAOSwsWpefnlB/s-l225.jpg,pukafan831,https://www.ebay.com/usr/pukafan831?_trksid=p2047675.l2559,Instant,0,0,1,"May 17, 2021 00:14:57 PDT"
item57009fbc2f,ECCO HOBART BROWN LEATHER TRI-BUCKLE STRAPS MOTO RIDING BOOTS 35 EURO/4-4.5 USA,https://www.ebay.com/itm/373672623151?hash=item57009fbc2f:g:2jkAAOSwSAdgWWo6,$29.95,"Puyallup, Washington, United States",https://i.ebayimg.com/thumbs/images/g/2jkAAOSwSAdgWWo6/s-l225.jpg,veepolar,https://www.ebay.com/usr/veepolar?_trksid=p2047675.l2559,Instant,0,0,1,Unknown
item596c75b462,Ecco Hobart Brown Zip Up Triple Buckle Equestrian Boots Women Sz EU38 (7 -7.5),https://www.ebay.com/itm/384071742562?hash=item596c75b462:g:ODUAAOSwdiNgZOwg,$69.95,"Seattle, Washington, United States",https://i.ebayimg.com/thumbs/images/g/ODUAAOSwdiNgZOwg/s-l225.jpg,solevationfootwear,https://www.ebay.com/usr/solevationfootwear?_trksid=p2047675.l2559,Instant,0,0,1,Unknown
item596c04e338,Ecco Hobart Brown Zip Up Triple Buckle Equestrian Boots  Women Sz EU39 (8 -8.5),https://www.ebay.com/itm/384064348984?hash=item596c04e338:g:rjYAAOSwIQBgX2tp,$69.95,"Seattle, Washington, United States",https://i.ebayimg.com/thumbs/images/g/rjYAAOSwIQBgX2tp/s-l225.jpg,solevationfootwear,https://www.ebay.com/usr/solevationfootwear?_trksid=p2047675.l2559,Instant,0,0,1,Unknown
item266ad13500,ECCO Hobart Brown 3 Buckle Full Zip Tall Riding Boots Women’s EU 40 US 9-9.5,https://www.ebay.com/itm/165000852736?hash=item266ad13500:g:U5sAAOSw7Q1fynbw,$49.99,"Gilbert, Arizona, United States",https://i.ebayimg.com/thumbs/images/g/U5sAAOSw7Q1fynbw/s-l225.jpg,707destination_unknown,https://www.ebay.com/usr/707destination_unknown?_trksid=p2047675.l2559,Instant,0,0,1,"Aug 30, 2021 08:56:57 PDT"
item4236493182,ECCO Hobart Brown Leather 3 Buckle Side Zip Riding Moto Boots EUR 39 US 8-8.5,https://www.ebay.com/itm/284378608002?hash=item4236493182:g:o8UAAOSwJpxgSnzH,$42.00,"Boise, Idaho, United States",https://i.ebayimg.com/thumbs/images/g/o8UAAOSwJpxgSnzH/s-l225.jpg,carinkatrina,https://www.ebay.com/usr/carinkatrina?_trksid=p2047675.l2559,Instant,0,0,1,Unknown
item4b970e4480,Women's ECCO Hobart Brown Leather Riding Boots Size EUR 39 / US 8 - 8.5 VGC!,https://www.ebay.com/itm/324656841856?hash=item4b970e4480:g:prwAAOSw4BBgrdxo,$23.74,"Lake Stevens, Washington, United States",https://i.ebayimg.com/thumbs/images/g/prwAAOSw4BBgrdxo/s-l225.jpg,daxflips,https://www.ebay.com/usr/daxflips?_trksid=p2047675.l2559,Instant,0,0,1,"Jun 05, 2021 12:13:39 PDT"
item2b12a7a413,ECCO Hobart Brown Leather Tall Riding Boots Side Zip Buckle Sz 42 US 10/10.5 M,https://www.ebay.com/itm/184996570131?hash=item2b12a7a413:g:-k8AAOSwUIle-PZ-,$39.99,"Pittsburgh, Pennsylvania, United States",https://i.ebayimg.com/thumbs/images/g/-k8AAOSwUIle-PZ-/s-l225.jpg,walnut412,https://www.ebay.com/usr/walnut412?_trksid=p2047675.l2559,Instant,0,0,1,Unknown
item5b8790bc4b,Ecco Womens Hobart Brown Leather Three Buckle Tall Riding Boots EU 38 US 7 - 7.5,https://www.ebay.com/itm/393116433483?hash=item5b8790bc4b:g:C9YAAOSw6yBgFv95,$69.95,"Georgetown, Kentucky, United States",https://i.ebayimg.com/thumbs/images/g/C9YAAOSw6yBgFv95/s-l225.jpg,peapoppersplace,https://www.ebay.com/usr/peapoppersplace?_trksid=p2047675.l2559,Instant,0,0,1,"May 12, 2021 08:37:44 PDT"
item1f29c9fb28,ECCO Hobart Brown Leather Ankle Booties Harness Boots Women's Size 39 US 8.5,https://www.ebay.com/itm/133845089064?hash=item1f29c9fb28:g:lWEAAOSwWk9hEyc~,$34.99,"Salisbury, Maryland, United States",https://i.ebayimg.com/thumbs/images/g/lWEAAOSwWk9hEyc~/s-l225.jpg,sashleysmarketplace,https://www.ebay.com/usr/sashleysmarketplace?_trksid=p2047675.l2559,Instant,0,0,1,Unknown
item4da836d168,"ECCO, Hobart Brown  leather  Knee- High  Women's  Boots, Size EUR 40 US 9-9.5",https://www.ebay.com/itm/333534646632?hash=item4da836d168:g:qiAAAOSwAJheXs3r,$125.00,"Matawan, New Jersey, United States",https://i.ebayimg.com/thumbs/images/g/qiAAAOSwAJheXs3r/s-l225.jpg,vistagrande,https://www.ebay.com/usr/vistagrande?_trksid=p2047675.l2559,Instant,0,0,1,"Feb 03, 2021 13:47:30 PST"
item4002c79039,NEW With Box ECCO Womens Hobart Brown Riding Boots 41 EU 10 / 10.5 Original $230,https://www.ebay.com/itm/274924539961?hash=item4002c79039:g:fJ0AAOSwqmxfmD7s,$70.00,"Springboro, Ohio, United States",https://i.ebayimg.com/thumbs/images/g/fJ0AAOSwqmxfmD7s/s-l225.jpg,trudyk,https://www.ebay.com/usr/trudyk?_trksid=p2047675.l2559,Instant,0,0,1,Unknown
item340a21577c,Ecco NEW Hobart Brown Buckles Side Zip Knee Hight Leather Boot Wo's US 10M/10.5,https://www.ebay.com/itm/223508256636?hash=item340a21577c:g:SKsAAOSwj61c0lvH,$169.99,"Chandler, Arizona, United States",https://i.ebayimg.com/thumbs/images/g/SKsAAOSwj61c0lvH/s-l225.jpg,couture2020,https://www.ebay.com/usr/couture2020?_trksid=p2047675.l2559,Instant,0,0,1,"Dec 07, 2020 20:50:02 PST"
item4dc25eef3f,Ecco Hobart Brown Leather Knee High Riding Buckle Boots Womens Size 35 M*,https://www.ebay.com/itm/333973483327?hash=item4dc25eef3f:g:HxQAAOSw8UZaCcHy,$51.30,"Charlotte, North Carolina, United States",https://i.ebayimg.com/thumbs/images/g/HxQAAOSw8UZaCcHy/s-l225.jpg,exclusivelyposh,https://www.ebay.com/usr/exclusivelyposh?_trksid=p2047675.l2559,Instant,0,0,1,"Jul 11, 2021 18:02:35 PDT"
item4dc25e875a,Ecco Hobart Brown Leather Knee High Riding Boots Womens Size 41 M *,https://www.ebay.com/itm/333973456730?hash=item4dc25e875a:g:qyIAAOSwMQBaS-k3,$51.30,"Charlotte, North Carolina, United States",https://i.ebayimg.com/thumbs/images/g/qyIAAOSwMQBaS-k3/s-l225.jpg,exclusivelyposh,https://www.ebay.com/usr/exclusivelyposh?_trksid=p2047675.l2559,Instant,0,0,1,"Jul 11, 2021 17:56:27 PDT"
item1ac1349c1d,Ecco Hobart Brown Leather Knee High Riding Buckle Boots Womens Size 35 M*,https://www.ebay.com/itm/114910600221?hash=item1ac1349c1d:g:HxQAAOSw8UZaCcHy,$48.73,"Charlotte, North Carolina, United States",https://i.ebayimg.com/thumbs/images/g/HxQAAOSw8UZaCcHy/s-l225.jpg,discounteddesignerfootwear,https://www.ebay.com/usr/discounteddesignerfootwear?_trksid=p2047675.l2559,Instant,0,0,1,"Aug 27, 2021 11:06:37 PDT"
item1ac13451bb,Ecco Hobart Brown Leather Knee High Riding Boots Womens Size 41 M *,https://www.ebay.com/itm/114910581179?hash=item1ac13451bb:g:qyIAAOSwMQBaS-k3,$48.73,"Charlotte, North Carolina, United States",https://i.ebayimg.com/thumbs/images/g/qyIAAOSwMQBaS-k3/s-l225.jpg,discounteddesignerfootwear,https://www.ebay.com/usr/discounteddesignerfootwear?_trksid=p2047675.l2559,Instant,0,0,1,"Aug 27, 2021 11:06:30 PDT"
item4b8b65709f,ECCO Hobart Brown Leather 3 Buckle Knee High Riding Boots Women’s EU 39 US 8-8.5,https://www.ebay.com/itm/324461228191?hash=item4b8b65709f:g:8R0AAOSwewJgCxPZ,$85.00,"Clarkston, Washington, United States",https://i.ebayimg.com/thumbs/images/g/8R0AAOSwewJgCxPZ/s-l225.jpg,pandoras_closet2,https://www.ebay.com/usr/pandoras_closet2?_trksid=p2047675.l2559,Instant,0,0,1,"Feb 22, 2021 10:10:36 PST"
item3b4cabffb6,"Florsheim Mens Leather Shoes Boat Style Size 7.5 EE ""HOBART"" Brown",https://www.ebay.com/itm/254689410998?hash=item3b4cabffb6:g:7qoAAOSwQOpd6aob,$29.91,"Wingham, NSW, Australia",https://i.ebayimg.com/thumbs/images/g/7qoAAOSwQOpd6aob/s-l225.jpg,rosenjasmin,https://www.ebay.com/usr/rosenjasmin?_trksid=p2047675.l2559,Instant,0,0,1,"Jan 21, 2021 18:07:54 PST"
item469a9a2d81,Mens Leather Bifold Wallet Notecase Banknotes Credit Cards Holder Hobart,https://www.ebay.com/itm/303241506177?var=602230356814&hash=item469a9a2d81:g:Gz8AAOSwXvRdQuuT,$45.34,"London, United Kingdom",https://i.ebayimg.com/thumbs/images/g/Gz8AAOSwXvRdQuuT/s-l225.jpg,house_of_leather,https://www.ebay.com/usr/house_of_leather?_trksid=p2047675.l2559,Instant,0,0,3,"Feb 01, 2021 05:45:39 PST"
