id,title,link,price,origin,image,seller_name,seller_link,sell_type,num_bids,num_watchers,num_stock,date
item3412e4882d,Salamis duprei ONE REAL BUTTERFLY PINK PURPLE MADAGASCAR UNMOUNTED WINGS CLOSED,https://www.ebay.com/itm/223655266349?hash=item3412e4882d:g:M2IAAOSwf8VddFKW,$14.00,"Sahuarita, Arizona, United States",https://i.ebayimg.com/images/g/M2IAAOSwf8VddFKW/s-l300.jpg,bicbugs,https://www.ebay.com/usr/bicbugs?_trksid=p2047675.l2559,Instant,0,0,More than 10,"Feb 08, 2021 18:30:46 PST"
item34253f5736,Salamis duprei REAL FRAMED BUTTERFLY MADAGASCAR AFRICA,https://www.ebay.com/itm/223963207478?hash=item34253f5736:g:TLEAAOSwaJFehAE9,$34.00,"Sahuarita, Arizona, United States",https://i.ebayimg.com/images/g/TLEAAOSwaJFehAE9/s-l300.jpg,bicbugs,https://www.ebay.com/usr/bicbugs?_trksid=p2047675.l2559,Instant,0,0,More than 10,"Feb 08, 2021 18:30:52 PST"
item3db1e328c5,Nymphalidae Salamis duprei PAIR Madagascar NYM0827,https://www.ebay.com/itm/264977459397?hash=item3db1e328c5:g:iWYAAOSwIK5f2HVh,$4.00,"Moscow, Russian Federation",https://i.ebayimg.com/images/g/iWYAAOSwIK5f2HVh/s-l300.jpg,dirktt50,https://www.ebay.com/usr/dirktt50?_trksid=p2047675.l2559,Instant,0,0,1,"Mar 26, 2021 03:54:14 PDT"
item28a7fd2719,Forest Mother of Pearl Butterfly Dome  (Salamis duprei),https://www.ebay.com/itm/174617077529?hash=item28a7fd2719:g:JrkAAOSwCtJaNe8f,$41.00,"Newport, North Carolina, United States",https://i.ebayimg.com/images/g/JrkAAOSwCtJaNe8f/s-l300.jpg,papilio28570,https://www.ebay.com/usr/papilio28570?_trksid=p2047675.l2559,Instant,0,0,2,Unknown
item28b1802cb8,"Madagascar, Salamis Duprei, butterfly, 50 cents, Combined shipping accepted",https://www.ebay.com/itm/174776659128?hash=item28b1802cb8:g:E1oAAOSwuwVfnCTc,$0.99,"Pompano Beach, Florida, United States",https://i.ebayimg.com/images/g/E1oAAOSwuwVfnCTc/s-l300.jpg,ugeponce1,https://www.ebay.com/usr/ugeponce1?_trksid=p2047675.l2559,Auction,0,0,1,Unknown
item1cd3875cbe,"Salamis duprei Female EX Madagascar, n131a",https://www.ebay.com/itm/123807947966?hash=item1cd3875cbe:g:zzsAAOSwl41dCldG,$38.98,"Brachbach, Germany",https://i.ebayimg.com/images/g/zzsAAOSwl41dCldG/s-l300.jpg,borboleta555,https://www.ebay.com/usr/borboleta555?_trksid=p2047675.l2559,Instant,0,0,1,"Nov 01, 2020 03:49:40 PST"
