id,title,link,price,origin,image,seller_name,seller_link,sell_type,num_bids,num_watchers,num_stock,date
item33ba46be62,Lyropteryx apollonia ONE REAL BUTTERFLY BLUE PAPERED UNMOUNTED WINGS CLOSED,https://www.ebay.com/itm/222168530530?hash=item33ba46be62:g:A-EAAOSwxXJcgv9F,$10.00,"Sahuarita, Arizona, United States",https://i.ebayimg.com/thumbs/images/g/A-EAAOSwxXJcgv9F/s-l225.jpg,bicbugs,https://www.ebay.com/usr/bicbugs?_trksid=p2047675.l2559,Instant,0,0,More than 10,"Jun 18, 2021 19:15:53 PDT"
item33aade0f1f,Lyropteryx apollonia REAL PERU METALMARK FRAMED BUTTERFLY INSECT,https://www.ebay.com/itm/221910011679?hash=item33aade0f1f:g:E8EAAOSwo0JWFuzW,$30.00,"Sahuarita, Arizona, United States",https://i.ebayimg.com/thumbs/images/g/E8EAAOSwo0JWFuzW/s-l225.jpg,bicbugs,https://www.ebay.com/usr/bicbugs?_trksid=p2047675.l2559,Instant,0,0,More than 10,"Jun 18, 2021 19:21:41 PDT"
item33c5d63560,Lyropteryx apollonia REAL BUTTERFLY BLUE GREEN CHRISTMAS ORNAMENT GIFT PERU,https://www.ebay.com/itm/222362482016?hash=item33c5d63560:g:cQUAAOSwhtddhqkl,$30.00,"Sahuarita, Arizona, United States",https://i.ebayimg.com/thumbs/images/g/cQUAAOSwhtddhqkl/s-l225.jpg,bicbugs,https://www.ebay.com/usr/bicbugs?_trksid=p2047675.l2559,Instant,0,0,More than 10,"Feb 08, 2021 18:30:49 PST"
item490655eedf,BUTTERFLIES Lyropteryx Apollonia State of Oman 1969 APOLLO METALMARK Butterfly,https://www.ebay.com/itm/313638907615?hash=item490655eedf:g:iwIAAOSwFTVhGC87,$1.99,"Buffalo, New York, United States",https://i.ebayimg.com/thumbs/images/g/iwIAAOSwFTVhGC87/s-l225.jpg,stampbabe,https://www.ebay.com/usr/stampbabe?_trksid=p2047675.l2559,Instant,0,0,1,Unknown
item446c74033e,Riodinidae: Lyropteryx apollonia 4 PCS! TWO PAIRS. Peru. VERY RARE!!,https://www.ebay.com/itm/293877318462?hash=item446c74033e:g:eSYAAOSw0GJfy7Jn,$49.00,"ruza, mosoblast, Russian Federation",https://i.ebayimg.com/thumbs/images/g/eSYAAOSw0GJfy7Jn/s-l225.jpg,roman-insects,https://www.ebay.com/usr/roman-insects?_trksid=p2047675.l2559,Instant,0,0,1,Unknown
