id,title,link,price,origin,image,seller_name,seller_link,sell_type,num_bids,num_watchers,num_stock,date
item54a36bab43,"MORPHO ACHILLES SSP. FROM TONANTINS, BRAZIL",https://www.ebay.com/itm/363518995267?hash=item54a36bab43:g:lucAAOSwpjJhJkkO,$1.25,"Munich, Germany",https://i.ebayimg.com/thumbs/images/g/lucAAOSwpjJhJkkO/s-l225.jpg,ilo44,https://www.ebay.com/usr/ilo44?_trksid=p2047675.l2559,Instant,0,0,1,Unknown
item48f8882063,"REAL Morpho achilles, Blue-Banded Morpho SUSTAINABLY SOURCED!! BIG Butterfly",https://www.ebay.com/itm/313407316067?hash=item48f8882063:g:ROUAAOSwUwRgHMkK,$9.99,"Estes Park, Colorado, United States",https://i.ebayimg.com/thumbs/images/g/ROUAAOSwUwRgHMkK/s-l225.jpg,little_caterpillar_butterfly_art,https://www.ebay.com/usr/little_caterpillar_butterfly_art?_trksid=p2047675.l2559,Instant,0,0,2,"Jul 29, 2021 13:58:33 PDT"
item33c64877e7,Morpho achilles ONE REAL BUTTERFLY BLUE BLACK UNMOUNTED WINGS CLOSED,https://www.ebay.com/itm/222369970151?hash=item33c64877e7:g:DsUAAOSw2IZfHkkG,$10.00,"Sahuarita, Arizona, United States",https://i.ebayimg.com/thumbs/images/g/DsUAAOSw2IZfHkkG/s-l225.jpg,bicbugs,https://www.ebay.com/usr/bicbugs?_trksid=p2047675.l2559,Instant,0,0,More than 10,"Jun 18, 2021 19:15:51 PDT"
item42391f51e7,5 Morpho achilles in A1 condition,https://www.ebay.com/itm/284426195431?hash=item42391f51e7:g:jcwAAOSwmgdhKCWH,$15.99,"Delray Beach, Florida, United States",https://i.ebayimg.com/thumbs/images/g/jcwAAOSwmgdhKCWH/s-l225.jpg,jeffleon4791gc,https://www.ebay.com/usr/jeffleon4791gc?_trksid=p2047675.l2559,Instant,0,0,1,Unknown
item58c9c500d0,Morpho achilles REAL FRAMED BUTTERFLY BLUE PERU,https://www.ebay.com/itm/381342253264?hash=item58c9c500d0:g:H5AAAOSwgeRZnkqs,$30.00,"Sahuarita, Arizona, United States",https://i.ebayimg.com/thumbs/images/g/H5AAAOSwgeRZnkqs/s-l225.jpg,bicbugs,https://www.ebay.com/usr/bicbugs?_trksid=p2047675.l2559,Instant,0,0,More than 10,"Jun 18, 2021 19:14:58 PDT"
item1f16dc770a,FRAMED BUTTERFLY BLUE MORPHO ACHILLES Entomology morphinae morpho achilles,https://www.ebay.com/itm/133527533322?hash=item1f16dc770a:g:zwkAAOSwZfBfa3Cg,$33.90,"Burbank, California, United States",https://i.ebayimg.com/thumbs/images/g/zwkAAOSwZfBfa3Cg/s-l225.jpg,bigredmachine1972,https://www.ebay.com/usr/bigredmachine1972?_trksid=p2047675.l2559,Instant,0,0,1,"Jul 26, 2021 07:16:27 PDT"
item3db06ff3cd,Morpho achilles fagardi MALE Peru Huanuco NYM0822,https://www.ebay.com/itm/264953131981?hash=item3db06ff3cd:g:6HUAAOSwbHpfv3YP,$10.00,"Moscow, Russian Federation",https://i.ebayimg.com/thumbs/images/g/6HUAAOSwbHpfv3YP/s-l225.jpg,dirktt50,https://www.ebay.com/usr/dirktt50?_trksid=p2047675.l2559,Instant,0,0,1,"Mar 26, 2021 03:54:24 PDT"
item3daa54833d,Morpho achilles phokylides MALE Brazil Rondonia NYM0791,https://www.ebay.com/itm/264850670397?hash=item3daa54833d:g:4vYAAOSwKaxfTnY~,$16.00,"Moscow, Russian Federation",https://i.ebayimg.com/thumbs/images/g/4vYAAOSwKaxfTnY~/s-l225.jpg,dirktt50,https://www.ebay.com/usr/dirktt50?_trksid=p2047675.l2559,Instant,0,0,1,"Mar 26, 2021 03:49:54 PDT"
