id,title,link,price,origin,image,seller_name,seller_link,sell_type,num_bids,num_watchers,num_stock,date
item21818b5017,Large Ox Eye Maniola jurtina Wall Fox Butterfly Colour Print 1956,https://www.ebay.com/itm/143907311639?hash=item21818b5017:g:9I8AAOSwmXJf8fq2,$10.02,"Buchhorst, Germany",https://i.ebayimg.com/thumbs/images/g/9I8AAOSwmXJf8fq2/s-l225.jpg,ropi1958,https://www.ebay.com/usr/ropi1958?_trksid=p2047675.l2559,Instant,0,0,1,"Feb 06, 2021 05:33:37 PST"
item343c2056dc,Artist-AK/Large Ox Eye (Maniola jurtina) Watercolour V. Rita Mühlbauer,https://www.ebay.com/itm/224347051740?hash=item343c2056dc:g:mDMAAOSwJk1gI-Qv,$1.77,"Backnang, Germany",https://i.ebayimg.com/thumbs/images/g/mDMAAOSwJk1gI-Qv/s-l225.jpg,mondblume333,https://www.ebay.com/usr/mondblume333?_trksid=p2047675.l2559,Instant,0,0,1,"Jul 18, 2021 04:52:25 PDT"
item56db1a647e,Ecological Genetics of Maniola Jurtina L. on the Isles of Scilly by Dowdeswell..,https://www.ebay.com/itm/373043127422?hash=item56db1a647e:g:SFgAAOSwhe1esdHk,$30.00,"Binghamton, New York, United States",https://i.ebayimg.com/thumbs/images/g/SFgAAOSwhe1esdHk/s-l225.jpg,robinson_st_books,https://www.ebay.com/usr/robinson_st_books?_trksid=p2047675.l2559,Instant,0,0,1,"Jan 30, 2021 18:17:37 PST"
item56db1a6435,The Influence of Isolation on Variability in the Butterfly Maniola Jurtina L. ..,https://www.ebay.com/itm/373043127349?hash=item56db1a6435:g:jsEAAOSwS0pesdHa,$30.00,"Binghamton, New York, United States",https://i.ebayimg.com/thumbs/images/g/jsEAAOSwS0pesdHa/s-l225.jpg,robinson_st_books,https://www.ebay.com/usr/robinson_st_books?_trksid=p2047675.l2559,Instant,0,0,2,"Jan 30, 2021 19:21:27 PST"
item447f595db2,"Nymphalidae Maniola jurtina female from Poland, mounted",https://www.ebay.com/itm/294194339250?hash=item447f595db2:g:o0kAAOSwx4JfHdWQ,$1.29,"Wroclaw, Poland",https://i.ebayimg.com/thumbs/images/g/o0kAAOSwx4JfHdWQ/s-l225.jpg,wkukub9,https://www.ebay.com/usr/wkukub9?_trksid=p2047675.l2559,Instant,0,0,1,Unknown
item4485d7221e,Myrtil maniola jurtina meadow brown insect plug france,https://www.ebay.com/itm/294303244830?hash=item4485d7221e:g:3LoAAOSwT5tWGPhe,$5.88,"Varna, Bulgaria",https://i.ebayimg.com/thumbs/images/g/3LoAAOSwT5tWGPhe/s-l225.jpg,saintmichelfrance,https://www.ebay.com/usr/saintmichelfrance?_trksid=p2047675.l2559,Instant,0,0,1,Unknown
