id,title,link,image,price_sold,end_date,origin,seller_name,seller_link,sell_type,num_bids,num_sold,auction_end_date
item597a597fea,Prey Not A Mimic Mousepad Loot Gaming Crate Exclusive 2020,https://www.ebay.com/itm/384304775146?hash=item597a597fea:g:gFkAAOSwFbBg~EzN,https://i.ebayimg.com/thumbs/images/g/gFkAAOSwFbBg~EzN/s-l225.jpg,$1.00,Aug-07 10:25,"Millington, Tennessee, United States",gweneich0,https://www.ebay.com/usr/gweneich0?_trksid=p2047675.l2559,Auction,1,1,"Aug 07, 2021

10:25:16 PDT"
item28b59da481,Marvel Heroclix Xmen: Rise and Fall 061a Mimic Super Rare (Pre-Sale),https://www.ebay.com/itm/174845699201?hash=item28b59da481:g:kzkAAOSw-Ppg25i9,https://i.ebayimg.com/thumbs/images/g/kzkAAOSw-Ppg25i9/s-l225.jpg,$24.50,Jul-25 17:49,"Huntsville, Alabama, United States",luckydicecafe,https://www.ebay.com/usr/luckydicecafe?_trksid=p2047675.l2559,Auction,7,1,"Jul 25, 2021

17:49:53 PDT"
item2b0da8c989,Marvel Heroclix Xmen: Rise and Fall 061a Mimic Super Rare (Pre-Sale),https://www.ebay.com/itm/184912759177?hash=item2b0da8c989:g:kzkAAOSw-Ppg25i9,https://i.ebayimg.com/thumbs/images/g/kzkAAOSw-Ppg25i9/s-l225.jpg,$36.00,Jul-11 21:08,"Huntsville, Alabama, United States",luckydicecafe,https://www.ebay.com/usr/luckydicecafe?_trksid=p2047675.l2559,Auction,24,1,"Jul 11, 2021

21:08:06 PDT"
item3ffcbf553e,HEROCLIX X-Men Rise and Fall 061a MIMIC SR Super Rare,https://www.ebay.com/itm/274823337278?hash=item3ffcbf553e:g:0TQAAOSwWIJhFwRJ,https://i.ebayimg.com/thumbs/images/g/0TQAAOSwWIJhFwRJ/s-l225.jpg,$32.99,Jun-25 23:45,"Wellsboro, Pennsylvania, United States",woolverine,https://www.ebay.com/usr/woolverine?_trksid=p2047675.l2559,Instant,0,2,
item3daeff18e8,"Exclusive Loot Crate Gaming Prey Collectible Mouse Pad “Not A Mimic”, New",https://www.ebay.com/itm/264928958696?hash=item3daeff18e8:g:sgkAAOSwIhFfptGy,https://i.ebayimg.com/thumbs/images/g/sgkAAOSwIhFfptGy/s-l225.jpg,$3.49,Jun-22 10:12,"Fort Worth, Texas, United States",melloncolliewhir,https://www.ebay.com/usr/melloncolliewhir?_trksid=p2047675.l2559,Instant,0,1,
item4dc4ccb014,HEROCLIX X-Men Rise and Fall 061a MIMIC SR Super Rare PRESALE,https://www.ebay.com/itm/334014230548?hash=item4dc4ccb014:g:k9AAAOSwVOlgrUsr,https://i.ebayimg.com/thumbs/images/g/k9AAAOSwVOlgrUsr/s-l225.jpg,$79.99,Jun-05 08:11,"Wellsboro, Pennsylvania, United States",woolverine,https://www.ebay.com/usr/woolverine?_trksid=p2047675.l2559,Instant,0,1,
