id,title,link,price,origin,image,seller_name,seller_link,sell_type,num_bids,num_watchers,num_stock,date
item3d89d7c6bc,Smaller Wood Nymph Butterfly Ideopsis gaura anapina Folded FAST FROM USA,https://www.ebay.com/itm/264305624764?hash=item3d89d7c6bc:g:DA8AAOSwgQ9V6Glz,$4.49,"Jupiter, Florida, United States",https://i.ebayimg.com/images/g/DA8AAOSwgQ9V6Glz/s-l300.jpg,ynot601,https://www.ebay.com/usr/ynot601?_trksid=p2047675.l2559,Instant,0,0,More than 10,"May 28, 2021 09:25:05 PDT"
item3443ce990e,LOT OF WOODEN CIRCUS TRAINS WITH ANIMALS & OTHER SMALLER WOOD TRAIN TOYS,https://www.ebay.com/itm/224475912462?hash=item3443ce990e:g:xzsAAOSwKqdgr0XK,$29.24,"Lansing, Michigan, United States",https://i.ebayimg.com/images/g/xzsAAOSwKqdgr0XK/s-l300.jpg,woodyscollectibles,https://www.ebay.com/usr/woodyscollectibles?_trksid=p2047675.l2559,Instant,0,0,1,Unknown
item3da9efe4ec,Vintage Doll House Smaller Wood Hallway Table,https://www.ebay.com/itm/264844076268?hash=item3da9efe4ec:g:HuwAAOSwTXhfRe7G,$5.00,"Aurora, Colorado, United States",https://i.ebayimg.com/images/g/HuwAAOSwTXhfRe7G/s-l300.jpg,milkeymilkey66,https://www.ebay.com/usr/milkeymilkey66?_trksid=p2047675.l2559,Instant,0,0,1,"Dec 25, 2020 21:19:24 PST"
item36420aaf7f,"Vintage smaller Wood Butter Pat mold, well made and fun collectible item",https://www.ebay.com/itm/233036230527?hash=item36420aaf7f:g:XtIAAOSwQ5pcAIpL,$14.99,"North Pole, Alaska, United States",https://i.ebayimg.com/images/g/XtIAAOSwQ5pcAIpL/s-l300.jpg,way_up_in_ak,https://www.ebay.com/usr/way_up_in_ak?_trksid=p2047675.l2559,Instant,0,0,1,"Dec 17, 2020 12:35:42 PST"
item1a8747e0ab,NICE ANTIQUE 1800-s SMALLER WOOD HANDMADE HANGING CUPBOARD SCANDINAVIA EUROPE,https://www.ebay.com/itm/113938784427?hash=item1a8747e0ab:g:m5sAAOSwYu9dtZMa,$79.99,"EUROPE, Estonia",https://i.ebayimg.com/images/g/m5sAAOSwYu9dtZMa/s-l300.jpg,scandiques,https://www.ebay.com/usr/scandiques?_trksid=p2047675.l2559,Instant,0,0,1,"Sep 27, 2020 04:58:31 PDT"
item1a8b2c46be,1 )VINTAGE HANDCARVED SMALLER WOOD DRINKING CUP SPOON KUKSA FOLK ART SCANDINAVIA,https://www.ebay.com/itm/114004084414?hash=item1a8b2c46be:g:sHEAAOSwi5Vd6qcM,$24.99,"EUROPE, Estonia",https://i.ebayimg.com/images/g/sHEAAOSwi5Vd6qcM/s-l300.jpg,scandiques,https://www.ebay.com/usr/scandiques?_trksid=p2047675.l2559,Instant,0,0,1,"Oct 05, 2020 02:46:02 PDT"
item1a8b2c4a01,2 )VINTAGE HANDCARVED SMALLER WOOD DRINKING CUP SPOON KUKSA FOLK ART SCANDINAVIA,https://www.ebay.com/itm/114004085249?hash=item1a8b2c4a01:g:2KcAAOSwnGld6qeD,$24.99,"EUROPE, Estonia",https://i.ebayimg.com/images/g/2KcAAOSwnGld6qeD/s-l300.jpg,scandiques,https://www.ebay.com/usr/scandiques?_trksid=p2047675.l2559,Instant,0,0,1,"Oct 05, 2020 02:46:38 PDT"
item3612e26ab3,"(116) Three smaller wood chisels, made in USA ""United"" tempered",https://www.ebay.com/itm/232245062323?hash=item3612e26ab3:g:E9UAAOSwx6pYqPK2,$21.00,"Canton, Ohio, United States",https://i.ebayimg.com/images/g/E9UAAOSwx6pYqPK2/s-l300.jpg,2914wood,https://www.ebay.com/usr/2914wood?_trksid=p2047675.l2559,Instant,0,0,1,Unknown
item1a96585adf,ANTIQUE 1800-s CARVED SMALLER WOOD HANDMADE HANGING CUPBOARD SCANDINAVIA EUROPE,https://www.ebay.com/itm/114191522527?hash=item1a96585adf:g:er4AAOSwD39ejdEQ,$129.99,"EUROPE, Estonia",https://i.ebayimg.com/images/g/er4AAOSwD39ejdEQ/s-l300.jpg,scandiques,https://www.ebay.com/usr/scandiques?_trksid=p2047675.l2559,Instant,0,0,1,"Jun 18, 2020 06:13:37 PDT"
item216d9dbeb8,DICKENS  MILK JUG SMALLER. WOOD & SONS. OLIVER,https://www.ebay.com/itm/143572975288?hash=item216d9dbeb8:g:mnEAAOSwd7VdC9MQ,$28.36,"milton keynes, Buckinghamshire, United Kingdom",https://i.ebayimg.com/images/g/mnEAAOSwd7VdC9MQ/s-l300.jpg,gails8971,https://www.ebay.com/usr/gails8971?_trksid=p2047675.l2559,Instant,0,0,1,"May 13, 2021 09:30:16 PDT"
item33fbdd077e,Vintage Smaller Wood Handle Standard Flat Head Screw Driver Tool - C027R,https://www.ebay.com/itm/223268898686?hash=item33fbdd077e:g:trAAAOSwcnZcBUFm,$7.95,"Shelburne Falls, Massachusetts, United States",https://i.ebayimg.com/images/g/trAAAOSwcnZcBUFm/s-l300.jpg,keeneye_collections,https://www.ebay.com/usr/keeneye_collections?_trksid=p2047675.l2559,Instant,0,0,1,"Dec 03, 2018 07:05:43 PST"
item56fb2a7663,PRETTY GIRL STRAWBERRYS HAND PAINTED FINE RARE SMALLER WOOD SOUVENIR THIMBLE,https://www.ebay.com/itm/373581051491?hash=item56fb2a7663:g:GL0AAOSwLFFf8HAW,$19.65,"Newcastle upon Tyne, United Kingdom",https://i.ebayimg.com/images/g/GL0AAOSwLFFf8HAW/s-l300.jpg,charlesgoslin,https://www.ebay.com/usr/charlesgoslin?_trksid=p2047675.l2559,Instant,0,0,1,"May 16, 2021 07:18:20 PDT"
item44118981eb,15 Piece Steel Drill Bit Set in Case 1/4 Inch and Smaller Wood Metal Plastic,https://www.ebay.com/itm/292352000491?hash=item44118981eb:g:4dgAAOSwj5FdTDUV,$8.99,"Lorain, Ohio, United States",https://i.ebayimg.com/images/g/4dgAAOSwj5FdTDUV/s-l300.jpg,www.5stardeal.com,https://www.ebay.com/usr/www.5stardeal.com?_trksid=p2047675.l2559,Instant,0,0,More than 10,"May 27, 2021 08:26:34 PDT"
item546d31f875,2 MUGS Prince Charles and Diana Marriage Smaller Wood & Sons Larger  Kiln Craft,https://www.ebay.com/itm/362609244277?hash=item546d31f875:g:jrwAAOSwpDdVdkj7,$9.99,"China Village, Maine, United States",https://i.ebayimg.com/images/g/jrwAAOSwpDdVdkj7/s-l300.jpg,hsjorgensen,https://www.ebay.com/usr/hsjorgensen?_trksid=p2047675.l2559,Instant,0,0,1,Unknown
item1a641a7eea,"UNIQUE , ca 1930-s ANTIQUE SMALLER WOOD / PINE + METAL ORGANIZER BOX  - NICE !",https://www.ebay.com/itm/113348607722?hash=item1a641a7eea:g:gs0AAOSwTxpb3dnU,$29.99,"EUROPE, Estonia",https://i.ebayimg.com/images/g/gs0AAOSwTxpb3dnU/s-l300.jpg,scandiques,https://www.ebay.com/usr/scandiques?_trksid=p2047675.l2559,Instant,0,0,1,"Dec 03, 2020 02:00:16 PST"
item4b5f0b8a80,Vintage Brown Beaded Wood Earring with Gold Tone Pierced with Smaller Wood Bead,https://www.ebay.com/itm/323717139072?hash=item4b5f0b8a80:g:XNkAAOSw5e5ceeRm,$14.99,"New London, Connecticut, United States",https://i.ebayimg.com/images/g/XNkAAOSw5e5ceeRm/s-l300.jpg,grandmasjewelry123,https://www.ebay.com/usr/grandmasjewelry123?_trksid=p2047675.l2559,Instant,0,0,1,"Mar 25, 2021 04:27:55 PDT"
item5b8550810b,PRETTY GIRL STRAWBERRYS HAND PAINTED FINE RARE SMALLER WOOD SOUVENIR THIMBLE,https://www.ebay.com/itm/393078669579?hash=item5b8550810b:g:GL0AAOSwLFFf8HAW,$19.78,"Newcastle upon Tyne, United Kingdom",https://i.ebayimg.com/images/g/GL0AAOSwLFFf8HAW/s-l300.jpg,charlesgoslin,https://www.ebay.com/usr/charlesgoslin?_trksid=p2047675.l2559,Instant,0,0,1,"Jan 02, 2021 05:10:02 PST"
