id,title,link,image,price_sold,end_date,origin,seller_name,seller_link,sell_type,num_bids,num_sold,auction_end_date
item2ede5eae0d,JUNONIA COENIA BUTTERFLY  JFK Kennedy Half Dollar US Colorized Coin,https://www.ebay.com/itm/201299242509?hash=item2ede5eae0d:g:Hj4AAOSwxfdatdK8,https://i.ebayimg.com/thumbs/images/g/Hj4AAOSwxfdatdK8/s-l225.jpg,$8.95,Apr-27 12:17,"Freeport, New York, United States",ecoins,https://www.ebay.com/usr/ecoins?_trksid=p2047675.l2559,Instant,0,6,
item56f7e7e803,Common Buckeye Butterfly Junonia coenia Nymphalidae Lepidoptera Southeast TX C22,https://www.ebay.com/itm/373526358019?hash=item56f7e7e803:g:EJMAAOSwNHRgaC-S,https://i.ebayimg.com/thumbs/images/g/EJMAAOSwNHRgaC-S/s-l225.jpg,$3.80,Apr-13 18:16,"Houston, Texas, United States",txentosupply,https://www.ebay.com/usr/txentosupply?_trksid=p2047675.l2559,Auction,2,1,"Apr 13, 2021

18:16:14 PDT"
item46c2a499f7,Junonia Coenia Art Gallery Quilts Raw Edge Application Series,https://www.ebay.com/itm/303913277943?hash=item46c2a499f7:g:7DAAAOSwVMhfTVsz,https://i.ebayimg.com/thumbs/images/g/7DAAAOSwVMhfTVsz/s-l225.jpg,$3.00,Mar-15 17:17,"Seattle, Washington, United States",luna18*2012,https://www.ebay.com/usr/luna18*2012?_trksid=p2047675.l2559,Auction,1,1,"Mar 15, 2021

17:17:28 PDT"
