id,title,link,image,price_sold,end_date,origin,seller_name,seller_link,sell_type,num_bids,num_sold,auction_end_date
item3ff73177cf,"Real Butterfly Necklace, Butterfly Jewelry, Tiger Butterfly, Danaus Genutia",https://www.ebay.com/itm/274730153935?hash=item3ff73177cf:g:~fsAAOSwFhRgWS4a,https://i.ebayimg.com/thumbs/images/g/~fsAAOSwFhRgWS4a/s-l225.jpg,$25.00,May-17 18:49,"Grants Pass, Oregon, United States",odditiesforsale,https://www.ebay.com/usr/odditiesforsale?_trksid=p2047675.l2559,Instant,0,1,
item3ff70c6ed6,"Tiger Butterfly in Resin, Danaus Genutia, Lucite, Insects in Resin, Butterfly",https://www.ebay.com/itm/274727726806?hash=item3ff70c6ed6:g:zd0AAOSw2GlgVnSz,https://i.ebayimg.com/thumbs/images/g/zd0AAOSw2GlgVnSz/s-l225.jpg,$28.00,May-17 14:17,"Grants Pass, Oregon, United States",odditiesforsale,https://www.ebay.com/usr/odditiesforsale?_trksid=p2047675.l2559,Instant,0,3,
item2b0875b8ce,Danaidae. 6 x Danaus genutia kyllene. Timor (36),https://www.ebay.com/itm/184825526478?hash=item2b0875b8ce:g:eOgAAOSwiD5gl9k8,https://i.ebayimg.com/thumbs/images/g/eOgAAOSwiD5gl9k8/s-l225.jpg,$11.00,May-16 10:55,"Jakarta, Indonesia",batavia-bugs,https://www.ebay.com/usr/batavia-bugs?_trksid=p2047675.l2559,Auction,3,1,"May 16, 2021

10:55:27 PDT"
item41f58cc6ca,collection PAIR unmounted butterfly Danaus genutia genutia YUNNAN CHINA  A1-,https://www.ebay.com/itm/283292518090?hash=item41f58cc6ca:g:qtUAAOxyMZ5Rnbt5,https://i.ebayimg.com/thumbs/images/g/qtUAAOxyMZ5Rnbt5/s-l225.jpg,$6.80,May-05 19:07,"beijing, China",china*butterfly,https://www.ebay.com/usr/china*butterfly?_trksid=p2047675.l2559,Instant,0,5,
item596f0fe656,The Common Tiger Danaus genutia Butterfly N in Clear Block Education Specimen,https://www.ebay.com/itm/384115402326?hash=item596f0fe656:g:PyIAAMXQeKNTLYPA,https://i.ebayimg.com/thumbs/images/g/PyIAAMXQeKNTLYPA/s-l225.jpg,$16.99,May-04 22:25,"Hong Kong, Hong Kong",gaofudev,https://www.ebay.com/usr/gaofudev?_trksid=p2047675.l2559,Auction,1,1,"May 04, 2021

22:25:26 PDT"
item23dbd09c07,Laminated Common Tiger Danaus genutia Butterfly Specimen in 110x110 mm Sheet,https://www.ebay.com/itm/154011737095?hash=item23dbd09c07:g:dnoAAMXQlgtTBCl~,https://i.ebayimg.com/thumbs/images/g/dnoAAMXQlgtTBCl~/s-l225.jpg,$10.00,Apr-15 14:50,"Hong Kong, Hong Kong",selltotheworld,https://www.ebay.com/usr/selltotheworld?_trksid=p2047675.l2559,Instant,0,1,
