id,title,link,image,price_sold,end_date,origin,seller_name,seller_link,sell_type,num_bids,num_sold,auction_end_date
item33fbb328a6,Papilio maacki summer form REAL FRAMED BUTTERFLY BLUE GREEN,https://www.ebay.com/itm/223266154662?hash=item33fbb328a6:g:MRQAAOSwvNVcMXGv,https://i.ebayimg.com/thumbs/images/g/MRQAAOSwvNVcMXGv/s-l225.jpg,$34.00,May-28 03:43,"Sahuarita, Arizona, United States",bicbugs,https://www.ebay.com/usr/bicbugs?_trksid=p2047675.l2559,Instant,0,24,
item4226c8f946,"Papilio maacki - A Lot of 5 Large, Unmounted A1 Specimens, Dazzling Summer Form",https://www.ebay.com/itm/284118546758?hash=item4226c8f946:g:SGYAAOSwN3xf2-gl,https://i.ebayimg.com/thumbs/images/g/SGYAAOSwN3xf2-gl/s-l225.jpg,$26.95,May-04 07:21,"Commack, New York, United States",limmerleps,https://www.ebay.com/usr/limmerleps?_trksid=p2047675.l2559,Instant,0,5,
item33e11a286e,Papilio maacki spring form ONE REAL BUTTERFLY BLUE GREEN WINGS CLOSED,https://www.ebay.com/itm/222819919982?hash=item33e11a286e:g:vAcAAOSw~E9cgxmk,https://i.ebayimg.com/thumbs/images/g/vAcAAOSw~E9cgxmk/s-l225.jpg,$14.00,Apr-27 21:40,"Sahuarita, Arizona, United States",bicbugs,https://www.ebay.com/usr/bicbugs?_trksid=p2047675.l2559,Instant,0,133,
item21875e0b4a,"+ ENTOMOLOGY, BUTTERFLY: PAPILIO MAACKI SPRING FORM MALE JAPAN +++ SPLENDID !",https://www.ebay.com/itm/144005008202?hash=item21875e0b4a:g:0GwAAOSwXcJgc0eH,https://i.ebayimg.com/thumbs/images/g/0GwAAOSwXcJgc0eH/s-l225.jpg,$16.16,Apr-18 12:01,"Haibach, Germany",aureus-butterflies-and-insects,https://www.ebay.com/usr/aureus-butterflies-and-insects?_trksid=p2047675.l2559,Auction,9,1,"Apr 18, 2021

12:01:35 PDT"
