id,title,link,image,price_sold,end_date,origin,seller_name,seller_link,sell_type,num_bids,num_sold,auction_end_date
item4abc3e3435,"1 lbs Cassia Tora Seeds Chinese Herb Jue Ming Zi Tea,Ketsumei-shi Gyeolmyeongja",https://www.ebay.com/itm/320985773109?epid=1548064894&hash=item4abc3e3435:g:gOEAAOSwBLlVHoVq,https://i.ebayimg.com/thumbs/images/g/gOEAAOSwBLlVHoVq/s-l225.jpg,$23.00,May-20 10:35,"Flushing, New York, United States",bongbong777,https://www.ebay.com/usr/bongbong777?_trksid=p2047675.l2559,Instant,0,68,
item4d3256f4a1,"Cassia Tora 20 OR 500 Seeds, Senna Tora A Wide Range Of Diverse Uses, Herb",https://www.ebay.com/itm/331557041313?hash=item4d3256f4a1:g:PHwAAOSwpdpVWALg,https://i.ebayimg.com/thumbs/images/g/PHwAAOSwpdpVWALg/s-l225.jpg,$2.50,May-16 19:12,"Venice, Florida, United States",theplantattraction,https://www.ebay.com/usr/theplantattraction?_trksid=p2047675.l2559,Instant,0,24,
item2ac1c66910,Pure Cassia Tora (Jue Ming Zi) Seed Coffee 20 Sachets,https://www.ebay.com/itm/183639632144?hash=item2ac1c66910:g:TrwAAOSw-rxcP6Ei,https://i.ebayimg.com/thumbs/images/g/TrwAAOSw-rxcP6Ei/s-l225.jpg,$6.37,May-03 17:26,"Mitcham, United Kingdom",possiblegreenltd,https://www.ebay.com/usr/possiblegreenltd?_trksid=p2047675.l2559,Instant,0,9,
item21305792f8,"600g Roasted Cassia Tora Seeds Tea Jue Ming Zi Tea, Ketsumei-shi, Gyeolmyeongja",https://www.ebay.com/itm/142544966392?hash=item21305792f8:g:rQIAAOSwy~BZ6aZe,https://i.ebayimg.com/thumbs/images/g/rQIAAOSwy~BZ6aZe/s-l225.jpg,$31.35,Apr-18 15:05,"incheon city, default, Korea, South",damgong,https://www.ebay.com/usr/damgong?_trksid=p2047675.l2559,Instant,0,6,
item3da70e3c3e,Cassia Tora Chakramarda WHOLE - 100g CHAKRAMARD SEEDS Ayurveda SHIPPING FREE,https://www.ebay.com/itm/264795733054?hash=item3da70e3c3e:g:rKYAAOSwM91Z30cH,https://i.ebayimg.com/thumbs/images/g/rKYAAOSwM91Z30cH/s-l225.jpg,$15.79,Mar-30 00:47,"MUMBAI, MAHARASHTRA, India",pure.incense,https://www.ebay.com/usr/pure.incense?_trksid=p2047675.l2559,Instant,0,2,
item4b657cd946,Cassia Tora Seeds Chakramard Jue Ming Zi Chakvad Pod Foetid Cassia Tovara Seed,https://www.ebay.com/itm/323825228102?hash=item4b657cd946:g:ZlUAAOSwThdc9eb9,https://i.ebayimg.com/thumbs/images/g/ZlUAAOSwThdc9eb9/s-l225.jpg,$9.98,Mar-27 21:53,"JAIPUR, RAJASTHAN, India",sakargravity,https://www.ebay.com/usr/sakargravity?_trksid=p2047675.l2559,Instant,0,1,
