id,title,link,image,price_sold,end_date,origin,seller_name,seller_link,sell_type,num_bids,num_sold,auction_end_date
item3ff9607caf,Franklin Mint Butterflies of the World Australian Beak Butterfly Figurine,https://www.ebay.com/itm/274766789807?hash=item3ff9607caf:g:XnIAAOSwEXRf~IDX,https://i.ebayimg.com/thumbs/images/g/XnIAAOSwEXRf~IDX/s-l225.jpg,$4.99,May-02 20:00,"West Palm Beach, Florida, United States",beakster07,https://www.ebay.com/usr/beakster07?_trksid=p2047675.l2559,Auction,1,1,"May 02, 2021

20:00:05 PDT"
item5b8f60e68e,"FRANKLIN MINT PORCELAIN BUTTERFLIES OF THE WORLD SCULPTURE ""AUSTRALIAN BEAK""",https://www.ebay.com/itm/393247516302?hash=item5b8f60e68e:g:g68AAOSwWyhgeHsr,https://i.ebayimg.com/thumbs/images/g/g68AAOSwWyhgeHsr/s-l225.jpg,$14.95,Apr-15 14:26,"Swedesboro, New Jersey, United States",cts_just-3,https://www.ebay.com/usr/cts_just-3?_trksid=p2047675.l2559,Instant,0,1,
item28a0020e55,Australian beak - Guinea Flower - Butterflies of the world  Franklin mint,https://www.ebay.com/itm/174483181141?hash=item28a0020e55:g:VKcAAOSwFwRezsx7,https://i.ebayimg.com/thumbs/images/g/VKcAAOSwFwRezsx7/s-l225.jpg,$17.50,Apr-15 05:17,"Raleigh, North Carolina, United States",addys-corner,https://www.ebay.com/usr/addys-corner?_trksid=p2047675.l2559,Instant,0,1,
item2aff8daa48,FRANKLIN MINT THE BUTTERFLIES OF THE WORLD AUSTRALIAN BEAK BY B HARGREAVES,https://www.ebay.com/itm/184676100680?hash=item2aff8daa48:g:nSsAAOSwiT1cJMUQ,https://i.ebayimg.com/thumbs/images/g/nSsAAOSwiT1cJMUQ/s-l225.jpg,$14.20,Mar-26 13:01,"Dunstable, United Kingdom",bettyicingsugar,https://www.ebay.com/usr/bettyicingsugar?_trksid=p2047675.l2559,Instant,0,1,
item4b8e3fe884,FRANKLIN MINT PORCELAIN BUTTERFLY WORLD FIGURINE  Australian Beak Guinea Flower,https://www.ebay.com/itm/324509100164?hash=item4b8e3fe884:g:JwAAAOSwXvZfDw~2,https://i.ebayimg.com/thumbs/images/g/JwAAAOSwXvZfDw~2/s-l225.jpg,$18.47,Mar-06 16:09,"UK, United Kingdom",collectableclutter4u,https://www.ebay.com/usr/collectableclutter4u?_trksid=p2047675.l2559,Instant,0,1,
