id,title,link,price,origin,image,seller_name,seller_link,sell_type,num_bids,num_watchers,num_stock,date
item2183cdbe45,Western Forest Trees : A Guide to the Identification of Trees and Woods for...,https://www.ebay.com/itm/143945219653?epid=11038308408&hash=item2183cdbe45:g:JeUAAOSwOt9g0zs7,$4.09,"Aurora, Illinois, United States",https://i.ebayimg.com/thumbs/images/g/JeUAAOSwOt9g0zs7/s-l225.jpg,thrift.books,https://www.ebay.com/usr/thrift.books?_trksid=p2047675.l2559,Instant,0,0,Last one,"Aug 19, 2021 14:35:01 PDT"
item23db7e8b6f,Western Forest Insects USDA  (Miscellaneous Pubs No. 1339) PB 1977   W3,https://www.ebay.com/itm/154006358895?hash=item23db7e8b6f:g:xKcAAOSw5kBfDIun,$10.95,"Mount Ida, Arkansas, United States",https://i.ebayimg.com/thumbs/images/g/xKcAAOSw5kBfDIun/s-l225.jpg,lancermil,https://www.ebay.com/usr/lancermil?_trksid=p2047675.l2559,Instant,0,0,1,Unknown
item4902ccb7c5,Western Forest Trees : A Guide to the Identification of Trees and Woods for Stud,https://www.ebay.com/itm/313579583429?epid=11038308408&hash=item4902ccb7c5:g:8xoAAOSwMc5g1dBJ,$5.39,"Mishawaka, Indiana, United States",https://i.ebayimg.com/thumbs/images/g/8xoAAOSwMc5g1dBJ/s-l225.jpg,betterworldbooks,https://www.ebay.com/usr/betterworldbooks?_trksid=p2047675.l2559,Instant,0,0,1,"Aug 26, 2021 23:57:38 PDT"
item3447aceeb4,1977 WESTERN FOREST INSECTS HARDCOVER BOOK U.S. DEPT. OF AG. FOREST SERVICE,https://www.ebay.com/itm/224540815028?hash=item3447aceeb4:g:7FUAAOSw8SRg7JWG,$12.50,"Florence, Oregon, United States",https://i.ebayimg.com/thumbs/images/g/7FUAAOSw8SRg7JWG/s-l225.jpg,webbantiques,https://www.ebay.com/usr/webbantiques?_trksid=p2047675.l2559,Instant,0,0,1,Unknown
item3677f514a5,"Western Forest Insects USDA Publication # 1339, 1977 R.L. Furniss & V.M. Carolin",https://www.ebay.com/itm/233940784293?hash=item3677f514a5:g:6lkAAOSw8ZFgKuuG,$8.50,"Logan, Utah, United States",https://i.ebayimg.com/thumbs/images/g/6lkAAOSw8ZFgKuuG/s-l225.jpg,dpaul62,https://www.ebay.com/usr/dpaul62?_trksid=p2047675.l2559,Instant,0,0,1,"Jun 27, 2021 08:11:11 PDT"
item1d12bd6310,Plants of the Western Forest Alberta Saskatchewan Manitoba Boreal Lone Pine Rare,https://www.ebay.com/itm/124868453136?hash=item1d12bd6310:g:SEMAAOSw4zthG~ZC,$44.99,"Culver City, California, United States",https://i.ebayimg.com/thumbs/images/g/SEMAAOSw4zthG~ZC/s-l225.jpg,jakyl777,https://www.ebay.com/usr/jakyl777?_trksid=p2047675.l2559,Instant,0,0,1,Unknown
item3ff90de24f,WESTERN FOREST TREES by James Berthold Berry 1966 paperback,https://www.ebay.com/itm/274761376335?hash=item3ff90de24f:g:46kAAOSwyBBgeYm6,$2.50,"Grand Junction, Michigan, United States",https://i.ebayimg.com/thumbs/images/g/46kAAOSwyBBgeYm6/s-l225.jpg,saddlelake,https://www.ebay.com/usr/saddlelake?_trksid=p2047675.l2559,Instant,0,0,1,"May 13, 2021 06:11:31 PDT"
item2ac89ff7dc,"Western Forest Insects Publication No. 1339 HB, 1977 R. L. Furniss Service, B325",https://www.ebay.com/itm/183754553308?hash=item2ac89ff7dc:g:Z3cAAOSwb-RbsAat,$18.98,"San Andreas, California, United States",https://i.ebayimg.com/thumbs/images/g/Z3cAAOSwb-RbsAat/s-l225.jpg,bdesigns,https://www.ebay.com/usr/bdesigns?_trksid=p2047675.l2559,Instant,0,0,1,"Jun 23, 2021 14:36:04 PDT"
item5241e18cce,Western Forest Trees - Paperback - 1966 - James Berthold Berry,https://www.ebay.com/itm/353292618958?hash=item5241e18cce:g:udUAAOSw9TRfvnB8,$8.00,"Milwaukee, Wisconsin, United States",https://i.ebayimg.com/thumbs/images/g/udUAAOSw9TRfvnB8/s-l225.jpg,jennhal_27,https://www.ebay.com/usr/jennhal_27?_trksid=p2047675.l2559,Instant,0,0,1,"Feb 10, 2021 07:26:47 PST"
item3b2d3c1d42,Western Forest Trees - Paperback - 1966 - James Berthold Berry,https://www.ebay.com/itm/254161984834?hash=item3b2d3c1d42:g:mw8AAOSwMtpciMH1,$8.50,"Gilbert, Arizona, United States",https://i.ebayimg.com/thumbs/images/g/mw8AAOSwMtpciMH1/s-l225.jpg,jogross28,https://www.ebay.com/usr/jogross28?_trksid=p2047675.l2559,Instant,0,0,1,"Oct 10, 2020 16:46:52 PDT"
item2cf4c0f3f7,Western Forest Trees,https://www.ebay.com/itm/193084847095?epid=11038308408&hash=item2cf4c0f3f7:g:4F4AAOSwBHNdcDPS,$4.89,"Toledo, Ohio, United States",https://i.ebayimg.com/thumbs/images/g/4F4AAOSwBHNdcDPS/s-l225.jpg,discover-books,https://www.ebay.com/usr/discover-books?_trksid=p2047675.l2559,Instant,0,0,2,"Aug 26, 2021 18:03:55 PDT"
item46a8fd57dc,B001MZAOQW Western Forest Trees  a Guide to the Identification of Tre,https://www.ebay.com/itm/303482886108?hash=item46a8fd57dc:g:sskAAOSwwfFeQq3m,$3.99,"Toledo, Ohio, United States",https://i.ebayimg.com/thumbs/images/g/sskAAOSwwfFeQq3m/s-l225.jpg,discover-books,https://www.ebay.com/usr/discover-books?_trksid=p2047675.l2559,Instant,0,0,3,"Jun 25, 2021 09:41:26 PDT"
item3dc1191061,Plants of the Western Forest: Alberta Saskatchewan and Manitoba Derek Johnson,https://www.ebay.com/itm/265232650337?hash=item3dc1191061:g:-H4AAOSwo8lg8amr,$74.95,"Frederick, Maryland, United States",https://i.ebayimg.com/thumbs/images/g/-H4AAOSwo8lg8amr/s-l225.jpg,particular_things,https://www.ebay.com/usr/particular_things?_trksid=p2047675.l2559,Instant,0,0,1,Unknown
item48f1168c06,"Plants of the Western Forest Alaska to Minnesota  Johnson, Derick  Good  Book  0",https://www.ebay.com/itm/313282432006?epid=79767473&hash=item48f1168c06:g:tIsAAOSw~y9ZKRjc,$40.61,"Colorado Springs, Colorado, United States",https://i.ebayimg.com/thumbs/images/g/tIsAAOSw~y9ZKRjc/s-l225.jpg,goodwill_colorado_springs,https://www.ebay.com/usr/goodwill_colorado_springs?_trksid=p2047675.l2559,Instant,0,0,1,"Aug 30, 2021 13:32:42 PDT"
item48ffdf3af6,Western forest trees : a guide to the identification of trees and woods for stud,https://www.ebay.com/itm/313530465014?hash=item48ffdf3af6:i:313530465014,$4.49,"Mishawaka, Indiana, United States",NA,betterworldbooks,https://www.ebay.com/usr/betterworldbooks?_trksid=p2047675.l2559,Instant,0,0,1,"Jun 11, 2021 00:46:50 PDT"
item56fc1d9529,Western Forest Trees; a Guide to the Identification of Trees and Woods for...,https://www.ebay.com/itm/373596984617?hash=item56fc1d9529:g:sfwAAOSwMlBgspq1,$7.89,"Aurora, Illinois, United States",https://i.ebayimg.com/thumbs/images/g/sfwAAOSwMlBgspq1/s-l225.jpg,thrift.books,https://www.ebay.com/usr/thrift.books?_trksid=p2047675.l2559,Instant,0,0,1,"Jul 21, 2021 02:32:05 PDT"
item2cf7f9030d,"Western Forest Insects, 1977, Miscellaneous Publications, Number 1339 : pages...",https://www.ebay.com/itm/193138852621?hash=item2cf7f9030d:g:1voAAOSwY0ddlfqS,$22.95,"Aurora, Illinois, United States",https://i.ebayimg.com/thumbs/images/g/1voAAOSwY0ddlfqS/s-l225.jpg,thrift.books,https://www.ebay.com/usr/thrift.books?_trksid=p2047675.l2559,Instant,0,0,1,"Aug 20, 2021 16:41:14 PDT"
item2d1f55ac93,Western Forest Trees; a Guide to the Identification of Trees and Woods for...,https://www.ebay.com/itm/193799236755?hash=item2d1f55ac93:g:B7wAAOSwrptf1cnB,$32.50,"Aurora, Illinois, United States",https://i.ebayimg.com/thumbs/images/g/B7wAAOSwrptf1cnB/s-l225.jpg,thrift.books,https://www.ebay.com/usr/thrift.books?_trksid=p2047675.l2559,Instant,0,0,1,"Aug 20, 2021 15:49:34 PDT"
item5b9da17a42,Western Forest Trees: A Guide to Identification by James Berthold Berry 1966 SC,https://www.ebay.com/itm/393486629442?hash=item5b9da17a42:g:XQ4AAOSw94JhDDwm,$6.00,"Woburn, Massachusetts, United States",https://i.ebayimg.com/thumbs/images/g/XQ4AAOSw94JhDDwm/s-l225.jpg,hanmar44,https://www.ebay.com/usr/hanmar44?_trksid=p2047675.l2559,Instant,0,0,1,Unknown
item422d83f9b4,"Rustic Western Forest Horned Elk Deer Head Cast Iron Door Knocker Sculpture 10""H",https://www.ebay.com/itm/284231465396?hash=item422d83f9b4:g:Jd0AAOSwuNdgW5yQ,$33.99,"Edmond, Oklahoma, United States",https://i.ebayimg.com/thumbs/images/g/Jd0AAOSwuNdgW5yQ/s-l225.jpg,istatue,https://www.ebay.com/usr/istatue?_trksid=p2047675.l2559,Instant,0,0,More than 10,"Jul 26, 2021 13:11:42 PDT"
item218ceb000b,WESTERN FOREST TREES. A GUIDE TO THE INDENTIFICATION OF TREES AND WOODS FOR...,https://www.ebay.com/itm/144098131979?hash=item218ceb000b:g:YiMAAOSwUldg3sQ9,$8.85,"Aurora, Illinois, United States",https://i.ebayimg.com/thumbs/images/g/YiMAAOSwUldg3sQ9/s-l225.jpg,thrift.books,https://www.ebay.com/usr/thrift.books?_trksid=p2047675.l2559,Instant,0,0,1,"Aug 11, 2021 13:12:22 PDT"
item52273d67e7,"Rustic Western Forest Horned Elk Deer Head Cast Iron Door Knocker Sculpture 10""H",https://www.ebay.com/itm/352845653991?hash=item52273d67e7:g:P0MAAOSwJU5dwxs7,$32.99,"Edmond, Oklahoma, United States",https://i.ebayimg.com/thumbs/images/g/P0MAAOSwJU5dwxs7/s-l225.jpg,ebrosgift,https://www.ebay.com/usr/ebrosgift?_trksid=p2047675.l2559,Instant,0,0,1,"Jun 29, 2021 10:17:11 PDT"
item23fa14a9c9,"Photo: Sacramental Scene in Western Forest,1854,Religious Revival Meeting,Presby",https://www.ebay.com/itm/154519513545?hash=item23fa14a9c9:g:1G4AAOSwcXRg4xE4,$14.99,"Toledo, Oregon, United States",https://i.ebayimg.com/thumbs/images/g/1G4AAOSwcXRg4xE4/s-l225.jpg,historic_maps_llc,https://www.ebay.com/usr/historic_maps_llc?_trksid=p2047675.l2559,Instant,0,0,1,"Jul 31, 2021 02:33:28 PDT"
item5b5d9051d7,Rustic Western Forest Black Bear Climbing Tree Cast Iron Door Knocker Figurine,https://www.ebay.com/itm/392411763159?hash=item5b5d9051d7:g:9UUAAOSw305dkQK8,$22.99,"Edmond, Oklahoma, United States",https://i.ebayimg.com/thumbs/images/g/9UUAAOSw305dkQK8/s-l225.jpg,ebrosgift,https://www.ebay.com/usr/ebrosgift?_trksid=p2047675.l2559,Instant,0,0,1,"Jun 29, 2021 10:14:58 PDT"
item5661afecd5,North Carolina Western Forest Conditions - USFS 1909 - 23.00 x 38.45,https://www.ebay.com/itm/371006106837?hash=item5661afecd5:g:Gw8AAOSwAHde0~2N,$36.95 to $94.95,"San Marcos, Texas, United States",https://i.ebayimg.com/thumbs/images/g/Gw8AAOSwAHde0~2N/s-l225.jpg,maps-of-the-past,https://www.ebay.com/usr/maps-of-the-past?_trksid=p2047675.l2559,Instant,0,0,More than 10,"Jul 26, 2021 10:12:17 PDT"
item59772782b1,Washington~A Western Forest Grounds~Real Photo Postcard~RPPC,https://www.ebay.com/itm/384251167409?hash=item59772782b1:g:I-UAAOSwj1Zg0qHx,$2.50,"Newton, Iowa, United States",https://i.ebayimg.com/thumbs/images/g/I-UAAOSwj1Zg0qHx/s-l225.jpg,refriedjeans,https://www.ebay.com/usr/refriedjeans?_trksid=p2047675.l2559,Instant,0,0,1,"Aug 25, 2021 12:16:21 PDT"
item3b5b52efca,Plants of the Western Forest Alaska to Minnesota - Paperback - GOOD,https://www.ebay.com/itm/254935232458?epid=79767473&hash=item3b5b52efca:g:0JAAAOSwWqxgb7gp,$38.71,"Montgomery, Illinois, United States",https://i.ebayimg.com/thumbs/images/g/0JAAAOSwWqxgb7gp/s-l225.jpg,second.sale,https://www.ebay.com/usr/second.sale?_trksid=p2047675.l2559,Instant,0,0,1,"Aug 11, 2021 06:45:13 PDT"
item342b506bc9,RUNNING HORSES BEAUTIFUL WESTERN FOREST TREES VIEWS THROW WALL ART 48 X 34 1/2,https://www.ebay.com/itm/224064990153?hash=item342b506bc9:g:CJwAAOSwtZpeatX0,$20.00,"Twin Falls, Idaho, United States",https://i.ebayimg.com/thumbs/images/g/CJwAAOSwtZpeatX0/s-l225.jpg,funkystop,https://www.ebay.com/usr/funkystop?_trksid=p2047675.l2559,Instant,0,0,1,Unknown
item59773f5fe1,"Playmobil raccoon / mapache / Waschbär x10 like set 4205, zoo western forest",https://www.ebay.com/itm/384252731361?hash=item59773f5fe1:g:6VkAAOSwyVFg3dqN,$18.75,"Middelharnis, Netherlands",https://i.ebayimg.com/thumbs/images/g/6VkAAOSwyVFg3dqN/s-l225.jpg,kittyjip76,https://www.ebay.com/usr/kittyjip76?_trksid=p2047675.l2559,Instant,0,0,1,Unknown
item2f6291fa3a,"Photo: Sacramental scene in western forest,Presbyterian religious service,1854",https://www.ebay.com/itm/203517196858?hash=item2f6291fa3a:g:wfwAAOSwzSpg5Yvq,$14.99,"Houston, Texas, United States",https://i.ebayimg.com/thumbs/images/g/wfwAAOSwzSpg5Yvq/s-l225.jpg,historic_photos_maps,https://www.ebay.com/usr/historic_photos_maps?_trksid=p2047675.l2559,Instant,0,0,1,"Jul 31, 2021 04:28:00 PDT"
item3ffae4495b,Vtg Postcard Unused PNC - Western Forest Scene Gathering Pine Sap UNP,https://www.ebay.com/itm/274792204635?hash=item3ffae4495b:g:rdMAAOSw55VgmKqB,$4.95,"Bremerton, Washington, United States",https://i.ebayimg.com/thumbs/images/g/rdMAAOSw55VgmKqB/s-l225.jpg,jackassretro,https://www.ebay.com/usr/jackassretro?_trksid=p2047675.l2559,Instant,0,0,1,"Aug 22, 2021 06:31:03 PDT"
item3632615924,Western Forest Landscape by Canadian Emily Carr Counted Cross Stitch Pattern,https://www.ebay.com/itm/232773474596?hash=item3632615924:g:XCkAAOSwMqNhFHpY,$9.74,"Forest Grove, Oregon, United States",https://i.ebayimg.com/thumbs/images/g/XCkAAOSwMqNhFHpY/s-l225.jpg,msbpkb,https://www.ebay.com/usr/msbpkb?_trksid=p2047675.l2559,Instant,0,0,1,"Aug 18, 2021 23:04:06 PDT"
item2afd2c820c,Matchbook Cover~Best Western Forest Motel & Restaurant Franklin Louisana,https://www.ebay.com/itm/184636178956?hash=item2afd2c820c:g:l9AAAOSwotJeC1yE,$3.99,"Holland, Michigan, United States",https://i.ebayimg.com/thumbs/images/g/l9AAAOSwotJeC1yE/s-l225.jpg,anordictrader,https://www.ebay.com/usr/anordictrader?_trksid=p2047675.l2559,Instant,0,0,1,"Jun 06, 2021 07:30:48 PDT"
item549cd93fe4,Western Forest Detail Landscape Canadian Emily Carr Counted Cross Stitch Pattern,https://www.ebay.com/itm/363408736228?hash=item549cd93fe4:g:9PMAAOSwVsZhFHnp,$9.74,"Forest Grove, Oregon, United States",https://i.ebayimg.com/thumbs/images/g/9PMAAOSwVsZhFHnp/s-l225.jpg,msbpkb,https://www.ebay.com/usr/msbpkb?_trksid=p2047675.l2559,Instant,0,0,1,"Aug 18, 2021 23:08:28 PDT"
item4dafc1af09,Historic Western Forest Industries Ltd. - Honeymoon Bay B.C. Train Postcard,https://www.ebay.com/itm/333661187849?hash=item4dafc1af09:g:qJkAAOSwUalfFkzZ,$4.38,"Sturt, SA, Australia",https://i.ebayimg.com/thumbs/images/g/qJkAAOSwUalfFkzZ/s-l225.jpg,blueunicorns,https://www.ebay.com/usr/blueunicorns?_trksid=p2047675.l2559,Instant,0,0,1,Unknown
item2afd3bb51f,PLANTS OF WESTERN FOREST ALASKA TO MINNESOTA By Derick Johnson & Linda J. VG,https://www.ebay.com/itm/184637175071?epid=79767473&hash=item2afd3bb51f:g:ypMAAOSw3j1gD-T6,$70.95,"US, United States",https://i.ebayimg.com/thumbs/images/g/ypMAAOSw3j1gD-T6/s-l225.jpg,zuber,https://www.ebay.com/usr/zuber?_trksid=p2047675.l2559,Instant,0,0,1,"Mar 10, 2021 14:08:05 PST"
item3b63a38966,Vintage Matchcover Best Western Forest Motel Restaurant Franklin La Louisiana,https://www.ebay.com/itm/255074732390?hash=item3b63a38966:g:HUYAAOSw1U1hB3i6,$9.99,"Elizabethtown, Pennsylvania, United States",https://i.ebayimg.com/thumbs/images/g/HUYAAOSw1U1hB3i6/s-l225.jpg,midwayva,https://www.ebay.com/usr/midwayva?_trksid=p2047675.l2559,Instant,0,0,1,"Aug 10, 2021 00:18:11 PDT"
item56dcf8c134,Western Forest Reserves National Parks 1899 - 23 x 27.88,https://www.ebay.com/itm/373074477364?hash=item56dcf8c134:g:-fQAAOSw2eNe2To~,$36.95 to $94.95,"San Marcos, Texas, United States",https://i.ebayimg.com/thumbs/images/g/-fQAAOSw2eNe2To~/s-l225.jpg,maps-of-the-past,https://www.ebay.com/usr/maps-of-the-past?_trksid=p2047675.l2559,Instant,0,0,More than 10,"Jul 26, 2021 10:10:59 PDT"
item1ccd9f99b2,BLACK BEAR 31067 button pins western forest new pin jewelry,https://www.ebay.com/itm/123708873138?hash=item1ccd9f99b2:g:srsAAOSw0bpcmpeg,$4.85,"Sun City West, Arizona, United States",https://i.ebayimg.com/thumbs/images/g/srsAAOSw0bpcmpeg/s-l225.jpg,ozarkmttraders,https://www.ebay.com/usr/ozarkmttraders?_trksid=p2047675.l2559,Instant,0,0,25,"Aug 21, 2020 04:29:42 PDT"
item4458f7ebaf,"Sacramental scene in western forest,Presbyterian religious service,1854 5622",https://www.ebay.com/itm/293550418863?hash=item4458f7ebaf:g:e58AAOSwtZpemiDv,$12.38,"80126, United States",https://i.ebayimg.com/thumbs/images/g/e58AAOSwtZpemiDv/s-l225.jpg,yesterdaysphotos,https://www.ebay.com/usr/yesterdaysphotos?_trksid=p2047675.l2559,Instant,0,0,5,Unknown
item1aba94504a,"4 HO Freight Cars, Lehigh Valley, Erie, North western, Forest Lumber",https://www.ebay.com/itm/114799431754?hash=item1aba94504a:g:akkAAOSwuXhglzkz,$29.00,"Banner Elk, North Carolina, United States",https://i.ebayimg.com/thumbs/images/g/akkAAOSwuXhglzkz/s-l225.jpg,clydette1,https://www.ebay.com/usr/clydette1?_trksid=p2047675.l2559,Instant,0,0,1,"Aug 09, 2021 05:49:36 PDT"
item4cff3fc26c,1848 Antique Print/PIONEER OF THE WESTERN FOREST,https://www.ebay.com/itm/330699883116?hash=item4cff3fc26c:g:N90AAOxy~dBRGtHK,$13.45,"Monroeville, Pennsylvania, United States",https://i.ebayimg.com/thumbs/images/g/N90AAOxy~dBRGtHK/s-l225.jpg,paulishere,https://www.ebay.com/usr/paulishere?_trksid=p2047675.l2559,Instant,0,0,1,"Feb 01, 2019 17:25:54 PST"
item4466ea45c4,"Sacramental Scene in Western Forest,1854,Religious Revival Meeting,Presbyt 4889",https://www.ebay.com/itm/293784405444?hash=item4466ea45c4:g:NfoAAOSwe7FfiJt6,$12.38,"80126, United States",https://i.ebayimg.com/thumbs/images/g/NfoAAOSwe7FfiJt6/s-l225.jpg,yesterdaysphotos,https://www.ebay.com/usr/yesterdaysphotos?_trksid=p2047675.l2559,Instant,0,0,5,Unknown
item34464b0c64,"Playmobil skunk / zorrillo / moufette x8 like set 3226 farm, zoo western forest",https://www.ebay.com/itm/224517622884?hash=item34464b0c64:g:wUsAAOSwxeBg3dg4,$19.75,"Middelharnis, Netherlands",https://i.ebayimg.com/thumbs/images/g/wUsAAOSwxeBg3dg4/s-l225.jpg,kittyjip76,https://www.ebay.com/usr/kittyjip76?_trksid=p2047675.l2559,Instant,0,0,1,"Jul 01, 2021 08:10:20 PDT"
item5b87009605,Railfan & Railroad Magazine 2011 June Western Forest products C&O Signals in WV,https://www.ebay.com/itm/393106986501?hash=item5b87009605:g:0yoAAOSwQdhgDKNN,$5.50,"Talbott, Tennessee, United States",https://i.ebayimg.com/thumbs/images/g/0yoAAOSwQdhgDKNN/s-l225.jpg,railroadtreasures,https://www.ebay.com/usr/railroadtreasures?_trksid=p2047675.l2559,Instant,0,0,1,Unknown
item549271aaed,Soft Women Baseball Cap Southwest Native American Feather with Beads Western,https://www.ebay.com/itm/363234175725?hash=item549271aaed:g:aroAAOSwoQZf5iCF,$14.99 to $16.99,"33578, United States",https://i.ebayimg.com/thumbs/images/g/aroAAOSwoQZf5iCF/s-l225.jpg,myspeedypros,https://www.ebay.com/usr/myspeedypros?_trksid=p2047675.l2559,Instant,0,0,More than 10,"Jul 14, 2021 09:25:28 PDT"
item2adcb8a2d2,Place-Based Planning: Innovations And Applications From Four Western Forest...,https://www.ebay.com/itm/184091714258?hash=item2adcb8a2d2:g:-rAAAOSwtzVfhY4N,$17.25,"USA, United States",https://i.ebayimg.com/thumbs/images/g/-rAAAOSwtzVfhY4N/s-l225.jpg,prepbooks,https://www.ebay.com/usr/prepbooks?_trksid=p2047675.l2559,Instant,0,0,1,"Aug 21, 2021 06:01:18 PDT"
item43d62f8b7b,RPPC POSTCARD HI PAL LARGE BROWN BLACK BEAR SITTING DOWN IN WESTERN FOREST #6hh3,https://www.ebay.com/itm/291356248955?hash=item43d62f8b7b:g:4FMAAOSw0e9UuZzh,$5.00,"Dayton, Ohio, United States",https://i.ebayimg.com/thumbs/images/g/4FMAAOSw0e9UuZzh/s-l225.jpg,scruffy4159,https://www.ebay.com/usr/scruffy4159?_trksid=p2047675.l2559,Instant,0,0,1,Unknown
item5241fa3a46,OG503 RP 1940s/50s WESTERN FOREST INDUSTRIES RAILROAD SHAY LOCO #3 BC,https://www.ebay.com/itm/353294236230?hash=item5241fa3a46:g:Ta4AAOSwDaVfqFU0,$6.99,"Sturgeon Bay, Wisconsin, United States",https://i.ebayimg.com/thumbs/images/g/Ta4AAOSwDaVfqFU0/s-l225.jpg,dfwu,https://www.ebay.com/usr/dfwu?_trksid=p2047675.l2559,Instant,0,0,1,Unknown
item4dbda55893,Pacific News #202 1978 August Southern Pacific Roster Western Forest industries,https://www.ebay.com/itm/333894211731?hash=item4dbda55893:g:L3UAAOSw-DtgLrSo,$5.00,"Talbott, Tennessee, United States",https://i.ebayimg.com/thumbs/images/g/L3UAAOSw-DtgLrSo/s-l225.jpg,railroadtreasures,https://www.ebay.com/usr/railroadtreasures?_trksid=p2047675.l2559,Instant,0,0,1,Unknown
item1f1c3d0f42,Soft Women Baseball Cap Western Southwest Native American Buffalo Skull Western,https://www.ebay.com/itm/133617749826?hash=item1f1c3d0f42:g:5QcAAOSwX2pf5iFL,$14.99 to $16.99,"33578, United States",https://i.ebayimg.com/thumbs/images/g/5QcAAOSwX2pf5iFL/s-l225.jpg,myspeedypros,https://www.ebay.com/usr/myspeedypros?_trksid=p2047675.l2559,Instant,0,0,More than 10,"Jul 14, 2021 09:25:29 PDT"
item23f08e3fe1,Rustic Western Forest Horned Elk Deer Head Cast Iron Door Knocker Sculpture,https://www.ebay.com/itm/154359709665?hash=item23f08e3fe1:g:8dUAAOSwvPpgQmi~,$25.00,"Anderson, South Carolina, United States",https://i.ebayimg.com/thumbs/images/g/8dUAAOSwvPpgQmi~/s-l225.jpg,brudsc,https://www.ebay.com/usr/brudsc?_trksid=p2047675.l2559,Instant,0,0,1,Unknown
item54a1bc8c7e,Mens RFID Blocking Bifold Wallet Soft Genuine Leather Brown Western Forest Brown,https://www.ebay.com/itm/363490741374?hash=item54a1bc8c7e:g:0w4AAOSwP7ZhCE7M,$42.50,"Miami, Florida, United States",https://i.ebayimg.com/thumbs/images/g/0w4AAOSwP7ZhCE7M/s-l225.jpg,viktbezbo-0,https://www.ebay.com/usr/viktbezbo-0?_trksid=p2047675.l2559,Instant,0,0,1,Unknown
item266cc17203,Mens RFID Blocking Bifold Wallet Soft Genuine Leather Brown Western Forest Brown,https://www.ebay.com/itm/165033374211?hash=item266cc17203:g:RtEAAOSwS1FhI~35,$44.16,"Miami, Florida, United States",https://i.ebayimg.com/thumbs/images/g/RtEAAOSwS1FhI~35/s-l225.jpg,shopingonlin,https://www.ebay.com/usr/shopingonlin?_trksid=p2047675.l2559,Instant,0,0,1,Unknown
item1f1c3d0f34,Soft Women Baseball Cap Western Farm Animal Horse Bareback Rider Cowboy Western,https://www.ebay.com/itm/133617749812?hash=item1f1c3d0f34:g:0xkAAOSwrphf5iFN,$14.99 to $16.99,"33578, United States",https://i.ebayimg.com/thumbs/images/g/0xkAAOSwrphf5iFN/s-l225.jpg,myspeedypros,https://www.ebay.com/usr/myspeedypros?_trksid=p2047675.l2559,Instant,0,0,More than 10,"Jul 14, 2021 09:25:30 PDT"
item4b9ac111ff,Mens RFID Blocking Bifold Wallet Soft Genuine Leather Brown Western Forest Brown,https://www.ebay.com/itm/324718891519?hash=item4b9ac111ff:g:zzUAAOSw1A5g8~v1,$42.57,"Miami, Florida, United States",https://i.ebayimg.com/thumbs/images/g/zzUAAOSw1A5g8~v1/s-l225.jpg,the_gold_deal,https://www.ebay.com/usr/the_gold_deal?_trksid=p2047675.l2559,Instant,0,0,1,"Aug 12, 2021 10:06:34 PDT"
item549271c346,Soft Women Baseball Cap Western Southwest Native American Buffalo Hunt Western,https://www.ebay.com/itm/363234181958?hash=item549271c346:g:MckAAOSwqwtf5iFM,$14.99 to $16.99,"33578, United States",https://i.ebayimg.com/thumbs/images/g/MckAAOSwqwtf5iFM/s-l225.jpg,myspeedypros,https://www.ebay.com/usr/myspeedypros?_trksid=p2047675.l2559,Instant,0,0,More than 10,"Jul 14, 2021 09:25:32 PDT"
item2b0027a6b6,"poster, Bison, Animals, Western, Forest, Yellowstone, Decoration, Dorm, room, ",https://www.ebay.com/itm/184686192310?hash=item2b0027a6b6:g:SGkAAOSwU39gOogm,$24.00,"Upland, Indiana, United States",https://i.ebayimg.com/thumbs/images/g/SGkAAOSwU39gOogm/s-l225.jpg,niwol-7815,https://www.ebay.com/usr/niwol-7815?_trksid=p2047675.l2559,Instant,0,0,1,"Apr 20, 2021 13:34:38 PDT"
item1f1c3d0f7c,Soft Women Baseball Cap Western Farm Animal Horse Saddle Bronco Cowboy Western,https://www.ebay.com/itm/133617749884?hash=item1f1c3d0f7c:g:dAAAAOSwj0tf5iFT,$14.99 to $16.99,"33578, United States",https://i.ebayimg.com/thumbs/images/g/dAAAAOSwj0tf5iFT/s-l225.jpg,myspeedypros,https://www.ebay.com/usr/myspeedypros?_trksid=p2047675.l2559,Instant,0,0,More than 10,"Jul 14, 2021 09:25:30 PDT"
item589bae42cd,VERY LARGE NATURAL PINE CONE FROM A WESTERN FOREST COLLECTED 30+ YEARS AGO,https://www.ebay.com/itm/380569010893?hash=item589bae42cd:g:JQQAAOxy0uZR1g3H,$12.99,"Hampton, New York, United States",https://i.ebayimg.com/thumbs/images/g/JQQAAOxy0uZR1g3H/s-l225.jpg,slvrtgrinsptorpeek,https://www.ebay.com/usr/slvrtgrinsptorpeek?_trksid=p2047675.l2559,Instant,0,0,1,"May 23, 2019 07:03:09 PDT"
item589bae42cb,VERY LARGE NATURAL PINE CONE FROM A WESTERN FOREST COLLECTED 30+ YEARS AGO,https://www.ebay.com/itm/380569010891?hash=item589bae42cb:g:WfwAAOxyHt9R1g1l,$12.99,"Hampton, New York, United States",https://i.ebayimg.com/thumbs/images/g/WfwAAOxyHt9R1g1l/s-l225.jpg,slvrtgrinsptorpeek,https://www.ebay.com/usr/slvrtgrinsptorpeek?_trksid=p2047675.l2559,Instant,0,0,1,"Oct 18, 2020 04:41:24 PDT"
item597bb1de8f,AC POPTOYS 1/12 BGS004 Military The Beautiful Western Forest soldier cosplay (dr,https://www.ebay.com/itm/384327343759?hash=item597bb1de8f:g:ju4AAOSwnHdhFfe5,$144.39,"Saitama, Japan",https://i.ebayimg.com/thumbs/images/g/ju4AAOSwnHdhFfe5/s-l225.jpg,deepworks_0001,https://www.ebay.com/usr/deepworks_0001?_trksid=p2047675.l2559,Instant,0,0,1,"Aug 28, 2021 21:11:46 PDT"
item48f9e32238,Bull Guard Mens RFID Blocking Bifold Wallet Soft Genuine Leather Brown Western,https://www.ebay.com/itm/313430057528?hash=item48f9e32238:g:ZIkAAOSwwJ1eQqqE,$72.40 to $74.10,"San Jose, CA, United States",https://i.ebayimg.com/thumbs/images/g/ZIkAAOSwwJ1eQqqE/s-l225.jpg,nyc_shopmall,https://www.ebay.com/usr/nyc_shopmall?_trksid=p2047675.l2559,Instant,0,0,1,"Jun 29, 2021 04:05:41 PDT"
item1f26e6e2c0,"Proceedings, Combined Meeting of the Western Forest Nursery Associations, United",https://www.ebay.com/itm/133796651712?epid=7031227418&hash=item1f26e6e2c0:g:srcAAOSw-3pg0sVm,$44.97,"Fairford, United Kingdom",https://i.ebayimg.com/thumbs/images/g/srcAAOSw-3pg0sVm/s-l225.jpg,books2aw,https://www.ebay.com/usr/books2aw?_trksid=p2047675.l2559,Instant,0,0,5,Unknown
item2d3d6ef850,Western Forest Industry : An Economic Outlook,https://www.ebay.com/itm/194304211024?hash=item2d3d6ef850:i:194304211024,$8.78,"Aurora, Illinois, United States",NA,thrift.books,https://www.ebay.com/usr/thrift.books?_trksid=p2047675.l2559,Instant,0,0,1,"Aug 24, 2021 20:05:27 PDT"
item2667785442,Mens RFID Blocking Bifold Wallet Soft Genuine Leather Brown Western Forest Brown,https://www.ebay.com/itm/164944696386?hash=item2667785442:g:bhYAAOSwInBg4uCz,$43.23,"Mays Landing, New Jersey, United States",https://i.ebayimg.com/thumbs/images/g/bhYAAOSwInBg4uCz/s-l225.jpg,marm.yuva,https://www.ebay.com/usr/marm.yuva?_trksid=p2047675.l2559,Instant,0,0,1,Unknown
item1f2ab8df2d,Mens RFID Blocking Bifold Wallet Soft Genuine Leather Brown Western,https://www.ebay.com/itm/133860745005?hash=item1f2ab8df2d:g:x~UAAOSwZRphKIcr,$38.78,"San Bernardino, California, United States",https://i.ebayimg.com/thumbs/images/g/x~UAAOSwZRphKIcr/s-l225.jpg,max_store22,https://www.ebay.com/usr/max_store22?_trksid=p2047675.l2559,Instant,0,0,3,"Aug 27, 2021 07:59:18 PDT"
