id,title,link,price,origin,image,seller_name,seller_link,sell_type,num_bids,num_watchers,num_stock,date
item5688ba3af1,GRETA OTO - Animals in Glass #1 - GLASSWINGED BUTTERFLY Silver Coin 2014 Palau,https://www.ebay.com/itm/371661093617?hash=item5688ba3af1:g:P8gAAOSwepJXZ1DU,$249.00,"Illinois, United States",https://i.ebayimg.com/thumbs/images/g/P8gAAOSwepJXZ1DU/s-l225.jpg,son-montuno,https://www.ebay.com/usr/son-montuno?_trksid=p2047675.l2559,Instant,0,0,1,"Aug 03, 2020 15:22:29 PDT"
item5475ba66bc,"Palau 2014 Buttefly Greta Oto 10 Dollars 50grams Silver Coin,Proof",https://www.ebay.com/itm/362752403132?hash=item5475ba66bc:g:NJ4AAOSwkNZUcdRu,$179.10,"Shanghai, China",https://i.ebayimg.com/thumbs/images/g/NJ4AAOSwkNZUcdRu/s-l225.jpg,wucoinbanknote,https://www.ebay.com/usr/wucoinbanknote?_trksid=p2047675.l2559,Instant,0,0,More than 10,"Aug 18, 2021 21:53:44 PDT"
item46c9d7be84,GRETA OTO Glasswing Butterfly Silver Coin 10$ Palau 2014,https://www.ebay.com/itm/304034070148?hash=item46c9d7be84:g:q9UAAOSwQgpgwVIs,$229.50,"Maple Falls, Washington, United States",https://i.ebayimg.com/thumbs/images/g/q9UAAOSwQgpgwVIs/s-l225.jpg,dazzlingcoins_com,https://www.ebay.com/usr/dazzlingcoins_com?_trksid=p2047675.l2559,Instant,0,0,1,"Aug 25, 2021 11:35:11 PDT"
item3b0d40785c,GLASSWINGED BUTTERFLY GRETA OTO GLOSSY POSTER PICTURE PHOTO PRINT insect 4414,https://www.ebay.com/itm/253625399388?hash=item3b0d40785c:g:G78AAOSwV4Ba-0H5,$9.99 to $18.99,"Westland, Michigan, United States",https://i.ebayimg.com/thumbs/images/g/G78AAOSwV4Ba-0H5/s-l225.jpg,conversationprints,https://www.ebay.com/usr/conversationprints?_trksid=p2047675.l2559,Instant,0,0,More than 10,"Mar 25, 2021 17:50:06 PDT"
item4002b497e4,"FRAMED Glasswing BUTTERFLY Greta Oto 5"" x 3 1/2""",https://www.ebay.com/itm/274923296740?hash=item4002b497e4:g:AwQAAOSwsmJhGcJD,$28.00,"Plant City, Florida, United States",https://i.ebayimg.com/thumbs/images/g/AwQAAOSwsmJhGcJD/s-l225.jpg,seizethenow,https://www.ebay.com/usr/seizethenow?_trksid=p2047675.l2559,Instant,0,0,1,Unknown
item3b50ef78b3,Greta Oto Docking Station And Charging Stand,https://www.ebay.com/itm/254760941747?hash=item3b50ef78b3:g:QWcAAOSwvddfmCjt,$28.99,"Independence, Missouri, United States",https://i.ebayimg.com/thumbs/images/g/QWcAAOSwvddfmCjt/s-l225.jpg,partsrabbit,https://www.ebay.com/usr/partsrabbit?_trksid=p2047675.l2559,Instant,0,0,1,"Feb 27, 2021 06:20:45 PST"
item1ec4615032,Palau Butterfly Greta Oto $10 Animals in Glass Silver coin,https://www.ebay.com/itm/132143730738?hash=item1ec4615032:g:D~cAAOSwdGFY3eXx,$199.00,"Burnaby, British Columbia, Canada",https://i.ebayimg.com/thumbs/images/g/D~cAAOSwdGFY3eXx/s-l225.jpg,moonrice007,https://www.ebay.com/usr/moonrice007?_trksid=p2047675.l2559,Instant,0,0,2,Unknown
item3d6528f74e,GLASSWINGED BUTTERFLY GRETA OTO GLOSSY POSTER PICTURE PHOTO PRINT insect 4413,https://www.ebay.com/itm/263690188622?hash=item3d6528f74e:g:GtEAAOSwLsRgbl~K,$9.99 to $18.99,"Westland, Michigan, United States",https://i.ebayimg.com/thumbs/images/g/GtEAAOSwLsRgbl~K/s-l225.jpg,conversationprints,https://www.ebay.com/usr/conversationprints?_trksid=p2047675.l2559,Instant,0,0,More than 10,"Apr 07, 2021 18:43:36 PDT"
item3d6528f483,GLASSWINGED BUTTERFLY GRETA OTO GLOSSY POSTER PICTURE PHOTO PRINT insect 4412,https://www.ebay.com/itm/263690187907?hash=item3d6528f483:g:wKwAAOSw-W9a-0Gk,$9.99 to $18.99,"Westland, Michigan, United States",https://i.ebayimg.com/thumbs/images/g/wKwAAOSw-W9a-0Gk/s-l225.jpg,conversationprints,https://www.ebay.com/usr/conversationprints?_trksid=p2047675.l2559,Instant,0,0,More than 10,"Mar 25, 2021 17:50:06 PDT"
item1ac139fc8e,Greta Oto Custom Italian Docking Station Charging Stand Handcrafted Dark Wood,https://www.ebay.com/itm/114910952590?hash=item1ac139fc8e:g:vHcAAOSwtZBgYq9w,$27.15,"Saint Joseph, Missouri, United States",https://i.ebayimg.com/thumbs/images/g/vHcAAOSwtZBgYq9w/s-l225.jpg,jamibrown73,https://www.ebay.com/usr/jamibrown73?_trksid=p2047675.l2559,Instant,0,0,1,Unknown
item1ce7ebcfdf,2014 Palau $10 Greta OTO Butterfly only 999 50 Gr. Silver Color Glass,https://www.ebay.com/itm/124150075359?hash=item1ce7ebcfdf:g:j7MAAOSwNlVekcQ8,$171.09,"Szczecin, Poland",https://i.ebayimg.com/thumbs/images/g/j7MAAOSwNlVekcQ8/s-l225.jpg,dudus-3,https://www.ebay.com/usr/dudus-3?_trksid=p2047675.l2559,Instant,0,0,1,"Aug 16, 2021 06:54:38 PDT"
item3b0d8564b0,GLASSWINGED BUTTERFLY GRETA OTO GLOSSY POSTER PICTURE PHOTO BANNER insect 4414,https://www.ebay.com/itm/253629916336?hash=item3b0d8564b0:g:yIoAAOSwceJgbm8v,$39.99 to $79.99,"Westland, Michigan, United States",https://i.ebayimg.com/thumbs/images/g/yIoAAOSwceJgbm8v/s-l225.jpg,conversationprints,https://www.ebay.com/usr/conversationprints?_trksid=p2047675.l2559,Instant,0,0,More than 10,"Apr 07, 2021 19:49:18 PDT"
item3d6576a456,GLASSWINGED BUTTERFLY GRETA OTO GLOSSY POSTER PICTURE PHOTO BANNER insect 4413,https://www.ebay.com/itm/263695279190?hash=item3d6576a456:g:wFYAAOSwyBBgbm~U,$39.99 to $79.99,"Westland, Michigan, United States",https://i.ebayimg.com/thumbs/images/g/wFYAAOSwyBBgbm~U/s-l225.jpg,conversationprints,https://www.ebay.com/usr/conversationprints?_trksid=p2047675.l2559,Instant,0,0,More than 10,"Apr 07, 2021 19:52:02 PDT"
item3d6576a34a,GLASSWINGED BUTTERFLY GRETA OTO GLOSSY POSTER PICTURE PHOTO BANNER insect 4412,https://www.ebay.com/itm/263695278922?hash=item3d6576a34a:g:RTUAAOSwhvxgbm~c,$39.99 to $79.99,"Westland, Michigan, United States",https://i.ebayimg.com/thumbs/images/g/RTUAAOSwhvxgbm~c/s-l225.jpg,conversationprints,https://www.ebay.com/usr/conversationprints?_trksid=p2047675.l2559,Instant,0,0,More than 10,"Apr 07, 2021 19:52:10 PDT"
item26582d3ae6,Greta Oto Dark Wood Docking Station Italian Handcraft & Design,https://www.ebay.com/itm/164688116454?hash=item26582d3ae6:g:LlEAAOSwzQxgHeEG,$11.99,"Feeding Hills, Massachusetts, United States",https://i.ebayimg.com/thumbs/images/g/LlEAAOSwzQxgHeEG/s-l225.jpg,popzy5,https://www.ebay.com/usr/popzy5?_trksid=p2047675.l2559,Instant,0,0,1,"Mar 05, 2021 14:10:15 PST"
item5241eb72b0,Stained glass mosaic on wood panel -wall art Greta Oto Butterfly,https://www.ebay.com/itm/353293267632?hash=item5241eb72b0:g:lu0AAOSwhEdej06y,$49.00,"Allison Park, Pennsylvania, United States",https://i.ebayimg.com/thumbs/images/g/lu0AAOSwhEdej06y/s-l225.jpg,glassmetaphors,https://www.ebay.com/usr/glassmetaphors?_trksid=p2047675.l2559,Instant,0,0,1,"Mar 25, 2021 17:29:39 PDT"
item3d8efe52d4,GLASSWINGED BUTTERFLY GLOSSY POSTER PICTURE PHOTO transparent greta oto bugs 783,https://www.ebay.com/itm/264392037076?hash=item3d8efe52d4:g:1vQAAOSwpTxgbhtV,$9.99 to $18.99,"Westland, Michigan, United States",https://i.ebayimg.com/thumbs/images/g/1vQAAOSwpTxgbhtV/s-l225.jpg,conversationprints,https://www.ebay.com/usr/conversationprints?_trksid=p2047675.l2559,Instant,0,0,More than 10,"Apr 07, 2021 13:51:31 PDT"
item3dc4966edf,"Greta Oto Docking Station Store -Watch,Key Sunglasses, phone genuine Wooden Gift",https://www.ebay.com/itm/265291198175?hash=item3dc4966edf:g:hD8AAOSwne1fr-tY,$13.74,"Liverpool, United Kingdom",https://i.ebayimg.com/thumbs/images/g/hD8AAOSwne1fr-tY/s-l225.jpg,james11176rugby,https://www.ebay.com/usr/james11176rugby?_trksid=p2047675.l2559,Instant,0,0,1,Unknown
item1ee9319830,Glasswing Butterfly 3d Natural History bookmark,https://www.ebay.com/itm/132761360432?hash=item1ee9319830:g:8tAAAOSwzOleZLKR,$2.81,"Surrey, United Kingdom",https://i.ebayimg.com/thumbs/images/g/8tAAAOSwzOleZLKR/s-l225.jpg,directfrommars1,https://www.ebay.com/usr/directfrommars1?_trksid=p2047675.l2559,Instant,0,0,6,"Aug 05, 2021 06:03:48 PDT"
