id,title,link,price,origin,image,seller_name,seller_link,sell_type,num_bids,num_watchers,num_stock,date
item33ea228b4c,Graphium stresemanni ONE REAL BUTTERFLY BLUE GREEN UNMOUNTED WINGS CLOSED,https://www.ebay.com/itm/222971464524?hash=item33ea228b4c:g:lbwAAOSwbZpe-AYG,$10.00,"Sahuarita, Arizona, United States",https://i.ebayimg.com/thumbs/images/g/lbwAAOSwbZpe-AYG/s-l225.jpg,bicbugs,https://www.ebay.com/usr/bicbugs?_trksid=p2047675.l2559,Instant,0,0,More than 10,"Jun 18, 2021 19:13:01 PDT"
item342b0ac3aa,Graphium stresemanni REAL FRAMED BUTTERFLY BLUE GREEN INDONESIA,https://www.ebay.com/itm/224060425130?hash=item342b0ac3aa:g:LvIAAOSw5EJe-AZY,$30.00,"Sahuarita, Arizona, United States",https://i.ebayimg.com/thumbs/images/g/LvIAAOSw5EJe-AZY/s-l225.jpg,bicbugs,https://www.ebay.com/usr/bicbugs?_trksid=p2047675.l2559,Instant,0,0,More than 10,"Jun 10, 2021 18:56:07 PDT"
item420f5bbaa3,Graphium stresemanni- TWO ( 2 ) A1 Specimens - Ceram Island,https://www.ebay.com/itm/283725511331?hash=item420f5bbaa3:g:WPkAAOSwzVdeB8cn,$15.95,"Commack, New York, United States",https://i.ebayimg.com/thumbs/images/g/WPkAAOSwzVdeB8cn/s-l225.jpg,limmerleps,https://www.ebay.com/usr/limmerleps?_trksid=p2047675.l2559,Instant,0,0,5,"Jun 24, 2020 08:14:57 PDT"
item41ff9ae07e,"Graphium stresemanni, Lot of 5 A1 RARE, Unmounted, Colorful Males ( CERAM )",https://www.ebay.com/itm/283461214334?hash=item41ff9ae07e:g:TiMAAOSw8W5aUqQl,$38.95,"Commack, New York, United States",https://i.ebayimg.com/thumbs/images/g/TiMAAOSw8W5aUqQl/s-l225.jpg,limmerleps,https://www.ebay.com/usr/limmerleps?_trksid=p2047675.l2559,Instant,0,0,5 lots (5 items per lot),"Aug 24, 2021 10:05:48 PDT"
item26465027dd,"GRAPHIUM STRESEMANNI, Framed Butterfly, Framed Insect, real Butterfly, Rare",https://www.ebay.com/itm/164388415453?hash=item26465027dd:g:jykAAOSwmQxfY9wT,$44.02,"Worksop, United Kingdom",https://i.ebayimg.com/thumbs/images/g/jykAAOSwmQxfY9wT/s-l225.jpg,leclaire1985,https://www.ebay.com/usr/leclaire1985?_trksid=p2047675.l2559,Instant,0,0,1,"Feb 08, 2021 15:46:25 PST"
item1d12e80c70,Tropical Blue Swallowtail Butterfly in Box Frame (Graphium stresemanni),https://www.ebay.com/itm/124871249008?hash=item1d12e80c70:g:ZccAAOSwTQxgT4o~,$68.77,"Hitchin, United Kingdom",https://i.ebayimg.com/thumbs/images/g/ZccAAOSwTQxgT4o~/s-l225.jpg,minibeastuk,https://www.ebay.com/usr/minibeastuk?_trksid=p2047675.l2559,Instant,0,0,3,Unknown
