id,title,link,price,origin,image,seller_name,seller_link,sell_type,num_bids,num_watchers,num_stock,date
item48ecd640f6,collection PAIR unmounted butterfly Nymphalidae Neptis hylas CHINA  #464,https://www.ebay.com/itm/313211109622?hash=item48ecd640f6:g:7uIAAOSw789fV081,$69.00,"beijing, China",https://i.ebayimg.com/images/g/7uIAAOSw789fV081/s-l300.jpg,china*butterfly,https://www.ebay.com/usr/china*butterfly?_trksid=p2047675.l2559,Instant,0,0,1,"Dec 16, 2020 00:30:24 PST"
item48c710b9c6,2 unmounted butterfly Nymphalidae Neptis hylas GUANGXI A1  A1-,https://www.ebay.com/itm/312577407430?hash=item48c710b9c6:g:1qkAAOxyOlhSr8xC,$8.80,"beijing, China",https://i.ebayimg.com/images/g/1qkAAOxyOlhSr8xC/s-l300.jpg,china*butterfly,https://www.ebay.com/usr/china*butterfly?_trksid=p2047675.l2559,Instant,0,0,Last one,"Dec 16, 2020 00:47:15 PST"
item597376e4ae,Named Common Sailor Neptis hylas Butterfly in 75 mm Clear Square Lucite Slide,https://www.ebay.com/itm/384189260974?hash=item597376e4ae:g:1cIAAOSw6o9fgCRs,$12.99,"Hong Kong, Hong Kong",https://i.ebayimg.com/images/g/1cIAAOSw6o9fgCRs/s-l300.jpg,gaofudev,https://www.ebay.com/usr/gaofudev?_trksid=p2047675.l2559,Auction,0,0,1,"May 29, 2021 00:12:44 PDT"
item218a23eec8,Laminated Common Sailor Neptis hylas Butterfly Specimen in 110x110 mm sheet,https://www.ebay.com/itm/144051531464?hash=item218a23eec8:g:arkAAOxywqFTBDDZ,$9.99,"Hong Kong, Hong Kong",https://i.ebayimg.com/images/g/arkAAOxywqFTBDDZ/s-l300.jpg,gaofudev,https://www.ebay.com/usr/gaofudev?_trksid=p2047675.l2559,Auction,0,0,1,Unknown
item2173f3674c,Laminated Common Sailor Neptis hylas Butterfly Specimen in 110x110 mm sheet,https://www.ebay.com/itm/143679252300?hash=item2173f3674c:g:arkAAOxywqFTBDDZ,$10.00,"Hong Kong, Hong Kong",https://i.ebayimg.com/images/g/arkAAOxywqFTBDDZ/s-l300.jpg,gaofudev,https://www.ebay.com/usr/gaofudev?_trksid=p2047675.l2559,Instant,0,0,1,"Apr 15, 2021 01:58:12 PDT"
item218945bfa5,Named Common Sailor Neptis hylas Butterfly in 75 mm Clear Square Lucite Slide,https://www.ebay.com/itm/144036970405?hash=item218945bfa5:g:POYAAOSwEOJgm7Ne,$13.00,"Hong Kong, Hong Kong",https://i.ebayimg.com/images/g/POYAAOSwEOJgm7Ne/s-l300.jpg,gaofudev,https://www.ebay.com/usr/gaofudev?_trksid=p2047675.l2559,Instant,0,0,1,"May 28, 2021 23:59:39 PDT"
