id,title,link,price,origin,image,seller_name,seller_link,sell_type,num_bids,num_watchers,num_stock,date
item3b3fd133fc,Ambrax Swallowtail Butterfly Papilio ambrax lutosa Male Folded FAST FROM USA,https://www.ebay.com/itm/254473745404?hash=item3b3fd133fc:g:-U8AAOSwaLdaY2eg,$3.69,"Jupiter, Florida, United States",https://i.ebayimg.com/images/g/-U8AAOSwaLdaY2eg/s-l300.jpg,ynot601,https://www.ebay.com/usr/ynot601?_trksid=p2047675.l2559,Instant,0,0,7,"May 28, 2021 09:25:06 PDT"
item46a686a292,Papilio ambrax egipius *** times *** Australia (unmounted),https://www.ebay.com/itm/303441552018?hash=item46a686a292:g:xzcAAOSwWHhc8lyk,$36.42,"Miami Playa, Spain",https://i.ebayimg.com/images/g/xzcAAOSwWHhc8lyk/s-l300.jpg,homerus61,https://www.ebay.com/usr/homerus61?_trksid=p2047675.l2559,Instant,0,0,5,"Jan 03, 2021 09:24:25 PST"
item3d9a9d4967,Lot of 10 Ambrax Swallowtail Butterfly Papilio ambrax lutosa Male Folded FAST US,https://www.ebay.com/itm/264587004263?hash=item3d9a9d4967:g:-U8AAOSwaLdaY2eg,$27.99,"Jupiter, Florida, United States",https://i.ebayimg.com/images/g/-U8AAOSwaLdaY2eg/s-l300.jpg,ynot601,https://www.ebay.com/usr/ynot601?_trksid=p2047675.l2559,Instant,0,0,2,"May 28, 2021 09:24:50 PDT"
item3dbcc4ba36,Swallowtail Butterfly Papilio ambrax lutosa SET x1 A1- Arfak West Papua #j01,https://www.ebay.com/itm/265160014390?hash=item3dbcc4ba36:g:Sq4AAOSwjqtgnoyN,$12.69,"Sleaford, United Kingdom",https://i.ebayimg.com/images/g/Sq4AAOSwjqtgnoyN/s-l300.jpg,themothman35,https://www.ebay.com/usr/themothman35?_trksid=p2047675.l2559,Instant,0,0,1,"May 14, 2021 07:54:22 PDT"
item3dbcc4b1d4,Swallowtail Butterfly Papilio ambrax lutosa SET x1 A- Arfak West Papua #j01,https://www.ebay.com/itm/265160012244?hash=item3dbcc4b1d4:g:TxIAAOSwXptgnowG,$9.85,"Sleaford, United Kingdom",https://i.ebayimg.com/images/g/TxIAAOSwXptgnowG/s-l300.jpg,themothman35,https://www.ebay.com/usr/themothman35?_trksid=p2047675.l2559,Instant,0,0,3,"May 14, 2021 07:54:23 PDT"
item3ffb406f10,Swallowtail Butterfly Papilio ambrax lutosa SET x1 A1- Arfak West Papua #j01,https://www.ebay.com/itm/274798243600?hash=item3ffb406f10:g:Sq4AAOSwjqtgnoyN,$10.71,"Sleaford, United Kingdom",https://i.ebayimg.com/images/g/Sq4AAOSwjqtgnoyN/s-l300.jpg,themothman35,https://www.ebay.com/usr/themothman35?_trksid=p2047675.l2559,Instant,0,0,1,"May 15, 2021 19:18:05 PDT"
item3ffb406ef8,Swallowtail Butterfly Papilio ambrax lutosa SET x1 A- Arfak West Papua #j01,https://www.ebay.com/itm/274798243576?hash=item3ffb406ef8:g:TxIAAOSwXptgnowG,$8.32,"Sleaford, United Kingdom",https://i.ebayimg.com/images/g/TxIAAOSwXptgnowG/s-l300.jpg,themothman35,https://www.ebay.com/usr/themothman35?_trksid=p2047675.l2559,Instant,0,0,3,"May 15, 2021 19:18:04 PDT"
item46c3c3f69c,Real Insect/Butterfly/Moth Spread B7157 Rare Female Papilio ambrax P.N.G.,https://www.ebay.com/itm/303932110492?hash=item46c3c3f69c:g:82gAAOSwJ3JgWrco,$12.68,"Goolwa, South Australia, Australia",https://i.ebayimg.com/images/g/82gAAOSwJ3JgWrco/s-l300.jpg,uniquebutterfliesandinsects,https://www.ebay.com/usr/uniquebutterfliesandinsects?_trksid=p2047675.l2559,Instant,0,0,1,Unknown
item46c399560a,Real Butterfly/Insect/Moth Non Set B7146 Rare Female Papilio ambrax Papua N.G.,https://www.ebay.com/itm/303929316874?hash=item46c399560a:g:i70AAOSwxndgW7Vq,$8.83,"Goolwa, South Australia, Australia",https://i.ebayimg.com/images/g/i70AAOSwxndgW7Vq/s-l300.jpg,uniquebutterfliesandinsects,https://www.ebay.com/usr/uniquebutterfliesandinsects?_trksid=p2047675.l2559,Instant,0,0,2,"May 02, 2021 21:15:39 PDT"
