id,title,link,price,origin,image,seller_name,seller_link,sell_type,num_bids,num_watchers,num_stock,date
item23e46c78d6,Insect Butterfly Papilionidae Graphium ridleyanus-Rare Female Form!,https://www.ebay.com/itm/154156169430?hash=item23e46c78d6:g:lFEAAOSwy79fki5Z,$225.00,"Pincher Creek, Alberta, Canada",https://i.ebayimg.com/images/g/lFEAAOSwy79fki5Z/s-l300.jpg,wynlynwings,https://www.ebay.com/usr/wynlynwings?_trksid=p2047675.l2559,Instant,0,0,1,Unknown
item5b565f85eb,Graphium ridleyanus Female F. infuscatus * Central Africa *,https://www.ebay.com/itm/392291124715?hash=item5b565f85eb:g:PcYAAOSwowdczuDv,$194.90,"Netphen, Germany",https://i.ebayimg.com/images/g/PcYAAOSwowdczuDv/s-l300.jpg,insects-more-com,https://www.ebay.com/usr/insects-more-com?_trksid=p2047675.l2559,Instant,0,0,1,Unknown
item3dbd4c022b,# SIERRA LEONE - 1989 - Graphium ridleyanus - Butterfly Animal - MNH Stamp,https://www.ebay.com/itm/265168880171?hash=item3dbd4c022b:g:0fEAAOSwXJFapQtV,$1.11,"Fara Gera d'Adda, Italy",https://i.ebayimg.com/images/g/0fEAAOSwXJFapQtV/s-l300.jpg,volley95,https://www.ebay.com/usr/volley95?_trksid=p2047675.l2559,Auction,0,0,1,Unknown
item46bef9557d,Real Butterfly/Insect/Moth Non Set B6927 Rare Dark red Graphium ridleyanus,https://www.ebay.com/itm/303851722109?hash=item46bef9557d:g:kjcAAOSwRFNgCAOV,$4.20,"Goolwa, South Australia, Australia",https://i.ebayimg.com/images/g/kjcAAOSwRFNgCAOV/s-l300.jpg,uniquebutterfliesandinsects,https://www.ebay.com/usr/uniquebutterfliesandinsects?_trksid=p2047675.l2559,Instant,0,0,7,"Mar 20, 2021 19:58:15 PDT"
item4900951f47,Autocollant Sticker: Lèpre Journées des Lepreux: Papillon Graphium Ridleyanus 25,https://www.ebay.com/itm/313542385479?hash=item4900951f47:g:Oj0AAOSw8FhghsY5,$6.09,"Faimes, Belgium",https://i.ebayimg.com/images/g/Oj0AAOSw8FhghsY5/s-l300.jpg,coulili,https://www.ebay.com/usr/coulili?_trksid=p2047675.l2559,Auction,0,0,1,Unknown
item447cea0754,"Gambia 1991 MNH Imperf, Acraea Swordtail Graphium ridleyanus Butterflies Insects",https://www.ebay.com/itm/294153488212?hash=item447cea0754:g:tAMAAOSw05VgjVki,$3.50,"BHIWANDI, MAHARASHTRA, India",https://i.ebayimg.com/images/g/tAMAAOSw05VgjVki/s-l300.jpg,kamalmedicine,https://www.ebay.com/usr/kamalmedicine?_trksid=p2047675.l2559,Instant,0,0,1,"May 24, 2021 20:45:13 PDT"
item56dd112689,BURUNDI 1968 5f SG369 used FG NH Butterflies Graphium ridleyanus a1,https://www.ebay.com/itm/373076076169?hash=item56dd112689:g:SYwAAOSwPGNe23Vv,$1.69,"Peterborough, Cambridgeshire, United Kingdom",https://i.ebayimg.com/images/g/SYwAAOSwPGNe23Vv/s-l300.jpg,abyssmag2-12500,https://www.ebay.com/usr/abyssmag2-12500?_trksid=p2047675.l2559,Instant,0,0,1,"Feb 28, 2021 07:12:00 PST"
item56dd112933,BURUNDI 1968 1f SG363 used FG NH Butterflies Graphium ridleyanus a1,https://www.ebay.com/itm/373076076851?hash=item56dd112933:g:RSEAAOSw3iRe23Xx,$1.69,"Peterborough, Cambridgeshire, United Kingdom",https://i.ebayimg.com/images/g/RSEAAOSw3iRe23Xx/s-l300.jpg,abyssmag2-12500,https://www.ebay.com/usr/abyssmag2-12500?_trksid=p2047675.l2559,Instant,0,0,1,"Feb 28, 2021 07:11:59 PST"
item56dd111191,BURUNDI 1968 8f SG379 used FG NH Butterflies Graphium ridleyanus AIRMAIL a1,https://www.ebay.com/itm/373076070801?hash=item56dd111191:g:MTgAAOSwLSxe23LU,$1.69,"Peterborough, Cambridgeshire, United Kingdom",https://i.ebayimg.com/images/g/MTgAAOSwLSxe23LU/s-l300.jpg,abyssmag2-12500,https://www.ebay.com/usr/abyssmag2-12500?_trksid=p2047675.l2559,Instant,0,0,1,"Feb 28, 2021 07:11:59 PST"
