id,title,link,price,origin,image,seller_name,seller_link,sell_type,num_bids,num_watchers,num_stock,date
item343a03b570,UCWY25 A+/ A Nepheronia thalassina?? Butterfly  Butterflies,https://www.ebay.com/itm/224311620976?hash=item343a03b570:g:aqkAAOSw-OVf-zDa,$3.55,"Southport, North Carolina, United States",https://i.ebayimg.com/thumbs/images/g/aqkAAOSw-OVf-zDa/s-l225.jpg,budgetbutterfly,https://www.ebay.com/usr/budgetbutterfly?_trksid=p2047675.l2559,Instant,0,0,4,Unknown
item1a8482eb01,"LEPIDOPTERA, PIERIDAE, NEPHERONIA THALASSINA (male) from R.C.A.",https://www.ebay.com/itm/113892322049?hash=item1a8482eb01:g:cIIAAOSwKGRdgS1S,$2.68,"Santiago de Compostela (A Coruña), Spain",https://i.ebayimg.com/thumbs/images/g/cIIAAOSwKGRdgS1S/s-l225.jpg,insectpassion,https://www.ebay.com/usr/insectpassion?_trksid=p2047675.l2559,Instant,0,0,More than 10,"Dec 30, 2019 15:12:27 PST"
item3dc22f5e0e,"Unmounted Butterfly / Pieridae - Nepheronia thalassina, male, CAR",https://www.ebay.com/itm/265250889230?hash=item3dc22f5e0e:g:4NMAAOSww-JhCBVa,$2.16,"Sieraków Wielkopolski, Poland",https://i.ebayimg.com/thumbs/images/g/4NMAAOSww-JhCBVa/s-l225.jpg,butterfly-shade,https://www.ebay.com/usr/butterfly-shade?_trksid=p2047675.l2559,Instant,0,0,5,"Aug 27, 2021 07:17:17 PDT"
item46cedb5d6c,Insect/Butterfly/Moth Set Spread B7668 Rare Large Female Nepheronia thalassina,https://www.ebay.com/itm/304118193516?hash=item46cedb5d6c:g:kgUAAOSwcNZhJC-9,$8.35,"Goolwa, South Australia, Australia",https://i.ebayimg.com/thumbs/images/g/kgUAAOSwcNZhJC-9/s-l225.jpg,uniquebutterfliesandinsects,https://www.ebay.com/usr/uniquebutterfliesandinsects?_trksid=p2047675.l2559,Instant,0,0,1,Unknown
item4488e81f31,Insect/Butterfly/Moth Set Spread B7666 Rare Large Female Nepheronia thalassina,https://www.ebay.com/itm/294354689841?hash=item4488e81f31:g:EaMAAOSwyUZhJC8e,$7.62,"Goolwa, South Australia, Australia",https://i.ebayimg.com/thumbs/images/g/EaMAAOSwyUZhJC8e/s-l225.jpg,uniquebutterfliesandinsects,https://www.ebay.com/usr/uniquebutterfliesandinsects?_trksid=p2047675.l2559,Instant,0,0,1,Unknown
item1ce7fd7c1c,"LEPIDOPTERA, PIERIDAE, NEPHERONIA THALASSINA (male) from CAMEROON",https://www.ebay.com/itm/124151233564?hash=item1ce7fd7c1c:g:cIIAAOSwKGRdgS1S,$2.68,"Santiago de Compostela (A Coruña), Spain",https://i.ebayimg.com/thumbs/images/g/cIIAAOSwKGRdgS1S/s-l225.jpg,insectpassion,https://www.ebay.com/usr/insectpassion?_trksid=p2047675.l2559,Instant,0,0,2,Unknown
