id,title,link,image,price_sold,end_date,origin,seller_name,seller_link,sell_type,num_bids,num_sold,auction_end_date
item5949dc6439,Marpesia coresia VERSO REAL FRAMED WAITER BUTTERFLY BLACK WHITE PERU,https://www.ebay.com/itm/383491269689?hash=item5949dc6439:g:TakAAOSwc15eiUuX,https://i.ebayimg.com/thumbs/images/g/TakAAOSwc15eiUuX/s-l225.jpg,$26.00,Jan-27 20:25,"Sahuarita, Arizona, United States",Unknown,Unknown,Instant,0,18,
item342b787804,Marpesia coresia REAL BUTTERFLY BLACK BROWN PERU UNMOUNTED WINGS CLOSED Recto,https://www.ebay.com/itm/224067614724?hash=item342b787804:g:jNQAAOSwqsZe~~Hu,https://i.ebayimg.com/thumbs/images/g/jNQAAOSwqsZe~~Hu/s-l225.jpg,$6.00,Jan-27 07:27,"Sahuarita, Arizona, United States",Unknown,Unknown,Instant,0,6,
item5929875ecc,Marpesia coresia VERSO REAL BUTTERFLY BLACK WHITE PERU UNMOUNTED WINGS CLOSED,https://www.ebay.com/itm/382948826828?hash=item5929875ecc:g:zXUAAOSwN5Fc16kd,https://i.ebayimg.com/thumbs/images/g/zXUAAOSwN5Fc16kd/s-l225.jpg,$6.00,Jan-27 07:27,"Sahuarita, Arizona, United States",Unknown,Unknown,Instant,0,28,
item5de8c76fa9,"Butterflie Marpesia coresia from Morelos, Mexico",https://www.ebay.com/itm/403337342889?hash=item5de8c76fa9:g:hzIAAOSwfjJhrIrm,https://i.ebayimg.com/thumbs/images/g/hzIAAOSwfjJhrIrm/s-l225.jpg,$1.90,Dec-12 14:02,"Madrid, Spain",spainbutterflies,https://www.ebay.com/usr/spainbutterflies?_trksid=p2047675.l2559,Auction,1,1,"Dec 12, 2021

14:02:10 PST"
