id,title,link,image,price_sold,end_date,origin,seller_name,seller_link,sell_type,num_bids,num_sold,auction_end_date
item33f04912a9,Morpho cacica ONE REAL BUTTERFLY BLUE MALE UNMOUNTED WINGS CLOSED,https://www.ebay.com/itm/223074652841?hash=item33f04912a9:g:oUgAAOSwIBxc2kJf,https://i.ebayimg.com/thumbs/images/g/oUgAAOSwIBxc2kJf/s-l225.jpg,$30.00,Feb-28 08:06,"Sahuarita, Arizona, United States",Unknown,Unknown,Instant,0,33,
item2afa328719,2 REAL FRAMED BUTTERFLY BLUE MORPHO CACICA & M.ZEPHYRITIS  MOUNTED DOUBLE GLASS,https://www.ebay.com/itm/184586241817?hash=item2afa328719:g:jZsAAOSwOMxf3V~f,https://i.ebayimg.com/thumbs/images/g/jZsAAOSwOMxf3V~f/s-l225.jpg,$119.99,Feb-17 09:52,"Miami, Florida, United States",eduentomology,https://www.ebay.com/usr/eduentomology?_trksid=p2047675.l2559,Instant,0,1,
item54aefc9a92,5 Morpho cacica in A1 condition,https://www.ebay.com/itm/363713043090?hash=item54aefc9a92:g:P2kAAOSwDgNh-xxh,https://i.ebayimg.com/thumbs/images/g/P2kAAOSwDgNh-xxh/s-l225.jpg,$137.50,Feb-07 17:36,"Delray Beach, Florida, United States",jeffleon4791gc,https://www.ebay.com/usr/jeffleon4791gc?_trksid=p2047675.l2559,Auction,8,1,"Feb 07, 2022

17:36:00 PST"
item4244710a12,1 Morpho Cacica Female in A1 condition,https://www.ebay.com/itm/284616100370?hash=item4244710a12:g:wfcAAOSw5Hlh6Gfh,https://i.ebayimg.com/thumbs/images/g/wfcAAOSw5Hlh6Gfh/s-l225.jpg,$61.00,Jan-24 17:24,"Delray Beach, Florida, United States",jeffleon4791gc,https://www.ebay.com/usr/jeffleon4791gc?_trksid=p2047675.l2559,Auction,7,1,"Jan 24, 2022

17:24:36 PST"
item33f049101d,Morpho cacica REAL FRAMED BUTTERFLY BLUE PERU,https://www.ebay.com/itm/223074652189?hash=item33f049101d:g:l7sAAOSw8tZbV83f,https://i.ebayimg.com/thumbs/images/g/l7sAAOSw8tZbV83f/s-l225.jpg,$48.00,Dec-24 20:51,"Sahuarita, Arizona, United States",Unknown,Unknown,Instant,0,18,
