id,title,link,image,price_sold,end_date,origin,seller_name,seller_link,sell_type,num_bids,num_sold,auction_end_date
item33ec7fad8d,Hamadryas amphinome REAL FRAMED BUTTERFLY BLUE WHITE PERU,https://www.ebay.com/itm/223011122573?hash=item33ec7fad8d:g:hSAAAOSwHvpbGymB,https://i.ebayimg.com/thumbs/images/g/hSAAAOSwHvpbGymB/s-l225.jpg,$34.00,Feb-17 07:17,"Sahuarita, Arizona, United States",Unknown,Unknown,Instant,0,53,
item5dee1ddcbd,"Butterflie Hamadryas amphinome diasia from Dominican Republic,Caribean",https://www.ebay.com/itm/403426892989?hash=item5dee1ddcbd:g:2xwAAOSwVidh7aR5,https://i.ebayimg.com/thumbs/images/g/2xwAAOSwVidh7aR5/s-l225.jpg,$4.25,Jan-30 13:43,"Madrid, Spain",spainbutterflies,https://www.ebay.com/usr/spainbutterflies?_trksid=p2047675.l2559,Auction,4,1,"Jan 30, 2022

13:43:32 PST"
item2ad0c9b18f,10 BUTTERFLIES MIX MONARCH DANAUS PLEXIPPUS & HAMADRYAS AMPHINOME WINGS CLOSED,https://www.ebay.com/itm/183891505551?hash=item2ad0c9b18f:g:nOoAAOSwlbZdMoNl,https://i.ebayimg.com/thumbs/images/g/nOoAAOSwlbZdMoNl/s-l225.jpg,$40.00,Jan-29 23:45,"Miami, Florida, United States",Unknown,Unknown,Instant,0,11,
item3456af75af,HAMADRYAS AMPHINOME MEXICANA MALE | VERACRUZ MEX | AS PICTURED | 21-215,https://www.ebay.com/itm/224792638895?hash=item3456af75af:g:foMAAOSwOTNg6jGi,https://i.ebayimg.com/thumbs/images/g/foMAAOSwOTNg6jGi/s-l225.jpg,$4.28,Jan-23 11:22,"Oldbury, United Kingdom",multicaudata,https://www.ebay.com/usr/multicaudata?_trksid=p2047675.l2559,Auction,3,1,"Jan 23, 2022

11:22:25 PST"
item33de46e475,Hamadryas amphinome ONE REAL BUTTERFLY BLUE WHITE PERU UNMOUNTED WINGS CLOSED,https://www.ebay.com/itm/222772520053?hash=item33de46e475:g:SC8AAOSwy8BfB97U,https://i.ebayimg.com/thumbs/images/g/SC8AAOSwy8BfB97U/s-l225.jpg,$14.00,Jan-20 21:29,"Sahuarita, Arizona, United States",Unknown,Unknown,Instant,0,179,
item345556a58f,HAMADRYAS AMPHINOME MEXICANA MALE | VERACRUZ MEX | AS PICTURED | 21-215,https://www.ebay.com/itm/224770041231?hash=item345556a58f:g:foMAAOSwOTNg6jGi,https://i.ebayimg.com/thumbs/images/g/foMAAOSwOTNg6jGi/s-l225.jpg,$4.29,Jan-09 11:41,"Oldbury, United Kingdom",multicaudata,https://www.ebay.com/usr/multicaudata?_trksid=p2047675.l2559,Auction,4,1,"Jan 09, 2022

11:41:39 PST"
item2d24d811ba,Hamadryas amphinome Butterfly Taxidermy REAL Insect (Unmounted),https://www.ebay.com/itm/193891668410?hash=item2d24d811ba:g:CBQAAOSw655gKIGw,https://i.ebayimg.com/thumbs/images/g/CBQAAOSw655gKIGw/s-l225.jpg,$9.75,Dec-26 20:31,"Sainte-Brigitte-de-Laval, Quebec, Canada",Unknown,Unknown,Instant,0,16,
item33e1689047,Hamadryas amphinome verso ONE REAL BUTTERFLY RED PERU WINGS CLOSED,https://www.ebay.com/itm/222825058375?hash=item33e1689047:g:3YEAAOSwN21chbiY,https://i.ebayimg.com/thumbs/images/g/3YEAAOSwN21chbiY/s-l225.jpg,$14.00,Dec-16 18:53,"Sahuarita, Arizona, United States",Unknown,Unknown,Instant,0,88,
item5de8b6093f,"Butterflie Hamadryas amphinome mexicana from Guerrero, Oaxaca, Mexico",https://www.ebay.com/itm/403336202559?hash=item5de8b6093f:g:ssMAAOSw2oVhq64X,https://i.ebayimg.com/thumbs/images/g/ssMAAOSw2oVhq64X/s-l225.jpg,$6.50,Dec-12 14:12,"Madrid, Spain",spainbutterflies,https://www.ebay.com/usr/spainbutterflies?_trksid=p2047675.l2559,Auction,5,1,"Dec 12, 2021

14:12:24 PST"
