id,title,link,image,price_sold,end_date,origin,seller_name,seller_link,sell_type,num_bids,num_sold,auction_end_date
item1a9125c76f,"Antonovka Apple (Malus pumila Antonovka), 20 seeds",https://www.ebay.com/itm/114104321903?hash=item1a9125c76f:g:2e8AAOSwGENe0Xue,https://i.ebayimg.com/thumbs/images/g/2e8AAOSwGENe0Xue/s-l225.jpg,$2.80,Feb-26 16:57,"Allentown, Pennsylvania, United States",Unknown,Unknown,Instant,0,120,
item56f5f7124e,"15 Crabapple Tree Seeds (Malus Pumila Var) Crab Apple Flowering Fruit, FREE SHIP",https://www.ebay.com/itm/373493797454?hash=item56f5f7124e:g:TL0AAOSwcMNgSu85,https://i.ebayimg.com/thumbs/images/g/TL0AAOSwcMNgSu85/s-l225.jpg,$5.99,Feb-26 15:10,"Saint Augustine, Florida, United States",Unknown,Unknown,Instant,0,80,
item58bfea8166,Malus pumila DWARF APPLE TREE Seeds!,https://www.ebay.com/itm/381176938854?hash=item58bfea8166:g:7MAAAOxyjP1R0POW,https://i.ebayimg.com/thumbs/images/g/7MAAAOxyjP1R0POW/s-l225.jpg,$4.99,Feb-24 19:05,"Walterboro, South Carolina, United States",Unknown,Unknown,Instant,0,38,
item288a52a3b0,Antonovka Apple (Malus pumila var. antonovka) 50 seeds,https://www.ebay.com/itm/174119363504?hash=item288a52a3b0:g:oFYAAOSwUEFd7ODU,https://i.ebayimg.com/thumbs/images/g/oFYAAOSwUEFd7ODU/s-l225.jpg,$5.90,Dec-06 12:14,Unknown,Unknown,Unknown,Instant,0,1,
item3687f8be43,GRANNY SMITH Apple Tree Seeds x25 Malus Pumila Sylvestris Green Acid variant,https://www.ebay.com/itm/234209459779?hash=item3687f8be43:g:TUAAAOSwPKNgSdBH,https://i.ebayimg.com/thumbs/images/g/TUAAAOSwPKNgSdBH/s-l225.jpg,$3.99,Dec-02 05:07,"Valletta, Malta, European Union, Malta",Unknown,Unknown,Instant,0,3,
