id,title,link,image,price_sold,end_date,origin,seller_name,seller_link,sell_type,num_bids,num_sold,auction_end_date
item23d840882c,Pea Extract Powder 75% Pea Peptide (Pisum Sativum) Anti-aging Cosmetics,https://www.ebay.com/itm/153951963180?hash=item23d840882c:g:UucAAOSwamZe0QEn,https://i.ebayimg.com/thumbs/images/g/UucAAOSwamZe0QEn/s-l225.jpg,$10.40 to $132.67,Feb-28 08:20,"Bahadurgarh, HARYANA, India",Unknown,Unknown,Instant,0,4,
item4d464c8327,50 MAMMOTH MELTING SUGAR PEA Stringless Snow Pea Pisum Sativum Vegetable Seeds,https://www.ebay.com/itm/331891901223?hash=item4d464c8327:g:waIAAOSwNuxXb2mu,https://i.ebayimg.com/thumbs/images/g/waIAAOSwNuxXb2mu/s-l225.jpg,$3.00,Feb-24 14:14,"Massillon, Ohio, United States",Unknown,Unknown,Instant,0,113,
item56fdcb0a3b,Peas (Pisum sativum) Garden Pea Chromo-lithograph from 1891 Pea,https://www.ebay.com/itm/373625129531?hash=item56fdcb0a3b:g:ztIAAOSwGbtg0x9G,https://i.ebayimg.com/thumbs/images/g/ztIAAOSwGbtg0x9G/s-l225.jpg,$7.86,Feb-22 08:51,"Kassel, Germany",005bond,https://www.ebay.com/usr/005bond?_trksid=p2047675.l2559,Instant,0,1,
item3dba19ac28,Pea Extract Powder 75% Pea Peptide (Pisum Sativum) Anti-aging Cosmetics 200g,https://www.ebay.com/itm/265115249704?hash=item3dba19ac28:g:3wIAAOSwCudf2DOl,https://i.ebayimg.com/thumbs/images/g/3wIAAOSwCudf2DOl/s-l225.jpg,$29.00,Feb-21 09:01,"Zhengzhou, China",Unknown,Unknown,Instant,0,3,
item400c9aa672,Pea - Snow Pea - Oregon Sugar Pod 2 (pisum sativum)  5/10/20/40 Seeds,https://www.ebay.com/itm/275089368690?hash=item400c9aa672:g:H50AAOSwfUBh09F3,https://i.ebayimg.com/thumbs/images/g/H50AAOSwfUBh09F3/s-l225.jpg,$0.78 to $2.59,Feb-18 07:56,"Hunter River, PE, Canada",Unknown,Unknown,Instant,0,1,
item3426b7a582,50 SUGAR ANN PEA Stringless Sweet Green Snap Pisum Sativum Vegetable Seeds,https://www.ebay.com/itm/223987869058?hash=item3426b7a582:g:l5sAAOSwM4xXb2qy,https://i.ebayimg.com/thumbs/images/g/l5sAAOSwM4xXb2qy/s-l225.jpg,$3.00,Feb-12 10:47,"Massillon, Ohio, United States",Unknown,Unknown,Instant,0,76,
item26549bd281,THOMAS LAXTON ENGLISH GARDEN PEA  (Pisum sativum) - 30 SEEDS - Non-GMO,https://www.ebay.com/itm/164628255361?hash=item26549bd281:g:zmEAAOSwnQhf9QXH,https://i.ebayimg.com/thumbs/images/g/zmEAAOSwnQhf9QXH/s-l225.jpg,$1.25,Feb-08 09:26,"Bossier City, Louisiana, United States",Unknown,Unknown,Instant,0,5,
item5baabfbfe3,Whole Dried 100% Natural Green Peas Pisum Sativum Free Shipping New,https://www.ebay.com/itm/393706717155?hash=item5baabfbfe3:g:PWEAAOSwyrthlU4M,https://i.ebayimg.com/thumbs/images/g/PWEAAOSwyrthlU4M/s-l225.jpg,$6.95 to $15.50,Feb-05 19:01,"Matale, Sri Lanka",Unknown,Unknown,Instant,0,1,
item48f93570ef,"Dry Peas Green, dry pisum sativum, 100% AYURVEDIC NATURAL Dry Peas Green, Free W",https://www.ebay.com/itm/313418674415?hash=item48f93570ef:g:DYIAAOSwappgKK3V,https://i.ebayimg.com/thumbs/images/g/DYIAAOSwappgKK3V/s-l225.jpg,$9.99 to $24.99,Feb-02 20:21,"Kurukshetra, Haryana, India",Unknown,Unknown,Instant,0,3,
item460393eb44,50 SNOW PEA Pisum Sativum Vegetable Legume Pod Pea Seeds *Flat Shipping,https://www.ebay.com/itm/300707736388?hash=item460393eb44:g:br4AAOxyKsZR0P85,https://i.ebayimg.com/thumbs/images/g/br4AAOxyKsZR0P85/s-l225.jpg,$3.00,Jan-26 21:30,"Massillon, Ohio, United States",Unknown,Unknown,Instant,0,"1,100",
item4d45a509cc,50 EARLY FROSTY GARDEN PEA English Shelling Pisum Sativum Vegetable Seeds,https://www.ebay.com/itm/331880925644?hash=item4d45a509cc:g:m~4AAOSw3YNXXxJ8,https://i.ebayimg.com/thumbs/images/g/m~4AAOSw3YNXXxJ8/s-l225.jpg,$3.00,Jan-12 06:55,"Massillon, Ohio, United States",Unknown,Unknown,Instant,0,55,
item3fdf33cbdd,50 SUPER SUGAR SNAP PEA Pisum Sativum Vegetable Legume Seeds *Flat Shipping,https://www.ebay.com/itm/274327653341?hash=item3fdf33cbdd:g:zOsAAOSwzlNZhRN6,https://i.ebayimg.com/thumbs/images/g/zOsAAOSwzlNZhRN6/s-l225.jpg,$3.00,Dec-31 12:51,"Massillon, Ohio, United States",Unknown,Unknown,Instant,0,42,
item1f2cf5dcd7,Pisum Sativum-Pea Garden Pea Thome Chromo-lithograph 1886,https://www.ebay.com/itm/133898296535?hash=item1f2cf5dcd7:g:rJEAAOSwKFNd87pU,https://i.ebayimg.com/thumbs/images/g/rJEAAOSwKFNd87pU/s-l225.jpg,$14.04,Dec-19 05:09,"Kassel, Germany",005bond,https://www.ebay.com/usr/005bond?_trksid=p2047675.l2559,Instant,0,1,
