id,title,link,image,price_sold,end_date,origin,seller_name,seller_link,sell_type,num_bids,num_sold,auction_end_date
item1f3495941f,Dictamnus ALBUS fraxinella-Copperplate Iron Berger Blackwell-Graduate - 1757,https://www.ebay.com/itm/134026204191?hash=item1f3495941f:g:CG0AAOSwP~diDM62,https://i.ebayimg.com/thumbs/images/g/CG0AAOSwP~diDM62/s-l225.jpg,$21.21,Mar-01 09:12,"75172 Pforzheim, Germany",goedeke,https://www.ebay.com/usr/goedeke?_trksid=p2047675.l2559,Auction,7,1,"Mar 01, 2022

09:12:14 PST"
item46501ceb9b,10 RED GAS PLANT Fragrant Fire Plant Dictamnus Albus Ruber Flower Seeds *CombS/H,https://www.ebay.com/itm/301991783323?hash=item46501ceb9b:g:kXIAAOSwepJXaMqp,https://i.ebayimg.com/thumbs/images/g/kXIAAOSwepJXaMqp/s-l225.jpg,$3.00,Feb-21 08:19,"Massillon, Ohio, United States",Unknown,Unknown,Instant,0,137,
item342662307f,"Bai Xian Pi (Dictamnus albus) Tincture, Dried Roots Liquid Extract",https://www.ebay.com/itm/223982268543?hash=item342662307f:g:~GUAAOSwK31em~Vb,https://i.ebayimg.com/thumbs/images/g/~GUAAOSwK31em~Vb/s-l225.jpg,$27.95 to $299.95,Feb-13 08:28,"Honolulu, Hawaii, United States",Unknown,Unknown,Instant,0,3,
item46501cf26a,10 GAS PLANT MIXED COLORS Dictamnus Albus Mix White Red Pink Lilac Flower Seeds,https://www.ebay.com/itm/301991785066?hash=item46501cf26a:g:JbQAAOSwjXRXaNeI,https://i.ebayimg.com/thumbs/images/g/JbQAAOSwjXRXaNeI/s-l225.jpg,$3.00,Feb-13 08:21,"Massillon, Ohio, United States",Unknown,Unknown,Instant,0,120,
