id,title,link,image,price_sold,end_date,origin,seller_name,seller_link,sell_type,num_bids,num_sold,auction_end_date
item342b982b50,Atrophaneura semperi male REAL FRAMED BUTTERFLY RED PINK PHILIPPINES,https://www.ebay.com/itm/224069692240?hash=item342b982b50:g:oOwAAOSwqzlfApXL,https://i.ebayimg.com/thumbs/images/g/oOwAAOSwqzlfApXL/s-l225.jpg,$42.00,Feb-28 07:22,"Sahuarita, Arizona, United States",Unknown,Unknown,Instant,0,6,
item1cc29daf86,ATROPHANEURA SEMPERI APHTONIA - unmounted FEMALE,https://www.ebay.com/itm/123524198278?hash=item1cc29daf86:g:YPsAAOSws2RcBT7j,https://i.ebayimg.com/thumbs/images/g/YPsAAOSws2RcBT7j/s-l225.jpg,$28.99,Feb-19 06:58,"Salzburg, Austria",Unknown,Unknown,Instant,0,1,
item590877a00b,Atrophaneura semperi male verso REAL FRAMED BUTTERFLY PINK RED,https://www.ebay.com/itm/382394146827?hash=item590877a00b:g:RH0AAOSwpFlaRa0r,https://i.ebayimg.com/thumbs/images/g/RH0AAOSwpFlaRa0r/s-l225.jpg,$42.00,Jan-30 12:13,"Sahuarita, Arizona, United States",Unknown,Unknown,Instant,0,13,
item59147e5e32,Atrophaneura semperi male ONE REAL BUTTERFLY PINK RED UNMOUNTED WINGS CLOSED,https://www.ebay.com/itm/382595915314?hash=item59147e5e32:g:d1QAAOSw1lxchHju,https://i.ebayimg.com/thumbs/images/g/d1QAAOSw1lxchHju/s-l225.jpg,$22.00,Jan-03 16:51,"Sahuarita, Arizona, United States",Unknown,Unknown,Instant,0,9,
item4009e09d9f,Lepidoptera - Papilionidae - Atrophaneura semperi supernotatus - Leyte Is,https://www.ebay.com/itm/275043622303?hash=item4009e09d9f:g:PwUAAOSwLv1holNP,https://i.ebayimg.com/thumbs/images/g/PwUAAOSwLv1holNP/s-l225.jpg,$12.75,Dec-05 11:56,"South Shields, United Kingdom",0191stanhope,https://www.ebay.com/usr/0191stanhope?_trksid=p2047675.l2559,Auction,10,1,"Dec 05, 2021

11:56:28 PST"
