id,title,link,image,price_sold,end_date,origin,seller_name,seller_link,sell_type,num_bids,num_sold,auction_end_date
item3dd3eab1c2,"Eurytides marcellus, 2nd generation, male, Virginia; Papilionidae",https://www.ebay.com/itm/265548378562?hash=item3dd3eab1c2:g:YvAAAOSwfrVh~f9H,https://i.ebayimg.com/thumbs/images/g/YvAAAOSwfrVh~f9H/s-l225.jpg,$6.00,Feb-20 12:48,"Washington, District Of Columbia, United States",kershawi,https://www.ebay.com/usr/kershawi?_trksid=p2047675.l2559,Auction,1,1,"Feb 20, 2022

12:48:15 PST"
item1d1ec0ae57,Zebra Swallowtail Butterfly Eurytides marcellus Papiliondae Southeast Texas L227,https://www.ebay.com/itm/125069995607?hash=item1d1ec0ae57:g:W2IAAOSwNk5hx9D8,https://i.ebayimg.com/thumbs/images/g/W2IAAOSwNk5hx9D8/s-l225.jpg,$12.85,Jan-10 19:49,"Houston, Texas, United States",txentosupply,https://www.ebay.com/usr/txentosupply?_trksid=p2047675.l2559,Auction,3,1,"Jan 10, 2022

19:49:57 PST"
item5920aeeb18,Eurytides marcellus zebra swallowtail black white butterfly USA framed,https://www.ebay.com/itm/382800423704?hash=item5920aeeb18:g:ftkAAOSw96VgunRz,https://i.ebayimg.com/thumbs/images/g/ftkAAOSw96VgunRz/s-l225.jpg,$28.00,Dec-06 19:09,"Sahuarita, Arizona, United States",Unknown,Unknown,Instant,0,17,
