id,title,link,image,price_sold,end_date,origin,seller_name,seller_link,sell_type,num_bids,num_sold,auction_end_date
item4b5c8d7f8b,Alfalfa- Medicago Sativa- 500 Seeds- BOGO 50% off SALE,https://www.ebay.com/itm/323675324299?hash=item4b5c8d7f8b:g:nu4AAOSwSI5bYg-D,https://i.ebayimg.com/thumbs/images/g/nu4AAOSwSI5bYg-D/s-l225.jpg,$2.99,Feb-28 21:21,"Lakemore, Ohio, United States",Unknown,Unknown,Instant,0,305,
item1f2e0d6ef4,1000 ALFALFA SEEDS MEDICAGO SATIVA MICROGREENS SPROUTING GREENS JUICING HEIRLOOM,https://www.ebay.com/itm/133916618484?hash=item1f2e0d6ef4:g:DdQAAOSw7x1hiF4Q,https://i.ebayimg.com/thumbs/images/g/DdQAAOSw7x1hiF4Q/s-l225.jpg,$2.99,Feb-26 18:32,"Greenville, Michigan, United States",Unknown,Unknown,Instant,0,30,
item5df256dbd6,1000 Alfalfa Seeds Medicago Sativa Garden Flowers HEIRLOOM,https://www.ebay.com/itm/403497737174?hash=item5df256dbd6:g:03gAAOSwujRiF9wM,https://i.ebayimg.com/thumbs/images/g/03gAAOSwujRiF9wM/s-l225.jpg,$2.99,Feb-26 04:05,"NanJing, China",Unknown,Unknown,Instant,0,3,
item5492101224,[DI LIQUID] Medicago Sativa Cleanse & Remove Toxins from the Body Liquid 500 ml,https://www.ebay.com/itm/363227779620?hash=item5492101224:g:~7AAAOSwaFlf3v13,https://i.ebayimg.com/thumbs/images/g/~7AAAOSwaFlf3v13/s-l225.jpg,$35.20,Feb-23 12:55,"Jakarta Selatan, Indonesia",Unknown,Unknown,Instant,0,2,
item28b8ae51b6,[K-LINK] Medicago Sativa Chlorofil Herbal Drink Eye Lung Digestive Support 500ml,https://www.ebay.com/itm/174897123766?hash=item28b8ae51b6:g:cmAAAOSwN2xhHJFB,https://i.ebayimg.com/thumbs/images/g/cmAAAOSwN2xhHJFB/s-l225.jpg,$41.42,Feb-23 06:56,"Jakarta, Indonesia",Unknown,Unknown,Instant,0,1,
item3676c6abf8,"The luzernebau and its revival (Medicago sativa), 1910 Berlin",https://www.ebay.com/itm/233920965624?hash=item3676c6abf8:g:J38AAOSw~91bkMYH,https://i.ebayimg.com/thumbs/images/g/J38AAOSw~91bkMYH/s-l225.jpg,$22.41,Feb-22 05:14,"Burgstädt, Germany",don-knarf,https://www.ebay.com/usr/don-knarf?_trksid=p2047675.l2559,Instant,0,1,
item4231361c06,100 Alfalfa Sprout Seeds Medicago Sativa Organic Non gmo Usa Micro Greens Easy,https://www.ebay.com/itm/284293471238?hash=item4231361c06:g:ieEAAOSwWeFgnZLv,https://i.ebayimg.com/thumbs/images/g/ieEAAOSwWeFgnZLv/s-l225.jpg,$3.99,Feb-17 17:51,"Copperas Cove, Texas, United States",Unknown,Unknown,Instant,0,12,
item4234897544,"Organic Alfalfa Leaf, Powder (Medicago sativa)",https://www.ebay.com/itm/284349265220?hash=item4234897544:g:G1AAAOSwhRJg2HyC,https://i.ebayimg.com/thumbs/images/g/G1AAAOSwhRJg2HyC/s-l225.jpg,$6.95 to $30.95,Feb-16 15:10,"Land O' Lakes, Florida, United States",Unknown,Unknown,Instant,0,18,
item4246041be0,Medicago Sativa Alfalfa 4 Fluid Ounces / Herb Pharm Exp: 11/2024,https://www.ebay.com/itm/284642515936?hash=item4246041be0:g:r50AAOSw3HphVobg,https://i.ebayimg.com/thumbs/images/g/r50AAOSw3HphVobg/s-l225.jpg,$16.99,Feb-13 18:23,"Omaha, Nebraska, United States",omgstores,https://www.ebay.com/usr/omgstores?_trksid=p2047675.l2559,Instant,0,1,
item2b22537b7d,Alfalfa Tea Cut Sifted (Medicago sativa 1 2 4 5 8 10 12 oz ounce lb pound),https://www.ebay.com/itm/185259490173?hash=item2b22537b7d:g:pGYAAOSwjOhh5LiG,https://i.ebayimg.com/thumbs/images/g/pGYAAOSwjOhh5LiG/s-l225.jpg,$2.99 to $41.99,Feb-13 17:41,"Lacey, Washington, United States",Unknown,Unknown,Instant,0,1,
item289da62d59,ALFALFA DRIED HERB Organic Aus Grown (Medicago sativa)  ALFALFA LOOSE LEAF TEA,https://www.ebay.com/itm/174443605337?hash=item289da62d59:g:~3QAAOSwyjlfgs0w,https://i.ebayimg.com/thumbs/images/g/~3QAAOSwyjlfgs0w/s-l225.jpg,$10.88 to $24.67,Feb-08 18:50,"Bowral, New South Wales, Australia",Unknown,Unknown,Instant,0,3,
item3dbe63eb3e,Dried Herbs: Alfalfa Leaf - Medicago sativa  250g.,https://www.ebay.com/itm/265187224382?hash=item3dbe63eb3e:g:bu8AAOSwYlJW34x1,https://i.ebayimg.com/thumbs/images/g/bu8AAOSwYlJW34x1/s-l225.jpg,$19.19,Feb-07 08:42,"Victoria Point, QLD, Australia",Unknown,Unknown,Instant,0,2,
item46116c6c6a,2000 ALFALFA Medicago Sativa Flower Seeds Ground Cover,https://www.ebay.com/itm/300940029034?hash=item46116c6c6a:g:Ho4AAOxy-gBR84Ru,https://i.ebayimg.com/thumbs/images/g/Ho4AAOxy-gBR84Ru/s-l225.jpg,$3.00,Feb-07 05:58,"Massillon, Ohio, United States",Unknown,Unknown,Instant,0,705,
item3ffe34383c,"Organic Alfalfa Leaf, c/s (Medicago sativa)",https://www.ebay.com/itm/274847774780?hash=item3ffe34383c:g:0o8AAOSwVSBg2HxA,https://i.ebayimg.com/thumbs/images/g/0o8AAOSwVSBg2HxA/s-l225.jpg,$6.95 to $28.95,Feb-02 18:32,"Land O' Lakes, Florida, United States",Unknown,Unknown,Instant,0,12,
item3429e55061,Alfalfa Leaf (Medicago sativa) - 1 oz Dried,https://www.ebay.com/itm/224041193569?hash=item3429e55061:g:jIUAAOSwrQVhyQwF,https://i.ebayimg.com/thumbs/images/g/jIUAAOSwrQVhyQwF/s-l225.jpg,$6.00,Feb-02 11:01,"Idaho Falls, Idaho, United States",Unknown,Unknown,Instant,0,59,
item23cfb0e450,Bulk 400 Gram Dried Organic Alfalfa - Medicago sativa - Dried Herb - Free Post,https://www.ebay.com/itm/153808331856?hash=item23cfb0e450:g:gTUAAOSwh~peK7lf,https://i.ebayimg.com/thumbs/images/g/gTUAAOSwh~peK7lf/s-l225.jpg,$24.31,Feb-01 13:57,"Malvern, Melbourne, VIC, Australia",Unknown,Unknown,Instant,0,1,
item36905f1695,1902 Medicago Sativa Common Lucerne Botanical Print Hand Colour (SL334),https://www.ebay.com/itm/234350384789?hash=item36905f1695:g:nsoAAOSwFKJeuwIR,https://i.ebayimg.com/thumbs/images/g/nsoAAOSwFKJeuwIR/s-l225.jpg,$10.73,Jan-22 15:21,"United Kingdom, United Kingdom",antiquepapercompany,https://www.ebay.com/usr/antiquepapercompany?_trksid=p2047675.l2559,Instant,0,1,
item4b7057e707,Organic Alfalfa Pure Sprout Powder Superfood 300g-2kg - Medicago Sativa,https://www.ebay.com/itm/324007356167?hash=item4b7057e707:g:WicAAOSwE3pd7lXo,https://i.ebayimg.com/thumbs/images/g/WicAAOSwE3pd7lXo/s-l225.jpg,$24.55 to $100.23,Jan-21 17:42,"Internet only, Greece",Unknown,Unknown,Instant,0,3,
item570520626b,"Alfalfa Tablets, Medicago sativa, 500mg x 120 Tablets",https://www.ebay.com/itm/373748163179?hash=item570520626b:g:wgwAAOSw0x1hXh9A,https://i.ebayimg.com/thumbs/images/g/wgwAAOSw0x1hXh9A/s-l225.jpg,$16.65,Jan-17 14:11,"Malvern, Australia",Unknown,Unknown,Instant,0,6,
item344399166e,Alfalfa hojas 1 LIBRA Medicago sativa Hierbas Alfalfa Leaves 16 oz Herbs,https://www.ebay.com/itm/224472405614?hash=item344399166e:g:KtEAAOSwwPRgq0HT,https://i.ebayimg.com/thumbs/images/g/KtEAAOSwwPRgq0HT/s-l225.jpg,$29.99,Jan-16 22:31,"California, United States",Unknown,Unknown,Instant,0,2,
item4d5968d511,"HerbEra Alfalfa Alcohol-FREE Herbal Extract, Organic(Medicago Sativa)",https://www.ebay.com/itm/332212524305?hash=item4d5968d511:g:UboAAOSwUltgP5yk,https://i.ebayimg.com/thumbs/images/g/UboAAOSwUltgP5yk/s-l225.jpg,$21.97 to $62.99,Jan-05 20:40,"Las Vegas, Nevada, United States",Unknown,Unknown,Instant,0,2,
item343d371d7e,Organic Alfalfa Pure Powder Superfood 25g-200g - Medicago sativa,https://www.ebay.com/itm/224365321598?hash=item343d371d7e:g:xy4AAOSwH4VgN9F1,https://i.ebayimg.com/thumbs/images/g/xy4AAOSwH4VgN9F1/s-l225.jpg,$9.27 to $17.52,Dec-31 03:37,"Patras, Greece",Unknown,Unknown,Instant,0,2,
item341ace0e57,Organic Alfalfa Pure Sprout Powder Superfood 25g-200g - Medicago Sativa,https://www.ebay.com/itm/223788011095?hash=item341ace0e57:g:WicAAOSwE3pd7lXo,https://i.ebayimg.com/thumbs/images/g/WicAAOSwE3pd7lXo/s-l225.jpg,$7.98 to $20.73,Dec-28 17:59,"Internet only, Greece",Unknown,Unknown,Instant,0,14,
item4aff406b32,Alfalfa Herb Capsules (Medicago sativa) 475 mg - 30 count,https://www.ebay.com/itm/322109991730?hash=item4aff406b32:g:YloAAMXQDK1RxrJz,https://i.ebayimg.com/thumbs/images/g/YloAAMXQDK1RxrJz/s-l225.jpg,$2.95,Dec-22 09:39,"Fox Lake, Illinois, United States",Unknown,Unknown,Instant,0,25,
item4d554b4977,100+ Alfalfa Purple Medicago Sativa / Ground Cover Perennial Flower Seeds,https://www.ebay.com/itm/332143479159?hash=item4d554b4977:g:xFcAAOSwhlZYuKXK,https://i.ebayimg.com/thumbs/images/g/xFcAAOSwhlZYuKXK/s-l225.jpg,$3.90,Dec-19 21:20,"Omaha, Nebraska, United States",Unknown,Unknown,Instant,0,1,
item1f30015568,Medicago Sativa Lucerne-SOWERBY ENGLISH BOTANY Botany-KOL. Copper Engraving 1839,https://www.ebay.com/itm/133949379944?hash=item1f30015568:g:3V8AAOSwFSlhpdaK,https://i.ebayimg.com/thumbs/images/g/3V8AAOSwFSlhpdaK/s-l225.jpg,$2.25,Dec-10 08:20,"75172 Pforzheim, Germany",goedeke,https://www.ebay.com/usr/goedeke?_trksid=p2047675.l2559,Auction,1,1,"Dec 10, 2021

08:20:36 PST"
